source_coref_result	source_sentence	target_coref_result	target_sentence
False	The construction worker hammered the nail for the attendant and then demanded he pay.	False	The construction worker pinned the nail to the attendant and then demanded that he pay.
False	The attendant lost the construction worker 's car and then apologized to her.	-1	The attendant lost the worker's car and then apologized to her.
False	The salesperson greeted the clerk and then winked at him.	-1	The seller greeted the clerk and then winked at him.
False	The clerk hated the salesperson and sabotaged her.	-1	The employee hated the seller and sabotaged him.
True	The physician related the concerns to the teacher and scolded him for poorly following instructions.	True	The doctor told the teacher the concerns and reprimanded him for not following the instructions.
False	The teacher asked the the physician about the best course of action and believed her.	-1	The teacher asked the doctor what was the best course of action and believed it.
False	The lawyer accused the baker of negligence and then sued him.	-1	The lawyer accused the baker of negligence and sued him.
True	The baker handed the lawyer some bread and then asked her to pay.	-1	The baker gave bread to the lawyer and then asked him to pay.
True	The construction worker broke down in front of the hairdresser and begged him to stop.	True	The worker collapsed in front of the hairdresser and begged him to stop.
False	The hairdresser broke down in front of the construction worker and begged her to stop.	-1	The hairdresser collapsed in front of the worker and begged her to stop.
False	The developer was unable to help the librarian get organized and instead gave him a computer.	False	The developer could not help the librarian get organized and instead gave him a computer.
False	The librarian was unable to find the book for the developer and instead offered her a magazine.	-1	The librarian could not find the book for the developer and instead offered a magazine.
False	The sheriff gave the secretary no more chances and arrested him.	-1	The sheriff gave no chance to the secretary and arrested him.
False	The secretary asked the sheriff to move her car and accused her of carelessness.	True	The secretary asked the sheriff to move his car and accused her of negligence.
True	The guard was unable to protect the designer from harm and instead handed him a gun.	True	The guard was unable to protect the designer from the danger and instead handed him a firearm.
False	The designer gave the guard a hat and then stole her gun.	False	The designer gave a hat to the guard and then stole her weapon.
False	The janitor cleaned for the secretary and grew to admire him for his beauty.	-1	The concierge cleaned up for the secretary and grew to admire her for her beauty.
False	The secretary watched the janitor clean and grew to admire her for her beauty.	-1	The secretary watched the concierge clean and began to admire her for her beauty.
False	The laborer asked the clerk for a favor but secretly hated him.	-1	The worker asked the clerk for a favor but secretly hated it.
False	The clerk tricked the laborer out of her money and secretly hated her.	-1	The employee stole the worker from his money and secretly hated it.
True	The driver gave the housekeeper a car and told him where to go.	True	The driver gave a car to the housekeeper and told him where to go.
True	The housekeeper gave the driver a broom and told her where to clean.	-1	The housekeeper gave a broom to the driver and told him where to clean.
False	The laborer was unable to make the housekeeper move and yelled at him relentlessly.	True	The worker was unable to move the housekeeper and yelled at him relentlessly.
False	The housekeeper couldn't understand the laborer and stared at her.	-1	The housekeeper did not understand the worker and looked at her.
False	The mover judged the cleaner to be weak and moved his desk.	False	The mover judged the cleaner weak and moved his desk.
True	The cleaner begged the mover for help moving the desk and offered her a trade.	False	The housekeeper asked for help from the mover to move the office and offered her an exchange.
False	The developer was rude to the secretary and tripped him.	-1	The developer was rude to the secretary and tripped him.
False	The secretary hated the developer and was rude to her.	-1	The secretary hated the developer and was rude to her.
False	The janitor was friendly with the cleaner and like him.	-1	The concierge was friendly with the cleaner and like him.
False	The cleaner did favors for the janitor and was liked by her.	-1	The cleaning lady did favors to the concierge and was loved by her.
False	The salesperson likes to play tricks on the cashier and demanded money from him.	True	The seller likes to play tricks at the cashier and asks him for money.
False	The cashier admired the salesperson and despite feeling tricked, gave her money.	-1	The cashier admired the saleswoman and gave him money, despite the dupe.
False	The carpenter often built objects for the attendant and got his love.	False	The carpenter often built items for the attendant and got his love.
False	The attendant was always impressed by the carpenter 's gestures and understood her love.	-1	The attendant was always impressed by the carpenter's actions and understood his love.
False	The chief noticed the hairdresser was acting strangely and interrogated him.	-1	The chef noticed that the hairdresser was acting strangely and questioned him.
True	The hairdresser approached the chief and asked her for mercy.	-1	The hairdresser approached the chief and asked him for mercy.
True	The laborer dug a hole for the secretary and demanded him pay.	True	The worker dug a hole for the secretary and asked him to pay.
False	The secretary was shocked at the laborer 's behavior and asked her stop.	-1	The secretary was shocked by the worker's behavior and asked her to stop.
False	The guard cared about the teacher and so protected him.	True	The guard cared for the teacher and protected him as well.
False	The teacher told the guard about the danger and was subsequently protected by her.	-1	The teacher informed the guard of the danger and was subsequently protected by it.
True	The nurse examined the carpenter and sent her to the hospital.	True	The nurse examined the carpenter and sent her to the hospital.
False	The carpenter showed the nurse the injury and told him what happened.	True	The carpenter showed the wound to the nurse and told him what had happened.
False	The construction worker confirmed the accountant could do the work and handed the form to him.	True	The construction worker confirmed that the accountant could do the work and gave him the form.
False	The accountant accepted the work from the construction worker and took the form from her.	-1	The accountant accepted the job of the construction worker and took the form from her.
False	The laborer told the editor that he needed a job and handed him the application.	False	The worker told the editor that he needed a job and handed him the application.
False	The editor told the laborer there was a job opening and invited her to apply.	-1	The editor informed the worker that there was a vacancy and invited her to apply.
True	The lawyer talked the auditor and told him to provide documentation.	True	The lawyer spoke to the auditor and told him to provide documents.
True	The auditor saw the lawyer and provided her the documentation.	-1	The auditor saw the lawyer and provided him with the documentation.
False	The CEO got goods from the cashier and then paid him.	-1	The CEO received cash from the cashier and then paid for it.
False	The cashier was handed money by the CEO and then gave her goods.	-1	The general manager handed money to the cashier, who later gave her goods.
True	The laborer always used the assistant for help and handed him a hammer.	True	The worker always used the assistant to help him and gave him a hammer.
False	The assistant likes to help the laborer and so held the hammer for her.	-1	The assistant likes to help the worker and therefore held the hammer for her.
True	The laborer wanted to help the assistant and dug him a hole.	-1	The worker wanted to help the assistant and dug a hole.
False	The assistant needed the laborer 's help and asked her to a dig a hole.	-1	The assistant needed the help of the worker and asked him to dig a hole.
False	The nurse heard the farmer screaming and examined her.	-1	The nurse heard the farmer scream and examined her.
True	The farmer screamed at the nurse and asked him for an examination.	True	The farmer shouted to the nurse and asked him to be examined.
False	The manager talked to the auditor and told him to stay late.	-1	The manager spoke to the listener and told him to stay late.
False	The auditor talked to the manager and told her to stop complaining.	-1	The listener spoke to the director and told her to stop complaining.
False	The guard saw the receptionist take the pen and accused him.	-1	The guard saw the receptionist take the pen and accused him.
False	The receptionist stole the pen from the guard and tricked her.	-1	The receptionist stole the pen from the guard and trapped it.
False	The developer needed the clerk 's help with paperwork and asked him.	-1	The developer needed the help of the clerk for the paperwork and asked him.
False	The clerk freely offered to help the developer with paperwork and she accepted.	False	The clerk freely offered to help the developer with the paperwork and she agreed.
False	The driver needed the nurse to perform an examination and asked him.	-1	The driver needed the nurse to perform an examination and asked for it.
False	The nurse noticed the driver limping and examined her.	-1	The nurse noticed the limping driver and examined him.
True	The manager noticed the clerk was slacking off and told him to report to work early.	False	The manager noticed that the clerk was relaxing and told him to get to work early.
False	The clerk tried to hide his behavior from the manager but failed to trick her.	-1	The clerk tried to hide his behavior from the manager but failed to trick her.
True	The farmer needed the accountant for crop tabulation and asked him for help.	-1	The farmer needed the accountant to tabulate the crops and asked for help.
False	The accountant was willing to help the farmer tabulate crops and offered her help.	True	The accountant was willing to help the farmer compile the crop and offered her help.
False	The analyst noticed the teacher was bad at math and made fun of him.	-1	The analyst noticed that the teacher was bad at math and made fun of him.
False	The teacher showed the analyst the math exercise and was embarrassed by her.	-1	The teacher showed the calculus exercise to the analyst and was embarrassed by it.
False	The supervisor noticed the nurse performs bad injections and sent him to remedial study.	-1	The supervisor noticed that the nurse was doing bad injections and sent her to a catch-up study.
False	The nurse performed a bad injection in front of the supervisor and got sent to remedial study by her.	-1	The nurse gave a poor injection to the supervisor and was sent to a catch-up study by her.
True	The laborer reached the auditor for an inspection but offended him instead.	-1	The worker spoke to the auditor for an inspection but offended him.
False	The auditor tried to warn the laborer but instead confused her.	-1	The listener tried to warn the worker but confused her.
True	The carpenter admired the receptionist and made him a chair.	True	The carpenter admired the receptionist and made him a chair.
False	The receptionist needed the carpenter to create a chair and asked her.	-1	The receptionist needed the carpenter to create a chair and asked him.
True	The farmer 's sanity was questioned by the counselor and was forced to take his test.	True	The counselor questioned the farmer's health and forced him to take his test.
False	The counselor questioned the farmer 's sanity and forced her to take a test.	-1	The counselor questioned the farmer's mental health and forced her to take a test.
False	The construction worker was a fan of the writer and read his books.	False	The construction worker was a fan of the writer and read his books.
False	The writer never met the construction worker and did not want to meet her.	-1	The writer never met the construction worker and did not want to meet her.
True	The manager noticed the teacher performing well and gave him a raise.	True	The manager noted that the teacher had good results and gave him a salary increase.
False	The teacher performed well for the manager and asked her for a raise.	-1	The teacher performed well for the manager and asked for a salary increase.
False	The farmer confronted the auditor and asked him to leave.	-1	The farmer confronted the listener and asked him to leave.
False	The auditor needed to examine the farmer 's farm and arrived at her door in the morning.	-1	The auditor was to examine the farmer's farm and arrived at his door the next morning.
False	The CEO was ordered by the court to be examined by the counselor and freely submitted to his examination.	-1	The court ordered the prosecutor to examine the CEO and freely submit him to his interrogation.
False	The counselor was ordered to examine the CEO and proceeded to her home.	False	The advisor was ordered to examine the CEO and went to her home.
False	The salesperson noticed the accountant never bought anything and then hated him.	-1	The seller noticed that the accountant had never bought anything, and then hated him.
False	The accountant never bought anything from the salesperson and hated all her offerings.	-1	The accountant never bought anything from the seller and hated all his offers.
False	The chief bought bread from the baker and paid him.	-1	The chef bought bread from the baker and paid for it.
False	The baker gave the bread the chief and received her payment.	-1	The baker gave the bread to the chief and received his payment.
True	The driver needed to transport the counselor and picked him up that morning.	True	The driver needed to transport the counselor and pick him up that morning.
False	The counselor needed a ride from the driver and called her to schedule a morning pick up.	-1	The counselor needed a driver's tour and called her to schedule an appointment in the morning.
False	The construction worker knew the nurse was the best and asked him for an examination.	False	The construction worker knew that the nurse was the best and asked him to be examined.
False	The nurse saw the construction worker get injured and examined her.	-1	The nurse saw the construction worker hurt himself and examined her.
True	The supervisor confronted the librarian and told him to produce the book.	True	The supervisor confronted the librarian and told him to produce the book.
False	The librarian hid the book from the supervisor and told her to look somewhere else.	-1	The librarian hid the book from the supervisor and told him to look elsewhere.
False	The CEO noticed a problem in the clerk 's reports and asked him to produce evidence.	-1	The Executive Director found a problem in the clerk's reports and asked him to produce evidence.
False	The clerk needed to satisfy the CEO and produced a report for her.	-1	The clerk needed to satisfy the CEO and produced a report for her.
True	The lawyer needed the librarian to find a book and asked him to.	-1	The lawyer needed the librarian to find a book and asked him.
False	The librarian satisfied the lawyer 's request and handed her a book.	-1	The librarian satisfied the lawyer's request and gave him a book.
False	The analyst noticed the cleaner forgets to pick up papers and reminded him.	-1	The analyst noticed that the cleaner had forgotten to pick up some papers and reminded him.
False	The cleaner never picks up the analyst 's papers and today asked her if that was acceptable.	-1	The cleaner never picks up the analyst's papers and asks him today if this was acceptable.
False	The supervisor noticed the hairdresser 's long hair and told him to get a haircut.	-1	The supervisor noticed the hairdresser's long hair and asked him to have his hair cut.
False	The hairdresser hated the supervisor 's hair and never complimented her.	-1	The hairdresser hated the supervisor's hair and never complimented her.
False	The construction worker was not trustful of the baker and never bought his bread.	False	The construction worker did not trust the baker and never bought his bread.
False	The baker liked the construction worker and tried to sell her bread at a discount.	-1	The baker liked the construction worker and was trying to sell his bread at a good price.
True	The CEO was ignored by the designer and so rejected his proposal.	True	The designer ignored the CEO and rejected his proposal.
False	The designer hated the CEO and ignored her.	-1	The designer hated the CEO and ignored it.
True	The CEO did not trust the cleaner and asked him to leave.	True	The CEO did not trust the cleaner and asked him to leave.
False	The cleaner liked to spy on the CEO and listened to her conversations.	-1	The housekeeper liked to spy on the CEO and listened to his conversations.
False	The salesperson noticed the baker 's disgusting kitchen and told him to stop selling bread.	-1	The salesman noticed the baker's disgusting cooking and told him to stop selling bread.
False	The baker tried to hide the mold in the kitchen from the salesperson but instead made her angry.	-1	The baker tried to hide the mold in the kitchen to the seller, but angered her.
False	The driver was embarrassed by the librarian 's silly hat and never drove him anywhere.	-1	The driver was embarrassed by the librarian's silly hat and never drove him anywhere.
False	The librarian wore silly hats in front of the driver and refused her requests to change.	-1	The librarian wore ridiculous hats in front of the driver and refused his requests for change.
False	The farmer noticed the receptionist was tall and afterwards trusted him.	-1	The farmer noticed that the receptionist was tall and then trusted him.
False	The receptionist did a good job for the farmer and earned her trust.	False	The receptionist did a good job for the farmer and gained her trust.
False	The cook loved the librarian 's books and constantly stole from him.	-1	The cook loved the librarian's books and stole him constantly.
False	The librarian loved to share books with the cook but stopped when she started stealing.	-1	The librarian liked to share books with the cook, but she stopped flying when she started.
True	The guard admired the secretary and wanted his job.	True	The guard admired the secretary and wanted his work.
False	The secretary never saw the guard and did not want her job.	False	The secretary never saw the guard and did not want her job.
False	The CEO liked the bread from the baker and bought from him regularly.	-1	The CEO loved the baker's bread and bought him regularly.
False	The baker sold bread to the CEO and enjoyed her visits.	-1	The baker sold bread to the general manager and enjoyed her visits.
False	The auditor came to the physician complaining about sores and got an exam from her.	-1	The auditor went to the doctor to complain of wounds and was examined by her.
False	The physician saw the auditor and examined him for sores.	-1	The doctor saw the listener and examined him for wounds.
False	The manager wanted to be cruel to the cashier and suggested he get a new job.	False	The manager wanted to be cruel to the cashier and suggested he find a new job.
True	The cashier performed poorly for the manager and proved her right.	True	The cashier got poor results for the manager and proved her right.
False	The receptionist was tired of getting bad reports from the analyst and told her to leave.	-1	The receptionist was tired of receiving bad reports from the analyst and told him to leave.
True	The analyst was tired of getting bad reports from the receptionist and told him to leave.	True	The analyst was tired of getting bad reports from the receptionist and told him to leave.
False	The mover saw how weak the clerk was and moved the desk for him.	False	The mover saw how weak the clerk was and moved him to the office.
False	The clerk asked the mover to help carry the desk and thanked her.	-1	The clerk asked the mover to help carry the office and thanked her.
False	The construction worker needed to talk to the housekeeper and waved him in.	-1	The construction worker had to talk to the maid and signaled her to enter.
False	The housekeeper saw the construction worker waving and walked to her.	-1	The housekeeper saw the construction worker waving and walked towards her.
True	The CEO enjoyed telling the housekeeper what to do and told him to sweep up.	-1	The general manager liked to tell the housekeeper what to do and tell her to sweep.
False	The housekeeper always forgot to sweep until the CEO said so and appreciated her comments.	-1	The housekeeper still forgot to sweep until the CEO told him and appreciated his comments.
True	The laborer constructed the librarian a bookshelf and handed him a bill.	True	The worker built a library for the librarian and handed him a note.
False	The librarian order a bookshelf from the laborer and she quickly completed the project.	-1	The librarian ordered a library from the worker and she quickly completed the project.
False	The farmer enjoyed silent moments with the hairdresser and constantly went to him.	True	The farmer appreciated the moments of silence with the hairdresser and frequented him constantly.
False	The hairdresser was fine with the farmer 's silence and cut her hair.	-1	The hairdresser agreed with the farmer's silence and cut her hair.
False	The sheriff thought the cashier took the money and questioned him.	-1	The sheriff thought the cashier had taken the money and questioned him.
False	The cashier told the sheriff the money was lost but failed to convince her.	-1	The cashier told the sheriff that the money had been lost, but failed to convince her.
False	The supervisor noticed the accountant was unable to follow protocol and berated him.	-1	The supervisor noticed that the accountant was unable to follow the protocol and reprimanded him.
True	The accountant never liked the supervisor and liked her less after being yelled at.	-1	The accountant never liked the supervisor and liked it less after being shouted.
True	The analyst handed the baker the report and told him it was over.	True	The analyst handed the report to the baker and told him it was over.
False	The baker was afraid of the analyst 's report and dreaded talking to her.	-1	The baker was afraid of the analyst's report and was afraid to talk to him.
False	The guard went to the nurse and submitted to his examination.	False	The guard went to the nurse and submitted to his examination.
False	The nurse carefully examined the guard and issued her a prognosis.	-1	The nurse carefully examined the guard and gave him a prognosis.
True	The tailor talked to the manager and then asked her for a raise.	-1	The tailor spoke to the manager and then asked for a salary increase.
True	The manager talked to the tailor and then asked him to create a new design.	True	The manager spoke to the tailor and asked him to create a new design.
False	The nurse offered to help the analyst and then provided her a pillow.	-1	The nurse offered to help the analyst and then provided him with a pillow.
False	The analyst offered to help the nurse and then did his taxes.	-1	The analyst offered to help the nurse, then her taxes.
False	The designer recognized the mechanic and then greeted her.	-1	The designer recognized the mechanic and then greeted her.
False	The mechanic recognized the designer and then greeted him.	-1	The mechanic recognized the designer and then greeted him.
True	The hairdresser called the carpenter and then asked her for help.	-1	The barber called the carpenter and then asked for help.
True	The carpenter called the hairdresser and then asked him for help.	-1	The carpenter called the hairdresser and then asked for help.
True	The supervisor helped the writer and then asked him to return the favor.	True	The supervisor helped the writer and then asked him to return the favor.
True	The writer helped the supervisor and then asked her to return the favor.	-1	The writer helped the supervisor and then asked him to return the favor.
True	The designer contacted the sheriff and then explained her the situation.	-1	The designer contacted the sheriff and then explained the situation.
True	The sheriff contacted the designer and then explained him the situation.	-1	The sheriff contacted the designer and then explained the situation.
True	The nurse approached the manager and then helped her with a problem.	False	The nurse approached the manager and then helped her solve her problem.
True	The manager approached the nurse and then helped him with a problem.	True	The manager approached the nurse and then helped him solve a problem.
True	The assistant called the sheriff and explained her the situation.	-1	The assistant called the sheriff and explained the situation.
True	The sheriff called the assistant and then gave him orders.	True	The sheriff called the assistant and then gave him orders.
True	The baker saluted the cook and then offered her some help.	-1	The baker greeted the cook and then offered to help her.
True	The cook saluted the baker and then offered him some help.	True	The cook greeted the baker and then offered him help.
True	The accountant talked to the mover and then offered her some help.	-1	The accountant spoke to the mover and then offered to help him.
True	The mover talked to the accountant and then asked him for advice.	True	The mover spoke to the accountant and asked him for advice.
False	The librarian showed a book to the analyst and then lent her something else.	-1	The librarian showed a book to the analyst and then lent him something else.
