source_coref_result	source_sentence	target_coref_result	target_sentence
False	The clerk called the physician and asked him about the medicine.	-1	The author called the doctor and asked him about the medicine.
True	The physician called the clerk and asked her about the product.	True	The doctor called the clerk and asked her about the product.
False	The nurse thanked the chief and handed him a present.	-1	The nurse thanked the president and gave him a present.
True	The chief thanked the nurse and handed her a present.	True	Thank the head of the nurse and handed her a gift.
True	The accountant met the analyst and recommended him some job positions.	-1	The accountant met with the analyst and recommended some jobs.
False	The analyst met the accountant and recommended her some job positions.	-1	The analyst met with accounting and recommended some jobs.
False	The receptionist helped the construction worker and got a present from him.	-1	The receptionist helped the construction worker and got a gift from him.
False	The construction worker helped the receptionist and got a present from her.	-1	The construction worker helped the receptionist and received a gift from them.
False	The hairdresser visited the guard and thanked him.	-1	The hairstylist visited the guard and thanked him.
False	The guard visited the hairdresser and thanked her.	-1	The guard visited the hairdresser and thanked her.
True	The accountant walked towards the developer and gave him a cup of coffee.	True	The accountant walked toward the developer and gave him a cup of coffee.
True	The developer walked towards the accountant and gave her a cup of coffee.	True	The developer walked toward the accountant and gave her a cup of coffee.
True	The manager meets the counselor regularly and asks her for suggestions.	True	The manager meets with the counselor regularly and asks her about the suggestions.
True	The counselor meets the manager regularly and provides him suggestions.	-1	The counselor meets regularly with the manager and offers suggestions.
True	The lawyer called the teacher to ask her the performance of the kid.	True	The lawyer contacted the teacher to ask her to perform the child.
False	The teacher called the lawyer to tell him the performance of the kid.	False	The teacher called the lawyer to tell him about the child's performance.
True	The secretary walked towards the mechanic and told him what was the problem with the machine.	True	The secretary walked towards the mechanic and told him what the problem was with the machine.
True	The mechanic walked towards the secretary and asked her where the machine was.	True	The mechanic walked toward the secretary and asked her where the machine was.
False	The baker talked to the supervisor and learned a lot from him.	-1	The baker talked to the supervisor and learned a lot from him.
True	The supervisor talked to the baker and taught her a lot.	True	The supervisor spoke to the baker and taught her a lot.
False	The housekeeper showed the janitor the direction and led him to the kitchen.	-1	The housekeeper showed the concierge direction and led him to the kitchen.
True	The janitor showed the housekeeper the direction and led her to the kitchen.	True	The guard showed the housekeeper the direction and drove her to the kitchen.
True	The counselor disliked the supervisor and wanted to leave his group.	True	The supervisor did not like the supervisor and wanted to leave his group.
False	The supervisor disliked the counselor and fired her.	-1	The supervisor did not like the consultant and fired it.
False	The writer contacted the CEO and asked for his opinions about the book.	False	The writer contacted the CEO and asked about his views on the book.
False	The CEO contacted the writer and asked for her suggestions about the book.	-1	The CEO contacted the author and asked for their suggestions on the book.
True	The hairdresser hates the mechanic after he refused to help with fixing the car.	-1	The mechanic hates mechanic after refusing to help repair the car.
True	The mechanic hates the hairdresser after she finished the ugly haircut.	True	The mechanic hates the hairdresser after she has finished cutting her ugly hair.
False	The cashier borrowed the tool from the carpenter but returned nothing to him.	-1	The cashier borrowed the gadget from the carpenter but did not return anything to him.
False	The carpenter borrowed the tool from the cashier but returned nothing to her.	-1	The carpenter borrowed the tool from the cashier but did not return anything.
False	The auditor talked with the sheriff and wanted to hear his opinion.	-1	The auditor spoke to Sharif and wanted to hear his opinion.
True	The sheriff talked with the auditor and wanted to hear her opinion.	True	The secretary spoke to the auditor and wanted to hear her opinion.
False	The baker wanted to thank the carpenter and made some bread for him.	-1	The baker wanted to thank the carpenter and make bread for him.
False	The carpenter wanted to thank the baker and made a chair for her.	-1	The carpenter wanted to thank the baker and make a chair for her.
False	The designer wanted to help the lawyer but he refused.	False	The designer wanted to help the lawyer but he refused.
False	The lawyer wanted to help the designer but she refused.	False	The lawyer wanted to help the designer but she refused.
False	The accountant got angry with the mechanic and complained to the boss about him.	True	The accountant was angered by the mechanic and complained to his boss about it.
False	The mechanic got angry with the accountant and complained to the boss about her.	-1	The mechanic angered with the accountant and complained to the boss about them.
False	The cook sent the cashier a present and expressed thanks to her.	-1	The treasurer sent a gift and thanked her.
False	The cashier sent the cook a present and expressed thanks to him.	-1	The cashier sent a gift cooker and thanked him.
False	The laborer eats more than the cleaner because he works harder.	-1	Eater works more than a cleaner because it works harder.
False	The cleaner eats more than the laborer because she works harder.	-1	The cleaner eats more than the agent because he works harder.
True	The mechanic learned a lot from the teacher and sent her a thankful card.	True	The mechanic learned a lot from the teacher and sent her a thank-you card.
True	The teacher learned a lot from the mechanic and sent him a thankful card.	True	The teacher learned a lot from the mechanic and sent him a card of thanks.
True	The baker passed the box to the guard and asked him to make the delivery.	True	The baker passed the box to the guard and asked him to deliver it.
True	The guard passed the box to the baker and appreciated her baking skills.	True	The guard passed the box to the baker and arranged her bread skills.
True	The tailor stopped the guard and showed him identification.	True	The guard stopped the guard and showed him an identity.
True	The guard stopped the tailor and asked for her identification.	True	The guard stopped the tailor and asked for her identity.
False	The analyst asked the clerk some questions and thanked her.	-1	The analyst asked the writer some questions and thanked them.
True	The clerk asked the analyst some questions and sent him away.	True	The analyst asked some questions and sent him away.
False	The lawyer asked the nurse about the operation and thanked her.	-1	The nurse asked about the operation and thanked her.
False	The nurse asked the lawyer about the case and thanked him.	-1	I asked the nurse about the case and thanked him.
False	The carpenter stopped the housekeeper and helped her.	-1	The carpenter stopped the housekeeper and helped her.
False	The housekeeper stopped the carpenter and helped him.	-1	The housekeeper stopped the carpenter and helped him.
True	The sheriff opened the door for the housekeeper and waited for her to pass by.	-1	The policeman opened the door to the housekeeper and waited to pass by.
False	The housekeeper opened the door for the sheriff and waited for him to pass by.	-1	The housekeeper opened the door to the police officer and waited for him to pass.
False	The physician asked the receptionist about the booking price and thanked her.	-1	The doctor asked the receptionist about the booking price and thanked her.
False	The receptionist helped the physician find the room and left him alone.	-1	The receptionist helped the doctor find the room and leave him alone.
False	The lawyer saw the editor in the restaurant and greeted her.	-1	The lawyer saw the editor in the restaurant and received it.
False	The editor saw the lawyer in the restaurant and greeted him.	-1	The lawyer saw the lawyer at the restaurant and greeted him.
False	The farmer bought a book from the writer and paid her.	-1	The farmer bought a book from the writer and paid for it.
False	The writer bought some fruit from the farmer and paid him.	-1	The writer bought some fruit from the farmer and paid him.
False	The sheriff borrowed a book from the librarian but never returned anything to her.	-1	Shear borrowed a book from the librarian, but she never returned anything to her.
False	The librarian helped the sheriff find the book and smiled at him.	-1	The Librarian helped to find the book and smiled at it.
True	The salesperson talked to the teacher and invited her to dinner.	-1	The salesperson spoke to the teacher and invited him to dinner.
True	The teacher talked to the salesperson and invited him to dinner.	True	The teacher spoke to the salesperson and invited him to dinner.
True	The janitor cleaned for the baker and asked her for the tips.	True	Clean the doorman for the baker and ask her for advice.
False	The baker packed the janitor some bread and waited for him to pay.	-1	The baker filled some bread and waited for him to pay.
False	The cook got the phone call from the nurse and began to prepare the lunch for her.	True	The chef got a call from the nurse and started preparing her lunch.
False	The nurse got the phone call from the cook and began to prepare the surgery for him.	False	The nurse got the phone call from the cook and began to prepare his surgery.
True	The developer successfully sold the housekeeper the product and helped her to set up.	False	The developer successfully sold the housekeeper product and helped her setup.
True	The housekeeper bought the product from the developer and asked him to set up.	True	The homeowner purchased the product from the developer and asked him to prepare it.
True	The driver dropped the accountant at the corner and asked her to watch out when crossing the street.	True	The driver dropped the accountant in the corner and asked her to watch when crossing the street.
True	The accountant asked the driver to stop at the corner and gave him some tips.	True	The accountant asked the driver to stop at the corner and gave him some advice.
True	The manager discussed with the designer for a long time and tried to convince her to sell this idea.	True	The manager discussed with the designer for a long time and tried to convince her to sell the idea.
False	The designer discussed with the manager for a long time but still refused to sell the idea to him.	-1	The designer discussed with the manager for a long time but refused to sell the idea to him.
False	The mechanic not only explained several terms to the counselor but also wrote some down for her.	-1	Not only did a mechanic explain many terms to the counselor, he also wrote down some things to her.
False	The counselor not only explained to the mechanic economy terms and also wrote down some down for him.	-1	The Chancellor did not only explain the terms of the mechanical economy, but wrote some for it.
False	The mechanic opened the door for the cleaner and led her to the room.	-1	The mechanic opened the cleaner's door and led it to the room.
False	The cleaner knocked at the mechanic 's door and waited for him to show up.	-1	The cleaner knocked at the mechanic's door and waited for him to appear.
False	The mover followed the writer 's instruction and waited outside her apartment.	-1	The engine followed the author's instructions and waited outside her apartment.
False	The writer asked the mover to move everything to the new apartment and paid him.	-1	The author asked the engine to transfer everything to the new apartment and pay him.
False	The carpenter stopped the tailor from entering the workspace and talked to her.	-1	Al-Najjar stopped the tailor from entering the work area and talking to her.
True	The tailor showed the carpenter the tools and let him try.	True	The tailor showed the carpenter the tools and allowed him to try.
False	The construction worker asked the assistant to make a list of today 's meetings and thanked her.	-1	The construction worker asked the assistant to prepare a list of the day's meetings and thanked them.
False	The assistant made a list of today 's schedule for the construction worker and showed him.	-1	The assistant made a list of the day's schedule for the construction worker and showed him.
False	The supervisor asked the secretary to stop by and assigned a task to her.	True	The supervisor asks the secretary to stop her and assign her a mission.
True	The secretary greeted the supervisor and handed him the report.	False	He received the supervisor and gave him the report.
True	The chief hired the receptionist and bought her a new phone for work.	True	The receptionist hired the president and bought her a new phone to work.
False	The receptionist was hired by the chief and will receive the payment from him.	-1	The receptionist is appointed by a President and you will receive the payment from him.
False	The janitor talked with the auditor and passed her the files.	-1	The doorman spoke with the checker and passed the files.
False	The auditor called the janitor and asked him to clean up the hall.	-1	The checker called the doorman and asked him to clean the hall.
True	The analyst met the tailor at home and asked her to make a new suit.	True	The tailor met at home and asked her to make a new suit.
True	The tailor met the analyst at home and offered him a new design.	False	Khayat met with the analyst at home and gave him a new design.
False	The sheriff stopped the nurse and hugged her for the great help.	-1	The nurse's mayor stopped and hugged her for great help.
False	The nurse met the sheriff at the scene and helped him with the accident.	-1	I met the nurse Sharif at the scene and helped him in the incident.
True	The janitor met the receptionist and got the key from her every day.	-1	The doorman met the receptionist and got the key from them every day.
False	The receptionist waits for the janitor and drives him back every day.	-1	The receptionist waits for the guard and returns him every day.
False	The mover went to the tailor 's house and helped her move the boxes.	-1	The engine went to the tailor's house and helped her move the boxes.
False	The tailor called the mover and asked him to arrive before 9 am.	-1	The tailor called the truck and asked him to arrive before 9 am.
True	The developer dropped by the nurse and discussed with her about the surgery.	True	The developer dropped by the nurse and discussed with her about the surgery.
True	The nurse gave the developer the prescription and told him not to worry.	True	The nurse gave the developer a prescription and asked him not to worry.
True	The mechanic helped the baker fix the machine and charged her 1000 dollars.	True	The mechanic helped the baker repair the machine and charged her $ 1,000.
True	The baker handed the mechanic the cake and waited for him to pay.	True	The baker gave the mechanic the cake and waited for him to pay.
True	The salesperson called the editor and asked her to write an article about the company.	True	The sales representative called the editor and asked her to write an article about the company.
False	The editor interviewed the salesperson and wrote an article about his company.	-1	The editor met the sales representative and wrote an article about his company.
False	The mover arrived early at the counselor 's house and offered to help her.	-1	The bus arrived early from the Chancellor's house and offered her help.
False	The counselor called the mover and asked him to start early.	-1	The chancellor called the truck and asked him to start early.
False	The supervisor stopped the cleaner and told her not to clean that room.	-1	The supervisor stopped the cleaning and told her not to clean that room.
True	The cleaner stopped the supervisor and told him not to walk on that way.	False	He stopped the supervisor and told him not to walk like that.
False	The lawyer called the tailor and made an appointment with her.	-1	Contact the lawyer and set an appointment.
False	The tailor called the lawyer and made an appointment with him.	-1	Lawyer called the lawyer and set an appointment with him.
True	The cook decided to fire the secretary and told her not to come here next Monday.	True	The chef decided to expel the secretary and asked her not to come here next Monday.
False	The secretary had a quarrel with the cook and threw a book to him.	False	He was faithful to the quarrel with the cook and gave him a book.
True	The farmer consulted the secretary about many things and invited her to dinner.	True	The farmer consulted the secretary about many things and invited her to dinner.
True	The secretary bought many products from the farmer and asked him for a discount.	True	The minister bought many products from the farmer and asked him to get a discount.
True	The farmer hired the assistant and told her to come to work twice a week.	True	The farmer hired an assistant and told her to come to work twice a week.
True	The assistant rescheduled the meeting for the farmer and told him to be well prepared.	True	The assistant replayed the meeting for the farmer and told him to be well prepared.
False	The supervisor had a quarrel with the attendant and decided to fire her.	-1	The supervisor quarreled with the incubator and decided to shoot her.
False	The attendant hit the supervisor by mistake and apologized to him.	-1	Accompanied the supervisor companion by mistake and apologized to him.
True	The manager asked the librarian a lot of questions and thanked her in the end.	-1	The manager asked the librarian a lot of questions and finally thanked her.
True	The librarian guided the manager to the bookshelf and asked what he needed.	True	The librarian directed the manager to the bookshelf and asked what he needed.
False	The mover discussed with the nurse about the surgery and thanked her.	-1	Discuss the engine with the nurse about the surgery and thank you.
False	The nurse helped to send the mover to the hospital and kept comforting him.	-1	The nurse helped send the engine to the hospital and kept it.
False	The farmer drove the attendant to the railway station and gave her a gift.	-1	The farmer led the servant to the train station and gave her a present.
False	The attendant bought some fruit from the farmer and paid him by check.	-1	The companion bought some fruit from the farm and paid it by check.
False	The developer consulted with the counselor for hours and paid her a lot of money.	-1	Consult a developer with an advisor for hours and pay her a lot of money.
True	The counselor taught the developer how to write the patent and charged him 2,000 dollars.	True	The consultant taught the developer how to write the patent and pay him $ 2,000.
True	The physician examined the accountant in detail and told her nothing to worry about.	True	The doctor examined the accountant in detail and told her nothing to worry about.
False	The accountant showed the bill to the physician and told him to pay that on time.	-1	The accountant showed the invoice to the doctor and told him to pay it in time.
False	The laborer saw the tailor at the corner and talked to her for 2 hours.	False	The worker saw the tailor in the corner and spoke with her for two hours.
False	The tailor offered the laborer a new suit and charged him nothing.	-1	The tailor offered the worker a new suit and did not accuse him of anything.
True	The physician hired a housekeeper and told her to work every day.	True	The doctor hired a housekeeper and told her to work every day.
False	The housekeeper woke the physician up and told him someone was calling for him.	-1	The housekeeper woke up to the doctor and told him that someone was calling him.
False	The sheriff chatted with the tailor and invited her to dinner later.	-1	I spoke to my partner and invited her to dinner later.
False	The tailor finished the suit for the sheriff and called him.	-1	The tailor finished the suit for the mayor and called him.
False	The driver crashed into the designer 's artifact and paid her a lot.	-1	The driver crashes into the designer's artifact and pays her a lot.
True	The designer stopped the driver and asked him to be careful in the Expo Location.	True	The designer stopped the driver and asked him to be careful at the show site.
True	The sheriff returned the expired cake to the baker and asked her to return the money.	True	The policeman returned the cookie to the baker and asked her to return the money.
False	The baker packed the cake for the sheriff and waited for him to pay.	-1	Bake the cake baker for the honor and wait for it to pay.
False	The janitor asked the clerk how to find the meeting room and thanked her.	-1	The doorman asked the writer how to find and thank the meeting room.
False	The clerk told the janitor to clean up the meeting room and thanked him.	-1	The staff member told the concierge to clean and thank the meeting room.
False	The developer did not find the attendant in the room and left her a note.	-1	The accompanying developer did not find the room and left a note.
True	The attendant told the developer there was a meeting and provided him the location.	False	He told the developer that there was a meeting and gave him the site.
False	The carpenter went to the writer 's house and fixed the window for her.	-1	Al-Najjar went to the writer's house and repaired the window.
False	The writer met the carpenter in the shopping mall and made an appointment with him.	-1	Meet the carpenter at the mall and schedule an appointment with him.
False	The cook needed the attendant to be a taste tester and asked her.	-1	The cook needs a hostess to have a taste test and ask her.
False	The attendant loomed over the cake the cook prepared and gave him feedback.	-1	The server was waving over the cook's cake and gave him notes.
True	The analyst needed to get the housekeeper into the house and paid her to do so.	-1	The analyst needed to get the housekeeper to the house and pay to do so.
True	The housekeeper was paid by the analyst and did his housework.	True	The housekeeper was paid by the analyst and he did his homework.
False	The guard wanted to spite the attendant and sabotaged her.	-1	The guard wanted to hit what had happened and destroy it.
True	The attendant did not want to fight with the guard and gave him flowers.	False	The servant did not want to fight with the guard and gave him flowers.
False	The physician noticed the librarian 's eye twitched and treated her.	-1	The doctor noted the librarian and his staff.
False	The librarian wrote the physician a nice note and repaid him with a book.	-1	The librarian wrote a nice note to the doctor and paid him a book.
False	The driver begged the writer to help and offered to pay her.	-1	The driver begged the clerk to help him and offer her payment.
True	The writer wrote the driver a note and even offered him relationship advice.	True	The writer wrote a memo driver and even offered him a relationship advice.
True	The mover refused to move the artwork where the designer asked and demanded she reconsider.	-1	The engine refused to transfer the artwork as the designer asked and asked him to reconsider.
False	The designer tried to explain to the mover that nothing was wrong and even drew him a diagram.	-1	The designer tried to explain to the engine that nothing was wrong, and even drew a diagram.
True	The driver perceived the baker 's frailty and helped her with deliveries.	True	The driver realized the weakness of the baker and helped her with deliveries.
True	The baker never wanted the driver 's help and beat him with a baguette.	True	The baker never wants to help the driver and hit him with the baguette.
False	The carpenter did not know what do when the auditor arrived and simply gave her all the paperwork.	-1	The carpenter did not know what to do when the checker arrived and simply gave him all the papers.
False	The auditor was baffled at the carpenter 's lack of organization and warned him that the audit would not end well.	-1	The auditor was puzzled by the carpenter's lack of organization and warned that the review would not end well.
False	The developer wanted free bread from the baker and made up a story for her about not having a kitchen.	False	The developer wanted to get free bread from the baker and make her a story about the lack of a kitchen.
True	The baker knew the developer was lying about the kitchen but made him bread anyways.	False	The baker knew that the developer was lying around the kitchen, but he made it empty anyway.
False	The chief was worried for the auditor 's safety and asked her to stop snooping.	-1	The president was concerned about the auditor's safety and asked her to stop sneezing.
False	The auditor ignored the chief 's warning and put him out of mind.	-1	Ignore the references warning the president and put him out of his mind.
False	The CEO was worried that the teacher liked to ignore students and called her.	True	The CEO was worried that the teacher liked to ignore the students and call them her name.
False	The teacher could not stand the CEO and purposefully failed his son.	-1	The teacher could not stand as chief executive and failed to achieve his son's goal.
