source_coref_result	source_sentence	target_coref_result	target_sentence
False	The lawyer accused the baker of negligence and then sued him.	-1	The lawyer accused the baker of negligence and then sued him.
False	The baker handed the lawyer some bread and then asked her to pay.	-1	The baker handed over some bread and then asked her to pay.
True	The construction worker broke down in front of the hairdresser and begged him to stop.	True	The construction worker collapsed in front of the hairdresser and begged him to stop.
False	The hairdresser broke down in front of the construction worker and begged her to stop.	False	The hair stylist collapsed in front of the construction worker and begged her to stop.
False	The developer was unable to help the librarian get organized and instead gave him a computer.	-1	The developer was unable to help the librarian organize and instead worked on a computer.
False	The librarian was unable to find the book for the developer and instead offered her a magazine.	-1	The librarian could not find the developer's book, and instead gave her a magazine.
False	The sheriff gave the secretary no more chances and arrested him.	-1	The secretary did not give the secretary additional opportunities and arrest him.
False	The secretary asked the sheriff to move her car and accused her of carelessness.	-1	The minister asked the policeman to move her car and accused her of indifference.
True	The guard was unable to protect the designer from harm and instead handed him a gun.	True	The guard was unable to protect the designer from harm and gave him a weapon instead.
False	The designer gave the guard a hat and then stole her gun.	-1	The designer gave the guard a hat and then stole his gun.
False	The janitor cleaned for the secretary and grew to admire him for his beauty.	False	He cleaned the doorman for the secretary and grew up to admire him for his beauty.
False	The secretary watched the janitor clean and grew to admire her for her beauty.	-1	The guard watched the guard clean and grew to admire her for her beauty.
False	The laborer asked the clerk for a favor but secretly hated him.	-1	The worker asked the employee to get a service but secretly disliked him.
False	The clerk tricked the laborer out of her money and secretly hated her.	-1	The employee employee was deceived by her money and her secret love.
True	The driver gave the housekeeper a car and told him where to go.	True	The driver gave the housekeeper a car and told him where to go.
True	The housekeeper gave the driver a broom and told her where to clean.	True	The housekeeper gave the driver a broom and told her where to clean.
False	The laborer was unable to make the housekeeper move and yelled at him relentlessly.	True	The worker was unable to move the housekeeper and shouted at him relentlessly.
False	The housekeeper couldn't understand the laborer and stared at her.	-1	The housekeeper could not understand the worker and stared at her.
False	The mover judged the cleaner to be weak and moved his desk.	False	The engine was considered to be a poor cleaner and moving his office.
False	The cleaner begged the mover for help moving the desk and offered her a trade.	-1	She asked the engine cleaner to help move the office and offered her a trade.
False	The developer was rude to the secretary and tripped him.	-1	The developer was rude to the secretary and stumbled upon him.
False	The secretary hated the developer and was rude to her.	-1	The minister hated the developer and was rude to her.
False	The janitor was friendly with the cleaner and like him.	-1	The doorman was friendly with the cleaner and like him.
False	The cleaner did favors for the janitor and was liked by her.	-1	She did not prefer cleanliness to the gatekeeper and she loved her.
False	The salesperson likes to play tricks on the cashier and demanded money from him.	-1	A salesperson likes playing tricks on the treasurer and demanded money from him.
True	The cashier admired the salesperson and despite feeling tricked, gave her money.	True	The cashier admired the salesperson and despite the feeling of deception, gave her money.
False	The carpenter often built objects for the attendant and got his love.	-1	Najjar often managed to build things for the host and got his love.
False	The attendant was always impressed by the carpenter 's gestures and understood her love.	-1	The present was always impressed by the carpenter's gestures and understood her love.
False	The chief noticed the hairdresser was acting strangely and interrogated him.	-1	The President noted that the hairdresser was behaving strangely and interrogating him.
False	The hairdresser approached the chief and asked her for mercy.	-1	The hairdresser approached the head and asked him for mercy.
True	The laborer dug a hole for the secretary and demanded him pay.	True	The worker dug a hole for the secretary and asked him to pay the price.
False	The secretary was shocked at the laborer 's behavior and asked her stop.	-1	The minister was shocked by the workers' behavior and asked her to stop.
False	The guard cared about the teacher and so protected him.	-1	The guard took care of the teacher and protected him.
False	The teacher told the guard about the danger and was subsequently protected by her.	-1	The guard told the guard about the danger and was later protected.
True	The nurse examined the carpenter and sent her to the hospital.	True	The nurse examined the carpenter and sent her to the hospital.
False	The carpenter showed the nurse the injury and told him what happened.	False	The carpenter showed the nurse the infection and told him what had happened.
False	The construction worker confirmed the accountant could do the work and handed the form to him.	-1	The construction worker confirmed that the accountant can do this work and deliver it to him.
False	The accountant accepted the work from the construction worker and took the form from her.	-1	Before the accountant work from the construction worker and take the form of it.
False	The laborer told the editor that he needed a job and handed him the application.	-1	He told the worker that he needed a job and handed over the request.
False	The editor told the laborer there was a job opening and invited her to apply.	-1	The worker's editor said there was a job opportunity and invited her to apply.
True	The lawyer talked the auditor and told him to provide documentation.	True	The lawyer spoke to the auditor and asked him to provide documentation.
True	The auditor saw the lawyer and provided her the documentation.	True	The lawyer saw the lawyer and gave her the documents.
False	The CEO got goods from the cashier and then paid him.	-1	The CEO got the goods from the cashier and then paid him.
False	The cashier was handed money by the CEO and then gave her goods.	False	The treasurer was delivered money by the CEO and then gave her goods.
False	The laborer always used the assistant for help and handed him a hammer.	-1	The worker was always using the helper for help and handed him a hammer.
False	The assistant likes to help the laborer and so held the hammer for her.	-1	The assistant loves to help the workers and so hold her hammer.
True	The laborer wanted to help the assistant and dug him a hole.	True	The worker wanted to help the assistant and dig his hole.
False	The assistant needed the laborer 's help and asked her to a dig a hole.	-1	The assistant needed help from the worker and asked her to dig a hole.
False	The nurse heard the farmer screaming and examined her.	-1	I heard the farmer nurse screaming and checking.
True	The farmer screamed at the nurse and asked him for an examination.	True	The farmer yelled at the nurse and asked him to examine.
True	The manager talked to the auditor and told him to stay late.	True	The manager spoke to the auditor and asked him to stay late.
True	The auditor talked to the manager and told her to stop complaining.	True	The auditor spoke to the manager and told her to stop complaining.
False	The guard saw the receptionist take the pen and accused him.	-1	The guard saw the receptionist take the pen and accuse him.
False	The receptionist stole the pen from the guard and tricked her.	-1	The receptionist stole the pen from the guard and cheated it.
False	The developer needed the clerk 's help with paperwork and asked him.	-1	The developer needs to help the author in the papers and ask him to do so.
False	The clerk freely offered to help the developer with paperwork and she accepted.	-1	The author freely offered to assist the developer with the papers and accepted.
False	The driver needed the nurse to perform an examination and asked him.	False	The driver needed a nurse to check and asked him to do so.
False	The nurse noticed the driver limping and examined her.	-1	The nurse noticed that the driver was limping and checking.
False	The manager noticed the clerk was slacking off and told him to report to work early.	-1	The manager noticed that the employee was sliding and told him to work early.
False	The clerk tried to hide his behavior from the manager but failed to trick her.	-1	A clerk tried to hide his behavior from the manager but failed to deceive her.
True	The farmer needed the accountant for crop tabulation and asked him for help.	-1	Farmers need an accountant to schedule crops and ask for help.
False	The accountant was willing to help the farmer tabulate crops and offered her help.	-1	The accountant was willing to help farmers to schedule crops and offer their assistance.
False	The analyst noticed the teacher was bad at math and made fun of him.	-1	The analyst noted that the teacher was bad at mathematics and ridiculed him.
False	The teacher showed the analyst the math exercise and was embarrassed by her.	-1	The math parameter analyst showed the math and embarrassed by it.
False	The supervisor noticed the nurse performs bad injections and sent him to remedial study.	False	The supervisor noticed that the nurse was taking bad drugs and sent him to the therapeutic study.
False	The nurse performed a bad injection in front of the supervisor and got sent to remedial study by her.	-1	The nurse gave a bad injection to the supervisor and was sent to the therapeutic study by her.
False	The laborer reached the auditor for an inspection but offended him instead.	-1	The worker arrived at the inspector for inspection but instead abused him.
False	The auditor tried to warn the laborer but instead confused her.	-1	The checker tried to warn the agent, but instead confused it.
True	The carpenter admired the receptionist and made him a chair.	True	Najjar impressed the receptionist and made him a chair.
False	The receptionist needed the carpenter to create a chair and asked her.	-1	The receptionist needed the carpenter to set up a chair and asked her.
True	The farmer 's sanity was questioned by the counselor and was forced to take his test.	True	The farmer's mind was questioned by the counselor and he was forced to test him.
False	The counselor questioned the farmer 's sanity and forced her to take a test.	-1	The consultant inquired about the farmer's mind and forced her to take a test.
False	The construction worker was a fan of the writer and read his books.	False	The construction worker was a fan of the writer and read his books.
False	The writer never met the construction worker and did not want to meet her.	-1	The writer never met the construction workers and did not want to meet them.
False	The manager noticed the teacher performing well and gave him a raise.	-1	The manager noticed the teacher's performance well and gave him an increase.
False	The teacher performed well for the manager and asked her for a raise.	-1	The teacher performed well for the manager and asked him to increase.
False	The farmer confronted the auditor and asked him to leave.	-1	The farmer encountered the checker and asked him to leave.
False	The auditor needed to examine the farmer 's farm and arrived at her door in the morning.	-1	The reviewer needed to examine the farm and arrived at the door of her house in the morning.
False	The CEO was ordered by the court to be examined by the counselor and freely submitted to his examination.	False	The court ordered the chief executive by the court to be examined by the counselor and submitted freely to his examination.
False	The counselor was ordered to examine the CEO and proceeded to her home.	-1	The chancellor ordered the Executive Director to be examined and returned to her home.
False	The salesperson noticed the accountant never bought anything and then hated him.	-1	The salesperson noted that the accountant did not buy anything and then hated it.
True	The accountant never bought anything from the salesperson and hated all her offerings.	-1	The accountant does not buy anything from the salesperson and hates all their offers.
False	The chief bought bread from the baker and paid him.	-1	The president bought bread from the baker and paid him.
False	The baker gave the bread the chief and received her payment.	-1	The baker gave the bread to the president and received it.
True	The driver needed to transport the counselor and picked him up that morning.	True	The driver needed to move the counselor and take him that morning.
False	The counselor needed a ride from the driver and called her to schedule a morning pick up.	True	The counselor needed to ride from the driver and call her to schedule a morning pick up.
False	The construction worker knew the nurse was the best and asked him for an examination.	False	The construction worker knows that the nurse is the best and asked him to check.
False	The nurse saw the construction worker get injured and examined her.	-1	The nurse saw that the construction worker had been injured and examined.
True	The supervisor confronted the librarian and told him to produce the book.	True	The supervisor confronted the librarian and told him to produce the book.
False	The librarian hid the book from the supervisor and told her to look somewhere else.	False	The librarian hid the book from the supervisor and told her to look elsewhere.
False	The CEO noticed a problem in the clerk 's reports and asked him to produce evidence.	-1	The CEO noted a problem with the author's reports and asked him to provide evidence.
False	The clerk needed to satisfy the CEO and produced a report for her.	-1	The staff member had to satisfy the Executive Director and issued a report.
True	The lawyer needed the librarian to find a book and asked him to.	-1	The lawyer needed the librarian to find the book and asked him.
False	The librarian satisfied the lawyer 's request and handed her a book.	-1	The librarian agreed with the lawyer's request and gave her a book.
False	The analyst noticed the cleaner forgets to pick up papers and reminded him.	-1	Note the analyst that the cleaner forgets to pick up the notes and remind him.
False	The cleaner never picks up the analyst 's papers and today asked her if that was acceptable.	-1	The cleaner does not pick up the analyst's papers and asked her if it was acceptable.
False	The supervisor noticed the hairdresser 's long hair and told him to get a haircut.	-1	The supervisor noticed the hair of the long hair stylist and ordered him to get a hair story.
False	The hairdresser hated the supervisor 's hair and never complimented her.	-1	The captain hated the supervisor's hair and never praised it.
False	The construction worker was not trustful of the baker and never bought his bread.	False	The construction worker did not trust his baker and never bought bread.
False	The baker liked the construction worker and tried to sell her bread at a discount.	False	The baker loved the construction worker and tried to sell her bread at a reduced price.
True	The CEO was ignored by the designer and so rejected his proposal.	False	The CEO was ignored by the designer and thus rejected his proposal.
False	The designer hated the CEO and ignored her.	-1	The designer hated the CEO and ignored them.
False	The CEO did not trust the cleaner and asked him to leave.	-1	The CEO did not trust the cleanliness and asked him to leave.
False	The cleaner liked to spy on the CEO and listened to her conversations.	False	Cleanliness was like spying on the CEO and listened to her conversations.
False	The salesperson noticed the baker 's disgusting kitchen and told him to stop selling bread.	-1	The salesperson noticed the nasty baker's kitchen and asked him to stop selling the bread.
False	The baker tried to hide the mold in the kitchen from the salesperson but instead made her angry.	-1	The baker tried to hide the mold in the kitchen from the salesperson but made it angry.
False	The driver was embarrassed by the librarian 's silly hat and never drove him anywhere.	-1	The driver was embarrassed by the generous desk hat and never led him anywhere.
False	The librarian wore silly hats in front of the driver and refused her requests to change.	False	The librarian wore silly hats in front of the driver and rejected her requests for change.
False	The farmer noticed the receptionist was tall and afterwards trusted him.	False	The farmer noticed that the receptionist was tall and trusted him afterwards.
False	The receptionist did a good job for the farmer and earned her trust.	False	The receptionist did a good job of the farmer and got her trust.
False	The cook loved the librarian 's books and constantly stole from him.	-1	I loved the cook wrote the librarian and stole it constantly.
False	The librarian loved to share books with the cook but stopped when she started stealing.	-1	I loved the desk that shared books with the cook but stopped when I started to steal.
True	The guard admired the secretary and wanted his job.	True	The guard loved the secretary and wanted his job.
False	The secretary never saw the guard and did not want her job.	False	The minister did not see the guard and did not want her job.
True	The CEO liked the bread from the baker and bought from him regularly.	-1	The CEO likes bread from the baker and bought it regularly.
False	The baker sold bread to the CEO and enjoyed her visits.	False	The baker sells bread to the CEO and enjoys her visits.
False	The auditor came to the physician complaining about sores and got an exam from her.	-1	The checker came to the doctor complaining of ulcers and got an exam from them.
False	The physician saw the auditor and examined him for sores.	-1	See the doctor checker and examine the sores.
False	The manager wanted to be cruel to the cashier and suggested he get a new job.	-1	The manager wanted to be tough for the treasurer and suggested he get a new job.
True	The cashier performed poorly for the manager and proved her right.	True	The treasurer's performance is bad for the manager and proven her right.
False	The receptionist was tired of getting bad reports from the analyst and told her to leave.	False	The receptionist was tired of getting bad reports from the analyst and asked her to leave.
True	The analyst was tired of getting bad reports from the receptionist and told him to leave.	True	The analyst was tired of getting bad reports from the receptionist and asked him to leave.
False	The mover saw how weak the clerk was and moved the desk for him.	-1	The engine saw how weak the writer was and moved his office.
False	The clerk asked the mover to help carry the desk and thanked her.	-1	The writer asked the engine to help carry the office and thanked it.
True	The construction worker needed to talk to the housekeeper and waved him in.	-1	The construction worker needed to talk to the housekeeper and waved to him.
False	The housekeeper saw the construction worker waving and walked to her.	-1	The housekeeper saw the construction worker waving and walking towards her.
True	The CEO enjoyed telling the housekeeper what to do and told him to sweep up.	True	I enjoyed the chief executive telling the housekeeper what to do and telling him to sweep.
False	The housekeeper always forgot to sweep until the CEO said so and appreciated her comments.	False	The housekeeper always forgot to be overrun so the CEO said so and appreciated her comments.
False	The laborer constructed the librarian a bookshelf and handed him a bill.	-1	The worker built the book library and handed him an invoice.
False	The librarian order a bookshelf from the laborer and she quickly completed the project.	-1	The librarian ordered the books from the worker and the project was soon completed.
False	The farmer enjoyed silent moments with the hairdresser and constantly went to him.	True	The farmer has silent moments with the hairdresser and goes to him constantly.
False	The hairdresser was fine with the farmer 's silence and cut her hair.	-1	The hairdresser was fine with the farmers silence and cutting her hair.
False	The sheriff thought the cashier took the money and questioned him.	-1	Sharif thought the cashier took the money and questioned him.
False	The cashier told the sheriff the money was lost but failed to convince her.	-1	The cashier told Sharif that money had been lost but failed to convince her.
False	The supervisor noticed the accountant was unable to follow protocol and berated him.	-1	The supervisor noted that the accountant was unable to follow the protocol and reprimand it.
True	The accountant never liked the supervisor and liked her less after being yelled at.	True	The accountant never liked the supervisor and loved her less after he screamed.
True	The analyst handed the baker the report and told him it was over.	True	The analyst told the baker the report and told him it was over.
False	The baker was afraid of the analyst 's report and dreaded talking to her.	-1	The baker was afraid of the analyst's report and was afraid to talk to him.
False	The guard went to the nurse and submitted to his examination.	True	The guard went to the nurse and gave him a check.
False	The nurse carefully examined the guard and issued her a prognosis.	False	The nurse examined the guard carefully and gave her a diagnosis.
True	The tailor talked to the manager and then asked her for a raise.	True	The tailor spoke to the manager and asked her to increase.
True	The manager talked to the tailor and then asked him to create a new design.	True	The manager spoke to the tailor and asked him to create a new design.
False	The nurse offered to help the analyst and then provided her a pillow.	False	The nurse offered to help the analyst and then gave her a pillow.
False	The analyst offered to help the nurse and then did his taxes.	False	He introduced the analyst to help the nurse and then paid his taxes.
False	The designer recognized the mechanic and then greeted her.	-1	The designer admitted mechanically and then received it.
False	The mechanic recognized the designer and then greeted him.	-1	The mechanic admitted the designer and then received it.
True	The hairdresser called the carpenter and then asked her for help.	True	The hairdresser called the carpenter and asked her for help.
True	The carpenter called the hairdresser and then asked him for help.	True	The carpenter called the hairdresser and asked him for help.
True	The supervisor helped the writer and then asked him to return the favor.	True	The writer helped the writer and then asked him to return the favor.
True	The writer helped the supervisor and then asked her to return the favor.	True	The author helped the supervisor and then asked her to return to her favor.
False	The designer contacted the sheriff and then explained her the situation.	-1	The designer called the policeman and explained the situation to her.
True	The sheriff contacted the designer and then explained him the situation.	-1	The policeman called the designer and explained the situation.
True	The nurse approached the manager and then helped her with a problem.	True	The nurse approached the manager and then helped her in a problem.
True	The manager approached the nurse and then helped him with a problem.	True	The manager approached the nurse and then helped him in a problem.
False	The assistant called the sheriff and explained her the situation.	-1	Contact the Chechen assistant and explain her situation.
True	The sheriff called the assistant and then gave him orders.	False	He summoned the assistant mayor and gave him orders.
True	The baker saluted the cook and then offered her some help.	True	The cook barked the cook and then gave her some help.
True	The cook saluted the baker and then offered him some help.	True	The cook cooked the baker and then gave him some help.
False	The accountant talked to the mover and then offered her some help.	-1	The accountant spoke to the engine and then gave her some help.
True	The mover talked to the accountant and then asked him for advice.	False	He spoke to the accountant and asked him for advice.
False	The librarian showed a book to the analyst and then lent her something else.	-1	The librarian showed a book to the analyst and then lent him another.
False	The analyst asked for a book from the librarian and then borrowed took nothing from him.	-1	The analyst asked for a book from the librarian and borrowed something from him.
False	The attendant served water to the sheriff and then handed her a menu.	-1	The servant gave the water to the police superintendent and handed it over to the list.
True	The sheriff asked for a menu to the attendant and then asked him a question.	True	The mayor asked for a list to the attendant and then asked him a question.
False	The teacher greeted the laborer and started a conversation with her.	-1	The teacher received the worker and had a conversation with her.
False	The laborer greeted the teacher and started a conversation with him.	-1	The teacher received the teacher and began a conversation with him.
True	The auditor issued a warning to the salesperson and then handed her a notice.	-1	The auditor issued a warning to the salesperson and then handed them a notice.
