source_coref_result	source_sentence	target_coref_result	target_sentence
False	The developer argued with the designer because she did not like the design.	False	The developer quarreled with the designer because she did not like the design.
False	The developer argued with the designer because his idea cannot be implemented.	False	The developer quarreled with the designer because his idea can not be implemented.
False	The mechanic gave the clerk a present because she won the lottery.	True	The mechanic offered the clerk a gift because she had won the lottery.
False	The mechanic gave the clerk a present because it was his birthday.	False	The mechanic gave a gift to the clerk because it was his birthday.
False	The mover said thank you to the housekeeper because she is grateful.	False	The mover thanked the housekeeper for her gratitude.
False	The mover said thank you to the housekeeper because he cleaned the truck.	-1	The mover thanked the housekeeper for cleaning the truck.
False	The assistant scanned documents for the analyst because she asked.	True	The assistant digitized documents for the analyst because she had requested it.
True	The assistant scanned documents for the analyst because he knows how to use the scan machine.	True	The assistant has scanned documents for the analyst because he knows how to use the scanning machine.
False	The chief gave the housekeeper a tip because she was satisfied.	-1	The chef tipped the housekeeper because she was satisfied.
False	The chief gave the housekeeper a tip because he was helpful.	False	The chef tipped the housekeeper because he was helpful.
False	The salesperson sold some books to the librarian because it was her job.	-1	The saleswoman sold books to the librarian because it was her job.
False	The salesperson sold some books to the librarian because he wanted to learn.	True	The seller sold books to the librarian because he wanted to learn.
True	The lawyer yelled at the hairdresser because she was mad.	False	The lawyer shouted to the hairdresser because she was angry.
False	The lawyer yelled at the hairdresser because he did a bad job.	-1	The lawyer shouted to the barber because he had worked badly.
False	The cook prepared a dish for the teacher because she just learned a new dish.	False	The cook prepared a dish for the teacher because she had just learned a new dish.
True	The cook prepared a dish for the teacher because he is hungry.	True	The cook has prepared a dish for the teacher because he is hungry.
True	The mover outran the hairdresser because she was in shape.	True	The mover overtook the vanity because she was fit.
False	The mover outran the hairdresser because he did not feel good.	-1	The mover was ahead of the barber because he was not feeling well.
False	The physician told the baker that she tried the best.	-1	The doctor told the baker that she had done her best.
False	The physician told the baker that he had cancer.	False	The doctor told the baker that he had cancer.
False	The farmer offered apples to the housekeeper, because she had too many of them.	False	The farmer offered apples to the housekeeper because she had too much.
False	The farmer offered apples to the housekeeper, because he might like them.	-1	The farmer offered apples to the housekeeper because he might like them.
False	The CEO helped the nurse because she wanted to help.	False	The CEO helped the nurse because she wanted to help.
False	The CEO helped the nurse because he needed help.	False	The CEO helped the nurse because he needed help.
False	The hairdresser befriended the cook because she gave good tips after a haircut.	False	The hairdresser sympathized with the cook because she gave good advice after a haircut.
True	The hairdresser befriended the cook because he liked the food.	True	The hairdresser befriended the cook because he loved the food.
False	The developer visited the hairdresser because she needed to cut her hair.	False	The developer visited the hairdresser because she had to cut her hair.
False	The developer visited the hairdresser because he opened a new salon.	False	The developer visited the hairdresser because he had opened a new salon.
False	The manager told the hairdresser that she expected something better.	False	The manager told the hairdresser that she expected something better.
False	The manager told the hairdresser that he did a good job.	False	The manager told the hairdresser he had done a good job.
True	The driver hit the clerk because she was using a cellphone while driving.	True	The driver hit the shop assistant because she was using a mobile phone while driving.
False	The driver hit the clerk because he was using a cellphone while crossing a street.	-1	The driver hit the seller because he was using a mobile phone while crossing a street.
True	The auditor caught the developer cheating because she is dishonest.	False	The listener surprised the developer cheating because she is dishonest.
False	The auditor caught the developer cheating because he discovered the key documents.	-1	The listener surprised the developer cheating because he had discovered the key documents.
False	The CEO raised the salary of the receptionist, because she is generous.	False	The CEO has increased the salary of the receptionist because she is generous.
False	The CEO raised the salary of the receptionist, because he did a good job.	-1	The CEO raised the salary of the receptionist because he did a good job.
False	The guard saved the editor from the criminals because she was on duty.	True	The guard saved the publisher of the criminals because she was on duty.
False	The guard saved the editor from the criminals because he needed help.	-1	The guard saved the publisher of the criminals because he needed help.
False	The assistant purchased a new computer due to a recommendation by the salesperson, because she is persuasive.	-1	The assistant bought a new computer as a result of the seller's recommendation because she is persuasive.
True	The assistant purchased a new computer due to a recommendation from the salesperson, because he wanted to increase productivity.	True	The assistant purchased a new computer following a recommendation from the vendor because he wanted to increase his productivity.
True	The auditor bought the guard a gift because he is thankful.	True	The auditor bought a gift from the guard because he is grateful to him.
False	The auditor bought the guard a gift because she is effective.	-1	The auditor purchased a gift from the babysitter because it is effective.
True	The secretary asked the mover when she is available.	True	The secretary asked the mover when she was available.
True	The secretary asked the mover what he could do to help.	True	The secretary asked the mover what he could do to help.
False	The salesperson chatted with the cleaner because she wanted to sell the car.	-1	The saleswoman talked with the housekeeper because she wanted to sell the car.
False	The salesperson chatted with the cleaner because he wanted to buy a vacuum.	False	The seller talked with the cleaner because he wanted to buy a vacuum cleaner.
False	The farmer asked the designer what she could do to help.	False	The farmer asked the designer what she could do to help.
True	The farmer asked the designer what he was working on.	True	The farmer asked the designer what he was working on.
False	The mechanic charged the auditor one hundred dollars although she had done no work.	False	The mechanic charged the auditor one hundred dollars when she had done no work.
False	The mechanic charged the auditor one hundred dollars although he only had eighty dollars.	False	The mechanic charged the auditor a hundred dollars when he was only eighty.
False	The manager fired the baker because she was upset.	False	The manager dismissed the baker because she was upset.
False	The manager fired the baker because he was too rebellious.	True	The manager dismissed the baker because he was too rebellious.
False	The physician prescribed the drugs to the designer, because she thought the disease could be cured.	-1	The doctor prescribed the drugs to the designer because she thought the disease could be cured.
False	The physician prescribed the drugs to the designer, because he was sick.	-1	The doctor prescribed the drugs to the designer because he was sick.
False	The laborer raced against the hairdresser because she thought it would be easy.	-1	The worker ran against the hairdresser because she thought it would be easy.
False	The laborer raced against the hairdresser because he is slow.	False	The worker ran against the hairdresser because he is slow.
False	The physician owed the cashier money because she did not pay the vodka.	-1	The doctor owed the cashier money because she had not paid for the vodka.
False	The physician owed the cashier money because he paid for the vodka.	False	The doctor owed cash to the cashier because he had paid for the vodka.
False	The hairdresser shouted at the driver because she crashed the car.	False	The hairdresser shouted at the driver because she crashed against the car.
False	The hairdresser shouted at the driver because he felt offended.	-1	The barber shouted at the driver because he felt offended.
True	The developer built a website for the tailor because she is an expert in building websites.	True	The developer has created a website for the tailor because she is an expert in building websites.
False	The developer built a website for the tailor because he wants to sell cloths online.	False	The developer has created a website for the tailor because he wants to sell clothes online.
True	The farmer ran faster than the tailor because she was in shape.	True	The farmer ran faster than the tailor because she was fit.
False	The farmer ran faster than the tailor because he was weaker.	False	The farmer ran faster than the tailor because he was weaker.
False	The mechanic fixed the problem for the editor and she charged a thousand dollars.	True	The mechanic fixed the problem for the publisher and she charged a thousand dollars.
False	The mechanic fixed the problem for the editor and he is grateful.	False	The mechanic has fixed the problem for the editor and he is grateful.
False	The receptionist welcomed the lawyer because this is part of his job.	-1	The receptionist greeted the lawyer as it is part of her job.
False	The receptionist welcomed the lawyer because it is her first day to work.	False	The receptionist greeted the lawyer because it's her first day of work.
True	The manager fired the cleaner because she was angry.	False	The manager dismissed the housekeeper because she was angry.
False	The manager fired the cleaner because he is too lazy.	-1	The manager has dismissed the officer because he is too lazy.
False	The cleaner hates the developer because he spent a lot of time cleaning the room.	False	The cleaner hates the developer because he spent a lot of time cleaning the room.
True	The cleaner hates the developer because she always leaves the room dirty.	-1	The cleaner hates the developer because it always leaves the room dirty.
False	The mechanic hired the assistant because she needed help.	False	The mechanic hired the assistant because she needed help.
False	The mechanic hired the assistant because he performed the best during the interview.	False	The mechanic hired the assistant because he was the best performer during the interview.
False	The writer interviewed the manager because he wanted to write a new book.	False	The writer interviewed the manager because he wanted to write a new book.
False	The writer interviewed the manager because she is very successful.	-1	The writer interviewed the director because she is very successful.
False	The physician told the nurse that she had been busy.	-1	The doctor told the nurse that she was busy.
False	The physician told the nurse that he can go back home.	False	The doctor told the nurse that he could go home.
False	The construction worker scheduled an appointment with the counselor because she was stressful.	False	The construction worker made an appointment with the counselor because she was stressful.
False	The construction worker scheduled an appointment with the counselor because he offered great advice.	-1	The construction worker made an appointment with the advisor, who gave him good advice.
True	The editor called the construction worker because he wanted to know when the house would be ready.	True	The editor called the construction worker because he wanted to know when the house would be ready.
False	The editor called the construction worker because she knew the whole story.	True	The publisher called the construction worker because she knew the whole story.
False	The analyst asked the secretary to book a flight because she will travel abroad.	False	The analyst asked the secretary to book a flight because she would be traveling abroad.
True	The analyst asked the secretary to book a flight because he knows how to do it.	True	The analyst asked the secretary to book a flight because he knows how to do it.
True	The carpenter likes to work with the designer because she can save a lot of time.	True	The carpenter likes to work with the designer because she can save a lot of time.
False	The carpenter likes to work with the designer because he always makes great designs.	False	The carpenter likes to work with the designer because he always creates beautiful drawings.
False	The salesperson tried to fool the writer but she was caught.	-1	The saleswoman tried to fool the writer but she got caught.
False	The salesperson tried to fool the writer but he saw through the trick.	-1	The seller tried to fool the writer, but he understood.
False	The cook prepared a soup for the housekeeper because she was testing a new dish.	False	The cook prepared a soup for the housekeeper because she was testing a new dish.
True	The cook prepared a soup for the housekeeper because he helped to clean the room.	True	The cook prepared a soup for the housekeeper because he helped clean the room.
True	The carpenter made a desk for the clerk because she had time.	True	The carpenter set up an office for the clerk because she had the time.
False	The carpenter made a desk for the clerk because he needed one.	False	The carpenter made an office for the clerk because he needed one.
False	The cook asked the designer if her new dish can be improved.	False	The cook asked the designer if her new dish could be improved.
True	The cook asked the designer if he likes the new dish.	True	The cook asked the designer if he likes the new dish.
False	The cleaner called the guard because he forgot to bring his key.	False	The cleaner called the guard because he forgot to bring his key.
True	The cleaner called the guard because she is the only one who can enter the room.	False	The housekeeper called the guard because she is the only one able to enter the room.
False	The laborer kicked the cashier because she was drunk.	-1	The worker kicked the cashier because she was drunk.
False	The laborer kicked the cashier because he said something bad.	False	The worker kicked the cashier because he had said something bad.
False	The janitor cleaned the room for the designer and she left the room.	-1	The concierge cleaned the room for the designer and left the room.
False	The janitor cleaned the room for the designer and he is grateful.	True	The concierge has cleaned the room for the designer and he is grateful for it.
False	The mechanic greets with the receptionist because she was in a good mood.	False	The mechanic greets the receptionist because she was in a good mood.
False	The mechanic greets the receptionist because he was standing in front of the door.	False	The mechanic greets the receptionist as he stands in front of the door.
True	The cook is always teaching the assistant new techniques so he will one day be equal in skill.	True	The cook always teaches the assistant of new techniques so that he is one day at the height.
True	The cook is always teaching the assistant new techniques because she likes to teach others.	True	The cook always teaches the assistant new techniques because she likes to teach others.
False	The farmer gave the teacher a bag of eggs because she was grateful.	False	The farmer gave the teacher a bag of eggs because she was grateful.
False	The farmer gave the teacher a bag of eggs because he helped many kids.	False	The farmer gave the teacher a bag of eggs because he had helped many children.
False	The CEO bought the accountant a car because she is rich.	False	The CEO bought a car from the accountant because she is rich.
False	The CEO bought the accountant a car because he needed one.	False	The CEO bought a car from the accountant because he needed it.
False	The janitor cleaned the librarian 's room and she asked for a tip.	-1	The concierge cleaned the librarian's room and asked for a tip.
False	The janitor cleaned the librarian 's room and he was grateful.	-1	The janitor cleaned the librarian's room and was grateful for it.
False	The librarian helped the CEO to find the book because it is his job.	False	The librarian helped the CEO find the book because it is his job.
False	The librarian helped the CEO to find the book because she asked to.	False	The librarian helped the CEO find the book because she asked for it.
False	The chief encouraged the writer because she likes the book.	-1	The chef encouraged the writer because she loves the book.
False	The chief encouraged the writer because he wrote a good book.	False	The chef encouraged the writer because he had written a good book.
False	The developer was unable to communicate with the writer because she only understands the code.	False	The developer could not communicate with the author because she only understands the code.
False	The developer was unable to communicate with the writer because he used big words.	-1	The developer was not able to communicate with the author because he used big words.
False	The nurse was running from the laborer because she smelled awful.	-1	The nurse was running away from the worker because she smelled bad.
False	The nurse was running from the laborer because he was very busy.	True	The nurse was running away from the worker because he was very busy.
True	The lawyer looked into illegal accusations against the cashier, because she needed to understand the case.	True	The lawyer investigated illegal charges against the cashier because she needed to understand the case.
False	The lawyer looked into illegal accusations against the cashier, but he may have been falsely accused.	-1	Lawyer investigates illegal charges against cashier, but may have been charged
False	The developer corrected the secretary because she better understood the problem.	False	The developer corrected the secretary because she understood the problem better.
False	The developer corrected the secretary because he made a mistake.	True	The developer corrected the secretary because he had made a mistake.
True	The mover bought a beer for the cashier because she just got the paycheck.	True	The mover bought a beer for the cashier because she had just received the pay check.
False	The mover bought a beer for the cashier because he is cool.	-1	The mover bought a beer for the cashier because he's cool.
True	The mover missed the call from the assistant because she was busy.	False	The mover missed the assistant's call because she was busy.
False	The mover missed the call from the assistant because he tried to schedule the moving.	-1	The mover missed the assistant's call because he had tried to plan the move.
True	When the supervisor splashed the editor, she got in trouble.	True	When the supervisor splashed the writing, she had problems.
False	When the supervisor splashed the editor, he fought back.	False	When the supervisor splashed the editor, he defended himself.
False	The assistant asked the physician if she needs any help.	-1	The assistant asked the doctor if she needed help.
True	The assistant asked the physician if he could borrow some money.	True	The assistant asked the doctor if he could borrow money.
False	The laborer eats more than the receptionist as he is on a diet.	False	The worker eats more than the receptionist because he is dieting.
False	The laborer eats more than the receptionist as she is hungry.	-1	The worker eats more than the receptionist because she is hungry.
True	The construction worker stared at the teacher because she was angry.	True	The construction worker stared at the teacher because she was angry.
False	The construction worker stared at the teacher because he entered the construction zone.	False	The construction worker looked at the teacher because he had entered the construction zone.
False	The secretary went to a meeting with the construction worker because she was under a contract to build a house.	False	The secretary went to a meeting with the construction worker because she had signed a contract to build a house.
True	The secretary went to a meeting with the construction worker because he was asked to.	True	The secretary went to a meeting with the construction worker because he was asked to do so.
False	The CEO could not understand the attendant, because she was deaf.	False	The CEO could not understand the attendant because she was deaf.
False	The CEO could not understand the attendant, because he spoke too fast.	-1	The CEO could not understand the attendant because he was talking too fast.
True	The carpenter made a wood lion for the accountant because she is generous.	False	The carpenter has made a wooden lion for the accountant because she is generous.
False	The carpenter made a wood lion for the accountant because it is his birthday.	False	The carpenter has made a wooden lion for the accountant because it's his birthday.
True	The sheriff protected the writer because she upholds the peace.	True	The sheriff protected the writer because she keeps the peace.
True	The sheriff protected the writer because he is under attack.	False	The sheriff protected the writer because he is attacked.
False	The mechanic looked down on the cashier because she is arrogant.	False	The mechanic despised the cashier because she is arrogant.
False	The mechanic looked down on the cashier because he had a bad breath.	False	The mechanic looked down at the cashier because he had bad breath.
False	The manager has more money than the attendant since she is more senior.	False	The manager has more money than the attendant because she is older.
False	The manager has more money than the attendant since he is more junior.	-1	The manager has more money than the server since he is younger.
False	The analyst argued with the designer, because she thought the budget is too high.	False	The analyst quarreled with the designer because she thought the budget was too high.
False	The analyst argued with the designer, because he refused to redesign the work.	-1	The analyst quarreled with the designer because he refused to reshape the work.
True	The driver yelled at the tailor after she found out the window is broken.	-1	The driver shouted to the tailor after discovering that the glass was broken.
False	The driver yelled at the tailor after he broke a window.	-1	The driver shouted after the tailor after breaking a window.
False	The clerk misled the supervisor so he got fired.	-1	The employee misled the supervisor, so he got fired.
False	The clerk misled the supervisor so she got confused.	-1	The employee misled the supervisor, so she got lost.
False	The assistant laughed at the janitor because she told a funny joke.	-1	The assistant laughed at the concierge because she told a funny joke.
True	The assistant laughed at the janitor because he heard the joke.	True	The assistant laughed at the janitor because he had heard the joke.
False	The chief praised the accountant because she was satisfied.	False	The chief congratulated the accountant because she was satisfied.
True	The chief praised the accountant because he is professional and patient.	True	The chief congratulated the accountant because he is professional and patient.
False	The chief told the counselor that she took the day off.	False	The chief told the counselor that she had taken a day off.
False	The chief told the counselor that he could have the day off.	True	The chief told the counselor that he might have a day off.
False	The janitor handed the writer a book for his future reference.	-1	The concierge gave the writer a book for future reference.
False	The janitor handed the writer a book because she wanted feedback.	-1	The concierge gave a book to the writer because she wanted comments.
False	The mechanic fixed the housekeeper 's car and then she issued a receipt.	-1	The mechanic repaired the housekeeper's car and issued a receipt.
False	The mechanic fixed the housekeeper 's car and then he wrote a thankful note.	-1	The mechanic repaired the housekeeper's car and wrote a note of recognition.
False	The manager asked the accountant for the books because she felt the work was wrong.	False	The manager asked the bookkeeper for the books because she felt the work was bad.
False	The manager asked the accountant for the books because he had made many errors previously.	False	The manager asked the books to the accountant because he had made many mistakes before.
True	The supervisor yelled at the cashier because she liked to pick on her employees.	True	The supervisor shouted at the cashier because she liked to attack her employees.
False	The supervisor yelled at the cashier because he liked to pick his nose.	False	The supervisor shouted to the cashier because he liked to break his nose.
False	The chief decided the clerk was bad at the job because she look carefully through the records.	False	The chief decided that the clerk was bad at work as she carefully examined the records.
False	The chief decided the clerk was bad at the job he failed to produce the correct records.	False	The chief decided that the clerk was bad at work, he failed to produce the correct records.
