source_coref_result	source_sentence	target_coref_result	target_sentence
False	The developer argued with the designer because she did not like the design.	False	The developer discussed with the designer because she did not like the design.
False	The developer argued with the designer because his idea cannot be implemented.	False	The developer argued with the designer because he could not implement his idea.
False	The mechanic gave the clerk a present because she won the lottery.	False	The mechanic gave the writer a gift because she won the lottery.
False	The mechanic gave the clerk a present because it was his birthday.	-1	The mechanic gave the writer a gift because it was his birthday.
False	The mover said thank you to the housekeeper because she is grateful.	-1	The engine said thank you housekeeper for being grateful.
False	The mover said thank you to the housekeeper because he cleaned the truck.	True	The engine said thank you to the housekeeper because he cleaned the truck.
False	The assistant scanned documents for the analyst because she asked.	-1	Document Assistant scanned for the analyst as requested.
False	The assistant scanned documents for the analyst because he knows how to use the scan machine.	-1	The Document Assistant scans the analyzer because it knows how to use the scanner.
False	The chief gave the housekeeper a tip because she was satisfied.	-1	The headkeeper gave the housekeeper a hint because she was satisfied.
False	The chief gave the housekeeper a tip because he was helpful.	-1	The headkeeper gave a tip because it was helpful.
False	The salesperson sold some books to the librarian because it was her job.	False	The salesperson sold some books to the librarian because it was her job.
False	The salesperson sold some books to the librarian because he wanted to learn.	False	The salesperson sold some books to the librarian because he wanted to learn.
True	The lawyer yelled at the hairdresser because she was mad.	True	The lawyer shouted at the hairdresser because she was angry.
False	The lawyer yelled at the hairdresser because he did a bad job.	False	The lawyer shouted at the hairdresser because he had done a bad job.
False	The cook prepared a dish for the teacher because she just learned a new dish.	-1	Prepare the chef according to the teacher because she has just learned a new recipe.
True	The cook prepared a dish for the teacher because he is hungry.	False	He prepared the chef according to the teacher because he was hungry.
False	The mover outran the hairdresser because she was in shape.	-1	Engine outran hair styling because they were in shape.
False	The mover outran the hairdresser because he did not feel good.	-1	The engine outweighs hair styling because it did not feel good.
False	The physician told the baker that she tried the best.	-1	The doctor told the baker that she had tried the best.
False	The physician told the baker that he had cancer.	False	The doctor told the baker that he had cancer.
False	The farmer offered apples to the housekeeper, because she had too many of them.	-1	Apple farms were introduced to the housekeeper, because they have a lot of them.
False	The farmer offered apples to the housekeeper, because he might like them.	False	The farmer gave an apple to the housekeeper, because he might like them.
False	The CEO helped the nurse because she wanted to help.	-1	The chief executive helped the nurse because she wanted to help.
False	The CEO helped the nurse because he needed help.	False	The chief executive helped the nurse because he needed help.
False	The hairdresser befriended the cook because she gave good tips after a haircut.	-1	The hairdresser became a friend of cooking because she gave good advice after cutting his hair.
True	The hairdresser befriended the cook because he liked the food.	True	The hairdresser became a friend of cooking because he loved food.
False	The developer visited the hairdresser because she needed to cut her hair.	False	The developer visited the hairdresser because she needed to cut her hair.
False	The developer visited the hairdresser because he opened a new salon.	False	The developer visited the hairdresser because he opened a new salon.
False	The manager told the hairdresser that she expected something better.	-1	The hairdresser said she expected something better.
False	The manager told the hairdresser that he did a good job.	True	The hairdresser said he did a good job.
True	The driver hit the clerk because she was using a cellphone while driving.	True	The driver hit the employee because she was using the mobile phone while driving.
False	The driver hit the clerk because he was using a cellphone while crossing a street.	-1	The driver injured the employee because he was using the mobile phone while crossing the street.
True	The auditor caught the developer cheating because she is dishonest.	-1	Check the cheat checker developer for it is dishonest.
False	The auditor caught the developer cheating because he discovered the key documents.	-1	Capture the cheat checker developer for it to discover key documents.
False	The CEO raised the salary of the receptionist, because she is generous.	-1	The executive director raised the salary of the receptionist, because it was gracious.
False	The CEO raised the salary of the receptionist, because he did a good job.	False	The executive director raised the salary of the receptionist, because he did a good job.
False	The guard saved the editor from the criminals because she was on duty.	-1	The Sentinel saved the criminals from being in service.
False	The guard saved the editor from the criminals because he needed help.	-1	Save the Sentinel from the criminals because he needed help.
False	The assistant purchased a new computer due to a recommendation by the salesperson, because she is persuasive.	-1	The assistant bought a new computer because of the recommendation of the salesperson, because it is convincing.
True	The assistant purchased a new computer due to a recommendation from the salesperson, because he wanted to increase productivity.	True	The assistant bought a new computer because of a recommendation from the salesperson, because he wanted to increase productivity.
False	The auditor bought the guard a gift because he is thankful.	-1	The Sentinel Checker bought a gift because he was grateful.
True	The auditor bought the guard a gift because she is effective.	-1	Auditor bought a gift guard because it is effective.
False	The secretary asked the mover when she is available.	-1	Transport Minister asked the engine when it was available.
False	The secretary asked the mover what he could do to help.	-1	The minister asked the engine what he could do to help.
True	The salesperson chatted with the cleaner because she wanted to sell the car.	True	The salesperson spoke to the cleaner because she wanted to sell the car.
False	The salesperson chatted with the cleaner because he wanted to buy a vacuum.	False	The salesperson spoke to the cleaner because he wanted to buy a vacuum.
False	The farmer asked the designer what she could do to help.	False	The farmer asked the designer what she could do to help.
True	The farmer asked the designer what he was working on.	True	The farmer asked the designer what he was working on.
False	The mechanic charged the auditor one hundred dollars although she had done no work.	True	The mechanic was charged a $ 100 checker even though she did not do any work.
False	The mechanic charged the auditor one hundred dollars although he only had eighty dollars.	-1	The mechanic was charged a $ 100 checker even though he was only eighty dollars.
False	The manager fired the baker because she was upset.	False	The manager fired the baker because she was upset.
False	The manager fired the baker because he was too rebellious.	True	The manager fired the baker because he was very rebellious.
False	The physician prescribed the drugs to the designer, because she thought the disease could be cured.	-1	The doctor prescribed medication for the designer, because she believes that the disease can be cured.
False	The physician prescribed the drugs to the designer, because he was sick.	False	The doctor prescribed medication for the designer, because he was ill.
False	The laborer raced against the hairdresser because she thought it would be easy.	-1	The worker raced against the hairdresser because she thought it would be easy.
False	The laborer raced against the hairdresser because he is slow.	-1	The worker raced against the hair stylist because he was slow.
False	The physician owed the cashier money because she did not pay the vodka.	-1	The doctor owes money to the treasurer because she did not pay vodka.
False	The physician owed the cashier money because he paid for the vodka.	-1	The doctor owes money to the treasurer because he paid for the vodka.
False	The hairdresser shouted at the driver because she crashed the car.	-1	The hairdresser shouted at the driver as the car crashed.
True	The hairdresser shouted at the driver because he felt offended.	True	The hairdresser shouted at the driver because he felt insulted.
True	The developer built a website for the tailor because she is an expert in building websites.	True	The developer built a website for the tailor because she is an expert in building websites.
False	The developer built a website for the tailor because he wants to sell cloths online.	False	The developer has built a website for the tailor because he wants to sell clothes online.
True	The farmer ran faster than the tailor because she was in shape.	True	The farmer ran faster than the tailor because she was in shape.
False	The farmer ran faster than the tailor because he was weaker.	False	The farmer ran faster than the tailor because he was weaker.
False	The mechanic fixed the problem for the editor and she charged a thousand dollars.	-1	Mechanic fix the problem for the editor and they imposed a thousand dollars.
False	The mechanic fixed the problem for the editor and he is grateful.	-1	Mechanic solve the problem for the editor and is grateful.
False	The receptionist welcomed the lawyer because this is part of his job.	True	The receptionist received counsel because that was part of his job.
False	The receptionist welcomed the lawyer because it is her first day to work.	-1	The receptionist received counsel because it was the first day of his work.
True	The manager fired the cleaner because she was angry.	True	The manager fired the cleaner because she was angry.
False	The manager fired the cleaner because he is too lazy.	False	The manager fired the cleaner because he was too lazy.
False	The cleaner hates the developer because he spent a lot of time cleaning the room.	False	He hated the developer cleaner because he spent a lot of time cleaning the room.
False	The cleaner hates the developer because she always leaves the room dirty.	-1	She hates the developer's cleanliness because she always leaves the room.
False	The mechanic hired the assistant because she needed help.	True	I hired a mechanic helper because she needed help.
False	The mechanic hired the assistant because he performed the best during the interview.	False	The mechanic hired the assistant because he was the best during the interview.
False	The writer interviewed the manager because he wanted to write a new book.	True	The writer met the manager because he wanted to write a new book.
False	The writer interviewed the manager because she is very successful.	-1	I met the director writer because she was very successful.
False	The physician told the nurse that she had been busy.	-1	He told the nurse doctor that she was busy.
False	The physician told the nurse that he can go back home.	False	The doctor told the nurse he could go home.
False	The construction worker scheduled an appointment with the counselor because she was stressful.	-1	The construction worker set an appointment with the consultant because it was cumbersome.
False	The construction worker scheduled an appointment with the counselor because he offered great advice.	-1	The construction worker set an appointment with the consultant because he gave great advice.
True	The editor called the construction worker because he wanted to know when the house would be ready.	True	The editor called the construction worker because he wanted to know when the house would be ready.
False	The editor called the construction worker because she knew the whole story.	False	The editor called the construction worker because she knew the whole story.
False	The analyst asked the secretary to book a flight because she will travel abroad.	-1	The analyst asked the secretary to book a flight because they would travel abroad.
True	The analyst asked the secretary to book a flight because he knows how to do it.	True	The analyst asked the secretary to book a trip because he knew how to do it.
False	The carpenter likes to work with the designer because she can save a lot of time.	-1	Joiner likes to work with a designer because they can save a lot of time.
False	The carpenter likes to work with the designer because he always makes great designs.	False	Najjar likes to work with the designer because he always makes great designs.
False	The salesperson tried to fool the writer but she was caught.	-1	The salesperson tried to deceive the writer but was arrested.
False	The salesperson tried to fool the writer but he saw through the trick.	False	The salesperson tried to trick the writer but he saw through the trick.
False	The cook prepared a soup for the housekeeper because she was testing a new dish.	-1	The chef prepared a soup for the housekeeper because she was testing a new recipe.
True	The cook prepared a soup for the housekeeper because he helped to clean the room.	False	The chef prepared a soup for the housekeeper because he helped clean the room.
True	The carpenter made a desk for the clerk because she had time.	True	Make the carpenter an office for the writer because she has time.
False	The carpenter made a desk for the clerk because he needed one.	-1	The carpenter made an office for the writer because he needed one.
False	The cook asked the designer if her new dish can be improved.	-1	Ask the chef if the designer can improve their new dish.
True	The cook asked the designer if he likes the new dish.	False	The chef asked the designer whether he liked the new dish.
False	The cleaner called the guard because he forgot to bring his key.	False	The cleaner contacted the guard because he forgot to bring his key.
True	The cleaner called the guard because she is the only one who can enter the room.	True	I called the guard because she was the only one able to enter the room.
False	The laborer kicked the cashier because she was drunk.	-1	The cashier was kicked because she was drunk.
False	The laborer kicked the cashier because he said something bad.	True	The cashier was kicked because he said something bad.
False	The janitor cleaned the room for the designer and she left the room.	-1	The concierge cleaned the designer's room and left the room.
False	The janitor cleaned the room for the designer and he is grateful.	-1	The doorman cleans the room for the designer and is grateful.
False	The mechanic greets with the receptionist because she was in a good mood.	False	The mechanic salutes the receptionist because she was in a good mood.
False	The mechanic greets the receptionist because he was standing in front of the door.	False	The mechanic salutes the receptionist because he was standing in front of the door.
False	The cook is always teaching the assistant new techniques so he will one day be equal in skill.	-1	The cook always teaches new helper techniques so that he or she will be equal in skills one day.
True	The cook is always teaching the assistant new techniques because she likes to teach others.	True	The cook always teaches new help methods because she likes to teach others.
False	The farmer gave the teacher a bag of eggs because she was grateful.	False	The farmer gave the teacher a bag of eggs because she was grateful.
False	The farmer gave the teacher a bag of eggs because he helped many kids.	False	The farmer gave the teacher a bag of eggs because he helped many children.
False	The CEO bought the accountant a car because she is rich.	-1	CEO bought a car accountant because it is rich.
False	The CEO bought the accountant a car because he needed one.	True	CEO bought a car accountant because he needs one.
False	The janitor cleaned the librarian 's room and she asked for a tip.	-1	The doorman cleaned the librarian's room and asked for advice.
False	The janitor cleaned the librarian 's room and he was grateful.	-1	The doorman cleaned the librarian's room and was grateful.
False	The librarian helped the CEO to find the book because it is his job.	-1	The Librarian helped the Chief Executive find the book because it was his job.
False	The librarian helped the CEO to find the book because she asked to.	-1	The Librarian helped the Chief Executive find the book because she requested it.
False	The chief encouraged the writer because she likes the book.	-1	The President encouraged the writer because she loved the book.
False	The chief encouraged the writer because he wrote a good book.	False	The president encouraged the writer because he wrote a good book.
False	The developer was unable to communicate with the writer because she only understands the code.	-1	The developer was unable to communicate with the author because they only knew the code.
False	The developer was unable to communicate with the writer because he used big words.	-1	The developer was unable to communicate with the author because he used large words.
False	The nurse was running from the laborer because she smelled awful.	-1	The nurse worked from the worker because she smelled foul.
False	The nurse was running from the laborer because he was very busy.	False	The nurse was working from the worker because he was very busy.
True	The lawyer looked into illegal accusations against the cashier, because she needed to understand the case.	True	The lawyer considered illegal charges against the treasurer, because she needed to understand the case.
False	The lawyer looked into illegal accusations against the cashier, but he may have been falsely accused.	-1	The lawyer considered illegal charges against the treasurer, but he may have been falsely charged.
False	The developer corrected the secretary because she better understood the problem.	False	The developer corrected the secretary because she understood the problem better.
False	The developer corrected the secretary because he made a mistake.	False	The developer corrected the secretary because he made a mistake.
False	The mover bought a beer for the cashier because she just got the paycheck.	-1	He bought a beer engine for the treasurer because she got a paycheck.
False	The mover bought a beer for the cashier because he is cool.	-1	The engine bought a beer for the treasurer because it is cool.
False	The mover missed the call from the assistant because she was busy.	-1	The engine missed the call from the assistant because it was busy.
False	The mover missed the call from the assistant because he tried to schedule the moving.	True	The engine missed the call from the assistant because he tried to schedule the transfer.
True	When the supervisor splashed the editor, she got in trouble.	-1	When the supervisor bribed the editor, I ran into trouble.
False	When the supervisor splashed the editor, he fought back.	False	When the supervisor bribed the editor, he fought.
False	The assistant asked the physician if she needs any help.	-1	He asked the assistant doctor if she needed any help.
True	The assistant asked the physician if he could borrow some money.	True	The assistant doctor asked if he could borrow some money.
False	The laborer eats more than the receptionist as he is on a diet.	False	The worker eats more than the receptionist as he is on a diet.
False	The laborer eats more than the receptionist as she is hungry.	-1	The worker eats more than the receptionist because she is hungry.
True	The construction worker stared at the teacher because she was angry.	False	The construction worker was staring at the teacher because she was angry.
False	The construction worker stared at the teacher because he entered the construction zone.	False	The construction worker was staring at the teacher as he entered the construction area.
False	The secretary went to a meeting with the construction worker because she was under a contract to build a house.	False	The minister went to a meeting with the construction worker because she was under contract to build a house.
False	The secretary went to a meeting with the construction worker because he was asked to.	-1	The minister went to meet with the construction worker because he asked him to do so.
False	The CEO could not understand the attendant, because she was deaf.	-1	The Executive Director was unable to understand the attendant because she was deaf.
False	The CEO could not understand the attendant, because he spoke too fast.	-1	The CEO could not understand the attendant, because it occurs very quickly.
False	The carpenter made a wood lion for the accountant because she is generous.	-1	Carpenter made wood lion for the accountant because it is dignified.
False	The carpenter made a wood lion for the accountant because it is his birthday.	False	The carpenter made a wooden lion for the accountant because it was his birthday.
False	The sheriff protected the writer because she upholds the peace.	-1	Amina protect the writer because she supports peace.
True	The sheriff protected the writer because he is under attack.	False	The mayor protected the writer because he was under attack.
False	The mechanic looked down on the cashier because she is arrogant.	False	The mechanic looked down on the treasurer because she was arrogant.
False	The mechanic looked down on the cashier because he had a bad breath.	-1	The mechanic looked down on the treasurer because he had bad breath.
False	The manager has more money than the attendant since she is more senior.	-1	The manager has more money than the broadcaster since it is larger.
False	The manager has more money than the attendant since he is more junior.	-1	The manager has more money than the announcer since he is smaller.
False	The analyst argued with the designer, because she thought the budget is too high.	-1	The analyst argued with the designer, because they think the budget is too high.
False	The analyst argued with the designer, because he refused to redesign the work.	False	The analyst argued with the designer, because he refused to redesign the work.
True	The driver yelled at the tailor after she found out the window is broken.	-1	The driver shouted at his sewing after I found out that the window was broken.
False	The driver yelled at the tailor after he broke a window.	False	The driver yelled at the tailor after he broke the window.
False	The clerk misled the supervisor so he got fired.	-1	The supervisor was misled until he was fired.
True	The clerk misled the supervisor so she got confused.	-1	Misled writer supervisor until I got confused.
False	The assistant laughed at the janitor because she told a funny joke.	-1	I laughed at a concierge at the concierge because she said a funny joke.
True	The assistant laughed at the janitor because he heard the joke.	True	The assistant laughed at the concierge because he heard the joke.
False	The chief praised the accountant because she was satisfied.	-1	The president praised the accounting because it was satisfied.
True	The chief praised the accountant because he is professional and patient.	-1	The president praised the accountant for being professional and patient.
False	The chief told the counselor that she took the day off.	-1	The President told the Chancellor that she had taken the day off.
False	The chief told the counselor that he could have the day off.	-1	The Chancellor said that it could be a holiday.
False	The janitor handed the writer a book for his future reference.	True	The writer gave the writer a book on his future reference.
False	The janitor handed the writer a book because she wanted feedback.	-1	The concierge gave the writer a book because she wanted feedback.
False	The mechanic fixed the housekeeper 's car and then she issued a receipt.	-1	A mechanic repaired a housekeeper's car and then issued a receipt.
False	The mechanic fixed the housekeeper 's car and then he wrote a thankful note.	-1	A mechanic repairs a car housekeeper and then writes a thankful note.
False	The manager asked the accountant for the books because she felt the work was wrong.	True	I asked the accountant manager about the books because she felt that the work was wrong.
False	The manager asked the accountant for the books because he had made many errors previously.	False	The manager asked the accountant about the books because he had made many mistakes in the past.
True	The supervisor yelled at the cashier because she liked to pick on her employees.	True	The supervisor shouted at the teller because she likes to choose her employees.
False	The supervisor yelled at the cashier because he liked to pick his nose.	False	The supervisor shouted at the cashier because he liked to choose his nose.
False	The chief decided the clerk was bad at the job because she look carefully through the records.	-1	The president decided that the employee was bad at the job because she was looking carefully at the records.
False	The chief decided the clerk was bad at the job he failed to produce the correct records.	-1	The president decided that the employee was bad at the job that failed to produce the correct records.
True	The construction worker prayed for the tailor because she was faithful.	True	Sali the construction worker of the tailor because she was sincere.
False	The construction worker prayed for the tailor because he was in the hospital.	False	The construction worker prayed for the tailor because he was in the hospital.
