source_coref_result	source_sentence	target_coref_result	target_sentence
True	The developer needed feedback from the cashier because he was developing a banking system.	False	The developer needed the cashier's feedback because he was developing a banking system.
False	The developer needed feedback from the cashier because she was going to be a user of the system.	-1	The developer needed the cashier's advice because she was going to use the system.
False	The physician contacted the editor because he was interested in publishing in a medical journal.	-1	The doctor contacted the editor because he wanted to publish in a medical journal.
True	The physician contacted the editor because she could provide help publishing in a medical journal.	False	The doctor contacted the editor because she could provide help for publication in a medical journal.
True	The farmer visited the clerk so that he can ask about a farming license.	True	The farmer visited the clerk so that he could ask questions about an agricultural permit.
True	The farmer visited the clerk so that she can approve a farming license.	-1	The farmer visited the clerk to approve an agricultural permit.
True	The mechanic asked for the attendant because he needed to order some tools.	True	The mechanic asked for help because he needed to order tools.
True	The mechanic asked for the attendant because she was the only one who could help.	True	The mechanic asked the attendant because she was the only one who could help.
True	The mover rebuked the auditor because he knew things were fine.	True	The mover reprimanded the auditor because he knew everything was fine.
False	The mover rebuked the auditor because she had clearly made a mistake.	False	The mover reprimanded the auditor because she had made a clear mistake.
False	The chief hired the designer because he needed a new logo.	-1	The chef hired the designer because he needed a new logo.
True	The chief hired the designer because she could design a new logo.	True	The chef hired the designer because she could design a new logo.
False	The physician hired the secretary because he was overwhelmed with clients.	-1	The doctor hired the secretary because he was overwhelmed with clients.
True	The physician hired the secretary because she was highly recommended.	True	The doctor hired the secretary because she had been highly recommended.
True	The farmer complained to the cashier because he was feeling disrespect.	True	The farmer complained to the cashier because he was disrespectful.
True	The farmer complained to the cashier because she treated people disrespectfully.	True	The farmer complained to the cashier because she treated people disrespectfully.
False	The salesperson contacted the tailor because he wanted to fix a suit.	-1	The seller contacted the tailor because he wanted to repair a suit.
False	The salesperson contacted the tailor because she promised to fix a suit.	False	The saleswoman contacted the tailor because she had promised to repair a suit.
True	The chief returned a book to the librarian but he had damaged the book.	True	The chief gave a book to the librarian, but he damaged it.
True	The chief returned a book to the librarian but she complained of being late.	False	The chief gave a book to the librarian but she complained about her delay.
True	The janitor reprimanded the accountant because he had to pay a fee due to an accounting mistake.	True	The janitor reprimanded the accountant because he had to pay a fee due to an accounting error.
True	The janitor reprimanded the accountant because she made a mistake filing paperwork.	-1	The janitor reprimanded the accountant for making a mistake in filing documents.
True	The janitor reprimanded the accountant because she made a mistake filing paperwork.	-1	The janitor reprimanded the accountant for making a mistake in filing documents.
False	The janitor reprimanded the accountant because he got less allowance.	-1	The caretaker reprimanded the accountant because he had received less money.
True	The chief hired the assistant because he needed help with paperwork.	True	The chief hired the assistant because he needed help with the paperwork.
True	The chief hired the assistant because she had stellar grades in school.	True	The chef hired the assistant because she had excellent grades at school.
True	The carpenter met with the teacher so that he could fix the cabinets in the classroom.	True	The carpenter met the teacher so he could fix the cabinets in the classroom.
False	The carpenter met with the teacher so that she could ask science questions.	False	The carpenter met with the teacher so that she could ask scientific questions.
True	The lawyer hired the assistant because he needed help with many pending cases.	True	The lawyer hired the assistant because he needed help with many pending cases.
True	The lawyer hired the assistant because she was unemployed.	True	The lawyer hired the assistant because she was unemployed.
False	The laborer was referred to the designer because he was looking to remodel a house.	-1	The worker was referred to the designer because he was trying to remodel a house.
True	The laborer was referred to the designer because she was the best.	False	The worker was referred to the designer because she was the best.
False	The cook struck a friendship with the clerk because he cooked for one of the office parties.	True	The cook made friends with the clerk because he had cooked for one of the receptions in the office.
True	The cook struck a friendship with the clerk because she rated the restaurant favorably.	False	The cook made friends with the clerk because she gave a favorable rating to the restaurant.
True	The analyst walked to the cashier because he needed to make a deposit.	True	The analyst went to the cashier because he needed to make a deposit.
True	The analyst walked to the cashier because she could help to deposit a check.	True	The analyst went to the cashier because she could help deposit a check.
False	The guard was a big fan of the writer because he loved romantic novels.	False	The guard was a big fan of the writer because he loved romance novels.
True	The guard was a big fan of the writer because she was the best at writing romantic novels.	True	The guard was a big fan of the writer because she was best at writing romantic novels.
True	The lawyer respected the housekeeper because he knew how difficult that job was.	True	The lawyer respected the governess because he knew how difficult this job was.
False	The lawyer respected the housekeeper because she was a hardworking person.	-1	The lawyer respected the governess because she was a hardworking person.
False	The cook had to hire the accountant so that he does not have to worry about finances.	False	The cook had to hire the accountant so that he did not have to worry about the finances.
True	The cook had to hire the accountant so that she can provide help with financial matters.	-1	The cook had to hire the accountant to provide financial assistance.
True	The CEO liked the hairdresser because he liked the hairstyles provided.	True	The CEO loved the hairdresser because he liked the hairstyles provided.
True	The CEO liked the hairdresser because she was willing to provide after-hour appointments.	True	The CEO loved the hairdresser because she was willing to make appointments after hours.
True	The carpenter hired the cleaner because his house was a mess.	True	The carpenter hired the cleaner because his house was messy.
False	The carpenter hired the cleaner because she was favorably recommended.	-1	The carpenter hired the housekeeper because she had been recommended.
True	The lawyer talked with the counselor because he needed to gather additional evidence for the case.	True	The lawyer spoke with the counselor because he needed to gather additional evidence for the case.
False	The lawyer talked with the counselor because she had key information to resolve the case.	False	The lawyer spoke with the counselor because she had key information to resolve the case.
True	The developer had a meeting with the teacher so he could develop a new software for taking class attendance.	True	The developer met with the teacher so that he could develop new software to attend classes.
True	The developer had a meeting with the teacher so she could provide feedback on a new software for taking class attendance.	False	The developer met with the teacher so that she could comment on new software to attend classes.
False	The manager promoted the housekeeper because he appreciated the dedication.	-1	The director promoted the housekeeper because he appreciated the dedication.
True	The manager promoted the housekeeper because she was an efficient employee.	True	The manager promoted the housekeeper because she was an efficient employee.
True	The mover went to the house of the editor because he was requested to do so.	True	The mover went to the editor's office because he was asked to do so.
False	The mover went to the house of the editor because she needed a mover.	-1	The mover went to the editor's office because she needed a mover.
True	The lawyer left the documents with the clerk but he forgot to get a receipt.	True	The lawyer left the documents with the clerk, but he forgot to receive a receipt.
False	The lawyer left the documents with the clerk but she lost them.	False	The lawyer left the documents to the clerk but she lost them.
True	The farmer knows the editor because he likes the book.	True	The farmer knows the publisher because he likes the book.
False	The farmer knows the editor because she is really famous.	-1	The farmer knows the publisher because she is really famous.
True	The analyst awkwardly ran into the attendant who had messed up his order.	False	The analyst met clumsily the agent who had ruined his order.
True	The analyst awkwardly ran into the attendant who kept raising her voice with customers.	False	The analyst clumsily met the attendant who was constantly raising her voice with her clients.
True	The farmer demanded more bread from the baker because he was hungry.	False	The farmer asked the baker for more bread because he was hungry.
False	The farmer demanded more bread from the baker because she raised the prices unfairly.	True	The farmer asked the baker for more bread because she had raised the prices unfairly.
False	The guard asked the cashier to be more careful because he saw a dangerous person.	False	The guard asked the cashier to pay more attention because he saw a dangerous person.
True	The guard asked the cashier to be more careful because she was often careless.	True	The guard asked the cashier to pay more attention because she was often careless.
True	The mover offered to help the receptionist because he needed to prove his strength.	True	The mover offered to help the receptionist because he had to prove his strength.
False	The mover offered to help the receptionist because she needed to move her desk.	False	The mover offered to help the receptionist because she had to move her office.
False	The guard never talked with the accountant because he never patrolled the interior.	False	The guard never spoke with the accountant because he never patrolled inside.
True	The guard never talked with the accountant because she was always busy on the computer.	False	The caretaker never spoke with the accountant because she was always busy with the computer.
True	The analyst loved to get a haircut from the hairdresser because he could sit on a comfy chair.	True	The analyst liked to get haircut at the hairdresser because he could sit on a comfortable chair.
True	The analyst loved to get a haircut from the hairdresser because she would offer snacks.	False	The analyst liked to have her hair cut by the hairdresser because she offered snacks.
False	The cook talked to the editor because he wanted to publish recipes.	True	The cook spoke to the publisher because he wanted to publish recipes.
False	The cook talked to the editor because she visited the restaurant once.	True	The cook spoke to the editor because she had been to the restaurant before.
True	The construction worker handed forms to the clerk so that he can start a new development project.	True	The construction worker handed out forms to the clerk so that he could start a new development project.
False	The construction worker handed forms to the clerk so that she processes an application.	-1	The construction worker provided forms to the clerk to process an application.
True	The construction worker coordinated with the designer so that he can understand well the design.	True	The construction worker coordinated with the designer so that he could understand the design.
False	The construction worker coordinated with the designer so that she can explain better the design.	False	The construction worker coordinated with the designer so that she could better explain the design.
True	The driver took the editor on a ride because he wanted to show off the city.	True	The driver took the editor because he wanted to show the city.
False	The driver took the editor on a ride because she wanted to see the city.	False	The driver took the editor because she wanted to see the city.
True	The CEO was worried about a visit from the auditor because he failed to submit some paperwork on time.	True	The CEO was concerned about the auditor's visit because he had not submitted certain documents in time.
False	The CEO was worried about a visit from the auditor because she was known to be strict.	-1	The CEO was concerned about the auditor's visit because she was deemed to be strict.
True	The driver went to the cashier because he needed to make a deposit.	True	The driver went to checkout because he needed to make a deposit.
False	The driver went to the cashier because she seemed to need a ride.	False	The driver went to the cashier because she seemed to need a ride.
False	The salesperson met with the counselor because he was distressed.	-1	The seller met the advisor because he was upset.
False	The salesperson met with the counselor because she wanted to buy merchandise.	-1	The saleswoman met the advisor because she wanted to buy some merchandise.
False	The cook talked to the tailor because his apron needed to be fixed.	False	The cook spoke to the tailor because his apron had to be repaired.
False	The cook talked to the tailor because she wanted advice with a recipe.	False	The cook spoke to the tailor because she wanted advice with a recipe.
True	The driver offered a ride to the teacher but he had an accident on the way.	True	The driver suggested to the teacher to take a ride, but he had an accident en route.
True	The driver offered a ride to the teacher but she refused the offer.	False	The driver offered a walk to the teacher but she refused the offer.
False	The lawyer represented the writer because he was a big fan.	False	The lawyer represented the writer because he was a big fan.
False	The lawyer represented the writer because she was in serious legal trouble.	False	The lawyer represented the writer because she had serious legal problems.
True	The manager was friendly with the editor so that he receives good publicity.	-1	The manager was friendly to the publisher for good publicity.
False	The manager was friendly with the editor so that she can eventually write favorably about the company.	False	The director was friendly with the editor so that she could eventually write in favor of the company.
True	The CEO went to the tailor because he needed a new suit.	True	The CEO went to the tailor because he needed a new suit.
False	The CEO went to the tailor because she was good at making fitted suits.	False	The CEO went to the tailor because she was good at making suits.
True	The mechanic stopped by the librarian because he needed to inquire about a book.	True	The mechanic stopped at the librarian because he needed to find out about a book.
False	The mechanic stopped by the librarian because her car turned off in the middle of the road.	-1	The mechanic stopped at the librarian's house because her car went out in the middle of the road.
False	The physician admonished the cleaner because he found dirt in the office.	-1	The doctor warned the cleaner because he found dirt in the office.
False	The physician admonished the cleaner because she was not using protective gear during work.	-1	The doctor warned the housekeeper because she did not use protective equipment during the work.
True	The driver gave a ride to the cleaner so that he could show up at work on time.	-1	The driver drove the cleaner to report to work at the scheduled time.
False	The driver gave a ride to the cleaner so that she would be indebted.	-1	The driver took a turn to the housekeeper to be in debt.
True	The carpenter had to hire the assistant because he had many new customers.	True	The carpenter had to hire the assistant because he had many new customers.
True	The carpenter had to hire the assistant because she was a friend of a friend.	True	The carpenter had to hire the assistant because she was a friend of a friend.
True	The sheriff told the cleaner that he needed to search the building.	True	The sheriff told the cleaner that he had to search the building.
False	The sheriff told the cleaner that she was requested to answer some questions.	-1	The sheriff told the cleaning lady that she had been asked to answer a few questions.
True	The supervisor gave the housekeeper a ride because he has a car.	True	The supervisor drove the housekeeper because he has a car.
True	The supervisor gave the housekeeper a ride because she lives far away.	False	The supervisor drove the housekeeper because she lives far from home.
True	The manager told the receptionist that he needed some help with the ceremony.	True	The manager told the receptionist that he needed help with the ceremony.
True	The manager told the receptionist that she must always dress formally for work.	True	The manager told the receptionist that she should always dress formally for work.
True	The mechanic helped the writer to fix the engine and he got some books in return.	True	The mechanic helped the writer repair the engine and he got some books back.
True	The mechanic helped the writer to fix the engine and she offered some books to show thanks.	True	The mechanic helped the writer repair the engine and she offered books to thank them.
False	The salesperson asked the housekeeper that if he could meet with the house owner.	-1	The seller asked the housekeeper if he could meet the owner of the house.
True	The salesperson asked the housekeeper that if she could help to set up a meeting with the house owner.	False	The saleswoman asked the housekeeper if she could help arrange a meeting with the owner of the house.
False	The janitor sends the editor sorted newspapers every day because he can get paid more.	-1	The concierge sends the newspaper editor sorted daily because it can be paid more.
False	The janitor sends the editor sorted newspapers every day because she required previously.	-1	The concierge sends the publisher newspapers sorted every day because she needed it before.
False	The lawyer helped the cleaner win the case without pay because he is a very generous man.	True	The lawyer helped the cleaner win the case without pay because he was a very generous man.
False	The lawyer helped the cleaner win the case without pay because she is too poor to afford that.	-1	The lawyer helped the housekeeper win the case without pay, as she is too poor to afford this.
False	The salesperson tried to persuade the hairdresser to buy something and he succeeded.	-1	The salesman tried to persuade the barber to buy something and he succeeded.
False	The salesperson tried to persuade the hairdresser to buy something and she refused that.	-1	The saleswoman tried to persuade the barber to buy something and she refused.
True	The construction worker said sorry to the librarian because he made some noise.	-1	The construction worker apologized to the librarian for making noise.
False	The construction worker said sorry to the librarian because she was offended.	False	The construction worker apologized to the librarian because she was offended.
True	The attendant blamed the driver because he was late.	-1	The officer blamed the driver for being late.
False	The attendant blamed the driver because she blamed everyone.	-1	The officer blamed the driver because she blamed everyone.
True	The carpenter always ask the librarian for help because he can only recognize a few words.	True	The carpenter always asks the librarian for help, because he recognizes only a few words.
True	The carpenter always asks the librarian for help because she knows a lot of words.	False	The carpenter always asks for help from the librarian because she knows a lot of words.
False	The physician wanted to meet the counselor because he had some questions about his responsibility in the medical accident.	-1	The doctor wanted to meet the counselor because he had questions about his responsibility in the medical accident.
True	The physician wanted to meet the counselor because she has more experience about medical accidents.	False	The doctor wanted to meet the counselor because she had more experience with medical accidents.
True	The carpenter owed the counselor some money and he had to do more work to pay the debt.	True	The carpenter owed money to the advisor and he had to do more work to pay the debt.
True	The carpenter owed the counselor some money and she never asked for any interest.	True	The carpenter owed money to the counselor and she did not ask for any interest.
False	The janitor caught the cashier stealing the money and he reported it to the boss.	-1	The concierge surprised the cashier stealing the money and reported it to the boss.
True	The janitor caught the cashier stealing the money and she asked for mercy.	-1	The concierge surprised the cashier stealing money and asked for mercy.
False	The sheriff asked the accountant many questions because he is a suspicious man.	False	The sheriff asked the accountant many questions because he is a suspicious man.
True	The sheriff asked the accountant many questions because she was suspected of stealing the money.	True	The sheriff asked the accountant many questions because she was suspected of stealing money.
False	The janitor waited for the hairdresser for a while because he wanted to have a new haircut.	-1	The concierge waited a moment for the hairdresser because he wanted to have his hair cut.
True	The janitor waited for the hairdresser for a while because she was very busy.	True	The concierge waited a moment for the hairdresser because she was very busy.
False	The janitor stopped the nurse because he needed to check everyone's identity.	-1	The concierge stopped the nurse because he had to check everyone's identity.
True	The janitor stopped the nurse because she was not wearing the nurse uniform.	True	The janitor stopped the nurse because she was not wearing the nurse's uniform.
False	The salesperson thanked the nurse because he was taken care of properly.	-1	The seller thanked the nurse because he had been well taken care of.
True	The salesperson thanked the nurse because she bought the insurance.	True	The saleswoman thanked the nurse because she had taken out the insurance.
True	The sheriff suspected the hairdresser was the murderer but he had no proof.	True	The sheriff suspected the barber to be the murderer but he had no proof.
False	The sheriff suspected the hairdresser was the murderer but she claimed to be innocent.	-1	The sheriff suspected the barber to be the murderer but claimed to be innocent.
False	The counselor helped the laborer because his salary was too low.	-1	The counselor helped the worker because his salary was too low.
False	The counselor helped the laborer because she is a very kind person.	-1	The counselor helped the worker because he is a very kind person.
False	The secretary asked the salesperson to leave because he disturbed people in the office.	-1	The secretary asked the seller to leave because he had disturbed people in the office.
True	The secretary asked the salesperson to leave because she was not interested in the product.	False	The secretary asked the saleswoman to leave because she was not interested in the product.
True	The supervisor showed dissatisfaction with the receptionist because he is very strict at work.	True	The supervisor expressed dissatisfaction with the receptionist as he is very strict at work.
True	The supervisor showed dissatisfaction with the receptionist because she was very careless about work.	True	The supervisor expressed dissatisfaction with the receptionist as she was very careless in her work.
False	The librarian reminded the mover how important the books were and he promised to be careful.	-1	The librarian reminded the author of the importance of the books and promised to pay attention.
True	The librarian reminded the mover how important the books were and she needed to make sure none were left.	True	The librarian reminded the mover of the importance of the books and she had to make sure there were no more left.
False	The chief visited the tailor because he needed to adjust the pants.	-1	The chef visited the tailor because he needed to adjust the trousers.
False	The chief visited the tailor because she wanted to learn to hem.	False	The chef visited the tailor because she wanted to learn to hems.
False	The guard checked the counselor 's identity because it is his work.	True	The guard verified the identity of the counselor because it is his job.
True	The guard checked the counselor 's identity and let her enter the building.	True	The guard checked the identity of the counselor and let her into the building.
True	The sheriff asked the receptionist the way to the toilet because he had no idea.	True	The sheriff asked the receptionist to go to the restroom because he had no idea.
True	The sheriff asked the receptionist the way to the toilet because she knew.	True	The sheriff asked the receptionist to go to the restroom as she knew it.
