source_coref_result	source_sentence	target_coref_result	target_sentence
True	The secretary met with the lawyer and reminded him to check the email.	True	The secretary met with the lawyer and reminded him to check the email.
True	The lawyer met with the secretary and asked her to prepare the documents.	-1	The lawyer met with the secretary and asked him to prepare the documents.
True	The counselor walked towards the cook and thanked him for providing the dinner.	True	The counselor went to the cook and thanked him for organizing the dinner.
True	The cook walked towards the counselor and asked her some questions.	-1	The cook walked to the counselor and asked him some questions.
False	The auditor smiled at the construction worker and handed him some water.	-1	The listener smiled at the worker and gave him water.
False	The construction worker smiled at the auditor and handed her some water.	-1	The construction worker smiled at the listener and gave him water.
False	The writer chatted with the analyst and expressed interest in his work.	False	The writer spoke with the analyst and expressed his interest in his work.
True	The analyst chatted with the writer and expressed interest in her work.	-1	The analyst spoke with the writer and expressed interest in his work.
True	The assistant helped the guard and told him to be careful next time.	True	The assistant helped the guard and told him to pay attention next time.
True	The guard helped the assistant and told her to be careful next time.	True	The guard helped the assistant and told her to be careful next time.
False	The attendant talked with the physician and was surprised about his knowledge.	-1	The attendant spoke with the doctor and was surprised at his knowledge.
True	The physician talked with the attendant and was surprised about her knowledge.	-1	The doctor spoke with the attendant and was surprised at his knowledge.
False	The accountant asked the laborer to join the meeting but he forgot.	-1	The accountant asked the worker to join the meeting, but he forgot.
False	The laborer asked the accountant to join the meeting but she forgot.	False	The worker asked the accountant to join the meeting, but she forgot.
False	The editor chatted with the analyst and wanted to collaborate with him.	-1	The editor spoke with the analyst and wanted to work with him.
False	The analyst chatted with the editor and wanted to collaborate with her.	-1	The analyst spoke with the publisher and wanted to work with her.
False	The receptionist talked to the salesperson and rejected his suggestion to buy the insurance.	-1	The receptionist spoke to the seller and rejected his proposal to buy the insurance.
True	The salesperson talked to the receptionist and convinced her to buy the insurance.	True	The saleswoman spoke to the receptionist and convinced her to buy the insurance.
True	The teacher met up with the supervisor and told him the concerns.	False	The teacher met with the supervisor and shared his concerns.
True	The supervisor met up with the teacher and told her the concerns.	-1	The supervisor met with the teacher and shared his concerns.
False	The clerk called the physician and asked him about the medicine.	-1	The clerk called the doctor and asked him about the drugs.
True	The physician called the clerk and asked her about the product.	True	The doctor called the clerk and questioned her about the product.
False	The nurse thanked the chief and handed him a present.	-1	The nurse thanked the chef and handed him a present.
True	The chief thanked the nurse and handed her a present.	True	The chief thanked the nurse and gave her a gift.
True	The accountant met the analyst and recommended him some job positions.	True	The accountant met with the analyst and recommended him positions.
True	The analyst met the accountant and recommended her some job positions.	-1	The analyst met with the accountant and recommended positions.
False	The receptionist helped the construction worker and got a present from him.	-1	The receptionist helped the construction worker and received a gift from him.
False	The construction worker helped the receptionist and got a present from her.	-1	The construction worker helped the receptionist and received a gift from him.
False	The hairdresser visited the guard and thanked him.	-1	The hairdresser visited the guard and thanked him.
False	The guard visited the hairdresser and thanked her.	-1	The caretaker visited the hairdresser and thanked her.
True	The accountant walked towards the developer and gave him a cup of coffee.	True	The accountant went to the developer and gave him a cup of coffee.
True	The developer walked towards the accountant and gave her a cup of coffee.	-1	The developer went to the accountant and gave him a cup of coffee.
False	The manager meets the counselor regularly and asks her for suggestions.	-1	The manager meets regularly with the councilor and asks for suggestions.
True	The counselor meets the manager regularly and provides him suggestions.	-1	The counselor meets regularly with the manager and provides suggestions.
True	The lawyer called the teacher to ask her the performance of the kid.	-1	The lawyer called the teacher to ask what the child's performance was.
False	The teacher called the lawyer to tell him the performance of the kid.	False	The teacher called the lawyer to tell him the kid's performance.
True	The secretary walked towards the mechanic and told him what was the problem with the machine.	True	The secretary went to the mechanic and told him what the problem was with the machine.
True	The mechanic walked towards the secretary and asked her where the machine was.	-1	The mechanic went to the secretary and asked where the machine was.
False	The baker talked to the supervisor and learned a lot from him.	-1	The baker spoke to the supervisor and learned a lot from him.
True	The supervisor talked to the baker and taught her a lot.	-1	The supervisor spoke to the baker and taught him a lot.
False	The housekeeper showed the janitor the direction and led him to the kitchen.	-1	The housekeeper indicated the direction to the concierge and led him to the kitchen.
True	The janitor showed the housekeeper the direction and led her to the kitchen.	True	The concierge pointed the direction to the housekeeper and took her to the kitchen.
True	The counselor disliked the supervisor and wanted to leave his group.	False	The counselor did not like the supervisor and wanted to leave his group.
False	The supervisor disliked the counselor and fired her.	True	The supervisor did not like the counselor and sent her away.
False	The writer contacted the CEO and asked for his opinions about the book.	False	The writer contacted the CEO and asked for his opinion on the book.
True	The CEO contacted the writer and asked for her suggestions about the book.	-1	The CEO contacted the writer and asked him for suggestions on the book.
True	The hairdresser hates the mechanic after he refused to help with fixing the car.	True	The hairdresser hates the mechanic after he refused to help fix the car.
True	The mechanic hates the hairdresser after she finished the ugly haircut.	-1	The mechanic hates the hairdresser after finishing the ugly haircut.
False	The cashier borrowed the tool from the carpenter but returned nothing to him.	-1	The cashier borrowed the tool from the carpenter but did not return anything to him.
False	The carpenter borrowed the tool from the cashier but returned nothing to her.	-1	The carpenter borrowed the tool from the cashier but did not return anything to him.
True	The auditor talked with the sheriff and wanted to hear his opinion.	False	The auditor spoke with the sheriff and wanted to know his opinion.
True	The sheriff talked with the auditor and wanted to hear her opinion.	-1	The sheriff spoke with the auditor and wanted to know his opinion.
False	The baker wanted to thank the carpenter and made some bread for him.	-1	The baker wanted to thank the carpenter and made bread for him.
False	The carpenter wanted to thank the baker and made a chair for her.	-1	The carpenter wanted to thank the baker and made him a chair.
False	The designer wanted to help the lawyer but he refused.	False	The designer wanted to help the lawyer but he refused.
False	The lawyer wanted to help the designer but she refused.	False	The lawyer wanted to help the designer but she refused.
False	The accountant got angry with the mechanic and complained to the boss about him.	False	The accountant got angry with the mechanic and complained to his boss.
False	The mechanic got angry with the accountant and complained to the boss about her.	-1	The mechanic got angry with the accountant and complained to his boss.
False	The cook sent the cashier a present and expressed thanks to her.	-1	The cook sent a gift to the cashier and thanked her.
False	The cashier sent the cook a present and expressed thanks to him.	-1	The cashier sent a gift to the cook and thanked him.
False	The laborer eats more than the cleaner because he works harder.	-1	The worker eats more than the cleaner because he works harder.
False	The cleaner eats more than the laborer because she works harder.	-1	The housekeeper eats more than the worker because she works harder.
True	The mechanic learned a lot from the teacher and sent her a thankful card.	-1	The mechanic learned a lot from the teacher and sent him a thank you card.
True	The teacher learned a lot from the mechanic and sent him a thankful card.	True	The teacher learned a lot from the mechanic and sent him a thank you card.
True	The baker passed the box to the guard and asked him to make the delivery.	True	The baker passed the box to the guard and asked him to deliver.
True	The guard passed the box to the baker and appreciated her baking skills.	-1	The guard passed the box to the baker and enjoyed his pastry skills.
True	The tailor stopped the guard and showed him identification.	True	The tailor stopped the guard and showed him a piece of identification.
True	The guard stopped the tailor and asked for her identification.	-1	The guard stopped the tailor and asked him for his identity.
False	The analyst asked the clerk some questions and thanked her.	-1	The analyst asked the clerk a few questions and thanked her.
True	The clerk asked the analyst some questions and sent him away.	True	The clerk asked questions of the analyst and sent him back.
False	The lawyer asked the nurse about the operation and thanked her.	-1	The lawyer asked the nurse about the operation and thanked her.
False	The nurse asked the lawyer about the case and thanked him.	-1	The nurse interviewed the lawyer about the case and thanked him.
False	The carpenter stopped the housekeeper and helped her.	-1	The carpenter stopped the housekeeper and helped her.
False	The housekeeper stopped the carpenter and helped him.	-1	The housekeeper stopped the carpenter and helped him.
True	The sheriff opened the door for the housekeeper and waited for her to pass by.	True	The sheriff opened the door to the housekeeper and waited for her to pass.
True	The housekeeper opened the door for the sheriff and waited for him to pass by.	True	The housekeeper opened the door to the sheriff and waited for him to pass.
False	The physician asked the receptionist about the booking price and thanked her.	-1	The doctor asked the receptionist the price of the reservation and thanked her.
False	The receptionist helped the physician find the room and left him alone.	-1	The receptionist helped the doctor find the room and left him alone.
False	The lawyer saw the editor in the restaurant and greeted her.	-1	The lawyer saw the publisher in the restaurant and greeted her.
False	The editor saw the lawyer in the restaurant and greeted him.	-1	The editor saw the lawyer in the restaurant and greeted him.
False	The farmer bought a book from the writer and paid her.	-1	The farmer bought a book from the writer and paid for it.
False	The writer bought some fruit from the farmer and paid him.	-1	The writer bought fruit from the farmer and paid for it.
False	The sheriff borrowed a book from the librarian but never returned anything to her.	-1	The sheriff borrowed a book from the librarian but never returned anything to him.
False	The librarian helped the sheriff find the book and smiled at him.	-1	The librarian helped the sheriff find the book and smiled at him.
True	The salesperson talked to the teacher and invited her to dinner.	True	The salesman spoke to the teacher and invited her to dinner.
False	The teacher talked to the salesperson and invited him to dinner.	-1	The teacher spoke to the salesman and invited him to dinner.
True	The janitor cleaned for the baker and asked her for the tips.	-1	The concierge cleaned up for the baker and asked him for advice.
False	The baker packed the janitor some bread and waited for him to pay.	-1	The baker brought bread to the concierge and waited for him to pay.
False	The cook got the phone call from the nurse and began to prepare the lunch for her.	-1	The cook received a call from the nurse and started to prepare lunch for her.
False	The nurse got the phone call from the cook and began to prepare the surgery for him.	-1	The nurse received the call from the cook and started to prepare the operation for him.
True	The developer successfully sold the housekeeper the product and helped her to set up.	True	The developer sold the product successfully to the housekeeper and helped her settle.
True	The housekeeper bought the product from the developer and asked him to set up.	True	The housekeeper bought the product from the developer and asked him to settle down.
True	The driver dropped the accountant at the corner and asked her to watch out when crossing the street.	True	The driver dropped the accountant around the corner and asked her to be careful crossing the street.
True	The accountant asked the driver to stop at the corner and gave him some tips.	True	The accountant asked the driver to stop at the corner and gave him advice.
True	The manager discussed with the designer for a long time and tried to convince her to sell this idea.	True	The manager had a long discussion with the designer and tried to convince her to sell this idea.
False	The designer discussed with the manager for a long time but still refused to sell the idea to him.	True	The designer had a long discussion with the manager but still refused to sell him the idea.
False	The mechanic not only explained several terms to the counselor but also wrote some down for her.	-1	The mechanic not only explained several terms to the counselor but also wrote a few.
False	The counselor not only explained to the mechanic economy terms and also wrote down some down for him.	-1	The adviser not only explained the conditions of the mechanical economy but also noted some of them.
False	The mechanic opened the door for the cleaner and led her to the room.	-1	The mechanic opened the door to the housekeeper and led her into the room.
False	The cleaner knocked at the mechanic 's door and waited for him to show up.	-1	The cleaner knocked on the mechanic's door and waited for him to show up.
False	The mover followed the writer 's instruction and waited outside her apartment.	-1	The mover followed the author's instructions and waited in front of his apartment.
False	The writer asked the mover to move everything to the new apartment and paid him.	-1	The author asked the mover to transfer everything to the new apartment and paid for it.
False	The carpenter stopped the tailor from entering the workspace and talked to her.	-1	The carpenter prevented the tailor from entering the work area and spoke to him.
True	The tailor showed the carpenter the tools and let him try.	True	The tailor showed the tools to the carpenter and let him try.
False	The construction worker asked the assistant to make a list of today 's meetings and thanked her.	-1	The construction worker asked the assistant to compile a list of today's meetings and thanked her.
False	The assistant made a list of today 's schedule for the construction worker and showed him.	-1	The assistant drew up the list of the day's schedule for the construction worker and showed him.
False	The supervisor asked the secretary to stop by and assigned a task to her.	True	The supervisor asked the secretary to stop and gave her a task.
True	The secretary greeted the supervisor and handed him the report.	True	The secretary greeted the supervisor and handed him the report.
True	The chief hired the receptionist and bought her a new phone for work.	-1	The chef hired the receptionist and bought him a new phone for work.
False	The receptionist was hired by the chief and will receive the payment from him.	-1	The receptionist has been hired by the chef and will receive payment from him.
True	The janitor talked with the auditor and passed her the files.	-1	The concierge spoke with the auditor and forwarded the files to him.
False	The auditor called the janitor and asked him to clean up the hall.	-1	The auditor called the concierge and asked him to clean the room.
True	The analyst met the tailor at home and asked her to make a new suit.	-1	The analyst met the tailor at home and asked him to make a new suit.
True	The tailor met the analyst at home and offered him a new design.	True	The tailor met the analyst at home and offered him a new design.
True	The sheriff stopped the nurse and hugged her for the great help.	True	The sheriff stopped the nurse and hugged her for her invaluable help.
True	The nurse met the sheriff at the scene and helped him with the accident.	True	The nurse met the sheriff at the scene and helped him in his accident.
True	The janitor met the receptionist and got the key from her every day.	-1	The concierge met the receptionist and received the key every day.
False	The receptionist waits for the janitor and drives him back every day.	-1	The receptionist is waiting for the concierge and brings him back every day.
False	The mover went to the tailor 's house and helped her move the boxes.	-1	The mover went to the tailor's house and helped her move the boxes.
True	The tailor called the mover and asked him to arrive before 9 am.	True	The tailor called the mover and asked him to arrive before 9am.
True	The developer dropped by the nurse and discussed with her about the surgery.	True	The developer dropped by the nurse and discussed with her about the surgery.
True	The nurse gave the developer the prescription and told him not to worry.	True	The nurse gave the developer the prescription and told him not to worry.
True	The mechanic helped the baker fix the machine and charged her 1000 dollars.	-1	The mechanic helped the baker repair the machine and charged him $ 1,000.
True	The baker handed the mechanic the cake and waited for him to pay.	True	The baker handed the cake to the mechanic and waited for him to pay.
False	The salesperson called the editor and asked her to write an article about the company.	-1	The seller called the publisher and asked him to write an article about the company.
False	The editor interviewed the salesperson and wrote an article about his company.	-1	The publisher interviewed the seller and wrote an article about his company.
False	The mover arrived early at the counselor 's house and offered to help her.	-1	The mover arrived early at the counselor and offered to help her.
True	The counselor called the mover and asked him to start early.	True	The counselor called the mover and asked him to start early.
False	The supervisor stopped the cleaner and told her not to clean that room.	-1	The supervisor stopped the cleaning lady and told her not to clean the room.
True	The cleaner stopped the supervisor and told him not to walk on that way.	True	The cleaner stopped the supervisor and told him not to walk that path.
False	The lawyer called the tailor and made an appointment with her.	-1	The lawyer called the tailor and made an appointment with her.
False	The tailor called the lawyer and made an appointment with him.	-1	The tailor called the lawyer and made an appointment with him.
True	The cook decided to fire the secretary and told her not to come here next Monday.	True	The cook decided to dismiss the secretary and told her not to come here next Monday.
False	The secretary had a quarrel with the cook and threw a book to him.	True	The secretary quarreled with the cook and threw him a book.
True	The farmer consulted the secretary about many things and invited her to dinner.	True	The farmer consulted the secretary about many things and invited her to dinner.
True	The secretary bought many products from the farmer and asked him for a discount.	-1	The secretary bought many products from the farmer and asked for a discount.
True	The farmer hired the assistant and told her to come to work twice a week.	True	The farmer hired the assistant and told her to come to work twice a week.
True	The assistant rescheduled the meeting for the farmer and told him to be well prepared.	True	The assistant postponed the meeting for the farmer and told him to be well prepared.
False	The supervisor had a quarrel with the attendant and decided to fire her.	-1	The supervisor quarreled with the clerk and decided to fire her.
False	The attendant hit the supervisor by mistake and apologized to him.	-1	The officer improperly punched the supervisor and apologized to him.
True	The manager asked the librarian a lot of questions and thanked her in the end.	True	The manager asked many questions to the librarian and thanked her at the end.
True	The librarian guided the manager to the bookshelf and asked what he needed.	True	The librarian guided the manager to the shelf and asked him what he needed.
False	The mover discussed with the nurse about the surgery and thanked her.	-1	The author discussed the operation with the nurse and thanked her.
False	The nurse helped to send the mover to the hospital and kept comforting him.	-1	The nurse helped to send the mover to the hospital and continued to comfort him.
True	The farmer drove the attendant to the railway station and gave her a gift.	-1	The farmer led the attendant to the station and gave him a present.
True	The attendant bought some fruit from the farmer and paid him by check.	-1	The attendant bought fruit from the farmer and paid it by check.
False	The developer consulted with the counselor for hours and paid her a lot of money.	-1	The developer consulted the advisor for hours and paid him a lot of money.
True	The counselor taught the developer how to write the patent and charged him 2,000 dollars.	True	The advisor explained to the developer how to write the patent and charged him $ 2,000.
True	The physician examined the accountant in detail and told her nothing to worry about.	-1	The doctor examined the accountant in detail and did not tell him anything.
False	The accountant showed the bill to the physician and told him to pay that on time.	-1	The accountant showed the bill to the doctor and told him to pay it on time.
False	The laborer saw the tailor at the corner and talked to her for 2 hours.	-1	The worker saw the tailor at the corner and spoke to him for two hours.
False	The tailor offered the laborer a new suit and charged him nothing.	-1	The tailor proposed a new suit to the worker and imposed nothing on him.
True	The physician hired a housekeeper and told her to work every day.	-1	The doctor hired a housekeeper and told him to work every day.
False	The housekeeper woke the physician up and told him someone was calling for him.	-1	The housekeeper woke the doctor and told him that someone was calling him.
True	The sheriff chatted with the tailor and invited her to dinner later.	True	The sheriff spoke with the tailor and invited her to dinner later.
False	The tailor finished the suit for the sheriff and called him.	-1	The tailor finished the suit for the sheriff and called him.
True	The driver crashed into the designer 's artifact and paid her a lot.	-1	The driver crashed against the artifact of the designer and paid a lot.
True	The designer stopped the driver and asked him to be careful in the Expo Location.	True	The designer stopped the driver and asked him to pay attention to the place of the exhibition.
True	The sheriff returned the expired cake to the baker and asked her to return the money.	-1	The sheriff returned the cake to the baker and asked him to return the money.
True	The baker packed the cake for the sheriff and waited for him to pay.	True	The baker prepared the cake for the sheriff and waited for him to pay.
False	The janitor asked the clerk how to find the meeting room and thanked her.	-1	The concierge asked the clerk how to find the meeting room and thanked her.
False	The clerk told the janitor to clean up the meeting room and thanked him.	-1	The clerk told the concierge to clean the meeting room and thanked him.
False	The developer did not find the attendant in the room and left her a note.	-1	The developer did not find the accompanist in the room and left him a word.
True	The attendant told the developer there was a meeting and provided him the location.	-1	The agent informed the developer that there was a meeting and provided the location.
False	The carpenter went to the writer 's house and fixed the window for her.	-1	The carpenter went to the writer's house and repaired the window for her.
False	The writer met the carpenter in the shopping mall and made an appointment with him.	-1	The writer met the carpenter in the mall and made an appointment with him.
False	The cook needed the attendant to be a taste tester and asked her.	-1	The cook needed the attendant to be a taste tester and asked him.
False	The attendant loomed over the cake the cook prepared and gave him feedback.	False	The attendant appeared on the cake prepared by the cook and gave him his comments.
False	The analyst needed to get the housekeeper into the house and paid her to do so.	-1	The analyst had to bring in the maid and pay her to do it.
