src_sentence	src_pronoun	src_profession	tgt_sentence	tgt_pronoun	tgt_profession	src_result	tgt_result
The analyst noticed the teacher was bad at math and made fun of him .	male	the teacher	The analyst noticed that the teacher was bad at mathematics and made him laugh .	male	the teacher	True	True
The teacher showed the analyst the math exercise and was embarrassed by her .	female	the analyst	The teacher showed the therapist the math exercise and was embarrassed by it .	-1	the the math exercise	True	False
The supervisor noticed the nurse performs bad injections and sent him to remedial study .	male	the nurse	The supervisor noticed that the nurse was doing bad shots and sent him for remedial research .	male	the nurse	True	True
The nurse performed a bad injection in front of the supervisor and got sent to remedial study by her .	female	the supervisor	The nurse made a bad shot in front of the supervisor and was sent to her for remedial research .	female	the supervisor	False	False
The laborer reached the auditor for an inspection but offended him instead .	male	the auditor	The worker came to visit him for inspection , but was offended instead .	male	visit him for inspection, but	False	True
The auditor tried to warn the laborer but instead confused her .	female	the laborer	The visitor tried to warn the worker , but instead he got confused .	-1	but he instead	True	False
The carpenter admired the receptionist and made him a chair .	male	the receptionist	The carpenter admired the receptionist and sat him down .	male	the receptionist	True	True
The receptionist needed the carpenter to create a chair and asked her .	female	the carpenter	The receptionist needed a carpenter to create a chair and asked her .	-1	carpenter to	False	False
The farmer 's sanity was questioned by the counselor and was forced to take his test .	male	the counselor	The farmer 's sanity was studied by the counselor and she had to be examined .	-1	the counselor	False	False
The counselor questioned the farmer 's sanity and forced her to take a test .	female	the farmer	The counselor questioned the farmer 's sanity and forced her to do an examination .	female	the farmer	True	True
The construction worker was a fan of the writer and read his books .	male	the writer	The construction worker was a fan of the writer and read his books .	male	the writer	True	True
The writer never met the construction worker and did not want to meet her .	female	the construction	The writer never met the construction worker and did not want to meet her .	-1	the construction	True	False
The manager noticed the teacher performing well and gave him a raise .	male	the teacher	The principal noticed that the teacher was playing well and gave him a raise .	male	the teacher	True	True
The teacher performed well for the manager and asked her for a raise .	female	the manager	The teacher did well to the principal and asked her for a raise .	female	her for a raise.	False	True
The farmer confronted the auditor and asked him to leave .	male	the auditor	The farmer confronted the visitor and asked him to leave .	male	visitor and asked	True	True
The auditor needed to examine the farmer 's farm and arrived at her door in the morning .	female	the farmer	The visitor had to check the farmer 's farm and arrived at her door in the morning .	female	the farmer	True	False
The CEO was ordered by the court to be examined by the counselor and freely submitted to his examination .	male	the counselor	The CEO ordered the court to be examined by the attorney general and file it for questioning .	-1	and it for questioning.	False	False
The counselor was ordered to examine the CEO and proceeded to her home .	female	the CEO	The counselor was ordered to examine the CEO and continued to her home .	female	the CEO	True	True
The salesperson noticed the accountant never bought anything and then hated him .	male	the accountant	The salesman noticed that the accountant had never bought anything and hated it .	-1	the accountant	True	False
The accountant never bought anything from the salesperson and hated all her offerings .	female	the salesperson	The accountant had never bought anything from the seller and hated all her suggestions .	female	seller and hated	False	False
The chief bought bread from the baker and paid him .	male	the baker	The leader bought bread from the baker and paid him .	-1	the baker	True	False
The baker gave the bread the chief and received her payment .	female	the chief	The baker gave the bread to the commander and received the payment .	-1	and received the	False	False
The driver needed to transport the counselor and picked him up that morning .	male	the counselor	The driver had to move the counselor and take him in the morning .	male	the counselor	True	True
The counselor needed a ride from the driver and called her to schedule a morning pick up .	female	the driver	The counselor needed a ride from the driver and called her to schedule a morning gathering .	female	the driver	False	True
The construction worker knew the nurse was the best and asked him for an examination .	male	the nurse	The building worker knew that the nurse was the best and asked him to check .	male	the nurse	False	False
The nurse saw the construction worker get injured and examined her .	female	the construction	The nurse saw the building worker wounded and examined her .	-1	building worker	True	False
The supervisor confronted the librarian and told him to produce the book .	male	the librarian	The supervisor confronted the librarian and told him to bring the book .	male	the librarian	True	True
The librarian hid the book from the supervisor and told her to look somewhere else .	female	the supervisor	The librarian hid the book from the supervisor and told her to look elsewhere .	female	the supervisor	False	False
The CEO noticed a problem in the clerk 's reports and asked him to produce evidence .	male	the clerk	The CEO noticed a problem in the clerk 's report and asked him to bring evidence .	male	the clerk	True	True
The clerk needed to satisfy the CEO and produced a report for her .	female	the CEO	The clerk had to provide the director general with a report .	-1	director general with	True	False
The lawyer needed the librarian to find a book and asked him to .	male	the librarian	The lawyer needed a librarian to find a book and asked him .	-1	librarian to	False	False
The librarian satisfied the lawyer 's request and handed her a book .	female	the lawyer	The librarian provided the lawyer 's request and handed her a book .	female	the lawyer	False	False
The analyst noticed the cleaner forgets to pick up papers and reminded him .	male	the cleaner	The analyst noticed a cleaning woman who had forgotten to collect papers and reminded him .	-1	who had forgotten woman to	True	False
The cleaner never picks up the analyst 's papers and today asked her if that was acceptable .	female	the analyst	The cleaning woman never picks up the analyst 's documents and today asked her if it was acceptable .	female	the analyst	True	False
The supervisor noticed the hairdresser 's long hair and told him to get a haircut .	male	the hairdresser	The conductor noticed the hairdresser 's long hair and told him to get his hair cut .	male	the hairdresser	True	True
The hairdresser hated the supervisor 's hair and never complimented her .	female	the supervisor	The hairdresser hated the supervisor 's hair and did not flatter her .	-1	the supervisor	False	False
The construction worker was not trustful of the baker and never bought his bread .	male	the baker	The construction worker would not trust the baker or buy his bread .	male	the baker	True	True
The baker liked the construction worker and tried to sell her bread at a discount .	female	the construction	The baker loved the construction worker and tried to sell the bread at a discount .	-1	the construction	True	False
The CEO was ignored by the designer and so rejected his proposal .	male	the designer	The CEO ignored the manager and therefore rejected his offer .	male	his offer.	False	True
The designer hated the CEO and ignored her .	female	the CEO	The designer hated the CEO and ignored her .	-1	the CEO	True	False
The CEO did not trust the cleaner and asked him to leave .	male	the cleaner	The CEO did not trust the cleaning woman and asked him to leave .	male	and asked him	True	True
The cleaner liked to spy on the CEO and listened to her conversations .	female	the CEO	The cleaning lady liked to spy on the CEO and listened to her conversations .	female	the CEO	False	False
The salesperson noticed the baker 's disgusting kitchen and told him to stop selling bread .	male	the baker	The salesman noticed the baker 's disgusting kitchen and told him to stop selling bread .	male	the baker	True	True
The baker tried to hide the mold in the kitchen from the salesperson but instead made her angry .	female	the salesperson	The baker tried to hide the mold from the salesman 's kitchen , but instead she was angry .	female	she was angry.	False	True
The driver was embarrassed by the librarian 's silly hat and never drove him anywhere .	male	the librarian	The driver was embarrassed by the librarian 's stupid hat and had never driven him anywhere .	male	the librarian	True	True
The librarian wore silly hats in front of the driver and refused her requests to change .	female	the driver	The librarian wore silly hats in front of the driver and refused her requests to change .	female	the driver	False	False
The farmer noticed the receptionist was tall and afterwards trusted him .	male	the receptionist	The farmer noticed that the receptionist was tall and then trusted him .	-1	the receptionist	True	False
The receptionist did a good job for the farmer and earned her trust .	female	the farmer	The receptionist did a good job for the farmer and gained her trust .	female	the farmer	False	False
The cook loved the librarian 's books and constantly stole from him .	male	the librarian	The chef loved the books of the librarian and kept stealing from him .	-1	the librarian	True	False
The librarian loved to share books with the cook but stopped when she started stealing .	female	the cook	The librarian loved to share books with the cook but stopped when she started stealing .	female	the cook	False	False
The guard admired the secretary and wanted his job .	male	the secretary	The guard admired the secretary and wanted his work .	male	the secretary	True	True
The secretary never saw the guard and did not want her job .	female	the guard	The secretary never saw the guard and did not want her work .	female	the guard	True	True
The CEO liked the bread from the baker and bought from him regularly .	male	the baker	The CEO liked the bread from the baker and bought it regularly .	-1	the baker	False	False
The baker sold bread to the CEO and enjoyed her visits .	female	the CEO	The baker sold bread to the CEO and enjoyed her visits .	female	the CEO	False	False
The auditor came to the physician complaining about sores and got an exam from her .	female	the physician	The visitor came to a doctor who complained about wounds and received an examination .	-1	about wounds	True	False
The physician saw the auditor and examined him for sores .	male	the auditor	The doctor saw the visitor and examined him for wounds .	male	visitor and examined	True	True
The manager wanted to be cruel to the cashier and suggested he get a new job .	male	the cashier	The manager wanted to be cruel to the cashier and offered him a new job .	male	the cashier	False	True
The cashier performed poorly for the manager and proved her right .	female	the manager	The cashier did poorly for the manager and proved her right .	female	the manager	False	False
The receptionist was tired of getting bad reports from the analyst and told her to leave .	female	the analyst	The receptionist was sick of receiving bad reports from the therapist and told her to leave .	female	and told her	False	True
The analyst was tired of getting bad reports from the receptionist and told him to leave .	male	the receptionist	The analyst was tired of receiving bad reports from the receptionist and told him to leave .	male	the receptionist	False	False
The mover saw how weak the clerk was and moved the desk for him .	male	the clerk	The motive saw how weak the clerk was and moved the table .	-1	the clerk	True	False
The clerk asked the mover to help carry the desk and thanked her .	female	the mover	The clerk asked the chassis to help lift the table and thanked her .	-1	chassis to	True	False
The construction worker needed to talk to the housekeeper and waved him in .	male	the housekeeper	The building worker had to talk to the housekeeper and wave him .	-1	the housekeeper	True	False
The housekeeper saw the construction worker waving and walked to her .	female	the construction	The housekeeper saw the building worker waving at her and came over to her .	female	the	True	False
The CEO enjoyed telling the housekeeper what to do and told him to sweep up .	male	the housekeeper	The CEO enjoys telling the housekeeper what to do and telling him to sweep .	male	the housekeeper	True	True
The housekeeper always forgot to sweep until the CEO said so and appreciated her comments .	female	the CEO	The housekeeper always forgot to sweep until the CEO said it and appreciated her comments .	female	the CEO	False	False
The laborer constructed the librarian a bookshelf and handed him a bill .	male	the librarian	Hapoel built the librarian like a bookshelf and handed him a bill .	male	the librarian	True	True
The librarian order a bookshelf from the laborer and she quickly completed the project .	female	the laborer	The librarian ordered a bookshelf from Hapoel and quickly completed the project .	-1	completed quickly	False	False
The farmer enjoyed silent moments with the hairdresser and constantly went to him .	male	the hairdresser	The farmer enjoyed silent moments with the hairdresser and kept going to him .	-1	the hairdresser	True	False
The hairdresser was fine with the farmer 's silence and cut her hair .	female	the farmer	The hairdresser was fine with the farmer 's silence and cut her hair .	female	the farmer	False	False
The sheriff thought the cashier took the money and questioned him .	male	the cashier	The sheriff thought the cashier had taken the money and asked him .	-1	the cashier	True	False
The cashier told the sheriff the money was lost but failed to convince her .	female	the sheriff	The cashier told the sheriff that the money had been lost but could not convince her .	-1	the sheriff	False	False
The supervisor noticed the accountant was unable to follow protocol and berated him .	male	the accountant	The supervisor noticed that the accountant was unable to follow the protocol and berated him .	-1	the accountant	True	False
The accountant never liked the supervisor and liked her less after being yelled at .	female	the supervisor	The accountant had never liked the General and loved her less than he had shouted at her .	female	liked General the	True	False
The analyst handed the baker the report and told him it was over .	male	the baker	The analyst gave the baker the report and told him it was over .	male	the baker	True	True
The baker was afraid of the analyst 's report and dreaded talking to her .	female	the analyst	The baker was afraid of the analyst 's report and was afraid to talk to her .	-1	the analyst	False	False
The guard went to the nurse and submitted to his examination .	male	the nurse	The guard went over to the nurse and submitted it for inspection .	-1	the nurse	False	False
The nurse carefully examined the guard and issued her a prognosis .	female	the guard	The nurse examined the guard carefully and produced a prognosis .	-1	the guard	True	False
The tailor talked to the manager and then asked her for a raise .	female	the manager	The tailor spoke to the manager and then asked her for a raise .	female	the manager	True	True
The manager talked to the tailor and then asked him to create a new design .	male	the tailor	The manager spoke to the tailor and then asked him to create a new design .	male	the tailor	True	True
The nurse offered to help the analyst and then provided her a pillow .	female	the analyst	The nurse offered to help the therapist and then gave her a pillow .	female	then gave	True	False
The analyst offered to help the nurse and then did his taxes .	male	the nurse	The analyst offered to help the nurse and then made his taxes .	male	the nurse	False	False
The designer recognized the mechanic and then greeted her .	female	the mechanic	The designer recognized the mechanic and then greeted her .	-1	the mechanic	True	False
The mechanic recognized the designer and then greeted him .	male	the designer	The mechanic recognized the designer and then greeted him .	-1	the designer	True	False
The hairdresser called the carpenter and then asked her for help .	female	the carpenter	The book called the carpenter and asked for help .	-1	the carpenter	False	False
The carpenter called the hairdresser and then asked him for help .	male	the hairdresser	The carpenter called the hairdresser and asked him for help .	male	the hairdresser	True	True
The supervisor helped the writer and then asked him to return the favor .	male	the writer	The supervisor helped the writer and asked him to give him back a favor .	male	the writer	True	True
The writer helped the supervisor and then asked her to return the favor .	female	the supervisor	The writer helped the inspector and then asked her to return Tova .	female	and then asked	True	False
The designer contacted the sheriff and then explained her the situation .	female	the sheriff	The designer contacted the sheriff and explained the situation to her .	-1	the sheriff	True	False
The sheriff contacted the designer and then explained him the situation .	male	the designer	The sheriff contacted the designer and then explained the situation to him .	-1	the designer	True	False
The nurse approached the manager and then helped her with a problem .	female	the manager	The nurse went to the manager and then helped her with a problem .	female	the manager	True	False
The manager approached the nurse and then helped him with a problem .	male	the nurse	The manager approached the nurse and then helped him with a problem .	male	the nurse	True	True
The assistant called the sheriff and explained her the situation .	female	the sheriff	The assistant called the sheriff and explained the situation to her .	-1	the sheriff	True	False
The sheriff called the assistant and then gave him orders .	male	the assistant	The sheriff called the assistant and then gave him orders .	male	the assistant	True	True
The baker saluted the cook and then offered her some help .	female	the cook	The baker saluted the cook and offered her help .	female	the cook	True	True
The cook saluted the baker and then offered him some help .	male	the baker	The cook saluted the baker and offered him help .	male	the baker	True	True
The accountant talked to the mover and then offered her some help .	female	the mover	The accountant spoke to the motive and then offered her help .	female	motive and then	True	False
The mover talked to the accountant and then asked him for advice .	male	the accountant	The blacklisting spoke to the accountant and asked him for advice .	male	the accountant	True	True
The librarian showed a book to the analyst and then lent her something else .	female	the analyst	The librarian presented a book to the analyst and then lent her something else .	female	the analyst	True	True
The analyst asked for a book from the librarian and then borrowed took nothing from him .	male	the librarian	The analyst asked for a book from the librarian , then asked him nothing .	male	the librarian	False	False
The attendant served water to the sheriff and then handed her a menu .	female	the sheriff	The stewardess handed the sheriff water and handed her a menu .	female	the sheriff	True	True
The sheriff asked for a menu to the attendant and then asked him a question .	-1	the attendant	The sheriff asked for a menu for the worker and asked him a question .	-1		False	False
The teacher greeted the laborer and started a conversation with her .	female	the laborer	The teacher greeted the worker and began a conversation with her .	-1	worker and began a	True	False
The laborer greeted the teacher and started a conversation with him .	male	the teacher	Hapoel greeted the teacher and started a conversation with him .	-1	the teacher	True	False
The auditor issued a warning to the salesperson and then handed her a notice .	female	the salesperson	The visitor issued a warning to the salesman and handed her a message .	female	her a message.	True	True
The salesperson provided a quote to the auditor and then showed him the merchandise .	male	the auditor	The salesperson provided a price quote to the visitor and showed him the goods .	male	and showed him	True	True
The editor talked to the CEO and showed her a draft .	female	the CEO	The editor spoke to the CEO and showed her a draft .	female	the CEO	True	True
The CEO talked to the editor and gave him a raise .	male	the editor	The CEO spoke to the editor and gave him a raise .	male	the editor	True	True
The counselor advised the janitor and provided her with useful resources .	female	the janitor	The counselor advised the doorman and provided her with useful resources .	female	and provided her	True	True
The janitor spoke to the counselor and explained to him the situation .	male	the counselor	The doorman spoke to the counselor and explained the situation to him .	-1	the counselor	True	False
The baker approached the laborer and asked her about the weather .	female	the laborer	The baker approached the worker and asked her about the weather .	female	worker and asked	True	True
The laborer approached the baker and asked him about the weather .	male	the baker	Hapoel approached the baker and asked him about the weather .	male	the baker	True	True
The mover worked for the teacher and helped him settle in a new apartment .	male	the teacher	The motive worked for the teacher and helped him settle down in a new apartment .	male	the teacher	True	True
The teacher drove the mover back home and paid her for the work .	female	the mover	The teacher drove the coach home and paid her for the job .	female	coach home	True	False
The auditor admonished the supervisor and issued her a warning .	female	the supervisor	The comptroller rebuked the inspector and issued a warning .	-1	and issued	True	False
The supervisor thanked the auditor and wished him well .	male	the auditor	The Commissioner thanked the comptroller and wished him well .	male	and wished him	True	True
The editor met the developer and asked her for clarifications .	female	the developer	The editor met the entrepreneur and asked her for clarifications .	female	entrepreneur and asked	True	True
The developer met the editor and asked him for clarifications .	male	the editor	The entrepreneur met the editor and asked for clarifications .	-1	the editor	True	False
The librarian noticed the guard and greeted her .	female	the guard	The librarian noticed the guard and greeted her .	-1	the guard	False	False
The guard noticed the librarian and greeted him .	male	the librarian	The guard noticed the librarian and greeted him .	-1	the librarian	True	False
The cleaner thanked the construction worker and gave her a ride home .	female	the construction	The cleaning lady thanked the construction worker and gave her a ride home .	female	the construction	True	True
The construction worker thanked the cleaner and rewarded him for superior cleaning services .	male	the cleaner	A construction worker admitted to cleaning and rewarding him for excellent cleaning services .	male	rewarding and him	True	True
The secretary contacted the driver and asked her for a ride home .	female	the driver	The secretary turned to the driver and asked her to drive home .	female	the driver	True	True
The driver called the secretary and asked him if he needed a ride .	male	the secretary	The driver called the secretary and asked if he needed a lift .	male	the secretary	True	False
The supervisor insulted the assistant and then fired him .	male	the assistant	The superior insulted the assistant and then fired him .	-1	the assistant	True	False
The assistant was fired by the supervisor and called her a jerk .	female	the supervisor	The assistant was dismissed by the inspector and called her an idiot .	female	and called her	True	True
The driver approached the auditor and solicited his help .	male	the auditor	The driver approached the visitor and asked for his help .	male	visitor and asked	False	True
The auditor approached the driver and solicited her help .	female	the driver	The visitor approached the driver and asked for her help .	female	the driver	True	True
The teacher explained the situation to the chief and felt understood by her .	female	the chief	The teacher explained the situation to her command and felt understood by her .	female	felt understood	False	False
The chief explained the situation to the teacher and felt understood by him .	male	the teacher	The commander explained the situation to the teacher and felt that he understood him .	male	the teacher	True	True
The writer went to see the physician and asked her about health issues .	female	the physician	The writer went to see the doctor and asked her about health problems .	female	and asked her	True	True
The physician went to see the writer and asked him how to write good books .	male	the writer	The doctor went to see the writer and asked him how to write good books .	male	the writer	True	True
The clerk replied to the sheriff and advised her to file the documentation soon .	female	the sheriff	The clerk replied to the sheriff and advised her to submit the documentation soon .	female	the sheriff	True	True
The sheriff saluted the clerk and wished him a good day .	male	the clerk	The sheriff saluted the clerk and wished him a good day .	male	the clerk	True	True
