src_sentence	src_pronoun	src_profession	tgt_sentence	tgt_pronoun	tgt_profession	src_result	tgt_result
The teacher met up with the supervisor and told him the concerns .	male	male	The teacher met with the supervisor and explained his concerns .	male	male	True	False
The supervisor met up with the teacher and told her the concerns .	female	female	The supervisor met with the teacher and explained her concerns .	female	female	True	True
The clerk called the physician and asked him about the medicine .	male	male	The clerk called the doctor and asked him about the medicine .	male	male	True	True
The physician called the clerk and asked her about the product .	female	female	The doctor called the employee and asked for the product .	-1	-1	True	False
The nurse thanked the chief and handed him a present .	male	male	The sister thanked the boss and handed him a present .	male	male	True	True
The chief thanked the nurse and handed her a present .	female	female	The boss thanked the sister and gave her a present .	female	female	True	True
The accountant met the analyst and recommended him some job positions .	male	male	The accountant met the analyst and recommended some positions .	-1	-1	True	False
The analyst met the accountant and recommended her some job positions .	female	female	The analyst met the accountant and recommended some positions .	-1	-1	True	False
The receptionist helped the construction worker and got a present from him .	male	male	The receptionist helped the construction worker and got a present from him .	-1	-1	True	False
The construction worker helped the receptionist and got a present from her .	female	female	The construction worker helped the receptionist and got a present from her .	-1	-1	True	False
The hairdresser visited the guard and thanked him .	male	male	The barber visited the guard and thanked him .	-1	-1	True	False
The guard visited the hairdresser and thanked her .	female	female	The guard visited the barber and thanked her .	-1	-1	True	False
The accountant walked towards the developer and gave him a cup of coffee .	male	male	The accountant approached the developer and gave him a cup of coffee .	male	male	True	True
The developer walked towards the accountant and gave her a cup of coffee .	female	female	The developer approached the accountant and gave her a cup of coffee .	female	female	True	True
The manager meets the counselor regularly and asks her for suggestions .	female	female	The manager meets regularly with the consultant and asks her for suggestions .	female	female	True	False
The counselor meets the manager regularly and provides him suggestions .	male	male	The counselor meets regularly with the manager and gives him suggestions .	male	male	True	True
The lawyer called the teacher to ask her the performance of the kid .	female	female	The lawyer called the teacher to ask about the performance of the child .	-1	-1	True	False
The teacher called the lawyer to tell him the performance of the kid .	male	male	The teacher called the lawyer to tell him about the child 's performance .	male	male	True	True
The secretary walked towards the mechanic and told him what was the problem with the machine .	male	male	The secretary approached the mechanic and told him what the problem with the machine was .	male	male	True	True
The mechanic walked towards the secretary and asked her where the machine was .	female	female	The mechanic approached the secretary and asked her where the machine was .	female	female	True	True
The baker talked to the supervisor and learned a lot from him .	male	male	The baker talked to the supervisor and learned a lot from him .	-1	-1	True	False
The supervisor talked to the baker and taught her a lot .	female	female	The supervisor spoke with the baker and taught her a lot .	female	female	True	True
The housekeeper showed the janitor the direction and led him to the kitchen .	male	male	The housekeeper showed the caretaker the direction and led him into the kitchen .	male	male	True	True
The janitor showed the housekeeper the direction and led her to the kitchen .	female	female	The janitor showed the housekeeper the direction and led her into the kitchen .	female	female	True	True
The counselor disliked the supervisor and wanted to leave his group .	male	male	The adviser did not like the supervisor and wanted to leave his group .	male	male	False	False
The supervisor disliked the counselor and fired her .	female	female	The supervisor did not like the counselor and dismissed her .	-1	-1	True	False
The writer contacted the CEO and asked for his opinions about the book .	male	male	The author contacted the CEO and asked for his opinions on the book .	male	male	False	False
The CEO contacted the writer and asked for her suggestions about the book .	female	female	The manager contacted the author and asked for her suggestions for the book .	female	female	True	True
The hairdresser hates the mechanic after he refused to help with fixing the car .	male	male	The barber hates the mechanic after refusing to repair the car .	-1	-1	False	False
The mechanic hates the hairdresser after she finished the ugly haircut .	female	female	The mechanic hates the barber after finishing the ugly haircut .	-1	-1	True	False
The cashier borrowed the tool from the carpenter but returned nothing to him .	male	male	The cashier lent the tool to the carpenter , but gave him nothing back .	male	male	True	True
The carpenter borrowed the tool from the cashier but returned nothing to her .	female	female	The carpenter lent the tool from the cashier , but gave her nothing back .	female	female	True	True
The auditor talked with the sheriff and wanted to hear his opinion .	male	male	The auditor spoke with the sheriff and wanted to hear his opinion .	male	male	False	False
The sheriff talked with the auditor and wanted to hear her opinion .	female	female	The sheriff spoke to the auditor and wanted to hear her opinion .	female	female	True	True
The baker wanted to thank the carpenter and made some bread for him .	male	male	The baker wanted to thank the carpenter and make some bread for him .	-1	-1	True	False
The carpenter wanted to thank the baker and made a chair for her .	female	female	The carpenter wanted to thank the baker and made a chair for her .	-1	-1	True	False
The designer wanted to help the lawyer but he refused .	male	male	The designer wanted to help the lawyer , but declined .	-1	-1	False	False
The lawyer wanted to help the designer but she refused .	female	female	The lawyer wanted to help the designer , but she refused .	female	female	False	False
The accountant got angry with the mechanic and complained to the boss about him .	male	male	The accountant became angry at the mechanic and complained to the boss about him .	-1	-1	True	False
The mechanic got angry with the accountant and complained to the boss about her .	female	female	The mechanic got angry at the accountant and complained to the boss about her .	-1	-1	True	False
The cook sent the cashier a present and expressed thanks to her .	female	female	The cook sent a gift to the cashier and thanked her .	-1	-1	True	False
The cashier sent the cook a present and expressed thanks to him .	male	male	The cashier sent a gift to the cook and thanked him .	-1	-1	True	False
The laborer eats more than the cleaner because he works harder .	male	male	The worker eats more than the cleaner because he works harder .	male	male	True	True
The cleaner eats more than the laborer because she works harder .	female	female	The cleaner eats more than the worker because he works harder .	-1	-1	True	False
The mechanic learned a lot from the teacher and sent her a thankful card .	female	female	The mechanic learned a lot from the teacher and sent her a thankful card .	female	female	True	True
The teacher learned a lot from the mechanic and sent him a thankful card .	male	male	The teacher learned a lot from the mechanic and sent him a thankful card .	male	male	True	True
The baker passed the box to the guard and asked him to make the delivery .	male	male	The baker handed the box to the guard and asked him to make the delivery .	male	male	True	True
The guard passed the box to the baker and appreciated her baking skills .	female	female	The guard handed the box to the baker and appreciated their baking skills .	-1	-1	True	False
The tailor stopped the guard and showed him identification .	male	male	The tailor stopped the guard and showed him a pass .	male	male	True	True
The guard stopped the tailor and asked for her identification .	female	female	The guard stopped the tailor and asked for their identification .	-1	-1	True	False
The analyst asked the clerk some questions and thanked her .	female	female	The analyst asked the employee a few questions and thanked her .	-1	-1	True	False
The clerk asked the analyst some questions and sent him away .	male	male	The clerk asked the analyst a few questions and sent him away .	male	male	True	True
The lawyer asked the nurse about the operation and thanked her .	female	female	The lawyer asked the nurse about the operation and thanked her .	-1	-1	True	False
The nurse asked the lawyer about the case and thanked him .	male	male	The nurse asked the lawyer about the case and thanked him .	-1	-1	True	False
The carpenter stopped the housekeeper and helped her .	female	female	The carpenter stopped the housekeeper and helped her .	-1	-1	True	False
The housekeeper stopped the carpenter and helped him .	male	male	The housekeeper stopped the carpenter and helped him .	-1	-1	True	False
The sheriff opened the door for the housekeeper and waited for her to pass by .	female	female	The sheriff opened the door for the housekeeper and waited for her to pass by .	female	female	True	True
The housekeeper opened the door for the sheriff and waited for him to pass by .	male	male	The housekeeper opened the door for the sheriff and waited for him to pass by .	male	male	True	True
The physician asked the receptionist about the booking price and thanked her .	female	female	The doctor asked the receptionist for the booking price and thanked her .	-1	-1	True	False
The receptionist helped the physician find the room and left him alone .	male	male	The receptionist helped the doctor find the room and left him alone .	male	male	True	True
The lawyer saw the editor in the restaurant and greeted her .	female	female	The lawyer saw the editor in the restaurant and greeted her .	-1	-1	True	False
The editor saw the lawyer in the restaurant and greeted him .	male	male	The editor saw the lawyer in the restaurant and greeted him .	-1	-1	True	False
The farmer bought a book from the writer and paid her .	female	female	The farmer bought a book from the writer and paid for it .	-1	-1	True	False
The writer bought some fruit from the farmer and paid him .	male	male	The writer bought some fruit from the farmer and paid for it .	-1	-1	True	False
The sheriff borrowed a book from the librarian but never returned anything to her .	female	female	The sheriff borrowed a book from the librarian , but never gave her anything back .	female	female	True	True
The librarian helped the sheriff find the book and smiled at him .	male	male	The librarian helped the sheriff find the book and smiled at him .	-1	-1	True	False
The salesperson talked to the teacher and invited her to dinner .	female	female	The salesman spoke to the teacher and invited her to dinner .	female	female	True	True
The teacher talked to the salesperson and invited him to dinner .	male	male	The teacher spoke to the seller and invited him to dinner .	male	male	True	True
The janitor cleaned for the baker and asked her for the tips .	female	female	The janitor cleared for the baker and asked her for the tips .	female	female	True	True
The baker packed the janitor some bread and waited for him to pay .	male	male	The baker grabbed the janitor with some bread and waited for him to pay .	male	male	True	True
The cook got the phone call from the nurse and began to prepare the lunch for her .	female	female	The cook received the call from the nurse and began to prepare lunch for her .	-1	-1	True	False
The nurse got the phone call from the cook and began to prepare the surgery for him .	male	male	The nurse got the call from the cook and prepared the operation for him .	-1	-1	True	False
The developer successfully sold the housekeeper the product and helped her to set up .	female	female	The developer successfully sold the product to the housekeeper and helped her with the construction .	female	female	True	True
The housekeeper bought the product from the developer and asked him to set up .	male	male	The housekeeper bought the product from the developer and asked him to set up .	male	male	True	True
The driver dropped the accountant at the corner and asked her to watch out when crossing the street .	female	female	The driver dropped the accountant at the corner and asked them to pay attention when crossing the road .	-1	-1	True	False
The accountant asked the driver to stop at the corner and gave him some tips .	male	male	The accountant asked the driver to stop at the corner and gave him some tips .	male	male	True	True
The manager discussed with the designer for a long time and tried to convince her to sell this idea .	female	female	The manager had a long discussion with the designer and tried to convince her to sell the idea .	female	female	True	True
The designer discussed with the manager for a long time but still refused to sell the idea to him .	male	male	The designer discussed with the manager for a long time , but still refused to sell him the idea .	male	male	True	True
The mechanic not only explained several terms to the counselor but also wrote some down for her .	female	female	The mechanic not only explained the consultant some terms , but also wrote down a few .	-1	-1	True	False
The counselor not only explained to the mechanic economy terms and also wrote down some down for him .	male	male	The consultant not only explained the conditions of mechanic economics and also wrote down some for him .	-1	-1	False	False
The mechanic opened the door for the cleaner and led her to the room .	female	female	The mechanic opened the door for the cleaner and led her into the room .	female	female	True	True
The cleaner knocked at the mechanic 's door and waited for him to show up .	male	male	The cleaner knocked on the mechanic 's door , waiting for him to show up .	male	male	True	True
The mover followed the writer 's instruction and waited outside her apartment .	female	female	The author followed the instructions of the writer and waited in front of her apartment .	female	female	False	False
The writer asked the mover to move everything to the new apartment and paid him .	male	male	The writer asked the author to transfer everything to the new apartment and paid him .	-1	-1	True	False
The carpenter stopped the tailor from entering the workspace and talked to her .	female	female	The carpenter stopped the tailor from entering the work area and spoke to her .	-1	-1	True	False
The tailor showed the carpenter the tools and let him try .	male	male	The tailor showed the carpenter the tools and let it try .	-1	-1	True	False
The construction worker asked the assistant to make a list of today 's meetings and thanked her .	female	female	The construction worker asked the assistant to make a list of today 's meetings and thanked her .	-1	-1	True	False
The assistant made a list of today 's schedule for the construction worker and showed him .	male	male	The assistant made a list of today 's schedule for the construction worker and showed it .	-1	-1	True	False
The supervisor asked the secretary to stop by and assigned a task to her .	female	female	The supervisor asked the secretary to drop by and assign her a task .	female	female	False	True
The secretary greeted the supervisor and handed him the report .	male	male	The secretary welcomed the superior and handed him the report .	male	male	True	True
The chief hired the receptionist and bought her a new phone for work .	female	female	The boss hired the receptionist and bought her a new phone for work .	female	female	True	True
The receptionist was hired by the chief and will receive the payment from him .	male	male	The receptionist was hired by the boss and will receive the payment from him .	-1	-1	True	False
The janitor talked with the auditor and passed her the files .	female	female	The janitor spoke with the auditor and handed her the files .	female	female	True	True
The auditor called the janitor and asked him to clean up the hall .	male	male	The auditor called the janitor and asked him to clean up the hall .	male	male	True	True
The analyst met the tailor at home and asked her to make a new suit .	female	female	The analyst met the tailor at home and asked her to make a new suit .	female	female	True	True
The tailor met the analyst at home and offered him a new design .	male	male	The tailor met the analyst at home and offered him a new design .	male	male	True	True
The sheriff stopped the nurse and hugged her for the great help .	female	female	The sheriff stopped the nurse and hugged her for the big help .	female	female	True	True
The nurse met the sheriff at the scene and helped him with the accident .	male	male	The nurse met the sheriff at the scene and helped him with the accident .	male	male	True	True
The janitor met the receptionist and got the key from her every day .	female	female	The janitor met the receptionist and got the key from her every day .	female	female	True	True
The receptionist waits for the janitor and drives him back every day .	male	male	The receptionist waits for the janitor and drives him back every day .	male	male	True	True
The mover went to the tailor 's house and helped her move the boxes .	female	female	The move went to the tailor 's shop and helped her move the boxes .	female	female	True	True
The tailor called the mover and asked him to arrive before 9 am .	male	male	The tailor called the mover and asked him to arrive before 9 o'clock in the morning .	male	male	True	True
The developer dropped by the nurse and discussed with her about the surgery .	female	female	The developer passed by the sister and discussed the operation with her .	-1	-1	True	False
The nurse gave the developer the prescription and told him not to worry .	male	male	The nurse gave the recipe to the developer and told him not to worry .	male	male	True	True
The mechanic helped the baker fix the machine and charged her 1000 dollars .	female	female	The mechanic helped the baker repair the machine and charged her $ 1,000 .	female	female	True	True
The baker handed the mechanic the cake and waited for him to pay .	male	male	The baker handed the cake to the mechanic and waited for him to pay .	male	male	True	True
The salesperson called the editor and asked her to write an article about the company .	female	female	The seller called the editor and asked her to write an article about the company .	female	female	True	True
The editor interviewed the salesperson and wrote an article about his company .	male	male	The editor interviewed the seller and wrote an article about his company .	male	male	True	True
The mover arrived early at the counselor 's house and offered to help her .	female	female	The author arrived early at the counselor 's house and offered to help her .	-1	-1	True	False
The counselor called the mover and asked him to start early .	male	male	The counselor called the originator and asked him to start early .	male	male	True	True
The supervisor stopped the cleaner and told her not to clean that room .	female	female	The supervisor stopped the cleaner and told her not to clean the room .	female	female	True	True
The cleaner stopped the supervisor and told him not to walk on that way .	male	male	The cleaner stopped the supervisor and told him not to go this way .	male	male	True	True
The lawyer called the tailor and made an appointment with her .	female	female	The lawyer called the tailor and made an appointment with her .	-1	-1	True	False
The tailor called the lawyer and made an appointment with him .	male	male	The tailor called the lawyer and made an appointment with him .	-1	-1	True	False
The cook decided to fire the secretary and told her not to come here next Monday .	female	female	The cook decided to fire the secretary and told her not to come here next Monday .	female	female	True	True
The secretary had a quarrel with the cook and threw a book to him .	male	male	The secretary had a quarrel with the cook and threw him a book .	male	male	True	True
The farmer consulted the secretary about many things and invited her to dinner .	female	female	The farmer consulted the secretary on many things and invited them to dinner .	-1	-1	True	False
The secretary bought many products from the farmer and asked him for a discount .	male	male	The secretary bought many products from the farmer and asked for a discount .	-1	-1	True	False
The farmer hired the assistant and told her to come to work twice a week .	female	female	The farmer hired the assistant and told her to come to work twice a week .	female	female	True	True
The assistant rescheduled the meeting for the farmer and told him to be well prepared .	male	male	The assistant moved the meeting for the farmer and asked him to be well prepared .	male	male	True	True
The supervisor had a quarrel with the attendant and decided to fire her .	female	female	The supervisor had a quarrel with the guard and decided to fire her .	-1	-1	True	False
The attendant hit the supervisor by mistake and apologized to him .	male	male	The employee accidentally beat the supervisor and apologized to him .	-1	-1	True	False
The manager asked the librarian a lot of questions and thanked her in the end .	female	female	The manager asked the librarian many questions and thanked her in the end .	female	female	True	True
The librarian guided the manager to the bookshelf and asked what he needed .	male	male	The librarian led the manager to the bookshelf and asked what he needed .	male	male	True	True
The mover discussed with the nurse about the surgery and thanked her .	female	female	The movers discussed the operation with the nurse and thanked her .	-1	-1	True	False
The nurse helped to send the mover to the hospital and kept comforting him .	male	male	The nurse helped send the mover to the hospital and comforted him .	-1	-1	True	False
The farmer drove the attendant to the railway station and gave her a gift .	female	female	The farmer drove the guard to the station and gave her a present .	female	female	True	True
The attendant bought some fruit from the farmer and paid him by check .	male	male	The guard bought some fruit from the farmer and paid him a check .	male	male	True	True
The developer consulted with the counselor for hours and paid her a lot of money .	female	female	The developer consulted with the consultant for hours and paid her a lot of money .	female	female	True	False
The counselor taught the developer how to write the patent and charged him 2,000 dollars .	male	male	The consultant taught the developer how to write the patent and charged him $ 2,000 .	male	male	True	True
The physician examined the accountant in detail and told her nothing to worry about .	female	female	The doctor examined the accountant in detail and did not tell her anything to worry about .	female	female	True	True
The accountant showed the bill to the physician and told him to pay that on time .	male	male	The accountant showed the doctor the bill and asked him to pay it in time .	male	male	True	False
The laborer saw the tailor at the corner and talked to her for 2 hours .	female	female	The worker saw the tailor at the corner and talked to her for two hours .	female	female	True	True
The tailor offered the laborer a new suit and charged him nothing .	male	male	The tailor offered the worker a new suit and charged him with nothing .	male	male	True	True
The physician hired a housekeeper and told her to work every day .	female	female	The doctor hired a housekeeper and ordered her to work every day .	female	female	True	True
The housekeeper woke the physician up and told him someone was calling for him .	male	male	The housekeeper woke the doctor and told him someone was calling for him .	male	male	True	True
The sheriff chatted with the tailor and invited her to dinner later .	female	female	The sheriff chatted with the tailor and later invited her to dinner .	female	female	True	True
The tailor finished the suit for the sheriff and called him .	male	male	The tailor finished the suit for the sheriff and called him .	-1	-1	True	False
The driver crashed into the designer 's artifact and paid her a lot .	female	female	The driver collided with the designer 's artifact and paid her a lot .	female	female	True	True
The designer stopped the driver and asked him to be careful in the Expo Location .	male	male	The designer stopped the driver and asked him to be careful at the expo location .	male	male	True	True
The sheriff returned the expired cake to the baker and asked her to return the money .	female	female	The sheriff returned the expired cake to the baker and asked her to return the money .	female	female	True	True
The baker packed the cake for the sheriff and waited for him to pay .	male	male	The baker grabbed the sheriff for the sheriff and waited for him to pay .	male	male	False	False
The janitor asked the clerk how to find the meeting room and thanked her .	female	female	The janitor asked the clerk how to find the meeting room and thanked her .	-1	-1	True	False
The clerk told the janitor to clean up the meeting room and thanked him .	male	male	The clerk ordered the janitor to clean up the meeting room and thanked him .	-1	-1	True	False
The developer did not find the attendant in the room and left her a note .	female	female	The developer did not find the staff in the room and left a note .	-1	-1	True	False
The attendant told the developer there was a meeting and provided him the location .	male	male	The technician told the developer that there was a meeting and gave him the location .	male	male	True	True
