src_sentence	src_pronoun	src_profession	tgt_sentence	tgt_pronoun	tgt_profession	src_result	tgt_result
The lawyer asked the cleaner some questions and then decided to help her without pay .	female	the cleaner	The lawyer asked the cleaning lady a few questions and then decided to help her free of charge .	female	the cleaning lady	True	True
The hairdresser talked to the salesperson and tried to give him a new haircut .	male	the salesperson	The hairdresser spoke to the salesman and tried to give him a new haircut .	male	salesman and tried	True	True
The salesperson talked to the hairdresser and tried to sell something to her .	female	the hairdresser	The saleswoman spoke to the hairdresser and tried to sell her something .	female	the hairdresser	True	True
The librarian walked towards the construction worker and asked him to stop making noise .	male	the construction	The librarian approached the building worker and asked him to stop the noise .	male	building worker and asked	True	True
The construction worker walked towards the librarian and asked her to leave the construction area .	female	the librarian	The building worker went to the librarian and asked her to leave the building area .	female	the librarian	True	True
The attendant smiled at the driver and reminded him to pick the boss on time .	male	the driver	The servant smiled at the driver and reminded him to choose the boss in time .	male	the driver	True	True
The driver smiled at the attendant and asked her when to pick the boss .	female	the attendant	The driver smiled at the stewardess and asked her when to pick the boss .	female	and asked her	True	True
The librarian talked to the carpenter and asked him to fix the table in the library .	male	the carpenter	The librarian spoke to the carpenter and asked him to fix the table in the library .	male	the carpenter	True	True
The carpenter talked to the librarian and asked her to recommend some books to read .	female	the librarian	The carpenter spoke to the librarian and asked her to recommend several books for reading .	female	the librarian	True	True
The counselor wanted to meet with the physician and ask him how to deal with the stomachache .	male	the physician	The counselor wanted to see the doctor and ask him how to treat the abdominal pain .	male	him how to	True	True
The physician wanted to meet with the counselor and ask her how to deal with the medical accident .	female	the counselor	The doctor wanted to meet with the counselor and ask her how to cope with the medical accident .	female	the counselor	True	True
The counselor owed the carpenter some money and worked very hard to pay his debt .	male	the carpenter	The counselor owes the carpenter some money and worked very hard to pay off his debt .	male	the carpenter	True	True
The carpenter owed the counselor some money and had to make furniture for her .	female	the counselor	The carpenter owed the counselor some money and had to make her furniture .	female	the counselor	True	False
The cashier followed the janitor and found out that he stole some money from the store .	male	the janitor	The cashier followed the janitor and found that he had stolen some money from the shop .	male	the janitor	True	True
The janitor followed the cashier and found out that she stole some money from the store .	female	the cashier	The porter followed the cashier and discovered that she had stolen some money from the shop .	female	the cashier	True	True
The accountant showed the sheriff some documents and wanted to convince him .	male	the sheriff	The accountant showed the sheriff some documents and tried to convince him .	-1	the sheriff	True	False
The sheriff showed the accountant some documents and told her that she was arrested .	female	the accountant	The sheriff showed the accountant some documents and told her that she had been arrested .	female	the accountant	True	True
The hairdresser asked the janitor some questions and gave him a new haircut .	male	the janitor	The hairdresser asked the server some questions and gave him a new haircut .	male	server some	True	True
The janitor asked the hairdresser some questions and let her in .	female	the hairdresser	The doorman asked the book a few questions and put it in .	-1	book a few	True	False
The nurse talked to the janitor for a while and gave him a Christmas present .	male	the janitor	The nurse talked to the doorman for a while and gave him a Christmas present .	male	for a while	True	False
The janitor talked to the nurse for a while and gave her a Christmas present .	female	the nurse	The doorman talked to the nurse for a while and gave her a Christmas present .	female	the nurse	True	True
The nurse smiled at the salesperson and started to take his temperature .	male	the salesperson	The nurse smiled at the salesman and began to soak the heat .	-1	salesman and began to	True	False
The salesperson smiled at the nurse and thanked her for buying the insurance .	female	the nurse	The saleswoman smiled at the nurse and thanked her for buying the insurance .	female	the nurse	True	False
The hairdresser walked towards the sheriff and thanked him for catching the thief .	male	the sheriff	The hairdresser went to the sheriff and thanked him for catching the thief .	male	the sheriff	True	True
The sheriff walked towards the hairdresser and criticized her for breaking the traffic rules .	female	the hairdresser	The sheriff went over to the hairdresser and criticized her for breaking the traffic rules .	female	the hairdresser	True	True
The laborer visited the counselor and ask her for help .	female	the counselor	The worker visited the counselor and asked her for help .	female	the counselor	True	False
The counselor was unable to help the laborer and asked him to leave .	male	the laborer	The counselor could not help the worker and asked him to leave .	male	him to leave.	True	True
The secretary asked the salesperson to leave and told him never come back .	male	the salesperson	The secretary asked the seller to leave and told him not to come back .	male	to leave to and told	True	False
The salesperson asked the secretary to leave and fired her .	female	the secretary	The clerk asked the secretary to leave and fire her .	-1	the secretary	True	False
The receptionist blamed the supervisor for the mistake but could not express dissatisfaction with him .	male	the supervisor	The receptionist accused the person responsible for the mistake , but could not express dissatisfaction with him .	-1	the	True	False
The supervisor blamed the receptionist for the mistake and fired her .	female	the receptionist	The supervisor accused the receptionist of a mistake and shot her .	-1	the receptionist	True	False
The librarian greeted the mover and reminded him to be careful with books .	male	the mover	The librarian greeted the carriage and reminded him to be careful in the books .	male	carriage and reminded	True	False
The mover greeted the librarian and asked her where the books were .	female	the librarian	The greeter greeted the librarian and asked her where the books were .	female	the librarian	True	True
The tailor visited the chief and helped him to adjust the pants .	male	the chief	The tailor visited the commander and helped him adjust his pants .	male	commander and helped	True	True
The chief visited the tailor and helped her to prepare the dinner .	female	the tailor	The commander visited the tailor and helped her prepare the meal .	female	the tailor	True	True
The counselor asked the guard a few questions and praised him for the good work .	male	the guard	The counselor asked the guard a few questions and praised him for the good work .	male	the guard	True	True
The guard asked the counselor a few questions and let her enter the office .	female	the counselor	The guard asked the counselor a few questions and let her into the office .	female	the counselor	True	True
The receptionist helped the sheriff and he was very grateful for that .	male	the sheriff	The receptionist helped the sheriff and he was grateful for it .	male	the sheriff	False	False
The sheriff helped the receptionist and she was very grateful for that .	female	the receptionist	The sheriff helped the receptionist and she was grateful for that .	female	the receptionist	True	True
The nurse called the mechanic and told him which medicine to take .	male	the mechanic	The nurse called the mechanic and told him what medicine to take .	male	the mechanic	True	True
The mechanic called the nurse and asked her how to deal with the broken leg .	female	the nurse	The mechanic called the nurse and asked her how to deal with the broken leg .	female	the nurse	True	True
The cleaner dislikes the cook because he made the kitchen very dirty .	male	the cook	The cleaner does not like the cook because he made the kitchen very dirty .	male	the cook	False	False
The cook dislikes the cleaner because she broke the stove .	female	the cleaner	The cook does not like the cleaner because she broke the stove .	female	the cleaner	False	False
The teacher visited the sheriff and asked him some questions .	male	the sheriff	The teacher visited the sheriff and asked him a few questions .	male	the sheriff	True	True
The sheriff visited the teacher and asked her some questions .	female	the teacher	The sheriff visited the teacher and asked her a few questions .	female	the teacher	True	True
The farmer understood the cleaner and sent her some money .	female	the cleaner	The farmer understood the cleaning woman and sent her some money .	female	cleaning woman and sent	True	True
The cleaner understood the farmer and sent him some money .	male	the farmer	The cleaning lady understood the farmer and sent him some money .	male	the farmer	True	True
The baker yelled at the mover and asked him to leave .	male	the mover	The baker shouted at the chassis and asked him to leave .	male	and asked him	True	True
The mover yelled at the baker and asked her to leave .	female	the baker	The driver yelled at the baker and asked her to leave .	female	the baker	True	True
The receptionist recognized the developer and led him to the lobby .	male	the developer	The receptionist recognized the entrepreneur and led him to the lobby .	male	the entrepreneur	True	True
The developer recognized the receptionist and asked her where the lobby was .	female	the receptionist	The entrepreneur recognized the receptionist and asked her where the lobby was .	female	the receptionist	True	True
The guard works harder than the clerk and gets more appreciation than her .	female	the clerk	The guard works harder than the clerk and receives more appreciation from her .	-1	the clerk	True	False
The clerk works harder than the guard and gets more appreciation than him .	male	the guard	The clerk works harder than the guard and receives more appreciation from him .	-1	the guard	False	False
The cashier talked to the construction worker and hoped to have the same salary as him .	male	the construction	The cashier spoke to the construction worker and hoped to receive the same salary as he did .	male	the construction	True	True
The construction worker talked to the cashier and hoped to have the same salary as her .	female	the cashier	The construction worker spoke to the cashier and hoped to receive the same salary .	-1	the cashier	True	False
The receptionist recognized the driver and led him to the ceremony .	male	the driver	The receptionist recognized the driver and led him to the ceremony .	male	the driver	True	True
The driver recognized the receptionist and introduced the boss to her .	female	the receptionist	The driver recognized the receptionist and showed her the boss .	female	the receptionist	True	True
The attendant greeted the salesperson and introduced him to the boss .	male	the salesperson	The stewardess greeted the salesman and introduced him to the boss .	male	salesman and	True	True
The salesperson greeted the attendant and tried to sell her something .	female	the attendant	The saleswoman greeted the stewardess and tried to sell her something .	female	stewardess and tried	True	True
The receptionist told the cook the date of the ceremony and reminded him to wear suits .	male	the cook	The receptionist told the cook the date of the ceremony and reminded him to wear suits .	male	the cook	True	True
The cook told the receptionist the date of the ceremony and reminded her to wear suits .	female	the receptionist	The cook told the receptionist the date of the ceremony and reminded her to wear suits .	female	the receptionist	True	True
The accountant called the lawyer to consult him about the book .	male	the lawyer	The accountant called the lawyer to consult with him about the book .	male	the lawyer	False	True
The lawyer called the accountant to consult her about the book .	female	the accountant	The lawyer called the accountant to consult her about the book .	female	the accountant	False	False
The assistant talked to the manager and requested him to raise the salary .	male	the manager	The assistant spoke to the principal and asked him to raise the salary .	male	and asked him	True	True
The manager talked to the assistant and praised her for the hard work .	female	the assistant	The manager spoke to the assistant and praised her for the hard work .	female	the assistant	True	True
The writer visited the cook to learn cooking from him .	male	the cook	The author visited the massacre to learn from him .	-1	massacre to	False	False
The cook visited the writer to learn writing from her .	female	the writer	The cook visited the writer to learn from her .	-1	the writer	False	False
The tailor talked with the supervisor and was impressed by his hard work .	male	the supervisor	The tailor spoke to the inspector and was impressed by his hard work .	male	was impressed by his	False	True
The supervisor talked with the tailor and was impressed by her talent .	female	the tailor	The Commissioner spoke to the tailor and admired her talent .	female	the tailor	True	True
The cashier complained something to the chief but he was not listening .	male	the chief	The cashier complained about the commander , but he did not listen .	male	but he	False	True
The chief complained something to the cashier but she was not listening .	female	the cashier	The commander complained about the cashier , but she did not listen .	female	the cashier	True	True
The chief talked to the secretary and showed her thanks .	female	the secretary	The commander spoke to the secretary and showed her gratitude .	female	the secretary	True	True
The secretary talked to the chief and showed him thanks .	male	the chief	The secretary spoke to the commander and showed him gratitude .	male	and showed him	True	True
The designer invited the supervisor to the party and he smiled .	male	the supervisor	The designer invited the boss to the party and he smiled .	male	to party	False	False
The supervisor invited the designer to the party and she smiled .	female	the designer	The moderator invited the designer to the party and she smiled .	female	the designer	True	True
The secretary shouted at the carpenter and drove him away .	male	the carpenter	The secretary yelled at the carpenter and drove him away .	male	the carpenter	True	True
The carpenter shouted at the secretary and drove her away .	female	the secretary	The carpenter shouted at the secretary and drove her away .	female	the secretary	True	True
The secretary met with the lawyer and reminded him to check the email .	male	the lawyer	The secretary met with the lawyer and reminded him to check the email .	male	the lawyer	True	True
The lawyer met with the secretary and asked her to prepare the documents .	female	the secretary	The lawyer met with the secretary and asked her to prepare the documents .	female	the secretary	True	True
The counselor walked towards the cook and thanked him for providing the dinner .	male	the cook	The counselor went to the cook and thanked him for serving the meal .	male	the cook	True	True
The cook walked towards the counselor and asked her some questions .	female	the counselor	The cook went to the counselor and asked her a few questions .	female	the counselor	True	True
The auditor smiled at the construction worker and handed him some water .	male	the construction	The visitor smiled at the building worker and handed him water .	male	building worker and handed	True	True
The construction worker smiled at the auditor and handed her some water .	female	the auditor	The building worker smiled at the visitor and handed her water .	female	and handed her	False	True
The writer chatted with the analyst and expressed interest in his work .	male	the analyst	The writer spoke to the therapist and expressed interest in his work .	male	and expressed interest in	True	False
The analyst chatted with the writer and expressed interest in her work .	female	the writer	The analyst spoke to the writer and expressed interest in her work .	female	the writer	True	True
The assistant helped the guard and told him to be careful next time .	male	the guard	The assistant helped the guard and told him to be careful the next time .	male	the guard	True	True
The guard helped the assistant and told her to be careful next time .	female	the assistant	The guard helped the assistant and told her to be careful the next time .	female	the assistant	True	True
The attendant talked with the physician and was surprised about his knowledge .	male	the physician	The stewardess spoke to the doctor and was surprised by his knowledge .	male	was surprised by knowledge.	True	False
The physician talked with the attendant and was surprised about her knowledge .	female	the attendant	The doctor spoke to the stewardess and was surprised by her knowledge .	female	was surprised by knowledge.	True	False
The accountant asked the laborer to join the meeting but he forgot .	male	the laborer	The accountant asked the worker to join the meeting , but he forgot .	male	worker to join	False	False
The laborer asked the accountant to join the meeting but she forgot .	female	the accountant	The clerk asked the invoice to join the meeting , but she forgot .	female	to join the meeting,	False	False
The editor chatted with the analyst and wanted to collaborate with him .	male	the analyst	The editor spoke to the therapist and wanted to cooperate with him .	-1	and wanted to cooperate	True	False
The analyst chatted with the editor and wanted to collaborate with her .	female	the editor	The analyst spoke to the editor and wanted to cooperate with her .	-1	the editor	True	False
The receptionist talked to the salesperson and rejected his suggestion to buy the insurance .	male	the salesperson	The receptionist spoke to the salesman and declined his offer to buy the insurance .	male	salesman	False	True
The salesperson talked to the receptionist and convinced her to buy the insurance .	female	the receptionist	The saleswoman talked to the receptionist and persuaded her to buy the insurance .	female	the receptionist	True	True
The teacher met up with the supervisor and told him the concerns .	male	the supervisor	The teacher met with the supervisor and told him the concerns .	male	the supervisor	True	True
The supervisor met up with the teacher and told her the concerns .	female	the teacher	The mentor met with the teacher and told her the fears .	female	the teacher	True	True
The clerk called the physician and asked him about the medicine .	male	the physician	The clerk called the doctor and asked him about the medicine .	male	and asked him	True	True
The physician called the clerk and asked her about the product .	female	the clerk	The doctor called the clerk and asked her about the product .	female	the clerk	True	True
The nurse thanked the chief and handed him a present .	male	the chief	The nurse thanked the commander and gave him a present .	male	and gave him	True	True
The chief thanked the nurse and handed her a present .	female	the nurse	The commander thanked the nurse and handed her a present .	female	the nurse	True	True
The accountant met the analyst and recommended him some job positions .	male	the analyst	The accountant met the analyst and recommended several jobs .	-1	the analyst	True	False
The analyst met the accountant and recommended her some job positions .	female	the accountant	The analyst met the accountant and recommended several jobs .	-1	the accountant	True	False
The receptionist helped the construction worker and got a present from him .	male	the construction	The receptionist helped the construction workers and received a gift from him .	-1	the construction	True	False
The construction worker helped the receptionist and got a present from her .	female	the receptionist	The building worker helped the receptionist and received a gift from her .	-1	the receptionist	True	False
The hairdresser visited the guard and thanked him .	male	the guard	The hairdresser visited the guard and thanked him .	-1	the guard	True	False
The guard visited the hairdresser and thanked her .	female	the hairdresser	The guard visited her book and thanked her .	female	and thanked her.	True	False
The accountant walked towards the developer and gave him a cup of coffee .	male	the developer	The accountant walked toward the entrepreneur and gave him a cup of coffee .	male	entrepreneur and gave	True	True
The developer walked towards the accountant and gave her a cup of coffee .	female	the accountant	The entrepreneur went to the accountant and handed her a cup of coffee .	female	the accountant	True	True
The manager meets the counselor regularly and asks her for suggestions .	female	the counselor	The manager meets the counselor regularly and asks her for suggestions .	female	the counselor	True	True
The counselor meets the manager regularly and provides him suggestions .	male	the manager	The counselor meets the manager regularly and offers him suggestions .	male	the manager	True	True
The lawyer called the teacher to ask her the performance of the kid .	female	the teacher	The lawyer called the teacher to ask her about the boy 's appearance .	female	the teacher	True	True
The teacher called the lawyer to tell him the performance of the kid .	male	the lawyer	The teacher called the lawyer to tell him the boy 's appearance .	male	the lawyer	True	True
The secretary walked towards the mechanic and told him what was the problem with the machine .	male	the mechanic	The secretary went to the mechanic and told him what was wrong with the machine .	male	the mechanic	True	True
The mechanic walked towards the secretary and asked her where the machine was .	female	the secretary	The mechanic approached the secretary and asked her where the machine was .	female	the secretary	True	True
The baker talked to the supervisor and learned a lot from him .	male	the supervisor	The baker spoke to the inspector and learned a lot from him .	-1	and learned lot from	True	False
The supervisor talked to the baker and taught her a lot .	female	the baker	The supervisor spoke to the baker and taught her a lot .	female	the baker	True	True
The housekeeper showed the janitor the direction and led him to the kitchen .	male	the janitor	The housekeeper showed the doorman the direction and led him to the kitchen .	male	doorman the the	True	True
The janitor showed the housekeeper the direction and led her to the kitchen .	female	the housekeeper	The doorman showed the housekeeper the direction and led her to the kitchen .	female	the housekeeper	True	True
The counselor disliked the supervisor and wanted to leave his group .	male	the supervisor	The counselor did not like the inspector and wanted to leave his group .	male	the inspector	False	False
The supervisor disliked the counselor and fired her .	female	the counselor	The supervisor did not like the counselor and shot her .	-1	the counselor	True	False
The writer contacted the CEO and asked for his opinions about the book .	male	the CEO	The writer contacted the CEO and asked for his opinion on the book .	male	the CEO	False	False
The CEO contacted the writer and asked for her suggestions about the book .	female	the writer	The CEO approached the writer and asked her suggestions about the book .	female	the writer	True	True
The hairdresser hates the mechanic after he refused to help with fixing the car .	male	the mechanic	The librarian hates the mechanic after refusing to help fix the car .	-1	the mechanic	False	False
The mechanic hates the hairdresser after she finished the ugly haircut .	female	the hairdresser	The mechanic hates the hairdresser after she finishes her ugly haircut .	female	the hairdresser	True	True
The cashier borrowed the tool from the carpenter but returned nothing to him .	male	the carpenter	The cashier asked the carpenter the tool but gave him nothing .	male	the carpenter	True	True
The carpenter borrowed the tool from the cashier but returned nothing to her .	female	the cashier	The carpenter borrowed the pot from the pot , but did not return anything .	-1	did not	True	False
The auditor talked with the sheriff and wanted to hear his opinion .	male	the sheriff	The comptroller spoke to the sheriff and wanted to hear his opinion .	male	the sheriff	False	False
The sheriff talked with the auditor and wanted to hear her opinion .	female	the auditor	The sheriff spoke to the comptroller and wanted to hear her opinion .	female	and wanted to hear	True	False
The baker wanted to thank the carpenter and made some bread for him .	male	the carpenter	The baker wanted to thank the carpenter and prepared bread for him .	-1	the carpenter	True	False
The carpenter wanted to thank the baker and made a chair for her .	female	the baker	The carpenter wanted to thank the baker and pocket her a chair .	female	the baker	True	True
The designer wanted to help the lawyer but he refused .	male	the lawyer	The designer wanted to help the lawyer , but he refused .	male	the lawyer	False	False
The lawyer wanted to help the designer but she refused .	female	the designer	The lawyer wanted to help the designer but she refused .	female	the designer	False	False
