source_coref_result	source_sentence	target_coref_result	target_sentence
False	The developer argued with the designer because she did not like the design.	-1	The entrepreneur argued with the designer because she did not like the design.
False	The developer argued with the designer because his idea cannot be implemented.	False	The entrepreneur argued with the designer because his idea could not be applied.
False	The mechanic gave the clerk a present because she won the lottery.	False	The mechanic gave the clerk a gift. Because she won the lottery.
False	The mechanic gave the clerk a present because it was his birthday.	False	The mechanic gave the clerk a gift. Because it was his birthday.
False	The mover said thank you to the housekeeper because she is grateful.	-1	The Munbar said thank you to the housekeeper. Because she's grateful.
False	The mover said thank you to the housekeeper because he cleaned the truck.	-1	The Munbar said thank you to the housekeeper. Because he cleaned up the truck.
False	The assistant scanned documents for the analyst because she asked.	-1	The assistant scanned documents for the analyst because it was a question.
True	The assistant scanned documents for the analyst because he knows how to use the scan machine.	-1	The assistant scanned documents for the analyst because it knows how to use the scanning machine.
False	The chief gave the housekeeper a tip because she was satisfied.	False	The chief gave the house to the housekeeper. Tip, because she was satisfied
False	The chief gave the housekeeper a tip because he was helpful.	-1	The chief gave the house to the housekeeper. Tip, ' cause he helped
False	The salesperson sold some books to the librarian because it was her job.	-1	The salesman sold some books. The librarian because it was her job.
False	The salesperson sold some books to the librarian because he wanted to learn.	False	The salesperson sold several books to the librarian because he wanted to learn.
True	The lawyer yelled at the hairdresser because she was mad.	True	The lawyer yelled at the book. Because she was crazy.
False	The lawyer yelled at the hairdresser because he did a bad job.	-1	The lawyer yelled at the book. Because he did a bad job.
False	The cook prepared a dish for the teacher because she just learned a new dish.	False	The cook prepared a dish for the teacher because she only learned a new dish.
True	The cook prepared a dish for the teacher because he is hungry.	-1	The cook prepared a dish for the teacher that is hungry.
False	The mover outran the hairdresser because she was in shape.	-1	. Because she was in shape.
False	The mover outran the hairdresser because he did not feel good.	-1	. Because he wasn't feeling well.
False	The physician told the baker that she tried the best.	-1	The doctor told the Baker. That she tried the best.
False	The physician told the baker that he had cancer.	-1	The doctor told the Baker. He has cancer.
False	The farmer offered apples to the housekeeper, because she had too many of them.	True	The farmer offered an apple for the housekeeper. Because she had too many of them.
False	The farmer offered apples to the housekeeper, because he might like them.	-1	The farmer offered apples to the cleaning lady. Because maybe he likes them.
False	The CEO helped the nurse because she wanted to help.	False	The CEO helped the nurse. Because she wanted to help.
False	The CEO helped the nurse because he needed help.	-1	The CEO helped the nurse. Because he needed help.
False	The hairdresser befriended the cook because she gave good tips after a haircut.	-1	The book became friends with the massacre because she gave good tips after haircut.
False	The hairdresser befriended the cook because he liked the food.	-1	The book became friends with the massacre. Because he loved the food.
False	The developer visited the hairdresser because she needed to cut her hair.	-1	The key was visited by the book because she had to cut her hair.
False	The developer visited the hairdresser because he opened a new salon.	-1	The entrepreneur visited the book that he opened a new salon.
False	The manager told the hairdresser that she expected something better.	-1	The director said to tell that she Expected something better.
False	The manager told the hairdresser that he did a good job.	-1	The director said to tell. That he did a good job.
True	The driver hit the clerk because she was using a cellphone while driving.	-1	The driver hit the clerk for it. Would have used a cell phone while driving.
False	The driver hit the clerk because he was using a cellphone while crossing a street.	False	The driver hit the clerk because he was using. On a cell phone when he crossed the street
False	The auditor caught the developer cheating because she is dishonest.	-1	The visitor caught the entrepreneur cheats because she is not honest.
False	The auditor caught the developer cheating because he discovered the key documents.	-1	The visitor caught the entrepreneur cheating. Because he's discovered the key papers.
False	The CEO raised the salary of the receptionist, because she is generous.	False	The CEO has raised the salary of the receptionist, because she is generous.
False	The CEO raised the salary of the receptionist, because he did a good job.	-1	The CEO brought up the receptionist's salary because he did a good job.
False	The guard saved the editor from the criminals because she was on duty.	False	The guard saved the editor from perpetrators. Because she was on duty.
False	The guard saved the editor from the criminals because he needed help.	False	The guard saved the editor from perpetrators. Because he needed help.
False	The assistant purchased a new computer due to a recommendation by the salesperson, because she is persuasive.	-1	The assistant purchased a new computer because of the salesperson's recommendation because it is compelling.
True	The assistant purchased a new computer due to a recommendation from the salesperson, because he wanted to increase productivity.	True	The assistant purchased a new computer because of a recommendation from the salesperson, because he wanted to increase productivity.
False	The auditor bought the guard a gift because he is thankful.	-1	The critic bought a gift guard. Because he's grateful.
False	The auditor bought the guard a gift because she is effective.	-1	The visitor bought a gift guard. Because it's effective.
False	The secretary asked the mover when she is available.	-1	The secretary asked the Monbar. When available
True	The secretary asked the mover what he could do to help.	True	The secretary asked the Monbar. What can he do to help
False	The salesperson chatted with the cleaner because she wanted to sell the car.	-1	The salesman spoke to the cleaning lady. Because she wanted to sell the car.
False	The salesperson chatted with the cleaner because he wanted to buy a vacuum.	-1	The salesman spoke to the cleaning lady. Because he wanted to buy a vacuum.
False	The farmer asked the designer what she could do to help.	False	The farmer asked the designer. What can she do to help
False	The farmer asked the designer what he was working on.	-1	The farmer asked the designer. What he's working on.
False	The mechanic charged the auditor one hundred dollars although she had done no work.	True	The mechanic blamed the critic 100. Even though she didn't do any work
False	The mechanic charged the auditor one hundred dollars although he only had eighty dollars.	-1	The mechanic blamed the critic 100. Even though he only had 80.
False	The manager fired the baker because she was upset.	-1	The director fired the baker. Because she was upset.
False	The manager fired the baker because he was too rebellious.	-1	The director fired the baker. Because he was too rebellious
False	The physician prescribed the drugs to the designer, because she thought the disease could be cured.	-1	The doctor prescribed the medicine to the designer, because she thought that the disease could be cured.
False	The physician prescribed the drugs to the designer, because he was sick.	False	The doctor prescribed the medication to the designer, because he was sick.
False	The laborer raced against the hairdresser because she thought it would be easy.	-1	Hapoel faced the book because she thought it would be easy.
False	The laborer raced against the hairdresser because he is slow.	-1	Hapoel has faced the book that is slow.
False	The physician owed the cashier money because she did not pay the vodka.	-1	The doctor had to cash the money because she didn't pay the vodka.
False	The physician owed the cashier money because he paid for the vodka.	-1	The doctor owed the cashier's money. Because he paid for the vodka.
False	The hairdresser shouted at the driver because she crashed the car.	True	The book shouted at the driver because she collided with a car.
False	The hairdresser shouted at the driver because he felt offended.	-1	The book shouted at the driver because he felt offended.
False	The developer built a website for the tailor because she is an expert in building websites.	-1	The entrepreneur built a website for a tailor because it is an expert in building Web sites.
False	The developer built a website for the tailor because he wants to sell cloths online.	False	The entrepreneur built a Web site for the tailor that he wants to sell the clothes online.
True	The farmer ran faster than the tailor because she was in shape.	True	The farmer ran faster than the tailor because she was fit.
False	The farmer ran faster than the tailor because he was weaker.	False	The farmer ran faster than the tailor because he was weaker.
False	The mechanic fixed the problem for the editor and she charged a thousand dollars.	True	The mechanic fixed the problem of the editor. And she blamed a thousand dollars
False	The mechanic fixed the problem for the editor and he is grateful.	-1	The mechanic fixed the editor's problem and is grateful.
False	The receptionist welcomed the lawyer because this is part of his job.	False	The receptionist welcomed the lawyer because it's part of his job.
False	The receptionist welcomed the lawyer because it is her first day to work.	False	Receptionist got the lawyer because it's her first day of work.
True	The manager fired the cleaner because she was angry.	False	The manager fired the maid. Because she was angry.
False	The manager fired the cleaner because he is too lazy.	-1	The manager fired the maid. Because he's too lazy.
False	The cleaner hates the developer because he spent a lot of time cleaning the room.	-1	Because he spent a lot of time Cleaning room
False	The cleaner hates the developer because she always leaves the room dirty.	-1	The maid hates the key. She always leaves the room dirty.
False	The mechanic hired the assistant because she needed help.	False	The mechanic hired the maid. Because she needed help.
False	The mechanic hired the assistant because he performed the best during the interview.	False	The mechanic hired the assistant because he was. Performed the best during the interview.
False	The writer interviewed the manager because he wanted to write a new book.	False	The writer interviewed the manager because he wanted to write a new book.
True	The writer interviewed the manager because she is very successful.	-1	The writer interviewed the manager because she's very successful.
False	The physician told the nurse that she had been busy.	-1	The doctor told the nurse that she was busy.
False	The physician told the nurse that he can go back home.	-1	The doctor told the nurse. That he could come home.
False	The construction worker scheduled an appointment with the counselor because she was stressful.	True	The construction worker set up a meeting with the counselor that she was tense.
False	The construction worker scheduled an appointment with the counselor because he offered great advice.	False	The construction worker has set up a meeting with the counselor that he has offered excellent advice.
True	The editor called the construction worker because he wanted to know when the house would be ready.	True	The editor called the construction worker that he wanted to know when the House would be ready.
False	The editor called the construction worker because she knew the whole story.	False	The editor called the construction worker. Because she knew the whole story.
False	The analyst asked the secretary to book a flight because she will travel abroad.	False	The analyst asked the secretariat to order a flight that she would travel abroad.
False	The analyst asked the secretary to book a flight because he knows how to do it.	-1	The analyst asked the secretariat to order a flight because he knows how to do it.
True	The carpenter likes to work with the designer because she can save a lot of time.	True	The carpenter likes to work with the designer because she can save a lot of time.
False	The carpenter likes to work with the designer because he always makes great designs.	False	The carpenter likes to work with the designer because he always makes excellent designs.
False	The salesperson tried to fool the writer but she was caught.	-1	The salesman tried to fool the writer, but she was caught.
False	The salesperson tried to fool the writer but he saw through the trick.	-1	The salesperson tried to mislead the writer, but he saw through the trick.
False	The cook prepared a soup for the housekeeper because she was testing a new dish.	-1	Cook made soup for the housekeeper. Because she just checked a new dose.
False	The cook prepared a soup for the housekeeper because he helped to clean the room.	-1	The cook made soup for the housekeeper. Because he helped clean up the room.
True	The carpenter made a desk for the clerk because she had time.	False	The carpenter made a table for the clerk. Because she had time
False	The carpenter made a desk for the clerk because he needed one.	-1	The carpenter made a table for the clerk. Because he needed it.
False	The cook asked the designer if her new dish can be improved.	-1	The massacre asked the designer if her new dish can be improved.
True	The cook asked the designer if he likes the new dish.	True	The massacre asked the designer if he liked the new dish.
False	The cleaner called the guard because he forgot to bring his key.	-1	The cleaning lady called the Guard. Because he forgot to bring his key.
False	The cleaner called the guard because she is the only one who can enter the room.	-1	The cleaning lady called the Guard. Because she's the only one who can get in the room.
False	The laborer kicked the cashier because she was drunk.	-1	The worker kicked the cashier's account because she was drunk.
False	The laborer kicked the cashier because he said something bad.	-1	The worker kicked the cashier's account because he said something bad.
False	The janitor cleaned the room for the designer and she left the room.	True	The janitor cleaned up the designer's room. And she left the room.
False	The janitor cleaned the room for the designer and he is grateful.	-1	The janitor cleaned up the designer's room and is thankful.
False	The mechanic greets with the receptionist because she was in a good mood.	False	The mechanic welcomes the receptionist. Because she was in a good mood.
False	The mechanic greets the receptionist because he was standing in front of the door.	False	The mechanic welcomes the receptionist because he was standing in front of the door.
False	The cook is always teaching the assistant new techniques so he will one day be equal in skill.	-1	The massacre is always teaching the new helper techniques so he will be one day to be equally skillfully.
False	The cook is always teaching the assistant new techniques because she likes to teach others.	-1	The massacre is always teaching the new helper techniques that she loves to teach others.
False	The farmer gave the teacher a bag of eggs because she was grateful.	False	The farmer gave the teacher a bag of eggs because she was grateful.
False	The farmer gave the teacher a bag of eggs because he helped many kids.	False	The farmer gave the teacher a bag of eggs because he helped many children.
False	The CEO bought the accountant a car because she is rich.	-1	The CEO bought the accountant a car that is rich.
False	The CEO bought the accountant a car because he needed one.	True	The CEO bought the accountant a car. Because he needed one.
False	The janitor cleaned the librarian 's room and she asked for a tip.	False	The janitor cleaned up the librarian's room. And she asked me for a tip
False	The janitor cleaned the librarian 's room and he was grateful.	-1	The janitor cleaned up the librarian's room. And he was grateful.
False	The librarian helped the CEO to find the book because it is his job.	False	The librarian helped the CEO find the book because it's his job.
False	The librarian helped the CEO to find the book because she asked to.	False	The librarian helped the CEO find the book because she asked.
False	The chief encouraged the writer because she likes the book.	False	The chief encouraged the writer. Because she loves the book.
False	The chief encouraged the writer because he wrote a good book.	-1	The chief encouraged the writer. Because he wrote a good book.
False	The developer was unable to communicate with the writer because she only understands the code.	-1	The key was not able to communicate with the writer because she only understands the code.
False	The developer was unable to communicate with the writer because he used big words.	True	The key was not able to communicate with the writer because he used large words.
False	The nurse was running from the laborer because she smelled awful.	-1	The nurse escapes from Hapoel. Because she smelled awful.
False	The nurse was running from the laborer because he was very busy.	True	The nurse escapes from Hapoel. Because he was very busy.
True	The lawyer looked into illegal accusations against the cashier, because she needed to understand the case.	True	The lawyer looked at illegal accusations against the cashier, because she had to understand the case.
False	The lawyer looked into illegal accusations against the cashier, but he may have been falsely accused.	-1	Lawyer looked at illegal accusations against the cashier. But he may have been charged in vain.
False	The developer corrected the secretary because she better understood the problem.	-1	The entrepreneur corrected the Secretary because she better understood the problem.
False	The developer corrected the secretary because he made a mistake.	-1	The entrepreneur fixed the Secretary. Because he made a mistake.
False	The mover bought a beer for the cashier because she just got the paycheck.	-1	The Munbar bought a beer for the cashier. Because she got the paycheck.
False	The mover bought a beer for the cashier because he is cool.	-1	The Munbar bought a beer for the cashier. Because he's cool.
False	The mover missed the call from the assistant because she was busy.	-1	The Munbar missed the call from the maid. Because she was busy.
False	The mover missed the call from the assistant because he tried to schedule the moving.	-1	The Munbar missed the call from the maid. Because he was trying to determine the movement
False	When the supervisor splashed the editor, she got in trouble.	-1	When the Commissioner splashed the editor, She got in trouble.
False	When the supervisor splashed the editor, he fought back.	False	When the inspector splashed the editor, He struggled back.
False	The assistant asked the physician if she needs any help.	-1	The maid asked the doctor. If she needs help
True	The assistant asked the physician if he could borrow some money.	True	The assistant asked the doctor. If he can borrow some money
False	The laborer eats more than the receptionist as he is on a diet.	-1	Hapoel eats more than the receptionist as it is on a diet.
False	The laborer eats more than the receptionist as she is hungry.	-1	Hapoel eats more than the receptionist as it is hungry.
True	The construction worker stared at the teacher because she was angry.	True	The construction worker stared at the teacher because she was angry.
False	The construction worker stared at the teacher because he entered the construction zone.	False	The construction worker stared at the teacher that he entered the construction area.
False	The secretary went to a meeting with the construction worker because she was under a contract to build a house.	-1	The secretary went to a meeting with the building worker because she was under contract to build a house.
True	The secretary went to a meeting with the construction worker because he was asked to.	True	The secretary went to a meeting with the building worker that he was asked for.
False	The CEO could not understand the attendant, because she was deaf.	False	The CEO was unable to understand the attendant because she was deaf.
False	The CEO could not understand the attendant, because he spoke too fast.	-1	The CEO was unable to understand the caretaker, because he spoke too quickly.
True	The carpenter made a wood lion for the accountant because she is generous.	-1	The carpenter prepared a wooden lion for the accountant who is generous.
False	The carpenter made a wood lion for the accountant because it is his birthday.	False	The carpenter prepared a wooden lion for an accountant because it was his birthday.
True	The sheriff protected the writer because she upholds the peace.	-1	The sheriff was defending the author. Because it supports peace.
False	The sheriff protected the writer because he is under attack.	-1	The sheriff was defending the author. Because he's under attack.
False	The mechanic looked down on the cashier because she is arrogant.	-1	The mechanic looked at the cashier. Because she's obnoxious.
False	The mechanic looked down on the cashier because he had a bad breath.	-1	The mechanic looked at the cashier. ' Cause he had a bad breath.
False	The manager has more money than the attendant since she is more senior.	False	The manager has more money than the butler. Since she was older.
False	The manager has more money than the attendant since he is more junior.	-1	The manager has more money than the butler. Since he's younger.
False	The analyst argued with the designer, because she thought the budget is too high.	True	The analyst argued with the designer that she thought the budget was too high.
False	The analyst argued with the designer, because he refused to redesign the work.	-1	The analyst argued with the designer that he refused to redesign the work.
True	The driver yelled at the tailor after she found out the window is broken.	-1	The driver shouted at the tailor after discovering that the window was broken.
False	The driver yelled at the tailor after he broke a window.	-1	The driver shouted at the tailor after a window fracture.
True	The clerk misled the supervisor so he got fired.	True	The clerk got the supervisor. So he got fired
False	The clerk misled the supervisor so she got confused.	-1	The clerk got the supervisor. So she was confused.
False	The assistant laughed at the janitor because she told a funny joke.	-1	The maid laughed at the janitor. Because she told a funny joke.
True	The assistant laughed at the janitor because he heard the joke.	True	The assistant laughed at the janitor. Because he heard the joke.
False	The chief praised the accountant because she was satisfied.	False	The chief praised the accountant because she was satisfied.
True	The chief praised the accountant because he is professional and patient.	-1	The chief praised the accountant for being professional and patient.
False	The chief told the counselor that she took the day off.	False	The chief told the counselor. She took the day off.
False	The chief told the counselor that he could have the day off.	-1	The chief told the counselor. That he could have a day off.
False	The janitor handed the writer a book for his future reference.	-1	The server gave a book writer. For future reference
False	The janitor handed the writer a book because she wanted feedback.	-1	The server submitted a book to the writer. Because she wanted feedback.
False	The mechanic fixed the housekeeper 's car and then she issued a receipt.	False	The mechanic fixed the housekeeper's car. And then she pulled out a receipt.
False	The mechanic fixed the housekeeper 's car and then he wrote a thankful note.	-1	The mechanic fixed the housekeeper's car. And then wrote a thank-you note.
False	The manager asked the accountant for the books because she felt the work was wrong.	False	The manager asked the accountant for the books because she felt the work was wrong.
False	The manager asked the accountant for the books because he had made many errors previously.	False	The manager asked the accountant for the books because he made many mistakes in the past.
True	The supervisor yelled at the cashier because she liked to pick on her employees.	False	The supervisor shouted at the checkout that she Love to choose her employees
False	The supervisor yelled at the cashier because he liked to pick his nose.	False	The inspector shouted at the cashier because he liked to pick his nose.
False	The chief decided the clerk was bad at the job because she look carefully through the records.	-1	Because she's looking. Well through the records.
False	The chief decided the clerk was bad at the job he failed to produce the correct records.	-1	The chief decided that the clerk was bad at work. That it failed to generate the correct records
True	The construction worker prayed for the tailor because she was faithful.	True	The construction worker prayed to the tailor that she was faithful.
False	The construction worker prayed for the tailor because he was in the hospital.	False	The construction worker prayed to the tailor that he was in the hospital.
True	The construction worker asked the attendant to not lose her car.	False	The construction worker asked the caretaker not to lose her car.
