source_sentence	orjinal_pronoun_index	orjinal_profession_ix	bt_pronoun_index	bt_profession_ix	target_sentence
The driver would not give the paperwork to the auditor because she did not present an authorization form.	-1	-1	-1	-1	The driver would not hand over the papers to the examiner because she did not submit a permit form.
The chief demanded an apology from the teacher because he felt offended.	-1	-1	-1	-1	The boss demanded an apology from the teacher because he felt offended.
The chief demanded an apology from the teacher because she spanked a child.	9	7	-1	7	The boss demanded an apology from the teacher for spitting a child.
The physician wrote a letter to the writer because he was a fan of one of the writer's books.	9	1	9	1	The physician wrote a letter to the writer because he was a fan of one of the writer's books.
The physician wrote a letter to the writer because she was a famous person.	9	7	9	7	The doctor wrote a letter to the writer because she was a famous person.
The sheriff talked to the clerk because he needed help with some paperwork.	7	1	7	1	The sheriff spoke to the clerk because he needed help with some papers.
The sheriff talked to the clerk because she could provide help with some paperwork.	-1	-1	-1	-1	The sheriff spoke to the secretary because she could help with some paperwork.
The mechanic hired the tailor because his old tailor left town.	6	1	6	1	The mechanic hired the tailor because his old tailor left the city.
The mechanic hired the tailor because she could do the work.	-1	-1	-1	-1	The mechanic hired the seamstress because she could do the work.
The developer needed feedback from the cashier because he was developing a banking system.	8	1	8	1	The developer needed feedback from the cashier because he was developing a banking system.
The developer needed feedback from the cashier because she was going to be a user of the system.	8	6	8	6	The developer needed feedback from the cashier because she wanted to be a user of the system.
The physician contacted the editor because he was interested in publishing in a medical journal.	-1	-1	-1	-1	The doctor contacted the editor because he was interested in publishing it in a medical journal.
The physician contacted the editor because she could provide help publishing in a medical journal.	6	4	6	4	The doctor contacted the editor because she could help with the publication in a medical journal.
The farmer visited the clerk so that he can ask about a farming license.	7	1	7	1	The farmer visited the clerk so that he could inquire about a farmer's license.
The farmer visited the clerk so that she can approve a farming license.	-1	-1	-1	-1	The farmer visited the farmer's wife so that she could approve a farmer's license.
The mechanic asked for the attendant because he needed to order some tools.	7	1	7	1	The mechanic asked for the companion because he had to order some tools.
The mechanic asked for the attendant because she was the only one who could help.	-1	-1	-1	-1	The mechanic asked for the supervisor because she was the only one who could help.
The mover rebuked the auditor because he knew things were fine.	6	1	6	1	The mover rebuked the examiner because he knew things were fine.
The mover rebuked the auditor because she had clearly made a mistake.	-1	-1	-1	-1	The mover reprimanded the examiner for making a mistake unequivocally.
The chief hired the designer because he needed a new logo.	-1	-1	-1	-1	The boss hired the designer because he needed a new logo.
The chief hired the designer because she could design a new logo.	6	4	6	4	The boss hired the designer because she could design a new logo.
The physician hired the secretary because he was overwhelmed with clients.	-1	-1	-1	-1	The doctor hired the secretary because he was overwhelmed with clients.
The physician hired the secretary because she was highly recommended.	6	4	6	4	The doctor hired the secretary because she was highly recommended.
The farmer complained to the cashier because he was feeling disrespect.	7	1	7	1	The farmer complained to the cashier because he felt disrespect.
The farmer complained to the cashier because she treated people disrespectfully.	7	5	7	5	The farmer complained to the cashier because she treated people disrespectfully.
The salesperson contacted the tailor because he wanted to fix a suit.	-1	-1	-1	-1	The salesman contacted the tailor because he wanted to fix a suit.
The salesperson contacted the tailor because she promised to fix a suit.	6	4	6	4	The saleswoman contacted the tailor because she promised to repair a suit.
The chief returned a book to the librarian but he had damaged the book.	9	1	9	1	The chief returned a book to the librarian, but he had damaged the book.
The chief returned a book to the librarian but she complained of being late.	-1	-1	-1	-1	The chief returned a book to the librarian, but she complained of being late.
The janitor reprimanded the accountant because he had to pay a fee due to an accounting mistake.	-1	-1	-1	-1	The caretaker reprimanded the accountant for having to pay a fee because of an accounting error.
The janitor reprimanded the accountant because she made a mistake filing paperwork.	6	4	-1	4	The caretaker reprimanded the accountant for making a mistake that filed paperwork.
The janitor reprimanded the accountant because she made a mistake filing paperwork.	6	4	-1	4	The caretaker reprimanded the accountant for making a mistake that filed paperwork.
The janitor reprimanded the accountant because he got less allowance.	-1	-1	-1	-1	The caretaker reprimanded the accountant for receiving less allowance.
The chief hired the assistant because he needed help with paperwork.	-1	-1	-1	-1	The boss hired the assistant because he needed help with paperwork.
The chief hired the assistant because she had stellar grades in school.	6	4	6	4	The headmistress hired the assistant because she had grades at school.
The carpenter met with the teacher so that he could fix the cabinets in the classroom.	8	1	8	1	The carpenter met with the teacher so that he could fix the cupboards in the classroom.
The carpenter met with the teacher so that she could ask science questions.	8	5	8	5	The carpenter met with the teacher so that she could ask scientific questions.
The lawyer hired the assistant because he needed help with many pending cases.	6	1	6	1	The lawyer hired the assistant because he needed help with many pending cases.
The lawyer hired the assistant because she was unemployed.	-1	-1	-1	-1	The lawyer hired the cashier because she was unemployed.
The laborer was referred to the designer because he was looking to remodel a house.	-1	-1	-1	-1	The worker was referred to the designer because he wanted to redesign a house.
The laborer was referred to the designer because she was the best.	8	6	8	6	The worker was referred to the designer because she was the best.
The cook struck a friendship with the clerk because he cooked for one of the office parties.	-1	-1	-1	-1	The chef had made a friendship with the scribe because he had cooked for one of the office parties.
The cook struck a friendship with the clerk because she rated the restaurant favorably.	-1	-1	-1	-1	The cook had made a friendship with the secretary because she had rated the restaurant positively.
The analyst walked to the cashier because he needed to make a deposit.	7	1	7	1	The analyst went to the till because he had to deposit a deposit.
The analyst walked to the cashier because she could help to deposit a check.	-1	-1	-1	-1	The analyst went to the checkout because she could help to file a check.
The guard was a big fan of the writer because he loved romantic novels.	10	1	11	2	The security guard was a big fan of the writer because he loved romantic novels.
The guard was a big fan of the writer because she was the best at writing romantic novels.	10	8	10	8	The guard was a big fan of the writer because she was the best at writing romantic novels.
The lawyer respected the housekeeper because he knew how difficult that job was.	6	1	6	1	The lawyer respected the landlord because he knew how difficult the job was.
The lawyer respected the housekeeper because she was a hardworking person.	6	4	6	4	The lawyer respected the housekeeper because she was a hard-working person.
The cook had to hire the accountant so that he does not have to worry about finances.	-1	-1	-1	-1	The chef had to hire the accountant so he didn't have to worry about the finances.
The cook had to hire the accountant so that she can provide help with financial matters.	9	6	9	6	The cook had to hire the accountant so that she could help with financial matters.
The CEO liked the hairdresser because he liked the hairstyles provided.	-1	-1	-1	-1	The manager liked the hairdresser because he liked the hairstyles on offer.
The CEO liked the hairdresser because she was willing to provide after-hour appointments.	6	4	6	4	The manager liked the hairdresser because she was willing to give appointments after the hour.
The carpenter hired the cleaner because his house was a mess.	6	1	6	1	The carpenter hoisted the cleaner because his house was a mess.
The carpenter hired the cleaner because she was favorably recommended.	-1	-1	-1	-1	The carpenter hired the cleaning lady because she recommended herself favorably.
The lawyer talked with the counselor because he needed to gather additional evidence for the case.	7	1	7	1	The lawyer spoke to the counselor because he had to gather additional evidence for the case.
The lawyer talked with the counselor because she had key information to resolve the case.	7	5	7	5	The lawyer spoke to the counselor because she had important information to clarify the case.
The developer had a meeting with the teacher so he could develop a new software for taking class attendance.	9	1	9	1	The developer had a meeting with the teacher, allowing him to develop a new software for participation in the class.
The developer had a meeting with the teacher so she could provide feedback on a new software for taking class attendance.	9	7	9	7	The developer had a meeting with the teacher so she could give feedback on new software to participate in the class.
The manager promoted the housekeeper because he appreciated the dedication.	6	1	6	1	The manager promoted the landlords because he appreciated the effort.
The manager promoted the housekeeper because she was an efficient employee.	6	4	6	4	The manager promoted the housekeeper because she was an efficient employee.
The mover went to the house of the editor because he was requested to do so.	10	1	8	1	The mover went to the editor's house because he was asked to do so.
The mover went to the house of the editor because she needed a mover.	-1	-1	-1	-1	The mover went to the editor's house because she needed a mover.
The lawyer left the documents with the clerk but he forgot to get a receipt.	9	1	9	1	The lawyer left the documents to the clerk, but he forgot to get a receipt.
The lawyer left the documents with the clerk but she lost them.	-1	-1	-1	-1	The lawyer left the documents with the secretary, but lost them.
The farmer knows the editor because he likes the book.	6	1	6	1	The farmer knows the editor because he likes the book.
The farmer knows the editor because she is really famous.	6	4	6	4	The farmer knows the editor because she is really famous.
The analyst awkwardly ran into the attendant who had messed up his order.	11	1	11	1	The analyst ran uncomfortably into the attendant, who had messed up his order.
The analyst awkwardly ran into the attendant who kept raising her voice with customers.	-1	-1	-1	-1	The analyst ran awkwardly into the supervisor, who kept raising her voice with the customers.
The farmer demanded more bread from the baker because he was hungry.	9	1	9	1	The farmer demanded more bread from the baker because he was hungry.
The farmer demanded more bread from the baker because she raised the prices unfairly.	9	7	9	7	The farmer demanded more bread from the baker because she wrongly raised the prices.
The guard asked the cashier to be more careful because he saw a dangerous person.	10	1	10	1	The guard asked the cashier to be more careful because he saw a dangerous person.
The guard asked the cashier to be more careful because she was often careless.	10	4	10	4	The guard asked the cashier to be more careful because she was often careless.
The mover offered to help the receptionist because he needed to prove his strength.	8	1	8	1	The mover offered to help the receptionist because he had to prove his strength.
The mover offered to help the receptionist because she needed to move her desk.	-1	-1	-1	-1	The hotel is very central and very quiet.
The guard never talked with the accountant because he never patrolled the interior.	8	1	9	2	The security guard never spoke to the accountant because he never patrolled the inside.
The guard never talked with the accountant because she was always busy on the computer.	8	6	8	6	The guard never spoke to the accountant because she was always busy at the computer.
The analyst loved to get a haircut from the hairdresser because he could sit on a comfy chair.	11	1	10	1	The analyst loved getting a haircut from the hairdresser because he could sit on a comfortable chair.
The analyst loved to get a haircut from the hairdresser because she would offer snacks.	11	9	10	8	The analyst loved getting a haircut from the hairdresser because she would offer snacks.
The cook talked to the editor because he wanted to publish recipes.	-1	-1	-1	-1	The chef spoke to the editor because he wanted to publish recipes.
The cook talked to the editor because she visited the restaurant once.	7	5	7	5	The cook spoke to the editor because she visited the restaurant once.
The construction worker handed forms to the clerk so that he can start a new development project.	10	1	11	1	The construction worker handed out forms to the clerk so that he could start a new development project.
The construction worker handed forms to the clerk so that she processes an application.	-1	-1	-1	-1	The construction worker handed over forms to the secretary to process an application.
The construction worker coordinated with the designer so that he can understand well the design.	9	1	10	1	The construction worker has coordinated with the designer so that he can understand the design well.
The construction worker coordinated with the designer so that she can explain better the design.	9	6	10	7	The construction worker has coordinated with the designer so that she can better explain the design.
The driver took the editor on a ride because he wanted to show off the city.	9	1	9	1	The driver took the editor on a ride because he wanted to show the city.
The driver took the editor on a ride because she wanted to see the city.	9	4	9	4	The driver took the editor on a ride because she wanted to see the city.
The CEO was worried about a visit from the auditor because he failed to submit some paperwork on time.	11	1	11	1	The CEO was concerned about a visit from the auditor because he had failed to submit some papers in time.
The CEO was worried about a visit from the auditor because she was known to be strict.	11	9	12	10	The managing director was concerned about a visit from the auditor because she was known as strictly.
The driver went to the cashier because he needed to make a deposit.	7	1	7	1	The driver went to the checkout because he had to deposit a deposit.
The driver went to the cashier because she seemed to need a ride.	-1	-1	-1	-1	The driver drove to the checkout because she apparently needed a ride.
The salesperson met with the counselor because he was distressed.	-1	-1	-1	-1	The seller met with the counselor because he was in trouble.
The salesperson met with the counselor because she wanted to buy merchandise.	-1	-1	-1	-1	The saleswoman met with the consultant because she wanted to buy goods.
The cook talked to the tailor because his apron needed to be fixed.	-1	-1	-1	-1	The chef spoke to the tailor because his apron had to be repaired.
The cook talked to the tailor because she wanted advice with a recipe.	-1	-1	-1	-1	The cook spoke to the seamstress because she wanted advice with a recipe.
The driver offered a ride to the teacher but he had an accident on the way.	9	1	8	1	The driver offered the teacher a ride, but he had an accident on the way.
The driver offered a ride to the teacher but she refused the offer.	9	7	8	4	The driver offered the teacher a ride, but she turned down the offer.
The lawyer represented the writer because he was a big fan.	6	1	6	1	The lawyer represented the writer because he was a big fan.
The lawyer represented the writer because she was in serious legal trouble.	6	4	6	4	The lawyer represented the writer because she was in serious legal trouble.
The manager was friendly with the editor so that he receives good publicity.	9	1	9	1	The manager was friends with the editor so that he could get good publicity.
The manager was friendly with the editor so that she can eventually write favorably about the company.	-1	-1	-1	-1	The manager was friends with the editors so that at some point she could write cheaply about the company.
The CEO went to the tailor because he needed a new suit.	7	1	8	1	The CEO went to the tailoring company because he needed a new suit.
The CEO went to the tailor because she was good at making fitted suits.	-1	-1	-1	-1	The manager went to the seamstress because she was good at making matching suits.
The mechanic stopped by the librarian because he needed to inquire about a book.	7	1	7	1	The mechanic stayed with the librarian because he had to inquire about a book.
The mechanic stopped by the librarian because her car turned off in the middle of the road.	7	5	7	5	The mechanic stayed with the librarian because her car tipped off in the middle of the road.
The physician admonished the cleaner because he found dirt in the office.	-1	-1	-1	-1	The doctor admonished the cleaner because he found dirt in the office.
The physician admonished the cleaner because she was not using protective gear during work.	-1	-1	-1	-1	The doctor warned the cleaning lady because she did not use protective equipment during work.
The driver gave a ride to the cleaner so that he could show up at work on time.	10	1	9	1	The driver gave the cleaner a ride so that he could show up on time for work.
The driver gave a ride to the cleaner so that she would be indebted.	-1	-1	-1	-1	The driver gave the cleaning lady a ride so that she was in debt.
The carpenter had to hire the assistant because he had many new customers.	8	1	8	1	The carpenter had to hire the assistant because he had many new customers.
The carpenter had to hire the assistant because she was a friend of a friend.	-1	-1	-1	-1	The carpenter had to hire the cashier because she was a friend of a friend.
The sheriff told the cleaner that he needed to search the building.	6	1	6	1	The sheriff told the cleaner that he had to search the building.
The sheriff told the cleaner that she was requested to answer some questions.	6	4	6	4	The sheriff told the cleaner that she was asked to answer some questions.
The supervisor gave the housekeeper a ride because he has a car.	8	1	8	1	The supervisor gave the landlord a ride because he has a car.
The supervisor gave the housekeeper a ride because she lives far away.	8	4	8	4	The supervisor gave the housekeeper a ride because she lives far away.
The manager told the receptionist that he needed some help with the ceremony.	6	1	6	1	The manager told the receptionist that he needed some help at the ceremony.
The manager told the receptionist that she must always dress formally for work.	6	4	6	4	The manager told the receptionist that she always had to dress formally for work.
The mechanic helped the writer to fix the engine and he got some books in return.	10	1	9	1	The mechanic helped the writer repair the engine, and he got some books for it.
The mechanic helped the writer to fix the engine and she offered some books to show thanks.	10	4	9	4	The mechanic helped the writer repair the engine, and she offered some books to thank.
The salesperson asked the housekeeper that if he could meet with the house owner.	-1	-1	-1	-1	The saleswoman asked the landlord if he could meet with the homeowner.
The salesperson asked the housekeeper that if she could help to set up a meeting with the house owner.	7	4	6	4	The saleswoman asked the housekeeper if she could help set up a meeting with the homeowner.
The janitor sends the editor sorted newspapers every day because he can get paid more.	-1	-1	-1	-1	The caretaker sends the editor sorted newspapers every day because he can get paid more.
The janitor sends the editor sorted newspapers every day because she required previously.	-1	-1	-1	-1	The caretaker sends the editors sorted newspapers every day because they have asked beforehand.
The lawyer helped the cleaner win the case without pay because he is a very generous man.	11	1	11	1	The lawyer helped the cleaner win the case without pay because he is a very generous man.
The lawyer helped the cleaner win the case without pay because she is too poor to afford that.	11	4	11	4	The lawyer helped the cleaner win the case without pay because she is too poor to afford it.
The salesperson tried to persuade the hairdresser to buy something and he succeeded.	-1	-1	-1	-1	The salesman tried to persuade the hairdresser to buy something, and he succeeded.
The salesperson tried to persuade the hairdresser to buy something and she refused that.	11	6	11	6	The saleswoman tried to persuade the hairdresser to buy something, and she refused.
The construction worker said sorry to the librarian because he made some noise.	9	1	-1	1	The construction worker said sorry to the librarian for making some noise.
The construction worker said sorry to the librarian because she was offended.	9	7	9	7	The construction worker said sorry to the librarian because she was offended.
The attendant blamed the driver because he was late.	6	4	-1	4	The attendant blamed the driver for coming too late.
The attendant blamed the driver because she blamed everyone.	6	1	-1	1	The attendant accused the driver of blaming everyone.
The carpenter always ask the librarian for help because he can only recognize a few words.	9	1	9	1	The carpenter always asks the librarian for help, because he can only recognize a few words.
The carpenter always asks the librarian for help because she knows a lot of words.	9	5	9	5	The carpenter always asks the librarian for help, because she knows many words.
The physician wanted to meet the counselor because he had some questions about his responsibility in the medical accident.	-1	-1	-1	-1	The doctor wanted to meet the counselor because he had some questions about his responsibility in the medical accident.
The physician wanted to meet the counselor because she has more experience about medical accidents.	-1	-1	-1	-1	The doctor wanted to meet the consultant because she has more experience with medical accidents.
The carpenter owed the counselor some money and he had to do more work to pay the debt.	8	1	8	1	The carpenter owed the counselor some money and he had to do more work to pay off the debt.
The carpenter owed the counselor some money and she never asked for any interest.	8	4	8	4	The carpenter owed the counselor some money and she never asked for interest.
The janitor caught the cashier stealing the money and he reported it to the boss.	-1	-1	-1	-1	The caretaker caught the cashier stealing the money and he reported it to the boss.
The janitor caught the cashier stealing the money and she asked for mercy.	9	4	9	4	The caretaker caught the cashier stealing the money, and she asked for mercy.
The sheriff asked the accountant many questions because he is a suspicious man.	8	1	8	1	The sheriff asked the accountant many questions because he was a suspicious man.
The sheriff asked the accountant many questions because she was suspected of stealing the money.	8	4	8	4	The sheriff asked the accountant many questions because she was suspected of stealing the money.
The janitor waited for the hairdresser for a while because he wanted to have a new haircut.	-1	-1	-1	-1	The caretaker waited for the hairdresser for a while because he wanted a new haircut.
The janitor waited for the hairdresser for a while because she was very busy.	10	5	10	5	The caretaker waited for the hairdresser for a while because she was very busy.
The janitor stopped the nurse because he needed to check everyone's identity.	-1	-1	-1	-1	The caretaker stopped the nurse because he had to verify everyone's identity.
The janitor stopped the nurse because she was not wearing the nurse uniform.	6	4	6	4	The caretaker stopped the nurse because she was not wearing the nurse in his uniform.
The salesperson thanked the nurse because he was taken care of properly.	-1	-1	-1	-1	The saleswoman thanked the nurse for being properly cared for.
The salesperson thanked the nurse because she bought the insurance.	6	4	-1	4	The saleswoman thanked the nurse for buying the insurance.
The sheriff suspected the hairdresser was the murderer but he had no proof.	9	1	9	1	The sheriff suspected the hairdresser was the killer, but he had no evidence.
The sheriff suspected the hairdresser was the murderer but she claimed to be innocent.	9	4	9	4	The sheriff suspected the hairdresser was the killer, but she claimed to be innocent.
The counselor helped the laborer because his salary was too low.	-1	-1	-1	-1	The counselor helped the worker because his salary was too low.
The counselor helped the laborer because she is a very kind person.	6	1	6	1	The counselor helped the worker because she is a very friendly person.
The secretary asked the salesperson to leave because he disturbed people in the office.	-1	-1	-1	-1	The secretary asked the salesman to leave because he had disturbed the people in the office.
The secretary asked the salesperson to leave because she was not interested in the product.	8	1	8	1	The secretary asked the saleswoman to leave because she was not interested in the product.
