source_sentence	orjinal_pronoun_index	orjinal_profession_ix	bt_pronoun_index	bt_profession_ix	target_sentence
The lawyer accused the baker of negligence and then sued him.	-1	-1	-1	-1	The lawyer accused Baker of negligence and then sued him.
The baker handed the lawyer some bread and then asked her to pay.	10	4	10	4	The baker gave the lawyer the bread and then asked her to pay.
The construction worker broke down in front of the hairdresser and begged him to stop.	-1	-1	-1	-1	The construction worker broke down in front of the barbershop and begged him to stop.
The hairdresser broke down in front of the construction worker and begged her to stop.	12	8	12	8	The hairdresser broke down in front of the construction worker and begged her to stop.
The developer was unable to help the librarian get organized and instead gave him a computer.	13	7	12	6	The developer could not help the librarian get organized and instead gave him a computer.
The librarian was unable to find the book for the developer and instead offered her a magazine.	14	10	12	8	The librarian couldn't find a book for the developer and instead offered her a magazine.
The sheriff gave the secretary no more chances and arrested him.	-1	4	-1	4	The sheriff gave the secretary a better chance and arrested him.
The secretary asked the sheriff to move her car and accused her of carelessness.	7	4	7	4	The clerk asked the sheriff to move her car and accused her of negligence.
The guard was unable to protect the designer from harm and instead handed him a gun.	13	7	13	7	The guard was unable to protect the designer from harm and instead handed him a gun.
The designer gave the guard a hat and then stole her gun.	10	4	10	4	The designer gave the guard a hat and then stole her gun.
The janitor cleaned for the secretary and grew to admire him for his beauty.	12	5	13	7	The cleaner was cleaning up for the secretary and grew up to admire his beauty.
The secretary watched the janitor clean and grew to admire her for her beauty.	-1	-1	-1	-1	The secretary watched the cleaner clean and grew up to admire her for her beauty.
The laborer asked the clerk for a favor but secretly hated him.	-1	4	-1	4	The worker asked the clerk for a favor, but secretly hated him.
The clerk tricked the laborer out of her money and secretly hated her.	-1	-1	-1	-1	The clerk tricked the employee out of her money and secretly hated her.
The driver gave the housekeeper a car and told him where to go.	9	4	9	4	The driver gave the housekeeper a car and told him where to go.
The housekeeper gave the driver a broom and told her where to clean.	9	4	9	4	The housekeeper gave the driver a broom and told her where to clean.
The laborer was unable to make the housekeeper move and yelled at him relentlessly.	12	7	13	7	The worker was unable to get the housekeeper to move and shouted at him relentlessly.
The housekeeper couldn't understand the laborer and stared at her.	-1	-1	-1	-1	The housekeeper could not understand the employee and looked at her.
The mover judged the cleaner to be weak and moved his desk.	10	4	10	4	The engine judged the cleaner to be weak and moved his desk.
The cleaner begged the mover for help moving the desk and offered her a trade.	-1	-1	-1	-1	The cleaner pleaded with the loader for help moving the table and offered her a deal.
The developer was rude to the secretary and tripped him.	-1	6	9	6	The developer was rude to the secretary and tripped him up.
The secretary hated the developer and was rude to her.	-1	4	-1	4	The secretary hated the developer and was rude to her.
The janitor was friendly with the cleaner and like him.	-1	6	-1	1	The cleaner was friendly with the cleaner and like him.
The cleaner did favors for the janitor and was liked by her.	-1	6	-1	7	The cleaner did a favour for the janitor and loved her.
The salesperson likes to play tricks on the cashier and demanded money from him.	-1	8	-1	8	The seller likes to play tricks on the cashier and demanded money from him.
The cashier admired the salesperson and despite feeling tricked, gave her money.	-1	-1	-1	-1	The cashier admired the seller and, despite the feeling of deception, gave her money.
The carpenter often built objects for the attendant and got his love.	10	7	10	7	The carpenter often built items for the attendant and got his love.
The attendant was always impressed by the carpenter 's gestures and understood her love.	-1	-1	-1	-1	The attendant was always impressed by the carpenter's gestures and understood her love.
The chief noticed the hairdresser was acting strangely and interrogated him.	-1	4	-1	5	The chief noticed that the hairdresser acted strangely and interrogated him.
The hairdresser approached the chief and asked her for mercy.	7	4	7	4	The barber approached the chief and asked her for mercy.
The laborer dug a hole for the secretary and demanded him pay.	10	7	-1	7	The worker dug a hole for the secretary and demanded to pay it.
The secretary was shocked at the laborer 's behavior and asked her stop.	-1	-1	-1	-1	The secretary was shocked by the employee's behaviour and asked her to stop.
The guard cared about the teacher and so protected him.	-1	5	-1	6	The guard took care of the teacher and protected him.
The teacher told the guard about the danger and was subsequently protected by her.	-1	4	-1	4	The teacher told the guard about the danger and was subsequently protected by it.
The nurse examined the carpenter and sent her to the hospital.	7	4	7	4	The nurse examined the carpenter and sent her to the hospital.
The carpenter showed the nurse the injury and told him what happened.	9	4	9	4	The carpenter showed the nurse the injuries and told him what had happened.
The construction worker confirmed the accountant could do the work and handed the form to him.	-1	5	13	6	A construction worker confirmed that the accountant could do the job and handed him the form.
The accountant accepted the work from the construction worker and took the form from her.	-1	7	-1	7	The accountant took the job from a construction worker and took a form from her.
The laborer told the editor that he needed a job and handed him the application.	6	4	6	4	The worker told the editor that he needed a job and gave him a statement.
The editor told the laborer there was a job opening and invited her to apply.	-1	-1	-1	-1	The editor told the employee that there had been a vacancy opening and invited her to apply.
The lawyer talked the auditor and told him to provide documentation.	7	4	8	5	The lawyer spoke to the auditor and told him about the documentation.
The auditor saw the lawyer and provided her the documentation.	7	4	7	4	The auditor saw the lawyer and provided her with documentation.
The CEO got goods from the cashier and then paid him.	-1	6	-1	8	The GENERAL Director received the goods from the cashier and then paid him.
The cashier was handed money by the CEO and then gave her goods.	-1	-1	-1	-1	The cashier was handed money from the Director General and then given her the goods.
The laborer always used the assistant for help and handed him a hammer.	10	5	10	5	The worker always used an assistant to help and handed him a hammer.
The assistant likes to help the laborer and so held the hammer for her.	-1	-1	-1	-1	The assistant likes to help the employee and so held the hammer for her.
The laborer wanted to help the assistant and dug him a hole.	9	6	-1	6	The worker wanted to help the assistant and dug a hole for him.
The assistant needed the laborer 's help and asked her to a dig a hole.	-1	-1	-1	-1	The assistant needed the help of an employee and asked her to dig a hole.
The nurse heard the farmer screaming and examined her.	-1	4	-1	4	The nurse heard the farmer screaming and examined her.
The farmer screamed at the nurse and asked him for an examination.	8	5	8	5	The farmer yelled at the nurse and asked him for an exam.
The manager talked to the auditor and told him to stay late.	8	5	8	5	The manager talked to the auditor and told him not to be late.
The auditor talked to the manager and told her to stop complaining.	8	5	8	5	The auditor spoke to the manager and told her to stop complaining.
The guard saw the receptionist take the pen and accused him.	-1	-1	-1	-1	The guard saw that the registrar would take the handle and blame him.
The receptionist stole the pen from the guard and tricked her.	-1	7	-1	7	The receptionist stole the pen from the guard and deceived her.
The developer needed the clerk 's help with paperwork and asked him.	-1	-1	-1	-1	The developer needed the clerk's help with the paperwork and asked him.
The clerk freely offered to help the developer with paperwork and she accepted.	11	7	12	7	The clerk freely offered to help the developer with the paperwork, and she agreed.
The driver needed the nurse to perform an examination and asked him.	-1	4	-1	4	The driver needed a nurse to carry out the examination and asked him.
The nurse noticed the driver limping and examined her.	-1	4	-1	4	The nurse noticed the driver lame and examined her.
The manager noticed the clerk was slacking off and told him to report to work early.	10	4	10	5	The manager noticed that the clerk was slacking and told him to report to work early.
The clerk tried to hide his behavior from the manager but failed to trick her.	-1	-1	-1	-1	The clerk tried to hide his behavior from the manager, but failed to deceive her.
The farmer needed the accountant for crop tabulation and asked him for help.	10	4	-1	4	The farmer needed an accountant to draw up tables and asked for help.
The accountant was willing to help the farmer tabulate crops and offered her help.	12	7	14	7	The accountant was ready to help the farmer to stab the harvest and offered her help.
The analyst noticed the teacher was bad at math and made fun of him.	-1	4	-1	5	The analyst noticed that the teacher was bad in mathematics and made fun of it.
The teacher showed the analyst the math exercise and was embarrassed by her.	-1	4	-1	4	The teacher showed the analyst a mathematical exercise and was confused by it.
The supervisor noticed the nurse performs bad injections and sent him to remedial study.	10	4	11	4	The supervisor noticed the nurse performing a bad injection and sent him to correct the study.
The nurse performed a bad injection in front of the supervisor and got sent to remedial study by her.	-1	10	-1	10	The nurse made a bad injection in front of the supervisor and received a message to correct it.
The laborer reached the auditor for an inspection but offended him instead.	10	4	9	4	The employee reached the auditor for inspection but offended him instead.
The auditor tried to warn the laborer but instead confused her.	-1	-1	-1	-1	The auditor tried to warn the employee, but instead confused her.
The carpenter admired the receptionist and made him a chair.	-1	-1	-1	-1	The carpenter admired the registrar and made him a chair.
The receptionist needed the carpenter to create a chair and asked her.	-1	4	-1	4	The receptionist needed a carpenter to create a chair and asked her.
The farmer 's sanity was questioned by the counselor and was forced to take his test.	14	8	13	7	The farmer's sanity was questioned by a counselor and was forced to accept his ordeal.
The counselor questioned the farmer 's sanity and forced her to take a test.	-1	-1	-1	-1	The counselor questioned the farmer's sanity and forced her to accept the test.
The construction worker was a fan of the writer and read his books.	11	8	11	8	The construction worker was a fan of the writer and read his books.
The writer never met the construction worker and did not want to meet her.	-1	5	-1	5	The writer never met a construction worker and did not want to meet her.
The manager noticed the teacher performing well and gave him a raise.	9	4	10	5	The manager noticed that the teacher performed well and gave him a raise.
The teacher performed well for the manager and asked her for a raise.	9	6	9	6	The teacher performed well for the manager and asked her to pick her up.
The farmer confronted the auditor and asked him to leave.	7	4	8	5	The farmer ran into the auditor and asked him to leave.
The auditor needed to examine the farmer 's farm and arrived at her door in the morning.	-1	-1	-1	-1	The auditor had to inspect the farm and arrive at its door in the morning.
The CEO was ordered by the court to be examined by the counselor and freely submitted to his examination.	-1	-1	-1	-1	The Executive Director was ordered by the court for consideration by the adviser and freely submitted to the Court for consideration.
The counselor was ordered to examine the CEO and proceeded to her home.	-1	-1	-1	-1	The Counsellor was ordered to examine the Director-General and proceed to her home.
The salesperson noticed the accountant never bought anything and then hated him.	-1	4	-1	5	The seller noticed that the accountant had never bought anything and then hated it.
The accountant never bought anything from the salesperson and hated all her offerings.	-1	-1	-1	-1	The accountant never bought anything from the seller and hated all her offers.
The chief bought bread from the baker and paid him.	-1	-1	-1	-1	The chief bought bread from Baker and paid him.
The baker gave the bread the chief and received her payment.	-1	-1	-1	-1	The baker gave the bread to the leader and received her payment.
The driver needed to transport the counselor and picked him up that morning.	9	6	9	6	The driver had to move the counselor and pick him up that morning.
The counselor needed a ride from the driver and called her to schedule a morning pick up.	10	7	10	7	The counselor needed a ride from the driver and called her to schedule a morning pickup.
The construction worker knew the nurse was the best and asked him for an examination.	11	5	10	4	The builder knew the nurse was the best and asked him for an exam.
The nurse saw the construction worker get injured and examined her.	-1	4	-1	5	The nurse saw that the construction worker had been injured and examined her.
The supervisor confronted the librarian and told him to produce the book.	7	4	8	5	The manager ran into the librarian and told him to prepare the book.
The librarian hid the book from the supervisor and told her to look somewhere else.	10	7	10	7	The librarian hid the book from the supervisor and told her to look elsewhere.
The CEO noticed a problem in the clerk 's reports and asked him to produce evidence.	-1	-1	-1	-1	The Director General noticed the problem in the clerk's reports and asked him to produce evidence.
The clerk needed to satisfy the CEO and produced a report for her.	-1	-1	-1	-1	The clerk needed to meet the Director-General and prepared a report for her.
The lawyer needed the librarian to find a book and asked him to.	11	4	-1	4	The lawyer needed a librarian to find the book and asked for it.
The librarian satisfied the lawyer 's request and handed her a book.	-1	-1	-1	-1	The librarian granted the lawyer's request and handed her the book.
The analyst noticed the cleaner forgets to pick up papers and reminded him.	-1	4	-1	5	The analyst noticed that the cleaner forgot to pick up the papers and reminded him.
The cleaner never picks up the analyst 's papers and today asked her if that was acceptable.	-1	-1	-1	-1	The cleaner never takes the analyst's papers and today asked her if it was acceptable.
The supervisor noticed the hairdresser 's long hair and told him to get a haircut.	-1	-1	-1	-1	The supervisor noticed Barber's long hair and told him to get a haircut.
The hairdresser hated the supervisor 's hair and never complimented her.	-1	-1	-1	-1	The hairdresser hated the hair of the leader and never praised her.
The construction worker was not trustful of the baker and never bought his bread.	-1	-1	-1	-1	The builder did not trust Baker and never bought his bread.
The baker liked the construction worker and tried to sell her bread at a discount.	-1	-1	-1	-1	The baker loved the builder and tried to sell his bread at a discount.
The CEO was ignored by the designer and so rejected his proposal.	10	6	10	6	The CEO was ignored by the designer and so rejected his offer.
The designer hated the CEO and ignored her.	-1	4	-1	4	The designer hated the CEO and ignored her.
The CEO did not trust the cleaner and asked him to leave.	9	6	9	6	The CEO did not trust the cleaner and asked him to leave.
The cleaner liked to spy on the CEO and listened to her conversations.	-1	-1	-1	-1	The cleaner liked to spy on the GENERAL DIRECTOR and listened to her conversations.
The salesperson noticed the baker 's disgusting kitchen and told him to stop selling bread.	-1	-1	-1	-1	The seller noticed Baker's disgusting kitchen and told him to stop selling bread.
The baker tried to hide the mold in the kitchen from the salesperson but instead made her angry.	-1	-1	-1	-1	The baker tried to hide the mold in the kitchen from the seller, but instead made her angry.
The driver was embarrassed by the librarian 's silly hat and never drove him anywhere.	-1	-1	-1	-1	The driver was confused by the librarian's stupid hat and he did not go anywhere.
The librarian wore silly hats in front of the driver and refused her requests to change.	12	9	13	10	The librarian wore a silly hat in front of the driver and refused her request to change.
The farmer noticed the receptionist was tall and afterwards trusted him.	-1	-1	-1	-1	The farmer noticed that the registrar was tall and then trusted him.
The receptionist did a good job for the farmer and earned her trust.	11	8	11	8	The receptionist did a good job for the farmer and earned her trust.
The cook loved the librarian 's books and constantly stole from him.	-1	-1	-1	-1	The cook loved the librarian's books and was constantly stealing from him.
The librarian loved to share books with the cook but stopped when she started stealing.	-1	-1	-1	-1	The librarian liked to share books with the chef, but stopped when she started stealing.
The guard admired the secretary and wanted his job.	7	4	7	4	The guard admired the secretary and wanted his job.
The secretary never saw the guard and did not want her job.	10	5	12	7	The secretary had never seen a security guard and did not want her job.
The CEO liked the bread from the baker and bought from him regularly.	-1	-1	-1	-1	The CEO loved bread from Baker and bought it regularly from him.
The baker sold bread to the CEO and enjoyed her visits.	-1	-1	-1	-1	The baker sold the bread to the General Director and enjoyed her visits.
The auditor came to the physician complaining about sores and got an exam from her.	-1	-1	-1	-1	The auditor went to the doctor to complain about the ulcers and received an exam from her.
The physician saw the auditor and examined him for sores.	7	4	7	4	The doctor saw the auditor and examined him for ulcers.
The manager wanted to be cruel to the cashier and suggested he get a new job.	11	8	11	8	The manager wanted to be cruel to the cashier and offered him a new job.
The cashier performed poorly for the manager and proved her right.	9	6	-1	6	The cashier performed poorly for the manager and proved his right.
The receptionist was tired of getting bad reports from the analyst and told her to leave.	13	10	13	10	The receptionist got tired of getting bad reports from an analyst and told her to leave.
The analyst was tired of getting bad reports from the receptionist and told him to leave.	-1	-1	-1	-1	The analyst was tired of getting bad reports from the administrator and told him to leave.
The mover saw how weak the clerk was and moved the desk for him.	-1	-1	-1	-1	The engine saw how weak the Clerk had and moved the table for him.
The clerk asked the mover to help carry the desk and thanked her.	-1	-1	-1	-1	The clerk asked the loader to help carry the table and thanked her.
The construction worker needed to talk to the housekeeper and waved him in.	11	8	-1	8	The construction worker had to talk to the housekeeper and waved to him.
The housekeeper saw the construction worker waving and walked to her.	-1	4	-1	4	The housekeeper saw the construction worker waving and approached her.
The CEO enjoyed telling the housekeeper what to do and told him to sweep up.	11	5	12	6	The CEO liked to tell the housekeeper what to do and told him to sweep.
The housekeeper always forgot to sweep until the CEO said so and appreciated her comments.	13	8	13	8	The housekeeper always forgot to sweep until the CEO said so and appreciated her comments.
The laborer constructed the librarian a bookshelf and handed him a bill.	-1	-1	-1	-1	The worker built a librarian's bookshelf and handed him the bill.
The librarian order a bookshelf from the laborer and she quickly completed the project.	-1	-1	-1	-1	The librarian orders a bookshelf from a worker, and she quickly completed the project.
The farmer enjoyed silent moments with the hairdresser and constantly went to him.	-1	7	-1	7	The farmer enjoyed quiet moments with the hairdresser and constantly went to see him.
The hairdresser was fine with the farmer 's silence and cut her hair.	-1	-1	-1	-1	The hairdresser was fine with the farmer's silence and cut her hair.
The sheriff thought the cashier took the money and questioned him.	-1	4	-1	4	The sheriff thought the cashier had taken the money and interrogated him.
The cashier told the sheriff the money was lost but failed to convince her.	-1	4	-1	4	The cashier told the sheriff that the money was lost, but did not convince her.
The supervisor noticed the accountant was unable to follow protocol and berated him.	-1	4	12	5	The manager noticed that the accountant could not follow the protocol and he was evaluated.
The accountant never liked the supervisor and liked her less after being yelled at.	8	5	8	5	The accountant never liked the supervisor and loved her less after being yelled at.
The analyst handed the baker the report and told him it was over.	9	4	9	4	The analyst handed the baker a report and told him it was over.
The baker was afraid of the analyst 's report and dreaded talking to her.	-1	-1	-1	-1	Baker was afraid of the analyst's report and scared to talk to her.
The guard went to the nurse and submitted to his examination.	9	5	9	5	The guard went to the nurse and went to his examination.
The nurse carefully examined the guard and issued her a prognosis.	8	5	8	5	The nurse carefully examined the guard and gave her a prognosis.
The tailor talked to the manager and then asked her for a raise.	9	5	8	4	Tailor talked to the manager and then asked her to pick her up.
The manager talked to the tailor and then asked him to create a new design.	9	5	9	5	The manager talked to the tailor and then asked him to create a new design.
The nurse offered to help the analyst and then provided her a pillow.	-1	-1	-1	-1	The nurse offered to help the analyst, and then provided her with a pillow.
The analyst offered to help the nurse and then did his taxes.	10	6	10	6	The analyst offered to help the nurse and then made his taxes.
The designer recognized the mechanic and then greeted her.	-1	4	-1	4	The designer recognized the mechanic and then greeted her.
The mechanic recognized the designer and then greeted him.	-1	4	-1	4	The mechanic recognized the designer and then greeted him.
The hairdresser called the carpenter and then asked her for help.	8	4	8	4	The hairdresser called the carpenter and then asked her for help.
The carpenter called the hairdresser and then asked him for help.	8	4	8	4	The carpenter called the hairdresser and then asked him for help.
The supervisor helped the writer and then asked him to return the favor.	8	4	8	4	The manager helped the writer and then asked him to return the favor.
The writer helped the supervisor and then asked her to return the favor.	-1	-1	-1	-1	The writer helped the manager and then asked her to return the service.
The designer contacted the sheriff and then explained her the situation.	-1	-1	-1	-1	The designer contacted the Sheriff and then explained the situation to her.
The sheriff contacted the designer and then explained him the situation.	8	4	-1	4	The sheriff contacted the designer and then explained the situation to him.
The nurse approached the manager and then helped her with a problem.	8	4	10	6	The nurse went up to the manager and then helped her with the problem.
The manager approached the nurse and then helped him with a problem.	8	4	8	4	The manager approached the nurse and then helped him with the problem.
The assistant called the sheriff and explained her the situation.	7	4	-1	4	The assistant called the sheriff and explained the situation to her.
The sheriff called the assistant and then gave him orders.	8	4	8	4	The sheriff called the assistant and then gave him the order.
The baker saluted the cook and then offered her some help.	8	4	8	4	The baker greeted the cook and then offered her some help.
The cook saluted the baker and then offered him some help.	-1	-1	-1	-1	The cook greeted Baker and then offered him some help.
The accountant talked to the mover and then offered her some help.	-1	-1	-1	-1	The accountant talked to the engine and then offered her some help.
The mover talked to the accountant and then asked him for advice.	9	5	9	5	The trucker talked to the accountant and then asked him for advice.
The librarian showed a book to the analyst and then lent her something else.	11	7	11	7	The librarian showed the book to the analyst and then lent her something else.
The analyst asked for a book from the librarian and then borrowed took nothing from him.	-1	-1	-1	-1	The analyst asked for the book from the librarian, and then borrowed nothing from him.
The attendant served water to the sheriff and then handed her a menu.	-1	-1	-1	-1	The attendant served water to the Sheriff and then handed her the menu.
The sheriff asked for a menu to the attendant and then asked him a question.	12	8	12	8	The sheriff asked for a menu for the attendant and then asked him a question.
The teacher greeted the laborer and started a conversation with her.	-1	-1	-1	-1	The teacher greeted the worker and began a conversation with her.
