source_coref_result	source_sentence	target_coref_result	target_sentence
False	The teacher asked the the physician about the best course of action and believed her.	-1	The teacher asked the doctor about the best course and believed her.
False	The lawyer accused the baker of negligence and then sued him.	-1	The lawyer blamed the negligence maker and then sued him.
True	The baker handed the lawyer some bread and then asked her to pay.	True	The baker gave the lawyer some bread. And then asked her to pay
False	The construction worker broke down in front of the hairdresser and begged him to stop.	-1	The worker of the building broke down in front of the book and begged him to stop.
False	The hairdresser broke down in front of the construction worker and begged her to stop.	True	The book broke down before the construction worker and begged her to stop.
False	The developer was unable to help the librarian get organized and instead gave him a computer.	True	The key was not able to help the librarian to be organized and instead gave him a computer.
False	The librarian was unable to find the book for the developer and instead offered her a magazine.	-1	The librarian could not find the book for the entrepreneur and instead offered her a magazine.
False	The sheriff gave the secretary no more chances and arrested him.	-1	The sheriff gave the Secretary Another chance and stopped him.
False	The secretary asked the sheriff to move her car and accused her of carelessness.	False	The secretary asked the sheriff to deliver. Her car and blamed her for negligence.
True	The guard was unable to protect the designer from harm and instead handed him a gun.	True	The guard was unable to protect the designer from harm, and instead gave him a gun.
False	The designer gave the guard a hat and then stole her gun.	False	The designer gave the guard a hat. And then stole her gun.
False	The janitor cleaned for the secretary and grew to admire him for his beauty.	True	The janitor cleansed the secretary and grew to admire him for his beauty.
False	The secretary watched the janitor clean and grew to admire her for her beauty.	-1	The secretary watched the server clean and growing. To admire her for her beauty.
False	The laborer asked the clerk for a favor but secretly hated him.	False	Hapoel asked a clerk for his benefit, but secretly hated him.
True	The clerk tricked the laborer out of her money and secretly hated her.	-1	The clerk cheated the laborer of his money and hated it secretly.
True	The driver gave the housekeeper a car and told him where to go.	False	The driver gave the housekeeper a car. And told him where to go.
True	The housekeeper gave the driver a broom and told her where to clean.	False	The housekeeper gave the driver a broom. And told her where to clean up.
False	The laborer was unable to make the housekeeper move and yelled at him relentlessly.	-1	The worker was unable to get the cleaner to move and shout at him viciously.
False	The housekeeper couldn't understand the laborer and stared at her.	-1	The housekeeper did not understand the worker and his tea.
False	The mover judged the cleaner to be weak and moved his desk.	-1	The Munbar judged the maid to be weak and moved his table.
False	The cleaner begged the mover for help moving the desk and offered her a trade.	-1	The cleaner begged the relay to help move the table and offered it a trade.
False	The developer was rude to the secretary and tripped him.	-1	The key was rude to the secretary and dropped it.
False	The secretary hated the developer and was rude to her.	-1	The Secretary hated the entrepreneur and was rude to her.
False	The janitor was friendly with the cleaner and like him.	-1	. The janitor was friendly with the maid and like him.
False	The cleaner did favors for the janitor and was liked by her.	-1	The cleaner did good to serve. And was in love with her.
False	The salesperson likes to play tricks on the cashier and demanded money from him.	-1	A salesperson likes to play tricks on the cashier and demanded money from him.
False	The cashier admired the salesperson and despite feeling tricked, gave her money.	-1	The cashier admired the salesperson, and in spite of the feeling a lot of tricked, gave her money.
False	The carpenter often built objects for the attendant and got his love.	False	The carpenter often built objects to the attendant and he received his love.
True	The attendant was always impressed by the carpenter 's gestures and understood her love.	True	The caretaker was always impressed by the gesture of the carpenter and understood her love.
False	The chief noticed the hairdresser was acting strangely and interrogated him.	-1	The chief noticed the sphere acting strangely and questioned him.
False	The hairdresser approached the chief and asked her for mercy.	-1	The book approached Sweetwater and asked her for mercy.
True	The laborer dug a hole for the secretary and demanded him pay.	False	The laborer dug a hole for the secretary and demanded that he pay.
False	The secretary was shocked at the laborer 's behavior and asked her stop.	-1	The secretary was shocked by the worker's behavior and asked her to stop.
False	The guard cared about the teacher and so protected him.	-1	The guard took care of the teacher. And so he protected him.
False	The teacher told the guard about the danger and was subsequently protected by her.	-1	The teacher told the guard about the danger and then was protected by her.
False	The nurse examined the carpenter and sent her to the hospital.	-1	The nurse reviewed the carpenter. And sent her to the hospital.
False	The carpenter showed the nurse the injury and told him what happened.	False	The carpenter showed to nurse the injury and told him what had happened.
False	The construction worker confirmed the accountant could do the work and handed the form to him.	True	The construction worker has confirmed that the accountant will be able to get the job done and gave him the form.
False	The accountant accepted the work from the construction worker and took the form from her.	-1	The accountant received the job from the construction worker and took the form from her.
False	The laborer told the editor that he needed a job and handed him the application.	False	Hapoel told the editor he needed work and gave him the request.
False	The editor told the laborer there was a job opening and invited her to apply.	-1	The editor told the worker that there was a job and invited her to submit.
False	The lawyer talked the auditor and told him to provide documentation.	-1	The lawyer spoke with the critic and told him to give a record.
True	The auditor saw the lawyer and provided her the documentation.	True	The auditor saw the lawyer and provided her with the documentation.
False	The CEO got goods from the cashier and then paid him.	-1	The CEO has received merchandise. From the register and paid him
False	The cashier was handed money by the CEO and then gave her goods.	False	The cashier was transferred to finance by the CEO and then gave her merchandise.
True	The laborer always used the assistant for help and handed him a hammer.	True	The laborer always used a help assistant and gave him a hammer.
False	The assistant likes to help the laborer and so held the hammer for her.	-1	The assistant likes to help a laborer and thus held the hammer for her.
True	The laborer wanted to help the assistant and dug him a hole.	False	Hapoel wanted to help the assistant and dig his hole.
True	The assistant needed the laborer 's help and asked her to a dig a hole.	True	The assistant needed the help of the laborer and asked her to dig a hole.
False	The nurse heard the farmer screaming and examined her.	True	The nurse heard the farmer scream and put her in the park.
True	The farmer screamed at the nurse and asked him for an examination.	True	The farmer shouted at the nurse and asked him for a checkup.
False	The manager talked to the auditor and told him to stay late.	-1	The director spoke to the critic. And told him to stay late
False	The auditor talked to the manager and told her to stop complaining.	-1	The critic spoke with the director. And told her to stop complaining
False	The guard saw the receptionist take the pen and accused him.	-1	The guard saw the receptionist. Taking the pen and blaming it.
False	The receptionist stole the pen from the guard and tricked her.	-1	The receptionist stole the pen. From the keeper and lifted it
False	The developer needed the clerk 's help with paperwork and asked him.	-1	The key needed the clerk's help. With the paperwork and asked him
False	The clerk freely offered to help the developer with paperwork and she accepted.	-1	The clerk freely offered to help the key with the paperwork and was accepted.
False	The driver needed the nurse to perform an examination and asked him.	False	The driver needed the nurse to perform a test and he asked him.
False	The nurse noticed the driver limping and examined her.	-1	The nurse noticed that the driver was limping and examined her.
True	The manager noticed the clerk was slacking off and told him to report to work early.	True	The principal spotted a clerk being cancelled. And told him to stand up early
False	The clerk tried to hide his behavior from the manager but failed to trick her.	-1	The clerk tried to conceal his behavior. From the director, but he couldn't outsmart her.
True	The farmer needed the accountant for crop tabulation and asked him for help.	-1	The farmer needed the accountant to cut the tobacco and asked for help.
False	The accountant was willing to help the farmer tabulate crops and offered her help.	-1	The accountant was ready to help the peasant immerse crops and offered her help.
False	The analyst noticed the teacher was bad at math and made fun of him.	-1	The analyst noticed that the teacher was bad at math and made fun of him.
False	The teacher showed the analyst the math exercise and was embarrassed by her.	-1	The teacher showed the analyst the math exercise and was embarrassed by it.
False	The supervisor noticed the nurse performs bad injections and sent him to remedial study.	True	The supervisor noticed the nurse doing bad shots and sending him to corrective research.
False	The nurse performed a bad injection in front of the supervisor and got sent to remedial study by her.	-1	The nurse performed a bad shot in front of the Commissioner and was sent to corrective research.
True	The laborer reached the auditor for an inspection but offended him instead.	False	The worker came to an auditor for criticism, but insulted him instead.
False	The auditor tried to warn the laborer but instead confused her.	-1	The visitor tried to warn the laborer, but instead confused her.
True	The carpenter admired the receptionist and made him a chair.	True	The carpenter admired the receptionist and made him a chair.
False	The receptionist needed the carpenter to create a chair and asked her.	-1	The receptionist needed a carpenter to create a chair, and he asked her.
True	The farmer 's sanity was questioned by the counselor and was forced to take his test.	-1	The peasant's sanity was investigated by the counselor and was forced to audition.
False	The counselor questioned the farmer 's sanity and forced her to take a test.	-1	The counselor questioned the peasant's sanity and forced her to audition.
False	The construction worker was a fan of the writer and read his books.	False	The construction worker was a fan of the writer and read his books.
False	The writer never met the construction worker and did not want to meet her.	-1	The author never met the construction worker and did not want to meet her.
True	The manager noticed the teacher performing well and gave him a raise.	True	The director noticed the teacher who performed well and gave him a raise.
False	The teacher performed well for the manager and asked her for a raise.	False	The teacher performed the manager well and asked her for a raise.
False	The farmer confronted the auditor and asked him to leave.	-1	The farmer confronted the critic and asked him to leave.
False	The auditor needed to examine the farmer 's farm and arrived at her door in the morning.	-1	The visitor had to check the peasant farm and come home in the morning.
False	The CEO was ordered by the court to be examined by the counselor and freely submitted to his examination.	True	The CEO was invited by the court to be examined by the counselor and served freely for his interrogation.
False	The counselor was ordered to examine the CEO and proceeded to her home.	False	The counselor instructed to examine the CEO and continued her home.
False	The salesperson noticed the accountant never bought anything and then hated him.	-1	The salesperson noticed that the accountant never bought anything and then hated him.
True	The accountant never bought anything from the salesperson and hated all her offerings.	True	The accountant never bought anything from the salesperson and hated all of her contributions.
False	The chief bought bread from the baker and paid him.	-1	The chakras bought bread from the ship. And paid him
False	The baker gave the bread the chief and received her payment.	-1	The baker gave the bread the fries. And accepted her payment.
False	The driver needed to transport the counselor and picked him up that morning.	-1	The driver had to move the counselor. And pick him up that morning.
False	The counselor needed a ride from the driver and called her to schedule a morning pick up.	True	The counselor needed a ride from the driver and called her to schedule a morning pick-up.
False	The construction worker knew the nurse was the best and asked him for an examination.	False	The construction worker knew that the nurse was the best and asked him to be examined.
False	The nurse saw the construction worker get injured and examined her.	-1	The nurse saw the construction worker hurt and studied it.
True	The supervisor confronted the librarian and told him to produce the book.	True	The supervisor confronted the librarian and told him to produce the book.
False	The librarian hid the book from the supervisor and told her to look somewhere else.	False	The librarian hid the book from his supervisor and told her to look elsewhere.
False	The CEO noticed a problem in the clerk 's reports and asked him to produce evidence.	-1	The CEO noticed a problem with the clerk's reports and asked him to produce evidence.
False	The clerk needed to satisfy the CEO and produced a report for her.	-1	The clerk had to provide the CEO and generate a report for her.
True	The lawyer needed the librarian to find a book and asked him to.	True	The lawyer had to have the librarian Will find a book and ask him
False	The librarian satisfied the lawyer 's request and handed her a book.	-1	The librarian provided the lawyer's request and gave her a book.
False	The analyst noticed the cleaner forgets to pick up papers and reminded him.	-1	The analyst noticed the cleaner forgetting to collect documents and reminded him.
False	The cleaner never picks up the analyst 's papers and today asked her if that was acceptable.	-1	And today she asked her. If it's acceptable to you
False	The supervisor noticed the hairdresser 's long hair and told him to get a haircut.	-1	The inspector noticed the long hair of the book and told him to get a haircut.
False	The hairdresser hated the supervisor 's hair and never complimented her.	-1	The book hated the supervisor's hair. And I've never been flattered.
False	The construction worker was not trustful of the baker and never bought his bread.	-1	The construction worker did not believe in the Baker and never bought his bread.
False	The baker liked the construction worker and tried to sell her bread at a discount.	False	The baker loved the construction worker and tried to sell her bread at a discount.
True	The CEO was ignored by the designer and so rejected his proposal.	True	The designer ignored the CEO and rejected his offer.
False	The designer hated the CEO and ignored her.	-1	The designer hated the CEO and ignored it.
False	The CEO did not trust the cleaner and asked him to leave.	-1	The CEO does not trust the cleaning lady and asked him to leave.
False	The cleaner liked to spy on the CEO and listened to her conversations.	False	The cleaner liked to spy on the CEO and listened to her calls.
False	The salesperson noticed the baker 's disgusting kitchen and told him to stop selling bread.	-1	The salesman noticed the baker's disgusting kitchen and told him to stop selling bread.
False	The baker tried to hide the mold in the kitchen from the salesperson but instead made her angry.	-1	The baker tried to hide the mold in the kitchen from the salesman, but instead annoyed her.
False	The driver was embarrassed by the librarian 's silly hat and never drove him anywhere.	-1	The driver was embarrassed by the librarian's stupid hat and never drove him anywhere.
False	The librarian wore silly hats in front of the driver and refused her requests to change.	False	The librarian wore silly hats in front of the driver and refused her requests to change.
False	The farmer noticed the receptionist was tall and afterwards trusted him.	-1	The farmer noticed that the receptionist was high and then trusted him.
False	The receptionist did a good job for the farmer and earned her trust.	-1	The receptionist did a good job. For the farmer and earned his trust
False	The cook loved the librarian 's books and constantly stole from him.	-1	The massacre loved the librarian's books and stole it all the time.
False	The librarian loved to share books with the cook but stopped when she started stealing.	-1	The librarian loved to share books with the massacre. But she was arrested when she started stealing
False	The guard admired the secretary and wanted his job.	-1	The guard admired the secretary. And wanted his job.
False	The secretary never saw the guard and did not want her job.	-1	The secretary never saw the guard. And didn't want her job
False	The CEO liked the bread from the baker and bought from him regularly.	-1	The CEO loved the bread from the ship and bought it regularly.
False	The baker sold bread to the CEO and enjoyed her visits.	-1	The baker sold bread to the CEO and enjoyed his visits.
False	The auditor came to the physician complaining about sores and got an exam from her.	-1	The visitor came to the doctor complaining of wounds and received a test from her.
False	The physician saw the auditor and examined him for sores.	-1	The doctor saw the critic and examined him on sores.
False	The manager wanted to be cruel to the cashier and suggested he get a new job.	-1	The director wanted to be cruel to a cashier. And asked him to get a new job.
True	The cashier performed poorly for the manager and proved her right.	-1	The cashier did poorly with the manager and proved their right.
False	The receptionist was tired of getting bad reports from the analyst and told her to leave.	False	The receptionist was tired of getting bad reports from the analyst and told her to leave.
True	The analyst was tired of getting bad reports from the receptionist and told him to leave.	True	The analyst was tired of getting bad reports from the receptionist and telling him to leave.
False	The mover saw how weak the clerk was and moved the desk for him.	-1	The Munbar saw how weak the clerk was and moved the table for him.
False	The clerk asked the mover to help carry the desk and thanked her.	-1	The clerk asked Monbar to help carry the table and thanked her.
False	The construction worker needed to talk to the housekeeper and waved him in.	-1	The construction worker had to talk to the assistant and wave at him.
False	The housekeeper saw the construction worker waving and walked to her.	-1	The housekeeper saw the worker, the building waving and went to her.
True	The CEO enjoyed telling the housekeeper what to do and told him to sweep up.	True	The CEO enjoys telling the housekeeper what to do and tell him to sweep.
False	The housekeeper always forgot to sweep until the CEO said so and appreciated her comments.	-1	The housekeeper always forgot to sweep up. The CEO said and appreciated his comments
True	The laborer constructed the librarian a bookshelf and handed him a bill.	True	Hapoel built the librarian as a bookshelf and gave him an account.
False	The librarian order a bookshelf from the laborer and she quickly completed the project.	-1	The Librarian orders a bookshelf from Hapoel and completed the project quickly.
False	The farmer enjoyed silent moments with the hairdresser and constantly went to him.	-1	The farmer enjoyed quiet moments with the book and he continued to go to him regularly.
False	The hairdresser was fine with the farmer 's silence and cut her hair.	-1	The book was fine with the peasant's silence and cut her hair.
False	The sheriff thought the cashier took the money and questioned him.	-1	The sheriff thought the cashier was a criminal. Took the money and questioned him.
False	The cashier told the sheriff the money was lost but failed to convince her.	-1	The cashier told the sheriff that the money Lost, but couldn't convince her.
False	The supervisor noticed the accountant was unable to follow protocol and berated him.	-1	The supervisor noticed that the accountant was unable to track and check the protocol.
True	The accountant never liked the supervisor and liked her less after being yelled at.	True	The accountant never liked the supervisor and loved her less after shouting at her.
False	The analyst handed the baker the report and told him it was over.	-1	The analyst ran the report and told him it was over.
False	The baker was afraid of the analyst 's report and dreaded talking to her.	-1	Who bakes fear of the analyst's report and fears to speak to her.
False	The guard went to the nurse and submitted to his examination.	-1	The guard went to the nurse and submitted it for review.
False	The nurse carefully examined the guard and issued her a prognosis.	-1	The nurse carefully studied the guard and issued an prognosis.
False	The tailor talked to the manager and then asked her for a raise.	-1	The tailor spoke with the principal and then asked her for a raise.
True	The manager talked to the tailor and then asked him to create a new design.	True	The director spoke with the tailor and asked him to create a new design.
False	The nurse offered to help the analyst and then provided her a pillow.	-1	The nurse offered to help an analyst. And then provided her with a pillow
False	The analyst offered to help the nurse and then did his taxes.	False	The analyst suggested helping the nurse and then doing his taxes.
False	The designer recognized the mechanic and then greeted her.	-1	The designer identified the mechanic. And then blessed her.
False	The mechanic recognized the designer and then greeted him.	-1	The mechanic identified the designer. And then blessed him.
False	The hairdresser called the carpenter and then asked her for help.	-1	The hairdresser called the carpenter. And asked her for help.
False	The carpenter called the hairdresser and then asked him for help.	-1	The carpenter called The Barber Shop. And asked him for help.
True	The supervisor helped the writer and then asked him to return the favor.	True	The supervisor helped the writer and asked him to return the favor.
True	The writer helped the supervisor and then asked her to return the favor.	True	The writer helped the supervisor and asked her to return the favor.
False	The designer contacted the sheriff and then explained her the situation.	-1	The designer contacted the sheriff. And explained the situation.
False	The sheriff contacted the designer and then explained him the situation.	-1	The sheriff made contact with the designer. And explained the situation.
True	The nurse approached the manager and then helped her with a problem.	True	The nurse approached the manager and then helped her with the problem.
False	The manager approached the nurse and then helped him with a problem.	-1	The director approached the nurse. And helped him with a problem.
False	The assistant called the sheriff and explained her the situation.	-1	The maid called the sheriff. And explained the situation.
False	The sheriff called the assistant and then gave him orders.	-1	The sheriff called the assistant. And gave him orders.
False	The baker saluted the cook and then offered her some help.	-1	The baker saluted the massacre. And offered her help.
True	The cook saluted the baker and then offered him some help.	True	The massacre saluted the baker and offered him help.
False	The accountant talked to the mover and then offered her some help.	-1	The accountant spoke with the Munbar. And then offered her some help.
False	The mover talked to the accountant and then asked him for advice.	-1	The Monbar spoke with the accountant. And then asked him for advice.
False	The librarian showed a book to the analyst and then lent her something else.	-1	The librarian showed a book to an analyst. And lent her something else.
False	The analyst asked for a book from the librarian and then borrowed took nothing from him.	-1	The analyst asked for a book from the librarian and then borrowed it from him.
True	The attendant served water to the sheriff and then handed her a menu.	True	The caretaker served water to the sheriff and handed her a menu.
False	The sheriff asked for a menu to the attendant and then asked him a question.	-1	The sheriff asked for a menu for the caretaker and then asked him a question.
False	The teacher greeted the laborer and started a conversation with her.	-1	The teacher congratulated the laborer and began to talk to her.
False	The laborer greeted the teacher and started a conversation with him.	-1	Who had blessed the teacher and began chatting with him.
False	The auditor issued a warning to the salesperson and then handed her a notice.	-1	The visitor issued a warning to the salesperson. And gave her a message.
