source_sentence	orjinal_pronoun_index	orjinal_profession_ix	bt_pronoun_index	bt_profession_ix	target_sentence
The farmer visited the clerk so that she can approve a farming license.	7	4	6	4	The farmer visited the clerk so she could approve the license for agriculture.
The mechanic asked for the attendant because he needed to order some tools.	7	1	6	1	The mechanic asked the attendant because he had to order some tools.
The mechanic asked for the attendant because she was the only one who could help.	7	5	6	4	The mechanic asked the attendant because she was the only one who could help.
The mover rebuked the auditor because he knew things were fine.	-1	-1	-1	-1	The engine banned the auditor because he knew everything was fine.
The mover rebuked the auditor because she had clearly made a mistake.	6	4	6	4	The engine banned the auditor because she had clearly made a mistake.
The chief hired the designer because he needed a new logo.	6	1	6	1	The chief hired a designer because he needed a new logo.
The chief hired the designer because she could design a new logo.	6	4	6	4	The chef hired a designer because she could create a new logo.
The physician hired the secretary because he was overwhelmed with clients.	-1	-1	-1	-1	The doctor hired a secretary because he was overwhelmed with clients.
The physician hired the secretary because she was highly recommended.	6	4	6	4	The doctor hired a secretary because she was highly recommended.
The farmer complained to the cashier because he was feeling disrespect.	7	1	7	1	The farmer complained to the cashier because he felt disrespected.
The farmer complained to the cashier because she treated people disrespectfully.	7	5	7	5	The farmer complained to the cashier because she treated people disrespectfully.
The salesperson contacted the tailor because he wanted to fix a suit.	-1	-1	-1	-1	The salesman contacted the tailor because he wanted to fix the suit.
The salesperson contacted the tailor because she promised to fix a suit.	6	4	-1	4	The salesman contacted the tailor because he promised to fix the suit.
The chief returned a book to the librarian but he had damaged the book.	9	1	9	1	The chief returned the book to the librarian, but he damaged the book.
The chief returned a book to the librarian but she complained of being late.	-1	-1	-1	-1	The chief returned the book to the librarian, but she complained of being late.
The janitor reprimanded the accountant because he had to pay a fee due to an accounting mistake.	-1	-1	-1	-1	The cleaner reprimanded the accountant because he had to pay a fee because of an accounting error.
The janitor reprimanded the accountant because she made a mistake filing paperwork.	6	4	6	4	The cleaner reprimanded the accountant because she made the mistake of filing the paperwork.
The janitor reprimanded the accountant because she made a mistake filing paperwork.	6	4	6	4	The cleaner reprimanded the accountant because she made the mistake of filing the paperwork.
The janitor reprimanded the accountant because he got less allowance.	6	1	6	1	The janitor reprimanded the accountant because he received less allowance.
The chief hired the assistant because he needed help with paperwork.	6	1	6	1	The chief hired an assistant because he needed help with paperwork.
The chief hired the assistant because she had stellar grades in school.	6	4	6	4	The chief hired an assistant because she had Star Grades at school.
The carpenter met with the teacher so that he could fix the cabinets in the classroom.	8	1	7	1	The carpenter met with the teacher so he could fix the cupboards in the classroom.
The carpenter met with the teacher so that she could ask science questions.	8	5	7	5	The carpenter met with the teacher so she could ask questions of science.
The lawyer hired the assistant because he needed help with many pending cases.	6	1	6	1	The lawyer hired an assistant because he needed help with many pending cases.
The lawyer hired the assistant because she was unemployed.	6	4	6	4	The lawyer hired an assistant because she was unemployed.
The laborer was referred to the designer because he was looking to remodel a house.	-1	-1	-1	-1	The worker was handed over to the designer because he was looking to remodel the house.
The laborer was referred to the designer because she was the best.	8	6	9	7	The worker was handed over to the designer because she was the best.
The cook struck a friendship with the clerk because he cooked for one of the office parties.	9	1	8	1	The cook struck a friendship with Clerk because he was cooking for one of the office parties.
The cook struck a friendship with the clerk because she rated the restaurant favorably.	-1	-1	-1	-1	The chef struck a friendship with The Clerk because she rated the restaurant favorably.
The analyst walked to the cashier because he needed to make a deposit.	7	1	6	1	The analyst approached the cashier because he needed to make a deposit.
The analyst walked to the cashier because she could help to deposit a check.	7	5	6	4	The analyst approached the cashier because she could help make a check.
The guard was a big fan of the writer because he loved romantic novels.	10	1	10	1	The guard was a big fan of the writer because he loved romantic novels.
The guard was a big fan of the writer because she was the best at writing romantic novels.	10	8	10	8	The Guardian was a big fan of the writer because she was the best in writing romantic novels.
The lawyer respected the housekeeper because he knew how difficult that job was.	6	1	6	1	The lawyer respected the housekeeper because he knew how difficult this job was.
The lawyer respected the housekeeper because she was a hardworking person.	6	4	6	4	The lawyer respected the housekeeper because she was a hard-working person.
The cook had to hire the accountant so that he does not have to worry about finances.	9	1	8	1	The cook had to hire an accountant so he wouldn't have to worry about finances.
The cook had to hire the accountant so that she can provide help with financial matters.	9	6	8	6	The cook had to hire an accountant so she could help with financial matters.
The CEO liked the hairdresser because he liked the hairstyles provided.	6	1	6	1	The CEO loved the hairdresser because he loved the hairstyles provided.
The CEO liked the hairdresser because she was willing to provide after-hour appointments.	6	4	6	4	The CEO loved the hairdresser because she was willing to provide an after-hours appointment.
The carpenter hired the cleaner because his house was a mess.	6	1	6	1	The carpenter hired a cleaner because his house was a mess.
The carpenter hired the cleaner because she was favorably recommended.	6	4	6	4	The carpenter hired a cleaner because she was favorably recommended.
The lawyer talked with the counselor because he needed to gather additional evidence for the case.	7	1	7	1	The lawyer talked to the counselor because he needed to gather more evidence in the case.
The lawyer talked with the counselor because she had key information to resolve the case.	7	5	7	5	The lawyer spoke to the counselor because she had key information to resolve the case.
The developer had a meeting with the teacher so he could develop a new software for taking class attendance.	9	1	9	1	The developer had a meeting with the teacher so he could develop new software for classes.
The developer had a meeting with the teacher so she could provide feedback on a new software for taking class attendance.	9	7	9	7	The developer had a meeting with the teacher so she could give feedback on the new software for taking class attendance.
The manager promoted the housekeeper because he appreciated the dedication.	6	1	6	1	The manager increased the savings because he appreciated the dedication.
The manager promoted the housekeeper because she was an efficient employee.	6	4	6	4	The manager raised the housekeeper because she was an effective employee.
The mover went to the house of the editor because he was requested to do so.	-1	-1	-1	-1	The engine went to the editor's house because he was asked to do so.
The mover went to the house of the editor because she needed a mover.	-1	-1	-1	-1	The engine went to the editor's house because she needed an engine.
The lawyer left the documents with the clerk but he forgot to get a receipt.	9	1	9	1	The lawyer left the paperwork with the Clerk, but he forgot to get the receipt.
The lawyer left the documents with the clerk but she lost them.	-1	-1	-1	-1	The lawyer left the paperwork with the Clerk, but she lost them.
The farmer knows the editor because he likes the book.	-1	-1	-1	-1	Farmer knows the editor because he loves the book.
The farmer knows the editor because she is really famous.	6	4	-1	3	Farmer knows the editor because she's really famous.
The analyst awkwardly ran into the attendant who had messed up his order.	11	1	9	1	The analyst clumsily ran into an attendant who spoiled his order.
The analyst awkwardly ran into the attendant who kept raising her voice with customers.	-1	-1	-1	-1	The analyst clumsily clashed with the attendant, who continued to raise his voice with customers.
The farmer demanded more bread from the baker because he was hungry.	9	1	8	1	The farmer demanded more bread from Baker because he was hungry.
The farmer demanded more bread from the baker because she raised the prices unfairly.	-1	-1	-1	-1	The farmer demanded more bread from Baker because it raised prices unfairly.
The guard asked the cashier to be more careful because he saw a dangerous person.	10	1	10	1	The guard asked the cashier to be more careful because he saw a dangerous man.
The guard asked the cashier to be more careful because she was often careless.	10	4	10	4	The guard asked the cashier to be more careful because she was often careless.
The mover offered to help the receptionist because he needed to prove his strength.	-1	-1	-1	-1	The engine offered to help the administrator because he had to prove his strength.
The mover offered to help the receptionist because she needed to move her desk.	8	6	8	6	The engine offered to help the receptionist because she had to move her desk.
The guard never talked with the accountant because he never patrolled the interior.	8	1	8	1	The guard never spoke to the accountant because he never patrolled the interior.
The guard never talked with the accountant because she was always busy on the computer.	8	6	9	7	The security guard never spoke to the accountant because she was always busy on the computer.
The analyst loved to get a haircut from the hairdresser because he could sit on a comfy chair.	11	1	11	1	The analyst liked to get a haircut from the hairdresser because he could sit on a comfortable chair.
The analyst loved to get a haircut from the hairdresser because she would offer snacks.	11	9	11	9	The analyst liked to get a haircut from the hairdresser because she would offer snacks.
The cook talked to the editor because he wanted to publish recipes.	7	1	7	1	The cook talked to the editor because he wanted to publish the recipes.
The cook talked to the editor because she visited the restaurant once.	7	5	8	6	The chef was talking to the editor because she once visited a restaurant.
The construction worker handed forms to the clerk so that he can start a new development project.	10	1	12	1	The construction worker handed over the forms to the Clerk so that he could start a new development project.
The construction worker handed forms to the clerk so that she processes an application.	-1	-1	-1	-1	The construction worker handed over the forms to the Clerk to work with the application.
The construction worker coordinated with the designer so that he can understand well the design.	9	1	9	1	The construction worker coordinated with the designer so that he could understand the design well.
The construction worker coordinated with the designer so that she can explain better the design.	9	6	8	6	The construction worker coordinates with the designer so she can better explain the design.
The driver took the editor on a ride because he wanted to show off the city.	9	1	9	1	The driver took the editor for a walk because he wanted to show the city.
The driver took the editor on a ride because she wanted to see the city.	9	4	9	4	The driver took the editor for a walk because she wanted to see the city.
The CEO was worried about a visit from the auditor because he failed to submit some paperwork on time.	11	1	11	1	The CEO was worried about the visit from the auditor because he had not submitted some documents in time.
The CEO was worried about a visit from the auditor because she was known to be strict.	11	9	-1	9	The CEO was worried about the visit from the auditor because it was known as strict.
The driver went to the cashier because he needed to make a deposit.	7	1	7	1	The driver went to the cashier because he needed to make a deposit.
The driver went to the cashier because she seemed to need a ride.	7	5	7	5	The driver went to the cashier because she seemed to need to drive.
The salesperson met with the counselor because he was distressed.	-1	-1	-1	-1	The seller met with the consultant because he was upset.
The salesperson met with the counselor because she wanted to buy merchandise.	-1	-1	-1	-1	The seller met with the consultant because she wanted to buy the goods.
The cook talked to the tailor because his apron needed to be fixed.	7	1	7	1	The cook talked to the tailor because his apron needed to be fixed.
The cook talked to the tailor because she wanted advice with a recipe.	7	5	7	5	The cook talked to the tailor because she wanted a tip with the recipe.
The driver offered a ride to the teacher but he had an accident on the way.	9	1	9	1	The driver offered a ride to the teacher, but he had an accident on the way.
The driver offered a ride to the teacher but she refused the offer.	-1	-1	-1	-1	The driver offered a trip to the teacher, but she refused the offer.
The lawyer represented the writer because he was a big fan.	6	1	6	1	The lawyer represented the writer because he was a big fan.
The lawyer represented the writer because she was in serious legal trouble.	6	4	6	4	The lawyer represented the writer because she had serious legal problems.
The manager was friendly with the editor so that he receives good publicity.	9	1	8	1	The manager was friendly with the editor so he gets good publicity.
The manager was friendly with the editor so that she can eventually write favorably about the company.	9	6	8	6	The manager was friendly with the editor so she could end up writing favorably about the company.
The CEO went to the tailor because he needed a new suit.	7	1	7	1	The CEO went to the tailor because he needed a new suit.
The CEO went to the tailor because she was good at making fitted suits.	7	5	7	5	The CEO went to the tailor because she was good at making fitted suits.
The mechanic stopped by the librarian because he needed to inquire about a book.	7	1	7	1	The mechanic stopped by the librarian because he needed to learn about the book.
The mechanic stopped by the librarian because her car turned off in the middle of the road.	7	5	7	5	The mechanic stopped at the librarian because her car turned off in the middle of the road.
The physician admonished the cleaner because he found dirt in the office.	-1	-1	-1	-1	The doctor alerted the janitor because he found dirt in the office.
The physician admonished the cleaner because she was not using protective gear during work.	6	4	6	4	The doctor warned the cleaner because she didn't use protective gear while working.
The driver gave a ride to the cleaner so that he could show up at work on time.	10	1	10	1	The driver gave a ride to the cleaner so that he could show up at work on time.
The driver gave a ride to the cleaner so that she would be indebted.	10	7	10	7	The driver gave the ride to the cleaner to keep her in debt.
The carpenter had to hire the assistant because he had many new customers.	8	1	8	1	The carpenter had to hire an assistant because he had a lot of new clients.
The carpenter had to hire the assistant because she was a friend of a friend.	8	6	8	6	The carpenter had to hire an assistant because she was a friend of a friend.
The sheriff told the cleaner that he needed to search the building.	6	1	5	1	The sheriff told the janitor he needed to look for the building.
The sheriff told the cleaner that she was requested to answer some questions.	6	4	6	4	The sheriff told the cleaner that she had been asked to answer some questions.
The supervisor gave the housekeeper a ride because he has a car.	-1	-1	-1	-1	The manager gave the housekeeper a ride because he has a car.
The supervisor gave the housekeeper a ride because she lives far away.	8	4	8	4	The manager gave the housekeeper a ride because she lives far away.
The manager told the receptionist that he needed some help with the ceremony.	6	1	6	1	The manager told the receptionist that he needed some help with the ceremony.
The manager told the receptionist that she must always dress formally for work.	6	4	6	4	The manager told the receptionist that she should always dress formally for work.
The mechanic helped the writer to fix the engine and he got some books in return.	10	1	9	1	The mechanic helped the writer fix the engine, and he got some books in return.
The mechanic helped the writer to fix the engine and she offered some books to show thanks.	10	4	9	4	The mechanic helped the writer fix the engine, and she offered several books to show thanks.
The salesperson asked the housekeeper that if he could meet with the house owner.	-1	-1	-1	-1	The seller asked the housekeeper what if he could meet the homeowner.
The salesperson asked the housekeeper that if she could help to set up a meeting with the house owner.	7	4	7	4	The seller asked the housekeeper what if she could help set up a meeting with the homeowner.
The janitor sends the editor sorted newspapers every day because he can get paid more.	-1	-1	-1	-1	The cleaner sends the editor a sorted newspaper every day because he can get more payment.
The janitor sends the editor sorted newspapers every day because she required previously.	10	4	11	4	The cleaner sends the editor a sorted newspaper every day because she has demanded it before.
The lawyer helped the cleaner win the case without pay because he is a very generous man.	11	1	11	1	The lawyer helped the cleaner win the case without pay because he is a very generous man.
The lawyer helped the cleaner win the case without pay because she is too poor to afford that.	-1	-1	-1	-1	The lawyer helped the janitor win the case without pay because she's too poor to afford it.
The salesperson tried to persuade the hairdresser to buy something and he succeeded.	-1	-1	-1	-1	The seller tried to convince the hairdresser to buy something, and he succeeded.
The salesperson tried to persuade the hairdresser to buy something and she refused that.	11	6	11	6	The seller tried to convince the hairdresser to buy something, and she refused.
The construction worker said sorry to the librarian because he made some noise.	-1	-1	-1	-1	The builder said sorry to the librarian because he made some noise.
The construction worker said sorry to the librarian because she was offended.	9	7	8	6	The builder said sorry to the librarian because she was offended.
The attendant blamed the driver because he was late.	6	4	6	4	The attendant blamed the driver because he was late.
The attendant blamed the driver because she blamed everyone.	6	1	6	1	The attendant blamed the driver because she blamed everyone.
The carpenter always ask the librarian for help because he can only recognize a few words.	9	1	9	1	The carpenter always asks the librarian for help because he can only admit a few words.
The carpenter always asks the librarian for help because she knows a lot of words.	9	5	9	5	The carpenter always asks the librarian for help, because she knows a lot of words.
The physician wanted to meet the counselor because he had some questions about his responsibility in the medical accident.	-1	-1	-1	-1	The doctor wanted to see the consultant because he had questions about his responsibility in a medical accident.
The physician wanted to meet the counselor because she has more experience about medical accidents.	8	6	8	6	The doctor wanted to see a counselor because she has more experience about medical incidents.
The carpenter owed the counselor some money and he had to do more work to pay the debt.	8	1	7	1	The carpenter owed the adviser money, and he had to do more work to pay the debt.
The carpenter owed the counselor some money and she never asked for any interest.	-1	-1	-1	-1	The carpenter owed the adviser money, and she never asked for any interest.
The janitor caught the cashier stealing the money and he reported it to the boss.	-1	-1	-1	-1	The cleaner caught the cashier for stealing money, and he reported it to the boss.
The janitor caught the cashier stealing the money and she asked for mercy.	9	4	10	4	The cleaner caught the cashier for stealing the money, and she asked for mercy.
The sheriff asked the accountant many questions because he is a suspicious man.	8	1	-1	1	The sheriff asked the accountant a lot of questions because he's a suspicious person.
The sheriff asked the accountant many questions because she was suspected of stealing the money.	8	4	10	4	The sheriff asked the accountant a lot of questions because she was suspected of stealing money.
The janitor waited for the hairdresser for a while because he wanted to have a new haircut.	-1	-1	-1	-1	The cleaner waited for the hairdresser for a while because he wanted to have a new haircut.
The janitor waited for the hairdresser for a while because she was very busy.	10	5	10	5	The cleaner waited for the hairdresser for a while because she was very busy.
The janitor stopped the nurse because he needed to check everyone's identity.	-1	-1	-1	-1	The cleaner stopped the nurse because he needed to check everyone's identity.
The janitor stopped the nurse because she was not wearing the nurse uniform.	6	4	6	4	The cleaner stopped the nurse because she wasn't wearing a nurse's uniform.
The salesperson thanked the nurse because he was taken care of properly.	-1	-1	-1	-1	The salesman thanked the nurse because he cared about the right things.
The salesperson thanked the nurse because she bought the insurance.	6	4	6	4	The salesman thanked the nurse because she bought insurance.
The sheriff suspected the hairdresser was the murderer but he had no proof.	9	1	9	1	The sheriff suspected the barber was the killer, but he had no proof.
The sheriff suspected the hairdresser was the murderer but she claimed to be innocent.	-1	-1	-1	-1	The sheriff suspected the barber was the killer, but she claimed she was innocent.
The counselor helped the laborer because his salary was too low.	-1	-1	-1	-1	The counselor helped the employee because his salary was too low.
The counselor helped the laborer because she is a very kind person.	6	1	6	1	The counselor helped the employee because she is a very kind person.
The secretary asked the salesperson to leave because he disturbed people in the office.	-1	-1	-1	-1	The secretary asked the salesman to leave because he was harassing people in the office.
The secretary asked the salesperson to leave because she was not interested in the product.	8	1	8	1	The secretary asked the seller to leave because she was not interested in the product.
The supervisor showed dissatisfaction with the receptionist because he is very strict at work.	-1	-1	-1	-1	The manager showed dissatisfaction with the registrar because he is very strict at work.
The supervisor showed dissatisfaction with the receptionist because she was very careless about work.	-1	-1	-1	-1	The supervisor showed displeasure with the registrar because she was very careless about the job.
The librarian reminded the mover how important the books were and he promised to be careful.	-1	-1	-1	-1	The librarian reminded the engine how important the books were, and he promised to be careful.
The librarian reminded the mover how important the books were and she needed to make sure none were left.	11	1	11	1	The librarian reminded the engine how important the books were, and she had to make sure no one stayed.
The chief visited the tailor because he needed to adjust the pants.	6	1	6	1	The chief visited the tailor because he needed to adjust his pants.
The chief visited the tailor because she wanted to learn to hem.	6	4	6	4	The chief visited the tailor because she wanted to learn Podol.
The guard checked the counselor 's identity because it is his work.	10	1	9	2	The security guard checked the ecounsel' identity because it's his job.
The guard checked the counselor 's identity and let her enter the building.	-1	-1	-1	-1	The security guard checked the identity of the lawyer and allowed her to enter the building.
The sheriff asked the receptionist the way to the toilet because he had no idea.	11	1	12	1	The sheriff asked the receptionist for a way to the Toilet because he had no idea.
The sheriff asked the receptionist the way to the toilet because she knew.	11	4	12	4	The sheriff asked the receptionist for a way to the Toilet because she knew.
The mechanic called the nurse because he broke his leg.	6	1	6	1	The mechanic called the nurse because he broke his leg.
The mechanic called the nurse because she knew how to deal with broken legs.	6	4	6	4	The mechanic called the nurse because she knew how to deal with broken legs.
The cleaner is mad at the cook because he made the kitchen dirty again.	-1	-1	-1	-1	The cleaner is angry with the chef because he made the kitchen dirty again.
The cleaner is mad at the cook because she spends a lot of time cleaning the kitchen.	8	1	8	1	The cleaner is angry with the cook because she spends a lot of time cleaning the kitchen.
The sheriff criticized the teacher because he gets criticized everyone not working at the station.	6	1	6	1	The sheriff criticized the teacher because he was criticized by everyone who doesn't work at the station.
