source_coref_result	source_sentence	target_coref_result	target_sentence
False	The physician talked with the attendant and was surprised about her knowledge.	-1	The doctor spoke with the caretaker and was amazed at her knowledge.
False	The accountant asked the laborer to join the meeting but he forgot.	-1	The accountant asked the worker to join the meeting but he forgot.
False	The laborer asked the accountant to join the meeting but she forgot.	False	Hapoel asked the accountant to join the meeting but she forgot.
False	The editor chatted with the analyst and wanted to collaborate with him.	-1	The editor spoke with the analyst and wanted to cooperate with him.
False	The analyst chatted with the editor and wanted to collaborate with her.	-1	The analyst spoke to the editor and wanted to cooperate with her.
True	The receptionist talked to the salesperson and rejected his suggestion to buy the insurance.	True	The receptionist spoke with the salesperson and rejected his offer to buy the insurance.
True	The salesperson talked to the receptionist and convinced her to buy the insurance.	True	The salesperson spoke to the receptionist and persuaded her to buy the insurance.
True	The teacher met up with the supervisor and told him the concerns.	True	The teacher met with his supervisor and told him the concerns.
True	The supervisor met up with the teacher and told her the concerns.	True	The supervisor knew the teacher and told her the concerns.
False	The clerk called the physician and asked him about the medicine.	-1	The clerk called the Doctor and asked him about the medicine.
True	The physician called the clerk and asked her about the product.	True	The doctor called the clerk and asked her about the product.
False	The nurse thanked the chief and handed him a present.	-1	The nurse confessed to Sweetwater and gave him a gift.
False	The chief thanked the nurse and handed her a present.	-1	The chief thanked the nurse. And gave her a gift.
True	The accountant met the analyst and recommended him some job positions.	-1	The accountant met the analyst and recommended work positions.
True	The analyst met the accountant and recommended her some job positions.	True	The analyst met the accountant and recommended her in work positions.
False	The receptionist helped the construction worker and got a present from him.	-1	The receptionist helped the construction worker and received a gift from him.
False	The construction worker helped the receptionist and got a present from her.	-1	The construction worker helped the receptionist and received a gift from her.
False	The hairdresser visited the guard and thanked him.	-1	The book visited the guard and thanked him.
False	The guard visited the hairdresser and thanked her.	-1	The guard visited the book and thanked her.
False	The accountant walked towards the developer and gave him a cup of coffee.	-1	The accountant went toward the key and gave him a cup of coffee.
True	The developer walked towards the accountant and gave her a cup of coffee.	True	The key went toward the accountant and gave her a cup of coffee.
True	The manager meets the counselor regularly and asks her for suggestions.	True	The manager meets the counselor regularly and asks her for proposals.
True	The counselor meets the manager regularly and provides him suggestions.	True	The consultant meets the manager regularly and provides him with proposals.
False	The lawyer called the teacher to ask her the performance of the kid.	-1	The lawyer called the teacher. To ask her the child's appearance
False	The teacher called the lawyer to tell him the performance of the kid.	-1	The teacher called on the lawyer to tell him. The child's appearance.
True	The secretary walked towards the mechanic and told him what was the problem with the machine.	True	The secretary went toward the mechanic and told him what was wrong with the machine.
False	The mechanic walked towards the secretary and asked her where the machine was.	-1	The mechanic went towards the secretary. And asked her where the machine was.
False	The baker talked to the supervisor and learned a lot from him.	-1	The Baker spoke to the supervisor. And learn a lot from it.
False	The supervisor talked to the baker and taught her a lot.	-1	The director spoke to the Baker. And taught her a lot
False	The housekeeper showed the janitor the direction and led him to the kitchen.	-1	The housekeeper showed a way to serve the direction. And led him into the kitchen.
False	The janitor showed the housekeeper the direction and led her to the kitchen.	-1	The janitor showed the cleaning lady the direction. And led her to the kitchen.
False	The counselor disliked the supervisor and wanted to leave his group.	-1	The counselor did not like the supervisor. And wanted to leave his team
False	The supervisor disliked the counselor and fired her.	-1	The manager didn't like the counselor. And fired her.
False	The writer contacted the CEO and asked for his opinions about the book.	False	The author contacted the CEO and asked for his views on the book.
True	The CEO contacted the writer and asked for her suggestions about the book.	-1	The CEO contacted the writer and asked for your suggestions for the book.
True	The hairdresser hates the mechanic after he refused to help with fixing the car.	-1	The book hates the mechanic to be late. Who refused to help repair the car.
False	The mechanic hates the hairdresser after she finished the ugly haircut.	-1	The mechanic hates the barbershop. After finishing the ugly haircut
False	The cashier borrowed the tool from the carpenter but returned nothing to him.	-1	The cashier asked the hangar tool, but did not return anything.
False	The carpenter borrowed the tool from the cashier but returned nothing to her.	-1	The carpenter asked the instrument from the register, but did not return anything to her.
False	The auditor talked with the sheriff and wanted to hear his opinion.	-1	The critic spoke with the sheriff. And wanted to hear his mind.
False	The sheriff talked with the auditor and wanted to hear her opinion.	-1	The sheriff talked to the critic. And wanted to hear her mind
False	The baker wanted to thank the carpenter and made some bread for him.	-1	The Baker wanted to thank the carpenter. And made him some bread.
False	The carpenter wanted to thank the baker and made a chair for her.	-1	The carpenter wanted to thank the Baker and made her a chair.
False	The designer wanted to help the lawyer but he refused.	-1	The designer wanted to help attorney but he refused.
False	The lawyer wanted to help the designer but she refused.	-1	The lawyer wanted to help the designer, but she refused.
False	The accountant got angry with the mechanic and complained to the boss about him.	True	The accountant got mad at the mechanic and complained about him to the boss.
False	The mechanic got angry with the accountant and complained to the boss about her.	-1	The mechanic got mad at the accountant. And complained to the boss about her.
False	The cook sent the cashier a present and expressed thanks to her.	-1	The cook sent the cashier a gift and expressed thanks to her.
False	The cashier sent the cook a present and expressed thanks to him.	-1	The cashier sent a gift to the cook and expressed thanks to him.
False	The laborer eats more than the cleaner because he works harder.	-1	The worker eats more than a cleaner. Because he works harder
False	The cleaner eats more than the laborer because she works harder.	-1	The cleaner eats more than the laborer. Because it works harder
False	The mechanic learned a lot from the teacher and sent her a thankful card.	-1	The mechanic learned a lot from the teacher. And send her a thank-you card.
True	The teacher learned a lot from the mechanic and sent him a thankful card.	True	The teacher learned a lot from the mechanic and sent him a thank-you card.
False	The baker passed the box to the guard and asked him to make the delivery.	-1	The Baker passed the box to the guard. And asked him to make the drop.
False	The guard passed the box to the baker and appreciated her baking skills.	-1	The guard passed the box to the baker. And appreciated her baking skills
False	The tailor stopped the guard and showed him identification.	-1	The tailor stopped the guard. And showed him his ID.
True	The guard stopped the tailor and asked for her identification.	True	The guard stopped the tailor and asked for her ID card.
False	The analyst asked the clerk some questions and thanked her.	-1	The analyst asked the clerk for some questions and thanked her.
False	The clerk asked the analyst some questions and sent him away.	-1	The clerk asked the analyst. A few questions and send him away.
False	The lawyer asked the nurse about the operation and thanked her.	-1	The lawyer asked the nurse about the operation and thanked her.
False	The nurse asked the lawyer about the case and thanked him.	-1	The nurse asked the lawyer about the case and thanked him.
False	The carpenter stopped the housekeeper and helped her.	-1	The carpenter stopped the housekeeper. And helped her
False	The housekeeper stopped the carpenter and helped him.	-1	The housekeeper stopped. The carpenter and helped him.
False	The sheriff opened the door for the housekeeper and waited for her to pass by.	-1	The sheriff opened the maid's door and waited for her to pass.
False	The housekeeper opened the door for the sheriff and waited for him to pass by.	-1	The housekeeper opened the door. The sheriff's waiting for him to pass.
False	The physician asked the receptionist about the booking price and thanked her.	-1	The doctor asked the receptionist about the price of the reservation and thanked her.
False	The receptionist helped the physician find the room and left him alone.	-1	The receptionist helped the doctor find the room and left him alone.
False	The lawyer saw the editor in the restaurant and greeted her.	-1	The lawyer saw the editor in the restaurant and greeted her.
False	The editor saw the lawyer in the restaurant and greeted him.	-1	The editor saw the lawyer in the restaurant and promoted him.
False	The farmer bought a book from the writer and paid her.	-1	The farmer bought a book from the writer. And paid her
False	The writer bought some fruit from the farmer and paid him.	-1	The scribe bought fruit from the farmer. And paid him
False	The sheriff borrowed a book from the librarian but never returned anything to her.	-1	The Sheriff borrowed a book from the librarian. But she never returned anything to her.
False	The librarian helped the sheriff find the book and smiled at him.	-1	The librarian helped the Sheriff find The book and smiled at it.
True	The salesperson talked to the teacher and invited her to dinner.	True	The salesperson spoke with the teacher and invited her over for dinner.
False	The teacher talked to the salesperson and invited him to dinner.	-1	The teacher spoke to the salesman. And invited him over for dinner.
False	The janitor cleaned for the baker and asked her for the tips.	-1	The janitor cleaned up the baker. And asked her for the tips
False	The baker packed the janitor some bread and waited for him to pay.	-1	The baker is packed to guard some bread. And waited for him to pay.
False	The cook got the phone call from the nurse and began to prepare the lunch for her.	-1	The massacre received the phone call from the nurse and began preparing his lunch for her.
False	The nurse got the phone call from the cook and began to prepare the surgery for him.	-1	The nurse received the phone call from the massacre and began preparing his surgery.
False	The developer successfully sold the housekeeper the product and helped her to set up.	-1	The entrepreneur successfully sold the product housewife and helped her define.
False	The housekeeper bought the product from the developer and asked him to set up.	-1	The housekeeper bought the product from the key and asked him to establish it.
True	The driver dropped the accountant at the corner and asked her to watch out when crossing the street.	True	The driver knocked the accountant in the corner and asked her to be careful about crossing the street.
True	The accountant asked the driver to stop at the corner and gave him some tips.	True	The accountant asked the driver to stop at the corner and gave him some tips.
True	The manager discussed with the designer for a long time and tried to convince her to sell this idea.	True	The principal discusses the designer for a long time and tried to convince her to sell this idea.
False	The designer discussed with the manager for a long time but still refused to sell the idea to him.	True	The designer spoke with the manager for a long time, but still refused to sell him the idea.
False	The mechanic not only explained several terms to the counselor but also wrote some down for her.	-1	The mechanic not only explained a few terms to the consultant, but also wrote some for her.
False	The counselor not only explained to the mechanic economy terms and also wrote down some down for him.	-1	The counselor did not only explain the terms of the mechanic's economy and also wrote some for him.
False	The mechanic opened the door for the cleaner and led her to the room.	-1	The mechanic opened the maid's door and led her to the room.
False	The cleaner knocked at the mechanic 's door and waited for him to show up.	-1	The cleaning lady was knocking on the mechanic's door. Waiting for him to show up.
True	The mover followed the writer 's instruction and waited outside her apartment.	True	The Monbar followed the teaching of the writer and waited outside her apartment.
False	The writer asked the mover to move everything to the new apartment and paid him.	-1	The author asked the Monbar to move everything to the new apartment and paid him.
False	The carpenter stopped the tailor from entering the workspace and talked to her.	-1	The carpenter stopped the tailor from entering the workplace and spoke to her.
True	The tailor showed the carpenter the tools and let him try.	True	The tailor showed a carpenter the dishes and let him try.
False	The construction worker asked the assistant to make a list of today 's meetings and thanked her.	-1	The construction worker asked the assistant to prepare a list of today's encounters and thanked her.
False	The assistant made a list of today 's schedule for the construction worker and showed him.	-1	The assistant made a list of today's schedule for the construction worker and showed him.
False	The supervisor asked the secretary to stop by and assigned a task to her.	-1	The supervisor asked the secretariat to stop and assign her a mission.
True	The secretary greeted the supervisor and handed him the report.	True	The Secretary welcomed the supervisor and handed him the report.
False	The chief hired the receptionist and bought her a new phone for work.	-1	The chief hired the receptionist. And bought her a new phone for work.
False	The receptionist was hired by the chief and will receive the payment from him.	-1	The receptionist was hired by the commander and received the payment from him.
False	The janitor talked with the auditor and passed her the files.	-1	The janitor spoke to the critic. And passed her files.
False	The auditor called the janitor and asked him to clean up the hall.	-1	The visitor called the server. And asked him to clean the hallway.
True	The analyst met the tailor at home and asked her to make a new suit.	True	The analyst met the tailor at home and asked her to make a new suit.
True	The tailor met the analyst at home and offered him a new design.	True	The tailor met the analyst at home and offered him a new design.
True	The sheriff stopped the nurse and hugged her for the great help.	True	The sheriff stopped the nurse and hugged. Her for the sake of the great help.
True	The nurse met the sheriff at the scene and helped him with the accident.	True	The nurse met the sheriff at the scene and helped him with the accident.
False	The janitor met the receptionist and got the key from her every day.	-1	The janitor met the receptionist. And got the key from her every day.
False	The receptionist waits for the janitor and drives him back every day.	-1	The receptionist is waiting for the service. And drives him back every day.
False	The mover went to the tailor 's house and helped her move the boxes.	-1	The Munbar went to the tailor's house and helped her move the crates.
False	The tailor called the mover and asked him to arrive before 9 am.	-1	The tailor called for Moonbar and asked him to arrive before 21:00.
True	The developer dropped by the nurse and discussed with her about the surgery.	True	The key was dropped by the nurse and spoke to her about the surgery.
False	The nurse gave the developer the prescription and told him not to worry.	-1	The nurse gave the key to the recipe and told him not to worry.
True	The mechanic helped the baker fix the machine and charged her 1000 dollars.	-1	The mechanic helped the baker fix the machine and blamed it for 1000 dollars.
False	The baker handed the mechanic the cake and waited for him to pay.	-1	The baker gave the cake to the mechanic. And waited for him to pay.
True	The salesperson called the editor and asked her to write an article about the company.	True	The salesperson called the editor and asked her to write an article about the company.
True	The editor interviewed the salesperson and wrote an article about his company.	True	The editor interviewed the salesperson and wrote an article about his company.
False	The mover arrived early at the counselor 's house and offered to help her.	-1	The Munbar came early to the counselor's house and offered to help her.
False	The counselor called the mover and asked him to start early.	-1	The consultant called the instructor. And asked him to start early
False	The supervisor stopped the cleaner and told her not to clean that room.	-1	The supervisor stopped the cleaning lady. And told her not to clean the room.
True	The cleaner stopped the supervisor and told him not to walk on that way.	False	The janitor stopped the supervisor and said. Him not to go that way.
False	The lawyer called the tailor and made an appointment with her.	-1	The lawyer called the Tailor. And set a meeting
False	The tailor called the lawyer and made an appointment with him.	-1	The tailor called a lawyer and set up a meeting.
True	The cook decided to fire the secretary and told her not to come here next Monday.	True	The massacre decided to fire the secretary and told her not to come here next Monday.
False	The secretary had a quarrel with the cook and threw a book to him.	-1	The secretary had a quarrel with the cook and threw a book at him.
True	The farmer consulted the secretary about many things and invited her to dinner.	True	The farmer consulted with the secretary a lot of things and invited her to dinner.
True	The secretary bought many products from the farmer and asked him for a discount.	True	The Secretary bought many products from the farmer and asked him for a discount.
True	The farmer hired the assistant and told her to come to work twice a week.	True	The farmer hired the assistant and told her to come to work twice a week.
False	The assistant rescheduled the meeting for the farmer and told him to be well prepared.	-1	The assistant is scheduled to advance the farmer's meeting and told him to be well prepared.
False	The supervisor had a quarrel with the attendant and decided to fire her.	-1	The supervisor had a quarrel with the caretaker and decided to fire her.
False	The attendant hit the supervisor by mistake and apologized to him.	-1	The caretaker beat the supervisor by mistake and apologized to him.
True	The manager asked the librarian a lot of questions and thanked her in the end.	True	The principal asked the librarian a lot of questions and thanked her eventually.
True	The librarian guided the manager to the bookshelf and asked what he needed.	True	The librarian instructed the manager to the bookshelf and asked what he needed.
False	The mover discussed with the nurse about the surgery and thanked her.	-1	The Monbar treated the nurse for surgery and thanked her.
False	The nurse helped to send the mover to the hospital and kept comforting him.	-1	The nurse helped send the Moonbar to the hospital and continued to comfort him.
True	The farmer drove the attendant to the railway station and gave her a gift.	True	The farmer drove the attendant to the train station and gave her a gift.
True	The attendant bought some fruit from the farmer and paid him by check.	True	The caretaker bought fruit from the farmer and paid him a cheque.
True	The developer consulted with the counselor for hours and paid her a lot of money.	True	The entrepreneur consulted with the counselor for hours and paid her a lot of money.
False	The counselor taught the developer how to write the patent and charged him 2,000 dollars.	-1	The consultant taught the entrepreneur how to write the patent and blamed it for 2,000 dollars.
True	The physician examined the accountant in detail and told her nothing to worry about.	True	The doctor examined the accountant in detail and told her not to worry.
False	The accountant showed the bill to the physician and told him to pay that on time.	-1	The accountant showed the doctor's account and told him to pay it in time.
False	The laborer saw the tailor at the corner and talked to her for 2 hours.	False	Hapoel saw the tailor in the corner and spoke with her for two hours.
False	The tailor offered the laborer a new suit and charged him nothing.	-1	The tailor offered a new suit and he did not accuse him.
True	The physician hired a housekeeper and told her to work every day.	True	The doctor hired a housekeeper and told her to work every day.
False	The housekeeper woke the physician up and told him someone was calling for him.	-1	The housekeeper woke the doctor. And told him that someone was calling him
True	The sheriff chatted with the tailor and invited her to dinner later.	True	The sheriff spoke to the tailor and invited her to dinner later.
False	The tailor finished the suit for the sheriff and called him.	-1	The tailor finished the suit. The sheriff's and called him.
False	The driver crashed into the designer 's artifact and paid her a lot.	-1	The driver crashed into the designer's artifact and paid her a lot.
True	The designer stopped the driver and asked him to be careful in the Expo Location.	True	The designer stopped the driver and asked him to be careful in the location of the expo.
True	The sheriff returned the expired cake to the baker and asked her to return the money.	True	The sheriff returned the cake expired to the baker and asked her to return the money.
False	The baker packed the cake for the sheriff and waited for him to pay.	-1	The baker packed the cake for the sheriff. And waited for him to pay.
False	The janitor asked the clerk how to find the meeting room and thanked her.	-1	The janitor asked the clerk how to find the conference room and thanked her.
False	The clerk told the janitor to clean up the meeting room and thanked him.	-1	The clerk told the janitor to clean the conference room and thanked him.
False	The developer did not find the attendant in the room and left her a note.	-1	The entrepreneur did not find the caretaker in the room and left her a note.
True	The attendant told the developer there was a meeting and provided him the location.	False	The caretaker told the developer that there was a meeting and provided him with the location.
False	The carpenter went to the writer 's house and fixed the window for her.	-1	The Carpenter went to the writer's house and repaired the window for her.
False	The writer met the carpenter in the shopping mall and made an appointment with him.	True	The writer met the carpenter at the mall and set him up with a meeting.
False	The cook needed the attendant to be a taste tester and asked her.	-1	The massacre needed the attendant to be a taste tester and asked her.
False	The attendant loomed over the cake the cook prepared and gave him feedback.	-1	The caretaker who learns about the cook's cake and gave him a feedback.
True	The analyst needed to get the housekeeper into the house and paid her to do so.	True	The analyst had to put the housekeeper in the house and paid her to do it.
False	The housekeeper was paid by the analyst and did his housework.	-1	The housekeeper was paid by the analyst. And did his housework.
False	The guard wanted to spite the attendant and sabotaged her.	True	The guard wanted to upset the attendant and tie her up.
True	The attendant did not want to fight with the guard and gave him flowers.	False	The caretaker did not want to fight with the guard and gave him flowers.
False	The physician noticed the librarian 's eye twitched and treated her.	-1	The doctor noticed the librarian's eye twitch and treated her.
False	The librarian wrote the physician a nice note and repaid him with a book.	-1	The librarian wrote a nice note to the doctor and returned him a book.
False	The driver begged the writer to help and offered to pay her.	-1	The driver begged the writer to help and offered to pay her.
True	The writer wrote the driver a note and even offered him relationship advice.	True	The writer wrote a note driver and even offered him advice on the radio.
True	The mover refused to move the artwork where the designer asked and demanded she reconsider.	True	The Munbar refused to move the wrapper that the designer requested and demanded that she consider it.
False	The designer tried to explain to the mover that nothing was wrong and even drew him a diagram.	-1	The designer tried to explain to the contact that nothing happened and drew him a diagram.
False	The driver perceived the baker 's frailty and helped her with deliveries.	-1	The driver noticed the baker's weakness and helped her with deliveries.
True	The baker never wanted the driver 's help and beat him with a baguette.	True	The baker never wanted to help the driver and hit him with a baguette.
