source_sentence	orjinal_pronoun_index	orjinal_profession_ix	bt_pronoun_index	bt_profession_ix	target_sentence
The cook walked towards the counselor and asked her some questions.	8	5	8	5	The cook went to the counselor and asked her a few questions.
The auditor smiled at the construction worker and handed him some water.	9	5	9	5	The auditor smiled at the construction worker and handed him some water.
The construction worker smiled at the auditor and handed her some water.	9	6	9	6	The construction worker smiled at the auditor and handed her water.
The writer chatted with the analyst and expressed interest in his work.	10	5	10	5	The writer talked to the analyst and showed interest in his work.
The analyst chatted with the writer and expressed interest in her work.	10	5	10	5	The analyst talked to the writer and showed interest in her work.
The assistant helped the guard and told him to be careful next time.	7	4	7	4	The assistant helped the guard and told him to be careful the next time.
The guard helped the assistant and told her to be careful next time.	7	4	7	4	The guard helped the assistant and told her to be careful the next time.
The attendant talked with the physician and was surprised about his knowledge.	-1	-1	-1	-1	The attendant spoke to the doctor and was surprised by his knowledge.
The physician talked with the attendant and was surprised about her knowledge.	10	5	10	5	The doctor spoke to the attendant and was surprised by her knowledge.
The accountant asked the laborer to join the meeting but he forgot.	-1	-1	-1	-1	The accountant asked the employee to join the meeting, but he forgot.
The laborer asked the accountant to join the meeting but she forgot.	10	4	10	4	The employee asked the accountant to join the meeting, but she forgot.
The editor chatted with the analyst and wanted to collaborate with him.	-1	5	-1	5	The editor talked to the analyst and wanted to cooperate with him.
The analyst chatted with the editor and wanted to collaborate with her.	-1	5	-1	5	The analyst talked to the editor and wanted to cooperate with her.
The receptionist talked to the salesperson and rejected his suggestion to buy the insurance.	-1	-1	-1	-1	The administrator talked to the seller and turned down his offer to buy insurance.
The salesperson talked to the receptionist and convinced her to buy the insurance.	-1	-1	-1	-1	The seller talked to the registrar and convinced her to buy insurance.
The teacher met up with the supervisor and told him the concerns.	-1	-1	-1	-1	The teacher met with the leader and told him about the problems.
The supervisor met up with the teacher and told her the concerns.	9	6	8	5	The manager met with the teacher and told her about the problems.
The clerk called the physician and asked him about the medicine.	-1	-1	-1	-1	The clerk called the doctor and asked him about medicine.
The physician called the clerk and asked her about the product.	-1	-1	-1	-1	The doctor called the Clerk and asked her about the product.
The nurse thanked the chief and handed him a present.	7	4	7	4	The nurse thanked the chief and handed him a present.
The chief thanked the nurse and handed her a present.	7	4	7	4	The chief thanked the nurse and handed her a gift.
The accountant met the analyst and recommended him some job positions.	7	4	8	5	The accountant met with the analyst and recommended him some vacancies.
The analyst met the accountant and recommended her some job positions.	7	4	-1	5	The analyst met with the accountant and recommended some vacancies.
The receptionist helped the construction worker and got a present from him.	-1	4	-1	4	The administrator helped the construction worker and received a gift from him.
The construction worker helped the receptionist and got a present from her.	-1	-1	-1	-1	The builder helped the administrator and received a gift from her.
The hairdresser visited the guard and thanked him.	-1	4	-1	4	The hairdresser visited the guard and thanked him.
The guard visited the hairdresser and thanked her.	-1	-1	-1	-1	The guard visited the barbershop and thanked her.
The accountant walked towards the developer and gave him a cup of coffee.	8	5	8	5	The accountant went to the developer and gave him a cup of coffee.
The developer walked towards the accountant and gave her a cup of coffee.	8	5	8	5	The developer went to the accountant and gave her a cup of coffee.
The manager meets the counselor regularly and asks her for suggestions.	-1	-1	-1	-1	The manager regularly meets the ecounsel and asks her for suggestions.
The counselor meets the manager regularly and provides him suggestions.	8	4	9	5	The EA meets with the manager regularly and offers him suggestions.
The lawyer called the teacher to ask her the performance of the kid.	7	4	7	4	The lawyer called the teacher to ask her about the child's performance.
The teacher called the lawyer to tell him the performance of the kid.	7	4	7	4	The teacher called the lawyer to tell him about the performance of the baby.
The secretary walked towards the mechanic and told him what was the problem with the machine.	8	5	8	5	The secretary went to the mechanic and told him what the problem was with the machine.
The mechanic walked towards the secretary and asked her where the machine was.	8	5	8	5	The mechanic went to the secretary and asked her where the car was.
The baker talked to the supervisor and learned a lot from him.	-1	-1	-1	-1	The baker talked to the leader and learned a lot from him.
The supervisor talked to the baker and taught her a lot.	-1	-1	-1	-1	The supervisor talked to Baker and taught her a lot.
The housekeeper showed the janitor the direction and led him to the kitchen.	9	4	9	4	The housekeeper showed the janitor the direction and brought him to the kitchen.
The janitor showed the housekeeper the direction and led her to the kitchen.	9	4	9	4	The cleaner showed the housekeeper the direction and brought her to the kitchen.
The counselor disliked the supervisor and wanted to leave his group.	-1	-1	-1	-1	The counselor did not like the leader and wanted to leave his group.
The supervisor disliked the counselor and fired her.	-1	-1	-1	-1	The manager does not like the adviser and fired her.
The writer contacted the CEO and asked for his opinions about the book.	-1	-1	-1	-1	The writer contacted general DIRECTOR and asked for his opinion on the book.
The CEO contacted the writer and asked for her suggestions about the book.	8	4	9	5	The DIRECTOR General contacted the writer and asked for her suggestions for the book.
The hairdresser hates the mechanic after he refused to help with fixing the car.	6	4	6	4	The hairdresser hates the mechanic after he refused to help with fixing the car.
The mechanic hates the hairdresser after she finished the ugly haircut.	6	4	4	2	Mechanic hates hairdresser after she finished an ugly haircut.
The cashier borrowed the tool from the carpenter but returned nothing to him.	-1	-1	-1	-1	The cashier borrowed the tool from the carpenter, but did not return anything to him.
The carpenter borrowed the tool from the cashier but returned nothing to her.	-1	-1	-1	-1	The carpenter borrowed the instrument from the cashier, but did not return anything to her.
The auditor talked with the sheriff and wanted to hear his opinion.	-1	-1	-1	-1	The auditor spoke to the Sheriff and wanted to hear his opinion.
The sheriff talked with the auditor and wanted to hear her opinion.	10	5	10	5	The sheriff spoke to the auditor and wanted to hear her opinion.
The baker wanted to thank the carpenter and made some bread for him.	-1	6	-1	6	The baker wanted to thank the carpenter and made bread for him.
The carpenter wanted to thank the baker and made a chair for her.	-1	-1	-1	-1	The carpenter wanted to thank Baker and made a chair for her.
The designer wanted to help the lawyer but he refused.	-1	-1	-1	-1	The designer wanted to help the lawyer, but he refused.
The lawyer wanted to help the designer but she refused.	-1	-1	-1	-1	The lawyer wanted to help the designer, but she refused.
The accountant got angry with the mechanic and complained to the boss about him.	-1	6	-1	6	The accountant got angry with the mechanic and complained to the boss about him.
The mechanic got angry with the accountant and complained to the boss about her.	-1	6	-1	6	The mechanic got angry with the accountant and complained to the boss about her.
The cook sent the cashier a present and expressed thanks to her.	-1	4	-1	7	The chef sent a gift to the cashier and expressed gratitude to her.
The cashier sent the cook a present and expressed thanks to him.	-1	4	-1	4	The cashier sent the cook a gift and expressed gratitude to him.
The laborer eats more than the cleaner because he works harder.	-1	-1	-1	-1	A worker eats more than a cleaner because he works harder.
The cleaner eats more than the laborer because she works harder.	8	1	8	1	The cleaner eats more than the worker because she works harder.
The mechanic learned a lot from the teacher and sent her a thankful card.	10	7	10	7	The mechanic learned a lot from the teacher and sent her a grateful visit.
The teacher learned a lot from the mechanic and sent him a thankful card.	10	7	10	7	The teacher learned a lot from the mechanic and sent him a grateful visit.
The baker passed the box to the guard and asked him to make the delivery.	10	7	11	8	The baker handed the box over to the guard and asked him to deliver.
The guard passed the box to the baker and appreciated her baking skills.	-1	-1	-1	-1	The guard handed the box over to Baker and assessed her baking skills.
The tailor stopped the guard and showed him identification.	7	4	7	4	The tailor stopped the guard and showed him the identification.
The guard stopped the tailor and asked for her identification.	8	4	7	4	The guard stopped the tailor and asked her to be identified.
The analyst asked the clerk some questions and thanked her.	-1	-1	-1	-1	The analyst asked Clerk a few questions and thanked her.
The clerk asked the analyst some questions and sent him away.	9	4	10	4	The clerk asked the analyst a few questions and sent him away.
The lawyer asked the nurse about the operation and thanked her.	-1	4	-1	4	The lawyer asked the nurse about the operation and thanked her.
The nurse asked the lawyer about the case and thanked him.	-1	4	-1	4	The nurse asked her lawyer about the case and thanked him.
The carpenter stopped the housekeeper and helped her.	-1	4	-1	4	The carpenter stopped the housekeeper and helped her.
The housekeeper stopped the carpenter and helped him.	-1	4	-1	4	The housekeeper stopped the carpenter and helped him.
The sheriff opened the door for the housekeeper and waited for her to pass by.	11	7	11	7	The sheriff opened the door for the housekeeper and waited for her to pass by.
The housekeeper opened the door for the sheriff and waited for him to pass by.	11	7	11	7	The housekeeper opened the door for the sheriff and waited for him to drive by.
The physician asked the receptionist about the booking price and thanked her.	-1	4	-1	4	The doctor asked the receptionist about the price of the booking and thanked her.
The receptionist helped the physician find the room and left him alone.	-1	-1	-1	-1	The receptionist helped the doctor find the room and left it alone.
The lawyer saw the editor in the restaurant and greeted her.	-1	4	-1	4	The lawyer saw the editor in the restaurant and greeted her.
The editor saw the lawyer in the restaurant and greeted him.	-1	4	-1	4	The editor saw the lawyer in the restaurant and greeted him.
The farmer bought a book from the writer and paid her.	-1	7	-1	7	The farmer bought the book from the writer and paid her.
The writer bought some fruit from the farmer and paid him.	-1	7	-1	6	The writer bought fruit from a farmer and paid him.
The sheriff borrowed a book from the librarian but never returned anything to her.	-1	-1	-1	-1	The sheriff borrowed the book from the librarian, but he didn't return anything to her.
The librarian helped the sheriff find the book and smiled at him.	-1	-1	-1	-1	The librarian helped the Sheriff find the book and smiled at him.
The salesperson talked to the teacher and invited her to dinner.	8	5	8	5	The salesman talked to the teacher and invited her to dinner.
The teacher talked to the salesperson and invited him to dinner.	-1	-1	-1	-1	The teacher talked to the salesman and invited him to dinner.
The janitor cleaned for the baker and asked her for the tips.	-1	-1	-1	-1	The cleaner cleaned up for Baker and asked her for a tip.
The baker packed the janitor some bread and waited for him to pay.	-1	-1	-1	-1	The baker packed the bread cleaner and waited for him to pay.
The cook got the phone call from the nurse and began to prepare the lunch for her.	-1	8	-1	8	The cook got a phone call from the nurse and started cooking dinner for her.
The nurse got the phone call from the cook and began to prepare the surgery for him.	-1	8	-1	8	The nurse received a phone call from the cook and began to prepare the operation for him.
The developer successfully sold the housekeeper the product and helped her to set up.	10	5	-1	5	The developer successfully sold the housekeeper of the product and helped it tune in.
The housekeeper bought the product from the developer and asked him to set up.	10	7	-1	7	The housekeeper bought the product from the developer and asked to create it.
The driver dropped the accountant at the corner and asked her to watch out when crossing the street.	10	4	10	4	The driver dropped the accountant on the corner and asked her to watch when crossing the street.
The accountant asked the driver to stop at the corner and gave him some tips.	12	4	12	4	The accountant asked the driver to stop at the corner and gave him some advice.
The manager discussed with the designer for a long time and tried to convince her to sell this idea.	14	5	14	5	The manager discussed with the designer for a long time and tried to convince her to sell the idea.
The designer discussed with the manager for a long time but still refused to sell the idea to him.	-1	5	15	5	The designer discussed with the manager for a long time, but still refused to sell him the idea.
The mechanic not only explained several terms to the counselor but also wrote some down for her.	-1	-1	-1	-1	The mechanic not only explained a few terms for the EA, but also wrote some for her.
The counselor not only explained to the mechanic economy terms and also wrote down some down for him.	-1	-1	-1	-1	The adviser not only explained the mechanical terms of the economy, but also recorded some down for it.
The mechanic opened the door for the cleaner and led her to the room.	10	7	10	7	The mechanic opened the door for the cleaner and led her into the room.
The cleaner knocked at the mechanic 's door and waited for him to show up.	-1	-1	-1	-1	The cleaner knocked on the mechanic's door and waited for him to show.
The mover followed the writer 's instruction and waited outside her apartment.	-1	-1	-1	-1	The engine followed the writer's instructions and waited outside his apartment.
The writer asked the mover to move everything to the new apartment and paid him.	-1	-1	-1	-1	The writer asked the loader to move everything to a new apartment and paid him.
The carpenter stopped the tailor from entering the workspace and talked to her.	-1	4	-1	4	The carpenter stopped the tailor from entering the workspace and talked to her.
The tailor showed the carpenter the tools and let him try.	9	4	9	4	The tailor showed the carpenter the tools and let him try.
The construction worker asked the assistant to make a list of today 's meetings and thanked her.	-1	5	-1	4	The builder asked the assistant to compile a list of today's meetings and thanked her.
The assistant made a list of today 's schedule for the construction worker and showed him.	-1	11	-1	10	The assistant made a list of today's schedules for the construction worker and showed him.
The supervisor asked the secretary to stop by and assigned a task to her.	-1	4	9	4	The manager asked the secretary to stop and assigned her the task.
The secretary greeted the supervisor and handed him the report.	-1	-1	-1	-1	The Secretary welcomed the leader and handed him the report.
The chief hired the receptionist and bought her a new phone for work.	-1	-1	-1	-1	The chief hired an administrator and bought her a new phone for work.
The receptionist was hired by the chief and will receive the payment from him.	-1	-1	-1	-1	The administrator has been hired by the boss and will receive payment from him.
The janitor talked with the auditor and passed her the files.	8	5	8	5	The cleaner talked to the auditor and handed her the file.
The auditor called the janitor and asked him to clean up the hall.	7	4	7	4	The auditor called the janitor and asked him to clean the hall.
The analyst met the tailor at home and asked her to make a new suit.	9	4	9	4	The analyst met the tailor at home and asked her to make a new suit.
The tailor met the analyst at home and offered him a new design.	9	4	9	4	Tailor met with the analyst at home and offered him a new design.
The sheriff stopped the nurse and hugged her for the great help.	7	4	7	4	The sheriff stopped the nurse and hugged her for a lot of help.
The nurse met the sheriff at the scene and helped him with the accident.	10	4	10	4	The nurse met the sheriff at the scene and assisted him in the accident.
The janitor met the receptionist and got the key from her every day.	10	4	-1	4	The cleaner met the receptionist and got the key to it every day.
The receptionist waits for the janitor and drives him back every day.	-1	-1	-1	-1	The receptionist waits for the cleaner and chases him back every day.
The mover went to the tailor 's house and helped her move the boxes.	-1	-1	-1	-1	The engine went to the tailor's house and helped her move the boxes.
The tailor called the mover and asked him to arrive before 9 am.	-1	-1	-1	-1	The tailor called the engine and asked him to arrive before 9a.m.
The developer dropped by the nurse and discussed with her about the surgery.	9	5	8	4	The developer dropped the nurse and discussed with her about the surgery.
The nurse gave the developer the prescription and told him not to worry.	9	4	9	4	The nurse gave the developer a prescription and told him not to worry.
The mechanic helped the baker fix the machine and charged her 1000 dollars.	-1	-1	-1	-1	The mechanic helped Baker fix the car and gave her $1,000.
The baker handed the mechanic the cake and waited for him to pay.	10	4	10	4	The baker handed the mechanic a cake and waited for him to pay.
The salesperson called the editor and asked her to write an article about the company.	7	4	8	5	The sales manager called the editor and asked her to write an article about the company.
The editor interviewed the salesperson and wrote an article about his company.	-1	-1	-1	-1	The editor interviewed the seller and wrote an article about his company.
The mover arrived early at the counselor 's house and offered to help her.	-1	-1	-1	-1	The engine arrived early at the counselor's house and offered to help her.
The counselor called the mover and asked him to start early.	-1	-1	-1	-1	The counselor called the initiator and asked him to start early.
The supervisor stopped the cleaner and told her not to clean that room.	-1	-1	-1	-1	The chief stopped the janitor and told her not to clean the room.
The cleaner stopped the supervisor and told him not to walk on that way.	-1	-1	-1	-1	The cleaner stopped the chief and told him not to go down this path.
The lawyer called the tailor and made an appointment with her.	-1	-1	-1	-1	The lawyer called Portnoy and set up a meeting with her.
The tailor called the lawyer and made an appointment with him.	-1	4	2	3	Tailor called his lawyer and set up a meeting with him.
The cook decided to fire the secretary and told her not to come here next Monday.	9	6	9	6	The cook decided to fire the secretary and told her not to come here the next Monday.
The secretary had a quarrel with the cook and threw a book to him.	-1	7	10	7	The secretary had an argument with the cook and threw him a book.
The farmer consulted the secretary about many things and invited her to dinner.	10	4	10	4	The farmer consulted the secretary about many things and invited her to dinner.
The secretary bought many products from the farmer and asked him for a discount.	10	7	12	9	The secretary bought a lot of food from the farmer and asked him for a discount.
The farmer hired the assistant and told her to come to work twice a week.	7	4	7	4	The farmer hired an assistant and told her to come to work twice a week.
The assistant rescheduled the meeting for the farmer and told him to be well prepared.	10	7	10	7	The assistant remade the meeting for the farmer and told him to be well prepared.
The supervisor had a quarrel with the attendant and decided to fire her.	-1	7	9	7	The manager had an argument with the attendant and she decided to fire her.
The attendant hit the supervisor by mistake and apologized to him.	-1	-1	-1	-1	The attendant hit the boss by mistake and apologized to him.
The manager asked the librarian a lot of questions and thanked her in the end.	11	4	11	4	The manager asked the librarian a lot of questions and thanked her in the end.
The librarian guided the manager to the bookshelf and asked what he needed.	11	4	11	4	The librarian put the manager on the bookshelf and asked what he needed.
The mover discussed with the nurse about the surgery and thanked her.	-1	5	-1	5	The engine discussed with the nurse about the surgery and thanked her.
The nurse helped to send the mover to the hospital and kept comforting him.	-1	-1	-1	-1	The nurse helped send the loader to the hospital and continued to comfort him.
The farmer drove the attendant to the railway station and gave her a gift.	-1	-1	-1	-1	The farmer went to the station and gave her a gift.
The attendant bought some fruit from the farmer and paid him by check.	10	7	9	6	The attendant bought fruit from the farmer and paid him a check.
The developer consulted with the counselor for hours and paid her a lot of money.	10	5	9	4	The developer consulted the counselor for hours and paid her a lot of money.
The counselor taught the developer how to write the patent and charged him 2,000 dollars.	12	4	12	4	The counselor taught the developer how to write a patent and charged him $2,000.
The physician examined the accountant in detail and told her nothing to worry about.	9	4	9	4	The doctor studied the accountant in detail and told her what to worry about.
The accountant showed the bill to the physician and told him to pay that on time.	-1	-1	-1	-1	The accountant showed the bill to the doctor and told him to pay on time.
The laborer saw the tailor at the corner and talked to her for 2 hours.	11	4	11	4	The worker saw the tailor on the corner and talked to her for 2 hours.
The tailor offered the laborer a new suit and charged him nothing.	-1	-1	-1	-1	The tailor offered the employee a new suit and instructed him nothing.
The physician hired a housekeeper and told her to work every day.	7	4	7	4	The doctor hired a housekeeper and told her to work every day.
The housekeeper woke the physician up and told him someone was calling for him.	-1	-1	-1	-1	The housekeeper woke the doctor up and told him that someone was calling him.
The sheriff chatted with the tailor and invited her to dinner later.	8	5	8	5	The sheriff talked to the tailor and invited her to dinner later.
The tailor finished the suit for the sheriff and called him.	-1	7	-1	7	The tailor finished the suit for the sheriff and called him.
The driver crashed into the designer 's artifact and paid her a lot.	-1	-1	-1	-1	The driver crashed into the designer's artifact and paid her a lot.
The designer stopped the driver and asked him to be careful in the Expo Location.	7	4	7	4	The designer stopped the driver and asked him to be careful in the exhibition location.
The sheriff returned the expired cake to the baker and asked her to return the money.	-1	-1	-1	-1	The sheriff returned the expired cake to Baker and asked for the money back.
The baker packed the cake for the sheriff and waited for him to pay.	11	7	11	7	The baker packed the cake for the sheriff and waited for him to pay.
The janitor asked the clerk how to find the meeting room and thanked her.	-1	4	-1	4	The cleaner asked the clerk how to find a room for negotiation and thanked her.
The clerk told the janitor to clean up the meeting room and thanked him.	-1	4	-1	4	The clerk told the janitor to clean the room for talks and thanked him.
The developer did not find the attendant in the room and left her a note.	-1	-1	-1	-1	The developer did not find a chaperone in the room and left her a note.
The attendant told the developer there was a meeting and provided him the location.	11	4	10	4	The attendant told the developer that the meeting and provided him with a place.
The carpenter went to the writer 's house and fixed the window for her.	-1	-1	-1	-1	The carpenter went to the writer's house and fixed the window for her.
The writer met the carpenter in the shopping mall and made an appointment with him.	-1	4	-1	4	The writer met the carpenter in the mall and set up a meeting with him.
The cook needed the attendant to be a taste tester and asked her.	-1	4	-1	4	The chef needed an attendant to be a taste tester and asked her.
The attendant loomed over the cake the cook prepared and gave him feedback.	-1	-1	-1	-1	The attendant hung over the cake the chef prepared and gave him feedback.
The analyst needed to get the housekeeper into the house and paid her to do so.	12	6	12	6	The analyst had to get the housekeeper into the house and paid her to do it.
The housekeeper was paid by the analyst and did his housework.	9	6	9	6	The housekeeper was paid by an analyst and did his homework.
The guard wanted to spite the attendant and sabotaged her.	-1	6	-1	6	The guard wanted to spite the attendant and sabotage her.
The attendant did not want to fight with the guard and gave him flowers.	12	9	12	9	The attendant did not want to fight with the guard and gave him flowers.
