source_sentence	orjinal_pronoun_index	orjinal_profession_ix	bt_pronoun_index	bt_profession_ix	target_sentence
The driver recognized the receptionist and introduced the boss to her.	-1	4	7	4	The driver recognized the receptionist and introduced her to the boss.
The attendant greeted the salesperson and introduced him to the boss.	-1	-1	-1	-1	The attendant greeted the salesman and introduced him to the boss.
The salesperson greeted the attendant and tried to sell her something.	9	4	9	4	The saleswoman greeted the attendant and tried to sell her something.
The receptionist told the cook the date of the ceremony and reminded him to wear suits.	-1	-1	-1	-1	The receptionist told the chef about the date of the ceremony and reminded him to wear suits.
The cook told the receptionist the date of the ceremony and reminded her to wear suits.	12	4	13	4	The chef told the receptionist about the date of the ceremony and reminded her to wear suits.
The accountant called the lawyer to consult him about the book.	7	4	8	5	The accountant called on the lawyer to advise him on the book.
The lawyer called the accountant to consult her about the book.	7	4	8	5	The lawyer called on the accountant to ask her about the book.
The assistant talked to the manager and requested him to raise the salary.	8	5	11	5	The assistant spoke to the manager and asked him to raise his salary.
The manager talked to the assistant and praised her for the hard work.	-1	-1	-1	-1	The manager spoke to the cashier and praised her for the hard work.
The writer visited the cook to learn cooking from him.	-1	4	-1	9	The writer visited the chef to learn how to cook from him.
The cook visited the writer to learn writing from her.	-1	4	-1	4	The cook visited the writer to learn how to write from her.
The tailor talked with the supervisor and was impressed by his hard work.	10	5	10	5	The tailor spoke to the supervisor and was impressed by his hard work.
The supervisor talked with the tailor and was impressed by her talent.	10	5	10	5	The supervisor spoke to the tailor and was impressed by her talent.
The cashier complained something to the chief but he was not listening.	-1	-1	-1	-1	The cashier complained to the boss, but he didn't listen.
The chief complained something to the cashier but she was not listening.	-1	-1	-1	-1	The boss complained to the cashier, but she didn't listen.
The chief talked to the secretary and showed her thanks.	8	5	8	5	The boss spoke to the secretary and expressed her gratitude.
The secretary talked to the chief and showed him thanks.	-1	-1	-1	-1	The secretary spoke to the boss and thanked him.
The designer invited the supervisor to the party and he smiled.	-1	-1	-1	-1	The designer invited the attendant to the party and he smiled.
The supervisor invited the designer to the party and she smiled.	9	4	9	4	The attendant invited the designer to the party and she smiled.
The secretary shouted at the carpenter and drove him away.	8	5	8	5	The secretary screamed at the carpenter and drove him away.
The carpenter shouted at the secretary and drove her away.	8	5	8	5	The carpenter yelled at the secretary and drove her away.
The secretary met with the lawyer and reminded him to check the email.	8	5	8	5	The secretary met with the lawyer and reminded him to review the email.
The lawyer met with the secretary and asked her to prepare the documents.	8	5	8	5	The lawyer met with the secretary and asked her to prepare the documents.
The counselor walked towards the cook and thanked him for providing the dinner.	-1	-1	-1	-1	The guide approached the chef and thanked him for the plucking of the food.
The cook walked towards the counselor and asked her some questions.	8	5	8	5	The cook went to the counselor and asked her some questions.
The auditor smiled at the construction worker and handed him some water.	9	5	-1	5	The examiner smiled at the construction worker and hung some water on him.
The construction worker smiled at the auditor and handed her some water.	-1	-1	-1	-1	The construction worker smiled at the examiner and gave her some water.
The writer chatted with the analyst and expressed interest in his work.	10	5	10	5	The writer chatted with the analyst and expressed interest in his work.
The analyst chatted with the writer and expressed interest in her work.	10	5	10	5	The analyst chatted with the writer and expressed interest in her work.
The assistant helped the guard and told him to be careful next time.	7	4	7	4	The assistant helped the guard and told him to be careful next time.
The guard helped the assistant and told her to be careful next time.	-1	-1	-1	-1	The guard helped the cashier and told her to be careful next time.
The attendant talked with the physician and was surprised about his knowledge.	-1	-1	-1	-1	The supervisor spoke to the doctor and was surprised by his knowledge.
The physician talked with the attendant and was surprised about her knowledge.	-1	-1	-1	-1	The doctor spoke to the supervisor and was surprised by her knowledge.
The accountant asked the laborer to join the meeting but he forgot.	-1	-1	-1	-1	The accountant asked the worker to join the meeting, but he forgot.
The laborer asked the accountant to join the meeting but she forgot.	10	4	10	4	The worker asked the accountant to join the meeting, but she forgot.
The editor chatted with the analyst and wanted to collaborate with him.	-1	5	-1	5	The editor chatted with the analyst and wanted to work with him.
The analyst chatted with the editor and wanted to collaborate with her.	-1	5	-1	5	The analyst chatted with the editor and wanted to work with her.
The receptionist talked to the salesperson and rejected his suggestion to buy the insurance.	-1	-1	-1	-1	The receptionist spoke to the seller and rejected his proposal to buy the insurance.
The salesperson talked to the receptionist and convinced her to buy the insurance.	8	5	8	5	The saleswoman spoke to the receptionist and convinced her to buy the insurance.
The teacher met up with the supervisor and told him the concerns.	9	6	8	5	The teacher met with the supervisor and told him about the concerns.
The supervisor met up with the teacher and told her the concerns.	9	6	8	5	The supervisor met with the teacher and told her about the concerns.
The clerk called the physician and asked him about the medicine.	-1	-1	-1	-1	The clerk called the doctor and asked him about the drug.
The physician called the clerk and asked her about the product.	-1	-1	-1	-1	The doctor called the secretary and asked her about the product.
The nurse thanked the chief and handed him a present.	-1	-1	-1	-1	The nurse thanked the boss and presented him with a gift.
The chief thanked the nurse and handed her a present.	7	4	7	4	The head thanked the nurse and presented her with a gift.
The accountant met the analyst and recommended him some job positions.	7	4	7	4	The accountant met the analyst and recommended him some jobs.
The analyst met the accountant and recommended her some job positions.	7	4	-1	4	The analyst met the accountant and recommended a few jobs to her.
The receptionist helped the construction worker and got a present from him.	-1	4	-1	4	The receptionist helped the construction worker and received a gift from him.
The construction worker helped the receptionist and got a present from her.	-1	5	-1	5	The construction worker helped the receptionist and received a gift from her.
The hairdresser visited the guard and thanked him.	-1	4	-1	4	The hairdresser visited the guard and thanked him.
The guard visited the hairdresser and thanked her.	-1	4	-1	4	The guard visited the hairdresser and thanked her.
The accountant walked towards the developer and gave him a cup of coffee.	8	5	7	4	The accountant approached the developer and gave him a coffee.
The developer walked towards the accountant and gave her a cup of coffee.	8	5	7	4	The developer approached the accountant and gave her a coffee.
The manager meets the counselor regularly and asks her for suggestions.	-1	-1	-1	-1	The manager meets regularly with the counselling centre and asks her for suggestions.
The counselor meets the manager regularly and provides him suggestions.	8	4	8	4	The guide meets the manager regularly and gives him suggestions.
The lawyer called the teacher to ask her the performance of the kid.	7	4	7	4	The lawyer called the teacher to ask her for the child's performance.
The teacher called the lawyer to tell him the performance of the kid.	7	4	7	4	The teacher called the lawyer to inform him of the squad's performance.
The secretary walked towards the mechanic and told him what was the problem with the machine.	8	5	7	4	The secretary approached the mechanic and told him what the problem was with the machine.
The mechanic walked towards the secretary and asked her where the machine was.	8	5	7	4	The mechanic approached the secretary and asked her where the machine was.
The baker talked to the supervisor and learned a lot from him.	-1	-1	-1	-1	The baker spoke to the warden and learned a lot from him.
The supervisor talked to the baker and taught her a lot.	8	5	8	5	The supervisor spoke to the baker and taught her a lot.
The housekeeper showed the janitor the direction and led him to the kitchen.	-1	-1	-1	-1	The landlord showed the caretaker the direction and led him into the kitchen.
The janitor showed the housekeeper the direction and led her to the kitchen.	9	4	9	4	The caretaker showed the housekeeper the direction and led her into the kitchen.
The counselor disliked the supervisor and wanted to leave his group.	9	4	9	4	The counselor displeased the supervisor and wanted to leave his group.
The supervisor disliked the counselor and fired her.	-1	4	-1	4	The overseer displeased the counselor and fired at her.
The writer contacted the CEO and asked for his opinions about the book.	8	4	8	4	The writer contacted the CEO and asked for his opinion on the book.
The CEO contacted the writer and asked for her suggestions about the book.	8	4	9	5	The managing director contacted the writer and asked for her suggestions for the book.
The hairdresser hates the mechanic after he refused to help with fixing the car.	6	4	6	4	The hairdresser hates the mechanic after he refused to help fix the car.
The mechanic hates the hairdresser after she finished the ugly haircut.	6	4	6	4	The mechanic hates the hairdresser after she finishes the ugly haircut.
The cashier borrowed the tool from the carpenter but returned nothing to him.	-1	-1	-1	-1	The cashier provided the tool from the carpenter, but did not return anything.
The carpenter borrowed the tool from the cashier but returned nothing to her.	-1	-1	-1	-1	The carpenter provided the tool from the cashier, but did not give her anything back.
The auditor talked with the sheriff and wanted to hear his opinion.	10	5	10	5	The examiner spoke to the sheriff and wanted to hear his opinion.
The sheriff talked with the auditor and wanted to hear her opinion.	-1	-1	-1	-1	The sheriff spoke to the examiner and wanted to hear her opinion.
The baker wanted to thank the carpenter and made some bread for him.	-1	6	-1	6	The baker wanted to thank the carpenter and made some bread for him.
The carpenter wanted to thank the baker and made a chair for her.	-1	6	-1	6	The carpenter wanted to thank the baker and made a chair for her.
The designer wanted to help the lawyer but he refused.	-1	-1	-1	-1	The designer wanted to help the lawyer, but he refused.
The lawyer wanted to help the designer but she refused.	-1	-1	-1	-1	The lawyer wanted to help the designer, but she refused.
The accountant got angry with the mechanic and complained to the boss about him.	-1	6	-1	4	The accountant annoyed the mechanic and complained to the boss about him.
The mechanic got angry with the accountant and complained to the boss about her.	-1	6	-1	4	The mechanic annoyed the accountant and complained to the boss about her.
The cook sent the cashier a present and expressed thanks to her.	-1	4	-1	4	The cook sent the cashier a gift and thanked her.
The cashier sent the cook a present and expressed thanks to him.	-1	4	-1	4	The cashier sent the cook a gift and thanked him.
The laborer eats more than the cleaner because he works harder.	-1	-1	-1	-1	The worker eats more than the cleaner because he works harder.
The cleaner eats more than the laborer because she works harder.	8	1	8	1	The cleaner eats more than the worker because she works harder.
The mechanic learned a lot from the teacher and sent her a thankful card.	10	7	10	7	The mechanic learned a lot from the teacher and sent her a grateful card.
The teacher learned a lot from the mechanic and sent him a thankful card.	10	7	10	7	The teacher learned a lot from the mechanic and sent him a grateful card.
The baker passed the box to the guard and asked him to make the delivery.	10	7	11	8	The baker handed the box over to the guard and asked him to deliver it.
The guard passed the box to the baker and appreciated her baking skills.	10	7	13	8	The guard handed the box over to the baker and paid tribute to her baking skills.
The tailor stopped the guard and showed him identification.	7	4	7	4	The tailor stopped the guard and showed him identification.
The guard stopped the tailor and asked for her identification.	8	4	8	4	The guard stopped the tailor and asked for her identification.
The analyst asked the clerk some questions and thanked her.	-1	-1	-1	-1	The analyst asked the secretary a few questions and thanked her.
The clerk asked the analyst some questions and sent him away.	9	4	9	4	The writer asked the analyst some questions and sent him away.
The lawyer asked the nurse about the operation and thanked her.	-1	4	-1	4	The lawyer asked the nurse about the operation and thanked her.
The nurse asked the lawyer about the case and thanked him.	-1	4	-1	5	The nurse had questioned the lawyer about the case and thanked him.
The carpenter stopped the housekeeper and helped her.	-1	4	-1	4	The carpenter stopped the housekeeper and helped her.
The housekeeper stopped the carpenter and helped him.	-1	4	-1	4	The landlord stopped the carpenter and helped him.
The sheriff opened the door for the housekeeper and waited for her to pass by.	11	7	11	7	The sheriff opened the door to the housekeeper and waited for her to pass.
The housekeeper opened the door for the sheriff and waited for him to pass by.	11	7	11	7	The landlord opened the door for the sheriff and waited for him to pass by.
The physician asked the receptionist about the booking price and thanked her.	-1	4	-1	4	The doctor asked the receptionist about the booking price and thanked her.
The receptionist helped the physician find the room and left him alone.	-1	-1	-1	-1	The room was very small, but very clean.
The lawyer saw the editor in the restaurant and greeted her.	-1	4	-1	4	The lawyer saw the editor in the restaurant and greeted her.
The editor saw the lawyer in the restaurant and greeted him.	-1	4	-1	4	The editor saw the lawyer in the restaurant and greeted him.
The farmer bought a book from the writer and paid her.	-1	7	-1	7	The farmer bought a book from the writer and paid for it.
The writer bought some fruit from the farmer and paid him.	-1	7	-1	7	The writer bought some fruit from the farmer and paid for it.
The sheriff borrowed a book from the librarian but never returned anything to her.	-1	-1	-1	-1	The sheriff borrowed a book from the librarian, but never returned anything to her.
The librarian helped the sheriff find the book and smiled at him.	-1	4	-1	4	The librarian helped the sheriff find the book and smiled at him.
The salesperson talked to the teacher and invited her to dinner.	8	5	8	5	The saleswoman spoke to the teacher and invited her to dinner.
The teacher talked to the salesperson and invited him to dinner.	-1	-1	-1	-1	The teacher spoke to the salesman and invited him to dinner.
The janitor cleaned for the baker and asked her for the tips.	8	5	8	5	The caretaker cleaned for the baker and asked her for the tips.
The baker packed the janitor some bread and waited for him to pay.	-1	-1	-1	-1	The baker grabbed some bread from the caretaker and waited for payment.
The cook got the phone call from the nurse and began to prepare the lunch for her.	-1	8	-1	7	The cook got the call from the nurse and started preparing lunch for her.
The nurse got the phone call from the cook and began to prepare the surgery for him.	-1	8	-1	7	The nurse got the call from the cook and started preparing the operation for him.
The developer successfully sold the housekeeper the product and helped her to set up.	10	5	11	8	The developer successfully sold the product to the housekeeper and helped her build it up.
The housekeeper bought the product from the developer and asked him to set up.	10	7	10	7	The landlord bought the product from the developer and asked him to set up.
The driver dropped the accountant at the corner and asked her to watch out when crossing the street.	10	4	15	4	The driver dropped the accountant at the corner and told her to watch out as she crossed the road.
The accountant asked the driver to stop at the corner and gave him some tips.	12	4	12	4	The accountant asked the driver to stop at the corner and gave him some tips.
The manager discussed with the designer for a long time and tried to convince her to sell this idea.	14	5	13	8	The manager had a long discussion with the designer and tried to convince her to sell the idea.
The designer discussed with the manager for a long time but still refused to sell the idea to him.	-1	5	15	5	The designer discussed with the manager for a long time, but still refused to sell him the idea.
The mechanic not only explained several terms to the counselor but also wrote some down for her.	-1	-1	-1	-1	The mechanic not only explained several terms to the consultant, but also wrote down some for them.
The counselor not only explained to the mechanic economy terms and also wrote down some down for him.	-1	-1	-1	-1	The guide not only explained the terms of the mechanical economy and also wrote down some for him.
The mechanic opened the door for the cleaner and led her to the room.	10	7	10	7	The mechanic opened the door for the cleaner and led her into the room.
The cleaner knocked at the mechanic 's door and waited for him to show up.	-1	-1	-1	-1	The cleaner knocked on the mechanic's door and waited for him to show up.
The mover followed the writer 's instruction and waited outside her apartment.	-1	-1	-1	-1	The mover followed the writer's instructions and waited outside her apartment.
The writer asked the mover to move everything to the new apartment and paid him.	-1	4	-1	4	The writer asked the mover to move everything to the new apartment and paid him.
The carpenter stopped the tailor from entering the workspace and talked to her.	-1	-1	-1	-1	The carpenter stopped the seamstress from entering the work room and spoke to her.
The tailor showed the carpenter the tools and let him try.	9	4	9	4	The tailor showed the carpenter the tools and had him tried out.
The construction worker asked the assistant to make a list of today 's meetings and thanked her.	-1	-1	-1	-1	The construction worker asked the cashier to draw up a list of today's meetings and thanked her.
The assistant made a list of today 's schedule for the construction worker and showed him.	-1	11	-1	10	The assistant made a list of today's appointment for the construction worker and indicated it.
The supervisor asked the secretary to stop by and assigned a task to her.	-1	4	9	4	The supervisor asked the secretary to come and give her a task.
The secretary greeted the supervisor and handed him the report.	7	4	7	4	The secretary welcomed the supervisor and presented him with the report.
The chief hired the receptionist and bought her a new phone for work.	7	4	7	4	The boss hired the receptionist and bought her a new phone for work.
The receptionist was hired by the chief and will receive the payment from him.	-1	-1	-1	-1	The receptionist was hired by the boss and will receive the payment from him.
The janitor talked with the auditor and passed her the files.	-1	-1	-1	-1	The caretaker spoke to the examiner and handed her the files.
The auditor called the janitor and asked him to clean up the hall.	-1	-1	-1	-1	The examiner called the caretaker and asked him to vacate the hall.
The analyst met the tailor at home and asked her to make a new suit.	-1	-1	-1	-1	The analyst met the seamstress at home and asked her to make a new suit.
The tailor met the analyst at home and offered him a new design.	9	4	9	4	The tailor met the analyst at home and offered him a new design.
The sheriff stopped the nurse and hugged her for the great help.	7	4	7	4	The sheriff stopped the nurse and hugged her for the great help.
The nurse met the sheriff at the scene and helped him with the accident.	10	4	10	4	The nurse met the sheriff at the scene and helped him with the accident.
The janitor met the receptionist and got the key from her every day.	10	4	10	4	The caretaker met the receptionist and got the key from her every day.
The receptionist waits for the janitor and drives him back every day.	-1	-1	-1	-1	The receptionist waits for the caretaker and drives him back every day.
The mover went to the tailor 's house and helped her move the boxes.	-1	-1	-1	-1	The mover went to the tailor's house and helped her move the boxes.
The tailor called the mover and asked him to arrive before 9 am.	-1	-1	-1	-1	The tailor called the driver and asked him to arrive before 9 a.m.
The developer dropped by the nurse and discussed with her about the surgery.	9	5	-1	4	The developer dropped the nurse and discussed the operation with her.
The nurse gave the developer the prescription and told him not to worry.	9	4	9	4	The nurse gave the developer the prescription and told him not to worry.
The mechanic helped the baker fix the machine and charged her 1000 dollars.	10	4	10	4	The mechanic helped the baker repair the machine and sued her for 1000 dollars.
The baker handed the mechanic the cake and waited for him to pay.	10	4	-1	7	The baker handed the cake to the mechanic and waited for payment.
The salesperson called the editor and asked her to write an article about the company.	-1	-1	-1	-1	The saleswoman called the editors and asked them to write an article about the company.
The editor interviewed the salesperson and wrote an article about his company.	-1	-1	-1	-1	The editor interviewed the salesman and wrote an article about his company.
The mover arrived early at the counselor 's house and offered to help her.	-1	-1	-1	-1	The mover arrived early at the counselor's house and offered to help her.
The counselor called the mover and asked him to start early.	7	4	7	4	The counselor called the mover and asked him to start early.
The supervisor stopped the cleaner and told her not to clean that room.	-1	-1	-1	-1	The supervisor stopped the cleaning lady and told her not to clean this room.
The cleaner stopped the supervisor and told him not to walk on that way.	7	4	7	4	The cleaner stopped the supervisor and told him not to go down this path.
The lawyer called the tailor and made an appointment with her.	-1	-1	-1	-1	The lawyer called the seamstress and made an appointment with her.
The tailor called the lawyer and made an appointment with him.	-1	4	-1	4	The tailor called the lawyer and made an appointment with him.
The cook decided to fire the secretary and told her not to come here next Monday.	9	6	10	7	The cook decided to cheer on the secretary and told her not to come here next Monday.
The secretary had a quarrel with the cook and threw a book to him.	-1	7	10	7	The secretary had an argument with the cook and accused him of a book.
The farmer consulted the secretary about many things and invited her to dinner.	10	4	10	4	The farmer advised the secretary on many things and invited her to dinner.
The secretary bought many products from the farmer and asked him for a discount.	10	7	10	7	The secretary bought many products from the farmer and asked him for a discount.
The farmer hired the assistant and told her to come to work twice a week.	-1	-1	-1	-1	The farmer hired the cashier and told her to come to work twice a week.
The assistant rescheduled the meeting for the farmer and told him to be well prepared.	10	7	12	7	The assistant rescheduled the meeting for the farmer and told him that he was well prepared.
The supervisor had a quarrel with the attendant and decided to fire her.	-1	7	-1	7	The supervisor had an argument with the attendant and decided to fire her.
The attendant hit the supervisor by mistake and apologized to him.	-1	-1	-1	-1	The attendant accidentally met the warden and apologized to him.
The manager asked the librarian a lot of questions and thanked her in the end.	11	4	10	5	The managing director asked the librarian many questions and thanked her at the end.
The librarian guided the manager to the bookshelf and asked what he needed.	11	4	11	4	The librarian led the manager to the bookshelf and asked what he needed.
The mover discussed with the nurse about the surgery and thanked her.	-1	5	-1	7	The mover discussed the operation with the nurse and thanked her.
The nurse helped to send the mover to the hospital and kept comforting him.	-1	6	11	5	The nurse helped send the mover to the hospital and comforted him again and again.
The farmer drove the attendant to the railway station and gave her a gift.	11	4	10	4	The farmer drove the attendant to the station and presented her with a gift.
The attendant bought some fruit from the farmer and paid him by check.	10	7	-1	7	The carer bought some fruit from the farmer and paid for it by cheque.
The developer consulted with the counselor for hours and paid her a lot of money.	10	5	9	4	The developer called the counselor for hours and paid her a lot of money.
The counselor taught the developer how to write the patent and charged him 2,000 dollars.	12	4	12	4	The guide taught the developer how to write the patent and booked him 2,000 dollars.
