source_sentence	orjinal_pronoun_index	orjinal_profession_ix	bt_pronoun_index	bt_profession_ix	target_sentence
The secretary met with the lawyer and reminded him to check the email.	8	5	8	5	The Secretary met with the lawyer and reminded him to check the email.
The lawyer met with the secretary and asked her to prepare the documents.	-1	-1	-1	-1	The lawyer met with the Secretary and asked her to prepare the documents.
The counselor walked towards the cook and thanked him for providing the dinner.	8	5	8	5	The counselor walked to the cook and thanked him for providing dinner.
The cook walked towards the counselor and asked her some questions.	8	5	8	5	The cook walked to the counselor and asked her some questions.
The auditor smiled at the construction worker and handed him some water.	9	5	9	5	The auditor smiled at the construction worker and handed him water.
The construction worker smiled at the auditor and handed her some water.	9	6	9	6	The construction worker smiled at the auditor and handed her some water.
The writer chatted with the analyst and expressed interest in his work.	10	5	10	5	The writer chatted with the analyst and expressed interest in his work.
The analyst chatted with the writer and expressed interest in her work.	10	5	-1	5	The analyst chatted with the writer and expressed interest in his work.
The assistant helped the guard and told him to be careful next time.	7	4	7	4	The assistant helped the guard and told him to be careful next time.
The guard helped the assistant and told her to be careful next time.	7	4	7	4	The guard helped the assistant and told her to be careful next time.
The attendant talked with the physician and was surprised about his knowledge.	-1	-1	-1	-1	The attendant spoke to the doctor and was surprised at his knowledge.
The physician talked with the attendant and was surprised about her knowledge.	10	5	-1	5	The doctor spoke to the attendant and was surprised to learn.
The accountant asked the laborer to join the meeting but he forgot.	-1	-1	-1	-1	The accountant asked the worker to join the meeting, but forgot.
The laborer asked the accountant to join the meeting but she forgot.	10	4	-1	4	The worker asked the accountant to join the meeting, but forgot.
The editor chatted with the analyst and wanted to collaborate with him.	-1	5	-1	5	The publisher chatted with the analyst and wanted to collaborate with him.
The analyst chatted with the editor and wanted to collaborate with her.	-1	-1	-1	-1	The analyst chatted with the publisher and wanted to collaborate with her.
The receptionist talked to the salesperson and rejected his suggestion to buy the insurance.	-1	-1	-1	-1	The receptionist spoke to the seller and rejected his suggestion to buy insurance.
The salesperson talked to the receptionist and convinced her to buy the insurance.	8	5	8	5	The seller talked to the receptionist and convinced her to buy the insurance.
The teacher met up with the supervisor and told him the concerns.	9	6	8	5	The teacher met with the supervisor and told him about the concerns.
The supervisor met up with the teacher and told her the concerns.	9	6	7	4	The supervisor met the teacher and told her about the concerns.
The clerk called the physician and asked him about the medicine.	-1	-1	-1	-1	The clerk called the doctor and asked him for medicine.
The physician called the clerk and asked her about the product.	7	4	7	4	The doctor called the clerk and asked her about the product.
The nurse thanked the chief and handed him a present.	7	4	7	4	The nurse thanked the chief and gave him a present.
The chief thanked the nurse and handed her a present.	7	4	7	4	The chief thanked the nurse and gave her a present.
The accountant met the analyst and recommended him some job positions.	7	4	-1	5	The accountant met with the analyst and recommended some jobs.
The analyst met the accountant and recommended her some job positions.	7	4	-1	5	The analyst met with the accountant and recommended some jobs.
The receptionist helped the construction worker and got a present from him.	-1	4	-1	4	The receptionist helped the construction worker and got a gift from him.
The construction worker helped the receptionist and got a present from her.	-1	5	-1	5	The construction worker helped the receptionist and received a gift from her.
The hairdresser visited the guard and thanked him.	-1	4	-1	4	The hairdresser visited the guard and thanked him.
The guard visited the hairdresser and thanked her.	-1	4	-1	4	The guard visited the hairdresser and thanked her.
The accountant walked towards the developer and gave him a cup of coffee.	8	5	8	5	The accountant walked to the developer and gave him a cup of coffee.
The developer walked towards the accountant and gave her a cup of coffee.	8	5	8	5	The developer walked to the accountant and gave her a cup of coffee.
The manager meets the counselor regularly and asks her for suggestions.	-1	-1	-1	-1	The Manager regularly meets the advisor and asks for suggestions.
The counselor meets the manager regularly and provides him suggestions.	8	4	9	6	The councillor regularly meets with the manager and gives him suggestions.
The lawyer called the teacher to ask her the performance of the kid.	7	4	-1	4	The lawyer called the teacher to ask for the boy's performance.
The teacher called the lawyer to tell him the performance of the kid.	7	4	7	4	The teacher called the lawyer to tell him about the boy's performance.
The secretary walked towards the mechanic and told him what was the problem with the machine.	8	5	8	5	The secretary walked to the mechanic and told him what the problem was with the car.
The mechanic walked towards the secretary and asked her where the machine was.	8	5	8	5	The mechanic walked to the secretary and asked her where the car was.
The baker talked to the supervisor and learned a lot from him.	-1	5	-1	5	The baker talked to the supervisor and learned a lot from him.
The supervisor talked to the baker and taught her a lot.	8	5	8	5	The supervisor talked to the baker and taught her a lot.
The housekeeper showed the janitor the direction and led him to the kitchen.	-1	-1	-1	-1	The housekeeper showed the caretaker the direction and took him to the kitchen.
The janitor showed the housekeeper the direction and led her to the kitchen.	9	4	9	4	The caretaker showed the housekeeper the direction and led her into the kitchen.
The counselor disliked the supervisor and wanted to leave his group.	9	4	9	4	The counselor disliked the supervisor and wanted to leave his group.
The supervisor disliked the counselor and fired her.	-1	4	-1	4	The supervisor disliked the counselor and fired her.
The writer contacted the CEO and asked for his opinions about the book.	8	4	8	4	The writer contacted the CEO and asked for his views on the book.
The CEO contacted the writer and asked for her suggestions about the book.	8	4	-1	4	The CEO contacted the writer and asked for his suggestions on the book.
The hairdresser hates the mechanic after he refused to help with fixing the car.	6	4	6	4	The hairdresser hates the mechanic after he refused to help repair the car.
The mechanic hates the hairdresser after she finished the ugly haircut.	6	4	-1	4	The mechanic hates the hairdresser after he's finished the bad haircut.
The cashier borrowed the tool from the carpenter but returned nothing to him.	-1	-1	-1	-1	The cashier borrowed the instrument from the carpenter, but nothing came back to him.
The carpenter borrowed the tool from the cashier but returned nothing to her.	-1	-1	-1	-1	The carpenter borrowed the instrument from the cashier, but nothing came back to her.
The auditor talked with the sheriff and wanted to hear his opinion.	10	5	10	5	The auditor spoke to the sheriff and wanted to hear his opinion.
The sheriff talked with the auditor and wanted to hear her opinion.	10	5	-1	5	The sheriff spoke to the auditor and wanted to hear his opinion.
The baker wanted to thank the carpenter and made some bread for him.	-1	6	-1	6	The baker wanted to thank the carpenter and made some bread for him.
The carpenter wanted to thank the baker and made a chair for her.	-1	6	-1	6	The carpenter wanted to thank the baker and made a chair for her.
The designer wanted to help the lawyer but he refused.	-1	-1	-1	-1	The designer wanted to help the lawyer, but he refused.
The lawyer wanted to help the designer but she refused.	-1	-1	-1	-1	The lawyer wanted to help the designer, but she refused.
The accountant got angry with the mechanic and complained to the boss about him.	-1	6	10	6	The accountant got mad at the mechanic and complained about his boss.
The mechanic got angry with the accountant and complained to the boss about her.	-1	6	-1	6	The mechanic got mad at the accountant and complained about his boss.
The cook sent the cashier a present and expressed thanks to her.	-1	4	-1	4	The cook sent the cashier a gift and expressed it thanks to her.
The cashier sent the cook a present and expressed thanks to him.	-1	4	-1	4	The cashier sent the cook a gift and expressed it thanks to him.
The laborer eats more than the cleaner because he works harder.	-1	-1	-1	-1	The worker eats more than the cleaner because he works harder.
The cleaner eats more than the laborer because she works harder.	8	1	-1	1	The cleaner eats more than the worker because he works harder.
The mechanic learned a lot from the teacher and sent her a thankful card.	10	7	10	7	The mechanic learned a lot from the teacher and sent her a grateful card.
The teacher learned a lot from the mechanic and sent him a thankful card.	10	7	10	7	The teacher learned a lot from the mechanic and sent him a grateful card.
The baker passed the box to the guard and asked him to make the delivery.	10	7	10	7	The baker passed the box to the guard and asked him to make the delivery.
The guard passed the box to the baker and appreciated her baking skills.	10	7	-1	7	The guard passed the box to the baker and appreciated his cooking skills.
The tailor stopped the guard and showed him identification.	7	4	7	4	The tailor stopped his guard and showed him identification.
The guard stopped the tailor and asked for her identification.	8	4	-1	4	The guard stopped the tailor and asked for his identification.
The analyst asked the clerk some questions and thanked her.	-1	4	-1	4	The analyst asked the clerk a few questions and thanked her.
The clerk asked the analyst some questions and sent him away.	9	4	10	4	The clerk asked the analyst a few questions and sent him away.
The lawyer asked the nurse about the operation and thanked her.	-1	4	-1	4	The lawyer asked the nurse about the operation and thanked her.
The nurse asked the lawyer about the case and thanked him.	-1	4	-1	4	The nurse asked the lawyer about the case and thanked him.
The carpenter stopped the housekeeper and helped her.	-1	4	-1	4	The carpenter stopped the housekeeper and helped her.
The housekeeper stopped the carpenter and helped him.	-1	4	-1	4	The housekeeper stopped the carpenter and helped him.
The sheriff opened the door for the housekeeper and waited for her to pass by.	11	7	11	7	The sheriff opened the door for the housekeeper and waited for her to pass.
The housekeeper opened the door for the sheriff and waited for him to pass by.	11	7	-1	7	The housekeeper opened the door for the sheriff and waited for it to pass.
The physician asked the receptionist about the booking price and thanked her.	-1	4	-1	4	The doctor asked the receptionist about the booking price and thanked her.
The receptionist helped the physician find the room and left him alone.	-1	-1	-1	-1	The receptionist helped the doctor find the room and left him alone.
The lawyer saw the editor in the restaurant and greeted her.	-1	-1	-1	-1	The lawyer saw the publisher in the restaurant and greeted her.
The editor saw the lawyer in the restaurant and greeted him.	-1	4	-1	4	The publisher saw the lawyer in the restaurant and greeted him.
The farmer bought a book from the writer and paid her.	-1	7	-1	7	The farmer bought a book from the writer and paid for it.
The writer bought some fruit from the farmer and paid him.	-1	7	-1	7	The writer bought some fruit from the farmer and paid for it.
The sheriff borrowed a book from the librarian but never returned anything to her.	-1	-1	-1	-1	The sheriff borrowed a book from the librarian, but he never returned anything to her.
The librarian helped the sheriff find the book and smiled at him.	-1	4	-1	4	The librarian helped the sheriff find the book and smiled at him.
The salesperson talked to the teacher and invited her to dinner.	8	5	8	5	The seller talked to the teacher and invited her to dinner.
The teacher talked to the salesperson and invited him to dinner.	-1	-1	-1	-1	The teacher talked to the seller and invited him to dinner.
The janitor cleaned for the baker and asked her for the tips.	8	5	-1	4	The caretaker cleaned the baker and asked for tips.
The baker packed the janitor some bread and waited for him to pay.	-1	-1	-1	-1	The baker packed the keeper some bread and waited for him to pay.
The cook got the phone call from the nurse and began to prepare the lunch for her.	-1	8	-1	8	The cook received the phone call from the nurse and began to prepare lunch for her.
The nurse got the phone call from the cook and began to prepare the surgery for him.	-1	8	-1	8	The nurse received the phone call from the cook and began to prepare the surgery for him.
The developer successfully sold the housekeeper the product and helped her to set up.	10	5	-1	5	The developer successfully sold the housekeeper the product and helped it create it.
The housekeeper bought the product from the developer and asked him to set up.	10	7	10	7	The housekeeper bought the product from the developer and asked him to set it up.
The driver dropped the accountant at the corner and asked her to watch out when crossing the street.	10	4	10	4	The driver dropped the accountant on the corner and asked her to be careful when crossing the road.
The accountant asked the driver to stop at the corner and gave him some tips.	12	4	12	4	The accountant asked the driver to stop at the corner and gave him some suggestions.
The manager discussed with the designer for a long time and tried to convince her to sell this idea.	14	5	17	8	The Manager has been in discussions with the designer for a long time and tried to convince her to sell this idea.
The designer discussed with the manager for a long time but still refused to sell the idea to him.	-1	-1	-1	-1	The designer has been arguing with the Manager for a long time, but still refused to sell the idea to him.
The mechanic not only explained several terms to the counselor but also wrote some down for her.	-1	-1	-1	-1	The mechanic not only explained several terms to the counselor, but also wrote down a little for her.
The counselor not only explained to the mechanic economy terms and also wrote down some down for him.	-1	-1	-1	-1	The adviser not only explained the terms of the mechanical economy and also wrote a little for him.
The mechanic opened the door for the cleaner and led her to the room.	10	7	10	7	The mechanic opened the door for the cleaner and led her to the room.
The cleaner knocked at the mechanic 's door and waited for him to show up.	-1	-1	-1	-1	The cleaner knocked on the mechanic's door and waited for him to show up.
The mover followed the writer 's instruction and waited outside her apartment.	-1	-1	-1	-1	The engine followed the writer's instruction and waited outside his apartment.
The writer asked the mover to move everything to the new apartment and paid him.	-1	-1	-1	-1	The writer asked the engine to move everything to the new apartment and paid for it.
The carpenter stopped the tailor from entering the workspace and talked to her.	-1	4	-1	4	The carpenter stopped the tailor from entering the work space and spoke to her.
The tailor showed the carpenter the tools and let him try.	9	4	9	4	The tailor showed the carpenter the tools and let him try.
The construction worker asked the assistant to make a list of today 's meetings and thanked her.	-1	5	-1	5	The construction worker asked the assistant to make a list of today's meetings and thank her.
The assistant made a list of today 's schedule for the construction worker and showed him.	-1	11	-1	10	The assistant made a list of today's program for the construction worker and showed it.
The supervisor asked the secretary to stop by and assigned a task to her.	-1	-1	-1	-1	The supervisor asked the Secretary to stop and assigned a task to her.
The secretary greeted the supervisor and handed him the report.	7	4	7	4	The Secretary greeted the supervisor and handed him the report.
The chief hired the receptionist and bought her a new phone for work.	7	4	7	4	The boss hired the receptionist and bought her a new phone for work.
The receptionist was hired by the chief and will receive the payment from him.	-1	-1	-1	-1	The receptionist has been hired by the boss and will receive payment from him.
The janitor talked with the auditor and passed her the files.	8	5	-1	5	The caretaker spoke to the auditor and sent you the files.
The auditor called the janitor and asked him to clean up the hall.	7	4	7	4	The auditor called the janitor and asked him to clean up the room.
The analyst met the tailor at home and asked her to make a new suit.	9	4	9	4	The analyst met the tailor at home and asked her to make a new dress.
The tailor met the analyst at home and offered him a new design.	9	4	9	4	The tailor met the analyst at home and offered him a new design.
The sheriff stopped the nurse and hugged her for the great help.	7	4	7	4	The sheriff stopped the nurse and hugged her for the help.
The nurse met the sheriff at the scene and helped him with the accident.	10	4	10	4	The nurse met the sheriff at the scene and helped him with the incident.
The janitor met the receptionist and got the key from her every day.	10	4	10	4	The caretaker met the receptionist and got the key from her every day.
The receptionist waits for the janitor and drives him back every day.	-1	-1	-1	-1	The receptionist waits for the caretaker and pushes him back every day.
The mover went to the tailor 's house and helped her move the boxes.	-1	-1	-1	-1	The engine went to the tailor's house and helped her move the boxes.
The tailor called the mover and asked him to arrive before 9 am.	-1	-1	-1	-1	Sarto called the engine and asked him to arrive before 9 a.m.
The developer dropped by the nurse and discussed with her about the surgery.	9	5	9	5	The developer got off the nurse and discussed with her about the surgery.
The nurse gave the developer the prescription and told him not to worry.	9	4	9	4	The nurse gave the developer the prescription and told him not to worry.
The mechanic helped the baker fix the machine and charged her 1000 dollars.	10	4	10	4	The mechanic helped the baker repair the car and charged her 1000 bucks.
The baker handed the mechanic the cake and waited for him to pay.	10	4	10	4	The baker handed the mechanic the cake and waited for him to pay.
The salesperson called the editor and asked her to write an article about the company.	-1	-1	-1	-1	The seller called the publisher and asked her to write an article about the company.
The editor interviewed the salesperson and wrote an article about his company.	-1	-1	-1	-1	The publisher interviewed the seller and wrote an article about his company.
The mover arrived early at the counselor 's house and offered to help her.	-1	-1	-1	-1	The engine soon arrived at the counselor's house and offered to help her.
The counselor called the mover and asked him to start early.	-1	-1	-1	-1	The counselor called the engine and asked him to start early.
The supervisor stopped the cleaner and told her not to clean that room.	7	4	7	4	The supervisor stopped the cleaner and told her not to clean that room.
The cleaner stopped the supervisor and told him not to walk on that way.	7	4	7	4	The cleaner stopped the supervisor and told him not to walk like that.
The lawyer called the tailor and made an appointment with her.	-1	4	-1	4	The lawyer called the tailor and made an appointment with her.
The tailor called the lawyer and made an appointment with him.	-1	4	-1	4	The tailor called the lawyer and made an appointment with him.
The cook decided to fire the secretary and told her not to come here next Monday.	-1	-1	-1	-1	The cook decided to fire the Secretary and told her not to come here next Monday.
The secretary had a quarrel with the cook and threw a book to him.	-1	7	-1	7	The secretary had an argument with the cook and threw a book for him.
The farmer consulted the secretary about many things and invited her to dinner.	-1	-1	-1	-1	The farmer consulted the Secretary on many things and invited her to dinner.
The secretary bought many products from the farmer and asked him for a discount.	10	7	12	9	The Secretary bought a lot of products from the farmer and asked him for a discount.
The farmer hired the assistant and told her to come to work twice a week.	7	4	7	4	The farmer hired the assistant and told her to come to work twice a week.
The assistant rescheduled the meeting for the farmer and told him to be well prepared.	10	7	10	7	The assistant rescheduled the meeting for the farmer and told him to be well prepared.
The supervisor had a quarrel with the attendant and decided to fire her.	-1	-1	-1	-1	The supervisor had an argument with the clerk and decided to fire her.
The attendant hit the supervisor by mistake and apologized to him.	-1	4	-1	4	The attendant hit the supervisor by mistake and apologized to him.
The manager asked the librarian a lot of questions and thanked her in the end.	11	4	11	4	The director asked the librarian a lot of questions and thanked her in the end.
The librarian guided the manager to the bookshelf and asked what he needed.	-1	-1	-1	-1	The librarian led the Manager to the bookstore and asked him what he needed.
The mover discussed with the nurse about the surgery and thanked her.	-1	5	-1	5	The engine argued with the nurse about the surgery and thanked her.
The nurse helped to send the mover to the hospital and kept comforting him.	-1	-1	-1	-1	The nurse helped send the engine to the hospital and keep it comforting.
The farmer drove the attendant to the railway station and gave her a gift.	-1	-1	-1	-1	The farmer drove the clerk to the train station and gave her a gift.
The attendant bought some fruit from the farmer and paid him by check.	10	7	-1	7	The clerk bought some fruit from the farmer and paid for it by check.
The developer consulted with the counselor for hours and paid her a lot of money.	-1	-1	-1	-1	The developer consulted the consultant for hours and paid her a lot of money.
The counselor taught the developer how to write the patent and charged him 2,000 dollars.	12	4	12	4	The councillor taught the developer how to write the patent and charged him 2,000 dollars.
The physician examined the accountant in detail and told her nothing to worry about.	9	4	9	4	The doctor examined the accountant in detail and told her nothing to worry about.
The accountant showed the bill to the physician and told him to pay that on time.	-1	-1	-1	-1	The accountant showed the bill to the doctor and told him to pay it on time.
The laborer saw the tailor at the corner and talked to her for 2 hours.	11	4	11	4	The worker saw the tailor at the corner and talked to her for 2 hours.
The tailor offered the laborer a new suit and charged him nothing.	-1	-1	-1	-1	The tailor offered the worker a new suit and he did not accused him anything.
The physician hired a housekeeper and told her to work every day.	7	4	7	4	The doctor hired a housekeeper and told her to work every day.
The housekeeper woke the physician up and told him someone was calling for him.	-1	-1	-1	-1	The housekeeper woke the doctor and told him someone was calling him.
The sheriff chatted with the tailor and invited her to dinner later.	8	5	8	5	The sheriff chatted with the tailor and invited her to dinner later.
The tailor finished the suit for the sheriff and called him.	-1	7	-1	7	The tailor finished the suit for the sheriff and called him.
The driver crashed into the designer 's artifact and paid her a lot.	-1	-1	-1	-1	The driver crashed into the designer's artifact and paid a lot for it.
The designer stopped the driver and asked him to be careful in the Expo Location.	7	4	7	4	The designer stopped the driver and asked him to be careful in the Expo location.
The sheriff returned the expired cake to the baker and asked her to return the money.	11	8	11	8	The sheriff returned the expired cake to the baker and asked her to return the money.
The baker packed the cake for the sheriff and waited for him to pay.	11	7	11	7	The baker made the cake for the sheriff and waited for him to pay.
The janitor asked the clerk how to find the meeting room and thanked her.	-1	4	-1	4	The caretaker asked the clerk how to find the meeting room and thank her.
The clerk told the janitor to clean up the meeting room and thanked him.	-1	4	-1	4	The clerk told the janitor to clean up the meeting room and thank him.
The developer did not find the attendant in the room and left her a note.	12	6	11	5	The developer couldn't find the attendant in the room and left her a note.
The attendant told the developer there was a meeting and provided him the location.	11	4	12	4	The attendant told the developer that there was a meeting and gave him the location.
The carpenter went to the writer 's house and fixed the window for her.	-1	-1	-1	-1	The carpenter went to the writer's house and stared at the window for her.
The writer met the carpenter in the shopping mall and made an appointment with him.	-1	4	-1	4	The writer met the carpenter in the mall and made an appointment with him.
The cook needed the attendant to be a taste tester and asked her.	-1	4	-1	4	The cook needed the attendant to be a taste tester and asked her.
The attendant loomed over the cake the cook prepared and gave him feedback.	-1	-1	-1	-1	The attendant loomed over the cake and gave him feedback.
