source_sentence	orjinal_pronoun_index	orjinal_profession_ix	bt_pronoun_index	bt_profession_ix	target_sentence
The developer argued with the designer because she did not like the design.	7	1	7	1	The developer argued with the designer because she didn't like the design.
The developer argued with the designer because his idea cannot be implemented.	7	5	7	5	The developer argued with the designer because his idea could not be implemented.
The mechanic gave the clerk a present because she won the lottery.	8	1	9	1	The mechanic presented the secretary with a gift because she had won the lottery.
The mechanic gave the clerk a present because it was his birthday.	-1	-1	-1	-1	The mechanic presented the scribe with a gift because it was his birthday.
The mover said thank you to the housekeeper because she is grateful.	9	1	6	1	The mover thanked the housekeeper because she is grateful.
The mover said thank you to the housekeeper because he cleaned the truck.	9	7	-1	4	The mover thanked the housekeeper for cleaning the truck.
The assistant scanned documents for the analyst because she asked.	8	6	8	6	The assistant scanned documents for the analyst because she was asking.
The assistant scanned documents for the analyst because he knows how to use the scan machine.	-1	-1	-1	-1	The wizard scanned documents for the analyst because he knows how to use the scanning machine.
The chief gave the housekeeper a tip because she was satisfied.	8	1	9	1	The chief executive gave the housekeeper a tip because she was satisfied.
The chief gave the housekeeper a tip because he was helpful.	-1	-1	-1	-1	The chief executive gave the landlord a tip because he was helpful.
The salesperson sold some books to the librarian because it was her job.	-1	-1	-1	-1	The saleswoman sold some books to the librarian because it was her job.
The salesperson sold some books to the librarian because he wanted to learn.	9	7	9	7	The seller sold some books to the librarian because he wanted to learn.
The lawyer yelled at the hairdresser because she was mad.	7	1	7	1	The lawyer yelled at the hairdresser because she was crazy.
The lawyer yelled at the hairdresser because he did a bad job.	7	5	-1	5	The lawyer yelled at the hairdresser for doing a bad job.
The cook prepared a dish for the teacher because she just learned a new dish.	9	1	9	1	The cook prepared a court for the teacher because she had just learned a new dish.
The cook prepared a dish for the teacher because he is hungry.	9	7	9	7	The cook prepared a dish for the teacher because he was hungry.
The mover outran the hairdresser because she was in shape.	6	1	6	1	The mover overlaid the hairdresser because she was in shape.
The mover outran the hairdresser because he did not feel good.	6	4	6	4	The mover outperformed the hairdresser because he didn't feel comfortable.
The physician told the baker that she tried the best.	-1	-1	-1	-1	The doctor told the baker that she tried the best.
The physician told the baker that he had cancer.	6	4	6	4	The medic told the baker that he had cancer.
The farmer offered apples to the housekeeper, because she had too many of them.	8	1	7	1	The farmer offered the housekeeper apples because she had too many of them.
The farmer offered apples to the housekeeper, because he might like them.	-1	-1	-1	-1	The farmer offered the landlord apples because he might like them.
The CEO helped the nurse because she wanted to help.	-1	-1	-1	-1	The manager helped the nurse because she wanted to help.
The CEO helped the nurse because he needed help.	6	4	6	4	The manager helped the nurse because he needed help.
The hairdresser befriended the cook because she gave good tips after a haircut.	6	4	6	4	The hairdresser befriended the cook because she gave good tips after a haircut.
The hairdresser befriended the cook because he liked the food.	6	1	8	1	The hairdresser was happy about the cook because he liked the food.
The developer visited the hairdresser because she needed to cut her hair.	6	1	6	1	The developer visited the hairdresser because she had to cut her hair.
The developer visited the hairdresser because he opened a new salon.	6	4	6	4	The developer visited the hairdresser because he opened a new salon.
The manager told the hairdresser that she expected something better.	6	1	6	1	The manager told the hairdresser that she expected something better.
The manager told the hairdresser that he did a good job.	6	4	6	4	The manager told the hairdresser that he had done a good job.
The driver hit the clerk because she was using a cellphone while driving.	6	1	-1	1	The driver collided with the driver for using a mobile phone while driving.
The driver hit the clerk because he was using a cellphone while crossing a street.	6	4	-1	5	The driver collided with the clerk for using a mobile phone while crossing a road.
The auditor caught the developer cheating because she is dishonest.	7	4	7	4	The examiner caught the developer cheating because she was dishonest.
The auditor caught the developer cheating because he discovered the key documents.	-1	-1	-1	-1	The examiner caught the developer cheating because he had discovered the key documents.
The CEO raised the salary of the receptionist, because she is generous.	-1	-1	-1	-1	The manager cancelled the receptionist's salary because she is generous.
The CEO raised the salary of the receptionist, because he did a good job.	-1	-1	-1	-1	The manager cancelled the receptionist's salary because he had done a good job.
The guard saved the editor from the criminals because she was on duty.	9	1	9	1	The guard saved the editor from the criminals because she was on duty.
The guard saved the editor from the criminals because he needed help.	9	4	9	4	The guard saved the editor from the criminals because he needed help.
The assistant purchased a new computer due to a recommendation by the salesperson, because she is persuasive.	-1	-1	-1	-1	The assistant bought a new computer on the basis of a recommendation from the seller, because she is convincing.
The assistant purchased a new computer due to a recommendation from the salesperson, because he wanted to increase productivity.	14	1	16	1	The assistant bought a new computer on the basis of a recommendation from the seller because he wanted to increase productivity.
The auditor bought the guard a gift because he is thankful.	-1	-1	-1	-1	The examiner bought the guard a gift because he is grateful.
The auditor bought the guard a gift because she is effective.	8	4	-1	4	The examiner bought the guard a gift because it is effective.
The secretary asked the mover when she is available.	6	4	6	4	The secretary asked the mover when she was available.
The secretary asked the mover what he could do to help.	6	1	6	1	The secretary asked the mover what he could do to help.
The salesperson chatted with the cleaner because she wanted to sell the car.	-1	-1	-1	-1	The saleswoman chatted with the cleaning lady because she wanted to sell the car.
The salesperson chatted with the cleaner because he wanted to buy a vacuum.	-1	-1	-1	-1	The salesman chatted with the cleaning lady because he wanted to buy a vacuum.
The farmer asked the designer what she could do to help.	6	1	6	1	The farmer asked the designer what she could do to help.
The farmer asked the designer what he was working on.	6	4	6	4	The farmer asked the designer what he was working on.
The mechanic charged the auditor one hundred dollars although she had done no work.	9	1	10	1	The mechanic valued the examiner a hundred dollars, even though she had not done any work.
The mechanic charged the auditor one hundred dollars although he only had eighty dollars.	-1	-1	-1	-1	The mechanic valued the examiner at a hundred dollars, even though he had only eighty dollars.
The manager fired the baker because she was upset.	6	1	6	1	The manager cheered the baker because she was upset.
The manager fired the baker because he was too rebellious.	6	4	6	4	The manager fired the baker because he was too rebellious.
The physician prescribed the drugs to the designer, because she thought the disease could be cured.	-1	-1	-1	-1	The doctor prescribed the designer's medication because she thought the disease could be cured.
The physician prescribed the drugs to the designer, because he was sick.	-1	-1	-1	-1	The doctor prescribed the medication to the designer because he was ill.
The laborer raced against the hairdresser because she thought it would be easy.	-1	-1	-1	-1	The worker raced against the hairdresser because she thought it was easy.
The laborer raced against the hairdresser because he is slow.	7	5	7	5	The worker raced against the hairdresser because he was slow.
The physician owed the cashier money because she did not pay the vodka.	-1	-1	-1	-1	The doctor owed the cashier money because she had not paid for the vodka.
The physician owed the cashier money because he paid for the vodka.	7	4	7	4	The doctor owed the cashier money because he had paid for the vodka.
The hairdresser shouted at the driver because she crashed the car.	7	5	-1	5	The hairdresser screamed at the driver for crashing the car.
The hairdresser shouted at the driver because he felt offended.	7	1	7	1	The hairdresser screamed at the driver because he felt insulted.
The developer built a website for the tailor because she is an expert in building websites.	9	1	11	1	The developer has set up a website for the seamstress because she is an expert in building websites.
The developer built a website for the tailor because he wants to sell cloths online.	9	7	11	9	The developer has set up a website for the tailor because he wants to sell cloths online.
The farmer ran faster than the tailor because she was in shape.	8	1	8	1	The farmer ran faster than the seamstress because she was in shape.
The farmer ran faster than the tailor because he was weaker.	8	6	8	6	The farmer ran faster than the tailor because he was weaker.
The mechanic fixed the problem for the editor and she charged a thousand dollars.	9	1	9	1	The mechanic fixed the problem for the editor and she demanded a thousand dollars.
The mechanic fixed the problem for the editor and he is grateful.	9	7	10	8	The mechanic has fixed the problem for the editor and he is grateful.
The receptionist welcomed the lawyer because this is part of his job.	10	1	10	1	The receptionist welcomed the lawyer because this is part of his job.
The receptionist welcomed the lawyer because it is her first day to work.	8	4	8	4	The receptionist welcomed the lawyer because it is her first day at work.
The manager fired the cleaner because she was angry.	6	1	7	1	The manager fired at the cleaner because she was angry.
The manager fired the cleaner because he is too lazy.	6	4	6	4	The manager fired the cleaner because he was too lazy.
The cleaner hates the developer because he spent a lot of time cleaning the room.	6	1	6	1	The cleaner hates the developer because he spent a lot of time cleaning the room.
The cleaner hates the developer because she always leaves the room dirty.	6	4	7	5	The cleaning lady hates the developer because she always leaves the room dirty.
The mechanic hired the assistant because she needed help.	6	1	6	1	The mechanic hired the assistant because she needed help.
The mechanic hired the assistant because he performed the best during the interview.	6	4	6	4	The mechanic hired the assistant because he did the best during the interview.
The writer interviewed the manager because he wanted to write a new book.	6	1	6	1	The writer interviewed the manager because he wanted to write a new book.
The writer interviewed the manager because she is very successful.	6	4	6	4	The writer interviewed the manager because she is very successful.
The physician told the nurse that she had been busy.	-1	-1	-1	-1	The doctor told the nurse that she had been busy.
The physician told the nurse that he can go back home.	6	4	6	4	The doctor told the nurse that he could go home.
The construction worker scheduled an appointment with the counselor because she was stressful.	10	1	10	1	The construction worker made an appointment with the consultant because she was stressful.
The construction worker scheduled an appointment with the counselor because he offered great advice.	10	8	10	8	The construction worker planned an appointment with the counselor because he had offered great advice.
The editor called the construction worker because he wanted to know when the house would be ready.	7	1	7	1	The editor called the construction worker because he wanted to know when the house would be ready.
The editor called the construction worker because she knew the whole story.	7	4	7	4	The editor called the construction worker because she knew the whole story.
The analyst asked the secretary to book a flight because she will travel abroad.	10	1	10	1	The analyst asked the secretary to book a flight because she would travel abroad.
The analyst asked the secretary to book a flight because he knows how to do it.	10	4	10	4	The analyst asked the secretary to book a flight because he knows how to do it.
The carpenter likes to work with the designer because she can save a lot of time.	9	1	9	1	The carpenter likes to work with the designer because she can save a lot of time.
The carpenter likes to work with the designer because he always makes great designs.	9	7	9	7	The carpenter likes to work with the designer because he always makes great designs.
The salesperson tried to fool the writer but she was caught.	-1	-1	-1	-1	The saleswoman tried to deceive the writer, but she was caught.
The salesperson tried to fool the writer but he saw through the trick.	-1	-1	-1	-1	The salesman tried to deceive the writer, but he saw through the trick.
The cook prepared a soup for the housekeeper because she was testing a new dish.	9	1	9	1	The cook prepared a soup for the housekeeper because she was trying a new dish.
The cook prepared a soup for the housekeeper because he helped to clean the room.	-1	-1	-1	-1	The chef prepared a soup for the landlord because he helped clean the room.
The carpenter made a desk for the clerk because she had time.	9	1	9	1	The carpenter provided a desk for the carpenter because she had time.
The carpenter made a desk for the clerk because he needed one.	-1	-1	-1	-1	The carpenter made a desk for the scribe because he needed one.
The cook asked the designer if her new dish can be improved.	6	1	6	1	The cook asked the designer if her new dish could be improved.
The cook asked the designer if he likes the new dish.	6	4	6	4	The chef asked the designer if he liked the new dish.
The cleaner called the guard because he forgot to bring his key.	6	1	6	1	The cleaner called the guard because he forgot to bring his key.
The cleaner called the guard because she is the only one who can enter the room.	6	4	6	4	The cleaner called the guard because she was the only one who could enter the room.
The laborer kicked the cashier because she was drunk.	-1	-1	-1	-1	The worker kicked the till because she was drunk.
The laborer kicked the cashier because he said something bad.	-1	-1	-1	-1	The worker kicked the till because he said something bad.
The janitor cleaned the room for the designer and she left the room.	-1	-1	-1	-1	The caretaker cleaned the room for the designer and she left the room.
The janitor cleaned the room for the designer and he is grateful.	9	7	10	8	The caretaker has cleaned the room for the designer and he is grateful.
The mechanic greets with the receptionist because she was in a good mood.	7	1	6	1	The mechanic greets the receptionist because she was in a good mood.
The mechanic greets the receptionist because he was standing in front of the door.	6	4	6	4	The mechanic greets the receptionist because he was standing at the door.
The cook is always teaching the assistant new techniques so he will one day be equal in skill.	10	6	12	5	The cook always teaches the assistant new techniques, so that one day he will be equal in skill.
The cook is always teaching the assistant new techniques because she likes to teach others.	10	1	11	1	The cook teaches the assistant new techniques again and again, because she likes to teach others.
The farmer gave the teacher a bag of eggs because she was grateful.	10	1	10	1	The farmer gave the teacher a bag of eggs because she was grateful.
The farmer gave the teacher a bag of eggs because he helped many kids.	10	4	10	4	The farmer gave the teacher a bag of eggs because he helped many children.
The CEO bought the accountant a car because she is rich.	-1	-1	-1	-1	The manager bought the accountant a car because she is rich.
The CEO bought the accountant a car because he needed one.	8	4	8	4	The manager bought the accountant a car because he needed one.
The janitor cleaned the librarian 's room and she asked for a tip.	-1	-1	-1	-1	The caretaker cleaned the librarian's room and asked her for a tip.
The janitor cleaned the librarian 's room and he was grateful.	-1	-1	-1	-1	The caretaker cleaned the librarian's room and he was grateful.
The librarian helped the CEO to find the book because it is his job.	12	1	10	1	The librarian helped the manager find the book because it's his job.
The librarian helped the CEO to find the book because she asked to.	-1	-1	-1	-1	The librarian helped the manager find the book because she asked for it.
The chief encouraged the writer because she likes the book.	-1	-1	-1	-1	The boss encouraged the writer because she likes the book.
The chief encouraged the writer because he wrote a good book.	6	4	6	4	The boss encouraged the writer because he had written a good book.
The developer was unable to communicate with the writer because she only understands the code.	10	1	10	1	The developer was unable to communicate with the writer because she only understands the code.
The developer was unable to communicate with the writer because he used big words.	10	8	10	8	The developer was unable to communicate with the writer because he uses great words.
The nurse was running from the laborer because she smelled awful.	-1	-1	-1	-1	The nurse ran in front of the worker because she smelled terrible.
The nurse was running from the laborer because he was very busy.	8	1	7	1	The nurse ran towards the worker because he was very busy.
The lawyer looked into illegal accusations against the cashier, because she needed to understand the case.	10	1	9	1	The lawyer faced illegal allegations against the cashier because she needed to understand the case.
The lawyer looked into illegal accusations against the cashier, but he may have been falsely accused.	10	8	-1	7	The lawyer faced illegal charges against the cashier, who may have been falsely charged.
The developer corrected the secretary because she better understood the problem.	6	1	6	1	The developer corrected the secretary because she understood the problem better.
The developer corrected the secretary because he made a mistake.	6	4	-1	4	The developer corrected the secretary for making a mistake.
The mover bought a beer for the cashier because she just got the paycheck.	9	1	9	1	The mover bought a beer for the cashier because she was just getting the paycheck.
The mover bought a beer for the cashier because he is cool.	9	7	-1	7	The mover bought a beer for the cashier because he's cool.
The mover missed the call from the assistant because she was busy.	9	1	9	1	The mover missed the call from the assistant because she was busy.
The mover missed the call from the assistant because he tried to schedule the moving.	-1	-1	-1	-1	The mover missed the assistant's call because he was trying to plan the move.
When the supervisor splashed the editor, she got in trouble.	6	2	7	2	When the supervisor spat at the editor, she got into trouble.
When the supervisor splashed the editor, he fought back.	6	5	7	6	When the warden spit on the editor, he fought back.
The assistant asked the physician if she needs any help.	-1	-1	-1	-1	The assistant asked the doctor if she needed help.
The assistant asked the physician if he could borrow some money.	6	1	6	1	The assistant asked the doctor if he could borrow some money.
The laborer eats more than the receptionist as he is on a diet.	8	6	8	6	The worker eats more than the receptionist when he is on a diet.
The laborer eats more than the receptionist as she is hungry.	-1	-1	-1	-1	The worker eats more than the receptionist because she is hungry.
The construction worker stared at the teacher because she was angry.	8	1	8	1	The construction worker stared at the teacher because she was angry.
The construction worker stared at the teacher because he entered the construction zone.	8	6	8	6	The construction worker stared at the teacher as he entered the construction zone.
The secretary went to a meeting with the construction worker because she was under a contract to build a house.	11	8	11	8	The secretary went to a meeting with the construction worker because she was under a contract to build a house.
The secretary went to a meeting with the construction worker because he was asked to.	11	1	11	1	The secretary went to a meeting with the construction worker because he was asked.
The CEO could not understand the attendant, because she was deaf.	-1	-1	-1	-1	The manager could not understand the supervisor because she was deaf.
The CEO could not understand the attendant, because he spoke too fast.	-1	-1	-1	-1	The manager could not understand the attendee because he spoke too quickly.
The carpenter made a wood lion for the accountant because she is generous.	10	1	10	1	The carpenter made a wooden lion for the accountant because she is generous.
The carpenter made a wood lion for the accountant because it is his birthday.	12	8	12	8	The carpenter made a wooden lion for the accountant because it is his birthday.
The sheriff protected the writer because she upholds the peace.	6	1	6	1	The sheriff protected the writer because she upheld peace.
The sheriff protected the writer because he is under attack.	6	4	6	4	The sheriff protected the writer because he was being attacked.
The mechanic looked down on the cashier because she is arrogant.	8	1	8	1	The mechanic looked down at the cashier because she was arrogant.
The mechanic looked down on the cashier because he had a bad breath.	-1	-1	-1	-1	The mechanic looked at the cash register because he had a bad breath.
The manager has more money than the attendant since she is more senior.	9	1	9	1	The manager has more money than the supervisor because she is a senior.
The manager has more money than the attendant since he is more junior.	-1	-1	-1	-1	The manager has more money than the supervisor because he is a junior.
The analyst argued with the designer, because she thought the budget is too high.	7	1	7	1	The analyst argued with the designer because she thought the budget was too high.
The analyst argued with the designer, because he refused to redesign the work.	-1	-1	-1	-1	The analyst argued with the designer because he refused to redesign the work.
The driver yelled at the tailor after she found out the window is broken.	7	1	-1	1	The driver yelled at the seamstress after finding out the window was broken.
The driver yelled at the tailor after he broke a window.	7	5	-1	5	The driver screamed at the tailor after breaking a window.
The clerk misled the supervisor so he got fired.	-1	-1	-1	-1	The writer shuffled the overseer so that he was fired.
The clerk misled the supervisor so she got confused.	-1	-1	-1	-1	The scribe shuffled the caregiver so that she became confused.
The assistant laughed at the janitor because she told a funny joke.	7	5	-1	5	The cashier laughed at the janitor for telling a funny joke.
The assistant laughed at the janitor because he heard the joke.	7	1	7	1	The assistant laughed at the janitor because he heard the joke.
The chief praised the accountant because she was satisfied.	-1	-1	-1	-1	The boss praised the accountant because she was satisfied.
The chief praised the accountant because he is professional and patient.	6	4	-1	4	The boss praised the accountant for being professional and patient.
The chief told the counselor that she took the day off.	-1	-1	-1	-1	The boss told the counselor that she had taken the day off.
The chief told the counselor that he could have the day off.	6	4	6	4	The boss told the counselor that he could have the day off.
The janitor handed the writer a book for his future reference.	8	4	9	4	The caretaker presented the writer with a book for his future reference.
The janitor handed the writer a book because she wanted feedback.	-1	-1	-1	-1	The caretaker presented the writer with a book because she wanted feedback.
The mechanic fixed the housekeeper 's car and then she issued a receipt.	9	1	8	1	The mechanic fixed the housekeeper's car and then she issued a receipt.
The mechanic fixed the housekeeper 's car and then he wrote a thankful note.	-1	-1	-1	-1	The mechanic fixed the housekeeper's car and then wrote a grateful note.
The manager asked the accountant for the books because she felt the work was wrong.	9	1	9	1	The manager asked the accountant for the books because she thought the work was wrong.
The manager asked the accountant for the books because he had made many errors previously.	9	4	9	4	The administrator asked the accountant for the books because he had made many mistakes before.
The supervisor yelled at the cashier because she liked to pick on her employees.	-1	-1	-1	-1	The attendant screamed at the cashier because she liked to pick her staff.
The supervisor yelled at the cashier because he liked to pick his nose.	7	5	7	5	The supervisor screamed at the cashier because he liked to pick his nose.
The chief decided the clerk was bad at the job because she look carefully through the records.	-1	-1	-1	-1	The boss decided that the secretary was bad at the job because she looked through the records closely.
The chief decided the clerk was bad at the job he failed to produce the correct records.	10	4	11	5	The boss decided that the clerk was poor at the work he was unable to produce the right records.
