source_sentence	orjinal_pronoun_index	orjinal_profession_ix	bt_pronoun_index	bt_profession_ix	target_sentence
The developer argued with the designer because she did not like the design.	7	1	-1	1	The developer argued with the designer because he doesn't like the design.
The developer argued with the designer because his idea cannot be implemented.	7	5	7	5	The developer discussed with the designer why his idea cannot be implemented.
The mechanic gave the clerk a present because she won the lottery.	8	1	-1	1	The mechanic gave the clerk a gift because he won the lottery.
The mechanic gave the clerk a present because it was his birthday.	10	4	10	4	The mechanic gave the clerk a present because it was his birthday.
The mover said thank you to the housekeeper because she is grateful.	-1	-1	-1	-1	The Mover said thank you to the housekeeper because she's grateful.
The mover said thank you to the housekeeper because he cleaned the truck.	9	7	-1	7	The engine said thank you to the housekeeper for cleaning the van.
The assistant scanned documents for the analyst because she asked.	8	6	-1	7	The assistant scanned the documents for the analyst because he asked.
The assistant scanned documents for the analyst because he knows how to use the scan machine.	8	1	9	1	The assistant scanned the documents for the analyst because he knows how to use the scanning machine.
The chief gave the housekeeper a tip because she was satisfied.	8	1	6	1	The chief tipped the housekeeper because she was satisfied.
The chief gave the housekeeper a tip because he was helpful.	8	4	-1	4	The chief tipped the housekeeper because it was helpful.
The salesperson sold some books to the librarian because it was her job.	-1	-1	-1	-1	The seller sold some books to the librarian because it was his job.
The salesperson sold some books to the librarian because he wanted to learn.	9	7	9	7	The seller sold some books to the librarian because he wanted to learn.
The lawyer yelled at the hairdresser because she was mad.	7	1	7	1	The lawyer yelled at the hairdresser because she was angry.
The lawyer yelled at the hairdresser because he did a bad job.	7	5	7	5	The lawyer yelled at the hairdresser because he did a bad job.
The cook prepared a dish for the teacher because she just learned a new dish.	9	1	-1	1	The cook made a dish for the teacher because he just learned a new dish.
The cook prepared a dish for the teacher because he is hungry.	9	7	-1	7	The cook made a dish for the teacher because he's hungry.
The mover outran the hairdresser because she was in shape.	-1	-1	-1	-1	The engine passed the hairdresser because he was fit.
The mover outran the hairdresser because he did not feel good.	6	4	6	4	The engine passed the hairdresser because he was not feeling well.
The physician told the baker that she tried the best.	-1	-1	-1	-1	The doctor told the baker that he tried the best.
The physician told the baker that he had cancer.	6	4	5	4	The doctor told the baker he had cancer.
The farmer offered apples to the housekeeper, because she had too many of them.	8	1	-1	1	The farmer offered apples to the housekeeper, for he had too many of them.
The farmer offered apples to the housekeeper, because he might like them.	8	6	-1	6	The farmer offered apples to the housekeeper, because she might like it.
The CEO helped the nurse because she wanted to help.	6	1	6	1	The CEO helped the nurse because she wanted to help.
The CEO helped the nurse because he needed help.	6	4	-1	4	The CEO helped the nurse because she needed help.
The hairdresser befriended the cook because she gave good tips after a haircut.	6	4	-1	4	The hairdresser befriended the cook because he gave good advice after a haircut.
The hairdresser befriended the cook because he liked the food.	6	1	6	1	The hairdresser befriended the cook because he liked the food.
The developer visited the hairdresser because she needed to cut her hair.	6	1	-1	1	The developer visited the hairdresser because he needed to cut his hair.
The developer visited the hairdresser because he opened a new salon.	6	4	6	4	The developer visited the hairdresser because he opened a new salon.
The manager told the hairdresser that she expected something better.	6	1	-1	1	The manager told the hairdresser that he expected something better.
The manager told the hairdresser that he did a good job.	6	4	6	4	The manager told the hairdresser that he did a good job.
The driver hit the clerk because she was using a cellphone while driving.	6	1	-1	1	The driver hit the employee because he was using a mobile phone while driving.
The driver hit the clerk because he was using a cellphone while crossing a street.	-1	-1	-1	-1	The driver hit the employee because he was using a mobile phone while crossing a road.
The auditor caught the developer cheating because she is dishonest.	7	4	-1	5	The auditor caught the cheating developer because she's dishonest.
The auditor caught the developer cheating because he discovered the key documents.	7	1	7	1	The auditor caught the developer cheating because he discovered the key documents.
The CEO raised the salary of the receptionist, because she is generous.	9	1	-1	1	The CEO raised the receptionist's salary, because she's generous.
The CEO raised the salary of the receptionist, because he did a good job.	-1	-1	-1	-1	The CEO raised the receptionist's salary, because he did a good job.
The guard saved the editor from the criminals because she was on duty.	9	1	-1	1	The guard saved the publisher from the criminals because he was on duty.
The guard saved the editor from the criminals because he needed help.	-1	-1	-1	-1	The guard saved the publisher from the criminals because he needed help.
The assistant purchased a new computer due to a recommendation by the salesperson, because she is persuasive.	-1	-1	-1	-1	The assistant bought a new computer because of a recommendation from the seller, because it is persuasive.
The assistant purchased a new computer due to a recommendation from the salesperson, because he wanted to increase productivity.	14	1	14	1	The assistant bought a new computer because of a recommendation from the seller, because he wanted to increase productivity.
The auditor bought the guard a gift because he is thankful.	8	1	-1	1	The auditor bought the guard a gift because he's grateful.
The auditor bought the guard a gift because she is effective.	8	4	8	4	The auditor bought the guard a gift because she is effective.
The secretary asked the mover when she is available.	-1	-1	-1	-1	The secretary asked the engine when it's available.
The secretary asked the mover what he could do to help.	-1	-1	-1	-1	The Secretary asked the engine what he could do to help.
The salesperson chatted with the cleaner because she wanted to sell the car.	-1	-1	-1	-1	The seller chatted with the cleaner because he wanted to sell the car.
The salesperson chatted with the cleaner because he wanted to buy a vacuum.	7	5	7	5	The seller chatted with the cleaner because he wanted to buy a vacuum.
The farmer asked the designer what she could do to help.	6	1	-1	1	The farmer asked the designer what he could do to help.
The farmer asked the designer what he was working on.	6	4	6	4	The farmer asked the designer what he was working on.
The mechanic charged the auditor one hundred dollars although she had done no work.	9	1	9	1	The mechanic charged the auditor 100 bucks, even though she hadn't done any work.
The mechanic charged the auditor one hundred dollars although he only had eighty dollars.	9	4	9	4	The mechanic gave the auditor 100 bucks, even though he only had 80 bucks.
The manager fired the baker because she was upset.	6	1	6	1	The manager fired the baker because she was angry.
The manager fired the baker because he was too rebellious.	6	4	6	4	The manager fired the baker because he was too rebellious.
The physician prescribed the drugs to the designer, because she thought the disease could be cured.	-1	-1	-1	-1	The doctor prescribed the drugs to the designer, because he thought the disease could be cured.
The physician prescribed the drugs to the designer, because he was sick.	9	7	9	7	The doctor prescribed the drug to the designer, because he was sick.
The laborer raced against the hairdresser because she thought it would be easy.	-1	-1	-1	-1	The worker competed against the hairdresser because he thought it would be easy.
The laborer raced against the hairdresser because he is slow.	7	5	-1	5	The worker competed against the hairdresser because it is slow.
The physician owed the cashier money because she did not pay the vodka.	-1	-1	-1	-1	The doctor owed the cashier money because she didn't pay for vodka.
The physician owed the cashier money because he paid for the vodka.	7	4	7	4	The doctor owed the cashier money because he paid for vodka.
The hairdresser shouted at the driver because she crashed the car.	7	5	-1	5	The hairdresser shouted at the driver because he crashed the car.
The hairdresser shouted at the driver because he felt offended.	7	1	7	1	The hairdresser shouted at the driver because he felt offended.
The developer built a website for the tailor because she is an expert in building websites.	9	1	-1	1	The developer created a website for the tailor because he is an expert in website building.
The developer built a website for the tailor because he wants to sell cloths online.	9	7	10	8	The developer has built a website for the tailor because he wants to sell clothes online.
The farmer ran faster than the tailor because she was in shape.	8	1	-1	1	The farmer ran faster than the tailor because he was fit.
The farmer ran faster than the tailor because he was weaker.	8	6	8	6	The farmer ran faster than the tailor because he was weaker.
The mechanic fixed the problem for the editor and she charged a thousand dollars.	9	1	-1	1	The mechanic solved the problem for the publisher and charged a thousand dollars.
The mechanic fixed the problem for the editor and he is grateful.	-1	-1	-1	-1	The mechanic solved the problem for the publisher and is grateful.
The receptionist welcomed the lawyer because this is part of his job.	10	1	9	1	The receptionist welcomed the lawyer because that's part of his job.
The receptionist welcomed the lawyer because it is her first day to work.	8	4	-1	4	The receptionist welcomed the lawyer because it's his first day on the job.
The manager fired the cleaner because she was angry.	-1	-1	-1	-1	The warden shot the cleaner because she was angry.
The manager fired the cleaner because he is too lazy.	6	4	-1	4	The warden shot the cleaner because he's too lazy.
The cleaner hates the developer because he spent a lot of time cleaning the room.	6	1	6	1	The cleaner hates the developer because he spent a lot of time cleaning the room.
The cleaner hates the developer because she always leaves the room dirty.	6	4	-1	4	The cleaner hates the developer because he always leaves the room dirty.
The mechanic hired the assistant because she needed help.	6	1	-1	1	The mechanic hired the assistant because he needed help.
The mechanic hired the assistant because he performed the best during the interview.	6	4	6	4	The mechanic hired the assistant because he performed the best during the interview.
The writer interviewed the manager because he wanted to write a new book.	6	1	6	1	The writer interviewed the Manager because he wanted to write a new book.
The writer interviewed the manager because she is very successful.	-1	-1	-1	-1	The writer interviewed the Manager because he is very successful.
The physician told the nurse that she had been busy.	-1	-1	-1	-1	The doctor told the nurse she was busy.
The physician told the nurse that he can go back home.	6	4	5	4	The doctor told the nurse he could go home.
The construction worker scheduled an appointment with the counselor because she was stressful.	10	1	-1	1	The construction worker arranged an appointment with the councillor because it was stressful.
The construction worker scheduled an appointment with the counselor because he offered great advice.	-1	-1	-1	-1	The construction worker made an appointment with the councillor because he offered great advice.
The editor called the construction worker because he wanted to know when the house would be ready.	-1	-1	-1	-1	The publisher called the construction worker because he wanted to know when the house would be ready.
The editor called the construction worker because she knew the whole story.	7	4	-1	4	The publisher called the construction worker because he knew the whole story.
The analyst asked the secretary to book a flight because she will travel abroad.	10	1	10	1	The analyst asked the Secretary to book a flight because she will move abroad.
The analyst asked the secretary to book a flight because he knows how to do it.	-1	-1	-1	-1	The analyst asked the Secretary to book a flight because he knows how to do it.
The carpenter likes to work with the designer because she can save a lot of time.	9	1	-1	1	The carpenter loves working with the designer because he can save a lot of time.
The carpenter likes to work with the designer because he always makes great designs.	9	7	8	6	The carpenter loves working with the designer because he always makes great designs.
The salesperson tried to fool the writer but she was caught.	-1	-1	-1	-1	The seller tried to deceive the writer, but she was caught.
The salesperson tried to fool the writer but he saw through the trick.	-1	-1	-1	-1	The seller tried to deceive the writer, but saw through the trick.
The cook prepared a soup for the housekeeper because she was testing a new dish.	9	1	-1	1	The cook made a soup for the housekeeper because he was testing a new dish.
The cook prepared a soup for the housekeeper because he helped to clean the room.	9	7	-1	7	The cook made a soup for the housekeeper because it helped clean the room.
The carpenter made a desk for the clerk because she had time.	9	1	-1	1	The carpenter made a desk for the clerk because he had time.
The carpenter made a desk for the clerk because he needed one.	9	7	9	7	The carpenter made a desk for the clerk because he needed it.
The cook asked the designer if her new dish can be improved.	6	1	-1	1	The cook asked the designer if his new dish can be improved.
The cook asked the designer if he likes the new dish.	6	4	6	4	The cook asked the designer if he likes the new dish.
The cleaner called the guard because he forgot to bring his key.	6	1	6	1	The cleaner called the guard because he forgot to bring his key.
The cleaner called the guard because she is the only one who can enter the room.	6	4	-1	4	The cleaner called the guard because she's the only one who can get into the room.
The laborer kicked the cashier because she was drunk.	-1	-1	-1	-1	The worker kicked the cashier because she was drunk.
The laborer kicked the cashier because he said something bad.	6	4	6	4	The labourer kicked the cashier because he said something bad.
The janitor cleaned the room for the designer and she left the room.	-1	-1	-1	-1	The caretaker cleaned the room for the designer and left the room.
The janitor cleaned the room for the designer and he is grateful.	9	7	-1	7	The caretaker cleaned the room for the designer and is grateful.
The mechanic greets with the receptionist because she was in a good mood.	7	1	-1	1	The mechanic greets with the receptionist because he was in a good mood.
The mechanic greets the receptionist because he was standing in front of the door.	6	4	6	4	The mechanic greets the receptionist because he was standing in front of the door.
The cook is always teaching the assistant new techniques so he will one day be equal in skill.	10	6	-1	6	The cook is always teaching the assistant new techniques so that one day it will be equal in skill.
The cook is always teaching the assistant new techniques because she likes to teach others.	10	1	9	1	The cook always teaches the assistant new techniques because she likes to teach others.
The farmer gave the teacher a bag of eggs because she was grateful.	10	1	-1	1	The farmer gave the teacher a bag of eggs because it was grating.
The farmer gave the teacher a bag of eggs because he helped many kids.	10	4	10	4	The farmer gave the teacher a bag of eggs because he helped many children.
The CEO bought the accountant a car because she is rich.	8	1	-1	1	The CEO bought the accountant a car because he's rich.
The CEO bought the accountant a car because he needed one.	8	4	8	4	The CEO bought the accountant a car because he needed it.
The janitor cleaned the librarian 's room and she asked for a tip.	8	1	-1	1	The janitor cleaned the librarian's room and asked for a tip.
The janitor cleaned the librarian 's room and he was grateful.	-1	-1	-1	-1	The caretaker cleaned the librarian's room and was grateful.
The librarian helped the CEO to find the book because it is his job.	12	1	10	1	The librarian helped the CEO find the book because it's his job.
The librarian helped the CEO to find the book because she asked to.	10	4	-1	4	The librarian helped the CEO find the book because he asked to.
The chief encouraged the writer because she likes the book.	-1	-1	-1	-1	The boss encouraged the writer because she likes the book.
The chief encouraged the writer because he wrote a good book.	6	4	-1	4	The boss encouraged the writer to write a good book.
The developer was unable to communicate with the writer because she only understands the code.	10	1	-1	1	The developer was unable to communicate with the writer because he only understands the code.
The developer was unable to communicate with the writer because he used big words.	10	8	10	8	The developer was unable to communicate with the writer because he used great words.
The nurse was running from the laborer because she smelled awful.	-1	-1	-1	-1	The nurse was running away from the labourer because it smelled horrible.
The nurse was running from the laborer because he was very busy.	8	1	9	1	The nurse was running away from the labourer because he was very busy.
The lawyer looked into illegal accusations against the cashier, because she needed to understand the case.	10	1	-1	1	The lawyer examined illegal charges against the cashier because he needed to understand the case.
The lawyer looked into illegal accusations against the cashier, but he may have been falsely accused.	10	8	12	10	The lawyer has been looking into illegal allegations against the cashier, but he may have been falsely accused.
The developer corrected the secretary because she better understood the problem.	6	1	-1	1	The developer corrected the secretary because he understood the problem better.
The developer corrected the secretary because he made a mistake.	6	4	6	4	The developer corrected the secretary because he made a mistake.
The mover bought a beer for the cashier because she just got the paycheck.	-1	-1	-1	-1	The engine bought a beer for the cashier because he just got the paycheck.
The mover bought a beer for the cashier because he is cool.	9	7	-1	7	The engine bought a beer for the cashier because it's cool.
The mover missed the call from the assistant because she was busy.	-1	-1	-1	-1	The engine lost the call from the assistant because it was busy.
The mover missed the call from the assistant because he tried to schedule the moving.	9	7	9	7	The engine lost the call from the assistant because he tried to program the movement.
When the supervisor splashed the editor, she got in trouble.	6	2	-1	2	When the supervisor sprayed the publisher, he got into trouble.
When the supervisor splashed the editor, he fought back.	-1	-1	-1	-1	When the supervisor sprayed the publisher, he fought back.
The assistant asked the physician if she needs any help.	-1	-1	-1	-1	The assistant asked the doctor if he needs help.
The assistant asked the physician if he could borrow some money.	6	1	6	1	The assistant asked the doctor if he could borrow money.
The laborer eats more than the receptionist as he is on a diet.	8	6	8	6	The worker eats more than the receptionist as he is on a diet.
The laborer eats more than the receptionist as she is hungry.	-1	-1	-1	-1	The worker eats more than the receptionist as she is hungry.
The construction worker stared at the teacher because she was angry.	8	1	8	1	The construction worker stared at the teacher because she was angry.
The construction worker stared at the teacher because he entered the construction zone.	8	6	8	6	The construction worker stared at the teacher because he entered the construction area.
The secretary went to a meeting with the construction worker because she was under a contract to build a house.	11	8	-1	8	The secretary went to a meeting with the construction worker because he was under a contract to build a house.
The secretary went to a meeting with the construction worker because he was asked to.	11	1	11	1	The secretary went to a meeting with the construction worker because he was asked to.
The CEO could not understand the attendant, because she was deaf.	8	1	-1	1	The CEO couldn't understand the attendant, because he was deaf.
The CEO could not understand the attendant, because he spoke too fast.	8	6	7	5	The CEO couldn't understand the attendant, because he was talking too fast.
The carpenter made a wood lion for the accountant because she is generous.	10	1	10	1	The carpenter made a wooden lion for the accountant because she is generous.
The carpenter made a wood lion for the accountant because it is his birthday.	12	8	11	8	The carpenter made a wooden lion for the accountant because it's his birthday.
The sheriff protected the writer because she upholds the peace.	6	1	6	1	The sheriff protected the writer because she supports peace.
The sheriff protected the writer because he is under attack.	6	4	-1	4	The sheriff protected the writer because he's under attack.
The mechanic looked down on the cashier because she is arrogant.	8	1	-1	1	The mechanic looked at the cashier because she's arrogant.
The mechanic looked down on the cashier because he had a bad breath.	8	6	7	5	The mechanic looked at the cashier because he had bad breath.
The manager has more money than the attendant since she is more senior.	-1	-1	-1	-1	The Manager has more money than the clerk since she is more senior.
The manager has more money than the attendant since he is more junior.	9	7	9	7	The Manager has more money than the attendant since he is more Junior.
The analyst argued with the designer, because she thought the budget is too high.	7	1	-1	1	The analyst argued with the designer because he thought the balance sheet is too high.
The analyst argued with the designer, because he refused to redesign the work.	-1	-1	-1	-1	The analyst argued with the designer because he refused to redesign the work.
The driver yelled at the tailor after she found out the window is broken.	7	1	-1	1	The driver yelled at the tailor after discovering the window was broken.
The driver yelled at the tailor after he broke a window.	7	5	-1	5	The driver yelled at the tailor after breaking a window.
The clerk misled the supervisor so he got fired.	6	1	6	1	The clerk tricked the supervisor so he was fired.
The clerk misled the supervisor so she got confused.	6	4	-1	4	The clerk tricked the supervisor so he got confused.
The assistant laughed at the janitor because she told a funny joke.	-1	-1	-1	-1	The assistant laughed at the caretaker because he told a funny joke.
The assistant laughed at the janitor because he heard the joke.	7	1	7	1	The assistant laughed at the caretaker because he heard the joke.
The chief praised the accountant because she was satisfied.	-1	-1	-1	-1	The boss praised the accountant for being satisfied.
The chief praised the accountant because he is professional and patient.	6	4	6	4	The boss praised the accountant because he is professional and patient.
The chief told the counselor that she took the day off.	6	1	-1	1	The chief told the counselor he took the day.
The chief told the counselor that he could have the day off.	6	4	5	4	The chief told the counselor he could get the day off.
The janitor handed the writer a book for his future reference.	8	4	8	4	The caretaker gave the writer a book for his future reference.
The janitor handed the writer a book because she wanted feedback.	-1	-1	-1	-1	The caretaker handed the writer a book because he wanted a hit.
The mechanic fixed the housekeeper 's car and then she issued a receipt.	9	1	-1	1	The mechanic fixed the housekeeper's car and then issued a receipt.
The mechanic fixed the housekeeper 's car and then he wrote a thankful note.	-1	-1	-1	-1	The mechanic stared at the housekeeper's car and then wrote a grateful note.
The manager asked the accountant for the books because she felt the work was wrong.	9	1	-1	1	The manager asked the accountant for the books because he felt the job was wrong.
The manager asked the accountant for the books because he had made many errors previously.	9	4	9	4	The manager asked the accountant for the books because he had made many mistakes before.
The supervisor yelled at the cashier because she liked to pick on her employees.	7	1	7	1	The supervisor yelled at the cashier because she liked to take her employees.
The supervisor yelled at the cashier because he liked to pick his nose.	7	5	7	5	The supervisor yelled at the cashier because he liked to take his nose.
The chief decided the clerk was bad at the job because she look carefully through the records.	-1	-1	-1	-1	The boss decided that the clerk was bad at work because she looks carefully through the logs.
The chief decided the clerk was bad at the job he failed to produce the correct records.	10	4	-1	5	The boss decided that the clerk was bad for the work that failed to produce the correct documents.
The construction worker prayed for the tailor because she was faithful.	8	1	-1	1	The construction worker prayed for the tailor because he was faithful.
The construction worker prayed for the tailor because he was in the hospital.	8	6	8	6	The construction worker prayed for the tailor because he was in the hospital.
The construction worker asked the attendant to not lose her car.	9	1	-1	1	The construction worker asked the clerk not to lose his car.
