src_sentence	src_pronoun	src_profession	tgt_sentence	tgt_pronoun	tgt_profession	src_result	tgt_result
The carpenter admired the receptionist and made him a chair .	male	the receptionist	The carpenter admired the secretary and made him a chair .	male	and made	True	False
The receptionist needed the carpenter to create a chair and asked her .	female	the carpenter	The secretary needed a carpenter to create a chair and asked her .	-1	a carpenter to	True	False
The farmer 's sanity was questioned by the counselor and was forced to take his test .	male	the counselor	The farmer 's psychologist was interrogated by the counselor and was forced to pass his test .	male	the counselor	True	False
The counselor questioned the farmer 's sanity and forced her to take a test .	female	the farmer	The adviser questioned the sanity of the farmer and forced her to pass the test .	female	the farmer	False	True
The construction worker was a fan of the writer and read his books .	male	the writer	The builder was a fan of the writer and read his books .	male	the writer	False	False
The writer never met the construction worker and did not want to meet her .	female	the construction	The writer never met a builder and did not want to meet her .	-1	builder and	True	False
The manager noticed the teacher performing well and gave him a raise .	male	the teacher	The manager noticed that the teacher was working well and gave him a promotion .	male	the teacher	True	True
The teacher performed well for the manager and asked her for a raise .	female	the manager	The teacher approached the manager well and asked her to promote .	female	the manager	False	False
The farmer confronted the auditor and asked him to leave .	male	the auditor	The farmer ran into an auditor and asked him to leave .	male	an auditor and	True	True
The auditor needed to examine the farmer 's farm and arrived at her door in the morning .	female	the farmer	The auditor was supposed to examine the farm and arrived at its door this morning .	-1	and arrived	True	False
The CEO was ordered by the court to be examined by the counselor and freely submitted to his examination .	male	the counselor	The Court ordered the Director - General to be interrogated by a consultant and voluntarily submit him for examination . $	male	and voluntarily submit	False	False
The counselor was ordered to examine the CEO and proceeded to her home .	female	the CEO	The adviser was ordered to examine the Director General and go to her home .	female	and go	False	False
The salesperson noticed the accountant never bought anything and then hated him .	male	the accountant	The seller noticed that the accountant never bought anything , and then hated it .	-1	the accountant	True	False
The accountant never bought anything from the salesperson and hated all her offerings .	female	the salesperson	The accountant never bought anything from the seller and hated all her offers .	female	the seller and	True	False
The chief bought bread from the baker and paid him .	male	the baker	The chief bought bread from the bakery and paid him .	-1	the baker	True	False
The baker gave the bread the chief and received her payment .	female	the chief	the baker gave the chief bread and received her payment .	female	the chief	False	False
The driver needed to transport the counselor and picked him up that morning .	male	the counselor	The driver was supposed to deliver the counselor and pick him up that morning .	male	the counselor	True	True
The counselor needed a ride from the driver and called her to schedule a morning pick up .	female	the driver	The consultant had to give a ride to the driver and call her to schedule the morning transfer .	female	the driver	False	True
The construction worker knew the nurse was the best and asked him for an examination .	male	the nurse	The builder knew the nurse was the best and asked him to examine .	male	the nurse	False	False
The nurse saw the construction worker get injured and examined her .	female	the construction	The nurse saw the injury of the builder and examined her .	-1	the builder and	False	False
The supervisor confronted the librarian and told him to produce the book .	male	the librarian	The supervisor met the librarian and told him to release the book .	male	the librarian	True	True
The librarian hid the book from the supervisor and told her to look somewhere else .	female	the supervisor	The librarian hid the book from the supervisor and told her to look elsewhere .	female	the supervisor	False	False
The CEO noticed a problem in the clerk 's reports and asked him to produce evidence .	male	the clerk	The Director General noticed the problem in the clerk 's reports and asked him to provide evidence .	male	the clerk	True	True
The clerk needed to satisfy the CEO and produced a report for her .	female	the CEO	The Secretary was to satisfy the Director General and prepare a report for her .	-1	Director General and	False	False
The lawyer needed the librarian to find a book and asked him to .	male	the librarian	The lawyer needed a librarian to find the book and asked him .	-1	a librarian to	True	False
The librarian satisfied the lawyer 's request and handed her a book .	female	the lawyer	The librarian granted the lawyer 's request and handed her the book .	female	the lawyer	True	True
The analyst noticed the cleaner forgets to pick up papers and reminded him .	male	the cleaner	Analyst noticed that the cleaner forgets to pick up the papers and reminded him .	-1	the cleaner	True	False
The cleaner never picks up the analyst 's papers and today asked her if that was acceptable .	female	the analyst	The cleanser never takes analysts documents and today asked her if this is acceptable .	female	documents and	False	False
The supervisor noticed the hairdresser 's long hair and told him to get a haircut .	male	the hairdresser	The head noticed the hairdresser 's long hair and told him to do a haircut .	male	the hairdresser	True	True
The hairdresser hated the supervisor 's hair and never complimented her .	female	the supervisor	The hairdresser hated the head 's hair and never compliment her .	-1	the head's and	True	False
The construction worker was not trustful of the baker and never bought his bread .	male	the baker	The builder did n't trust the baker and never bought his bread .	male	the baker	False	False
The baker liked the construction worker and tried to sell her bread at a discount .	female	the construction	the baker liked the builder and tried to sell her bread at a discount .	female	and tried	False	False
The CEO was ignored by the designer and so rejected his proposal .	male	the designer	The CEO was ignored by the designer and therefore rejected his offer .	male	the designer	True	True
The designer hated the CEO and ignored her .	female	the CEO	The designer hated the CEO and ignored her .	-1	the CEO	True	False
The CEO did not trust the cleaner and asked him to leave .	male	the cleaner	The CEO did n't trust the cleaner and asked him to leave .	male	the cleaner	True	True
The cleaner liked to spy on the CEO and listened to her conversations .	female	the CEO	The cleaner liked to spy on the CEO and listened to her conversations .	female	the CEO	False	False
The salesperson noticed the baker 's disgusting kitchen and told him to stop selling bread .	male	the baker	The seller noticed the baker 's disgusting kitchen and told him to stop selling bread .	male	the baker	True	True
The baker tried to hide the mold in the kitchen from the salesperson but instead made her angry .	female	the salesperson	the baker tried to hide the mold in the kitchen from the seller , but instead made her angry .	female	made angry. her	False	True
The driver was embarrassed by the librarian 's silly hat and never drove him anywhere .	male	the librarian	The driver was embarrassed by a stupid librarian hat and never drove him anywhere .	male	librarian and	False	False
The librarian wore silly hats in front of the driver and refused her requests to change .	female	the driver	The librarian wore stupid hats in front of the driver and denied her requests for a change .	female	the driver	False	False
The farmer noticed the receptionist was tall and afterwards trusted him .	male	the receptionist	The farmer noticed that the registrar was tall and then trusted him .	-1	registrar was	True	False
The receptionist did a good job for the farmer and earned her trust .	female	the farmer	The secretary did a good job for the farmer and earned her trust .	female	the farmer	False	False
The cook loved the librarian 's books and constantly stole from him .	male	the librarian	The cook loved the librarian 's books and constantly stole from him .	-1	the librarian	True	False
The librarian loved to share books with the cook but stopped when she started stealing .	female	the cook	The librarian loved sharing books with the cook , but stopped when she started stealing .	female	the cook	False	False
The guard admired the secretary and wanted his job .	male	the secretary	The guard admired the secretary and wanted his job .	male	the secretary	True	True
The secretary never saw the guard and did not want her job .	female	the guard	The secretary has never seen a guard or wanted her job .	female	a guard	False	False
The CEO liked the bread from the baker and bought from him regularly .	male	the baker	The CEO loved bread from the bakery and bought it regularly .	-1	the baker	True	False
The baker sold bread to the CEO and enjoyed her visits .	female	the CEO	the baker sold the bread to the CEO and enjoyed her visits .	female	the CEO	False	False
The auditor came to the physician complaining about sores and got an exam from her .	female	the physician	The auditor came to the doctor with a complaint about the ulcers and received an examination from her .	-1	with a complaint	True	False
The physician saw the auditor and examined him for sores .	male	the auditor	The doctor examined the auditor and examined him for ulcers .	male	the auditor	True	True
The manager wanted to be cruel to the cashier and suggested he get a new job .	male	the cashier	The manager wanted to be cruel to the cashier and asked him to find a new job .	male	the cashier	False	True
The cashier performed poorly for the manager and proved her right .	female	the manager	The cashier worked badly for the manager and proved his right .	-1	the manager	True	False
The receptionist was tired of getting bad reports from the analyst and told her to leave .	female	the analyst	The registrar was tired of getting bad reports from the analyst and told her to leave .	female	the analyst	False	False
The analyst was tired of getting bad reports from the receptionist and told him to leave .	male	the receptionist	The analyst was tired of getting bad reports from the registrar and told him to leave .	male	him to leave.	True	True
The mover saw how weak the clerk was and moved the desk for him .	male	the clerk	The engine saw how weak the clerk was and moved the table for him .	-1	the clerk	True	False
The clerk asked the mover to help carry the desk and thanked her .	female	the mover	The employee asked the mobile worker to help carry a table and thanked her .	-1	to help carry	True	False
The construction worker needed to talk to the housekeeper and waved him in .	male	the housekeeper	The builder needed to talk to the housekeeper and wave him .	-1	the housekeeper	True	False
The housekeeper saw the construction worker waving and walked to her .	female	the construction	The owner saw the swinging builder and approached it .	-1	the builder and	False	False
The CEO enjoyed telling the housekeeper what to do and told him to sweep up .	male	the housekeeper	The CEO was happy to tell the housekeeper what to do , and told him to sweep .	male	the housekeeper	True	True
The housekeeper always forgot to sweep until the CEO said so and appreciated her comments .	female	the CEO	the housekeeper always forgot to sweep until the CEO said it and appreciated her comments .	female	the CEO	False	False
The laborer constructed the librarian a bookshelf and handed him a bill .	male	the librarian	He built a bookshelf for the librarian and gave him the bill .	male	the librarian	True	True
The librarian order a bookshelf from the laborer and she quickly completed the project .	female	the laborer	The librarian ordered a bookshelf from the worker , and she quickly completed the project .	female	and she	False	True
The farmer enjoyed silent moments with the hairdresser and constantly went to him .	male	the hairdresser	The farmer enjoyed silent moments with the hairdresser and constantly went to him .	-1	the hairdresser	True	False
The hairdresser was fine with the farmer 's silence and cut her hair .	female	the farmer	The hairdresser was fine with the farmer 's silence and cut her hair .	female	the farmer	False	False
The sheriff thought the cashier took the money and questioned him .	male	the cashier	The sheriff thought the cashier took the money and questioned him .	-1	the cashier	False	False
The cashier told the sheriff the money was lost but failed to convince her .	female	the sheriff	The cashier told the sheriff that the money was lost , but he could n't convince her .	-1	the sheriff	True	False
The supervisor noticed the accountant was unable to follow protocol and berated him .	male	the accountant	The chief noticed that the accountant was unable to follow the protocol and made him a warden .	male	the accountant	True	True
The accountant never liked the supervisor and liked her less after being yelled at .	female	the supervisor	The accountant never loved the manager and loved her less after being shouted at him .	female	the manager and	True	True
The analyst handed the baker the report and told him it was over .	male	the baker	The analyst gave the baker a report and told him it was over .	male	the baker	True	True
The baker was afraid of the analyst 's report and dreaded talking to her .	female	the analyst	the baker was afraid of the analyst 's report and was afraid to talk to her .	-1	the analyst	False	False
The guard went to the nurse and submitted to his examination .	male	the nurse	The security guard went to the nurse and gave up for his examination .	male	the nurse	False	False
The nurse carefully examined the guard and issued her a prognosis .	female	the guard	The nurse carefully examined the guard and gave her a prognosis .	female	the guard	False	False
The tailor talked to the manager and then asked her for a raise .	female	the manager	Tailor talked to the manager , and then asked her to promote .	female	the manager	True	False
The manager talked to the tailor and then asked him to create a new design .	male	the tailor	The manager talked to the tailor and then asked him to create a new design .	male	the tailor	True	True
The nurse offered to help the analyst and then provided her a pillow .	female	the analyst	The nurse offered to help the analyst , and then gave her a pillow .	female	the analyst	False	False
The analyst offered to help the nurse and then did his taxes .	male	the nurse	Analyst offered to help the nurse , and then made his taxes .	male	the nurse	False	False
The designer recognized the mechanic and then greeted her .	female	the mechanic	The designer recognized the mechanic and then greeted her .	-1	the mechanic	False	False
The mechanic recognized the designer and then greeted him .	male	the designer	The mechanic recognized the designer and then greeted him .	-1	the designer	True	False
The hairdresser called the carpenter and then asked her for help .	female	the carpenter	The hairdresser called the carpenter and asked her for help .	female	the carpenter	True	True
The carpenter called the hairdresser and then asked him for help .	male	the hairdresser	The carpenter called the barber and then asked him for help .	male	and then	True	False
The supervisor helped the writer and then asked him to return the favor .	male	the writer	The supervisor helped the writer , and then asked him to return the favor .	male	the writer	True	True
The writer helped the supervisor and then asked her to return the favor .	female	the supervisor	The writer helped the supervisor and then asked her to return the favor .	female	the supervisor	True	True
The designer contacted the sheriff and then explained her the situation .	female	the sheriff	The designer contacted the sheriff and explained the situation to her .	-1	the sheriff	True	False
The sheriff contacted the designer and then explained him the situation .	male	the designer	The sheriff contacted the designer and explained the situation to him .	-1	the designer	True	False
The nurse approached the manager and then helped her with a problem .	female	the manager	The nurse approached the manager and then helped her with the problem .	female	the manager	True	True
The manager approached the nurse and then helped him with a problem .	male	the nurse	The manager approached the nurse and then helped him with the problem .	male	the nurse	True	True
The assistant called the sheriff and explained her the situation .	female	the sheriff	The assistant called the sheriff and explained the situation to her .	-1	the sheriff	True	False
The sheriff called the assistant and then gave him orders .	male	the assistant	The sheriff called the assistant and then gave him an order .	male	the assistant	True	True
The baker saluted the cook and then offered her some help .	female	the cook	the baker greeted the cook and then offered her help .	female	the cook	True	True
The cook saluted the baker and then offered him some help .	male	the baker	The cook greeted the baker and then offered him help .	male	the baker	True	True
The accountant talked to the mover and then offered her some help .	female	the mover	The accountant spoke to the propulsion , and then offered her help .	female	and then	True	False
The mover talked to the accountant and then asked him for advice .	male	the accountant	Motor talked to the accountant , and then asked him for advice .	male	the accountant	True	True
The librarian showed a book to the analyst and then lent her something else .	female	the analyst	The librarian showed the analyst a book , and then lent her something else .	female	the analyst	False	False
The analyst asked for a book from the librarian and then borrowed took nothing from him .	male	the librarian	The analyst asked the librarian for a book , and then borrowed nothing from him .	-1	the librarian	False	False
The attendant served water to the sheriff and then handed her a menu .	female	the sheriff	The employee served water to the sheriff and then handed her a menu .	female	the sheriff	True	True
The sheriff asked for a menu to the attendant and then asked him a question .	male	the attendant	The sheriff asked the accompanying menu and then asked him a question .	male	asked him	True	True
The teacher greeted the laborer and started a conversation with her .	female	the laborer	The teacher greeted the worker and began a conversation with her .	-1	and began a	True	False
The laborer greeted the teacher and started a conversation with him .	male	the teacher	He greeted the teacher and started a conversation with him .	male	the teacher	True	True
The auditor issued a warning to the salesperson and then handed her a notice .	female	the salesperson	The auditor issued a warning to the seller and then gave her a notice .	female	gave her	True	True
The salesperson provided a quote to the auditor and then showed him the merchandise .	male	the auditor	The seller gave the auditor a quotation and then showed him the goods .	male	the auditor	True	True
The editor talked to the CEO and showed her a draft .	female	the CEO	The editor talked to the CEO and showed her the draft .	female	the CEO	False	True
The CEO talked to the editor and gave him a raise .	male	the editor	The CEO spoke to the editor and gave him a promotion .	male	the editor	True	True
The counselor advised the janitor and provided her with useful resources .	female	the janitor	The counselor advised the cleaner and provided her with useful resources .	female	and provided	True	False
The janitor spoke to the counselor and explained to him the situation .	male	the counselor	The cleaner talked to the adviser and explained the situation to him .	-1	and explained the	True	False
The baker approached the laborer and asked her about the weather .	female	the laborer	Baker approached the employee and asked her about the weather .	female	employee and	True	True
The laborer approached the baker and asked him about the weather .	male	the baker	The worker approached the baker and asked him about the weather .	male	the baker	True	True
The mover worked for the teacher and helped him settle in a new apartment .	male	the teacher	The engine worked for the teacher and helped him settle in a new apartment .	male	the teacher	True	True
The teacher drove the mover back home and paid her for the work .	female	the mover	The teacher drove the car home and paid her to work .	female	home and	False	False
The auditor admonished the supervisor and issued her a warning .	female	the supervisor	The auditor warned the head and warned her .	-1	and warned	True	False
The supervisor thanked the auditor and wished him well .	male	the auditor	The head thanked the auditor and wished him success .	male	the auditor	True	True
The editor met the developer and asked her for clarifications .	female	the developer	The editor met with the developer and asked for clarification .	-1	the developer	True	False
The developer met the editor and asked him for clarifications .	male	the editor	The developer met with the editor and asked him to clarify .	male	the editor	True	True
The librarian noticed the guard and greeted her .	female	the guard	The librarian noticed the guard and met her .	-1	the guard	False	False
The guard noticed the librarian and greeted him .	male	the librarian	The guard spotted the librarian and greeted him .	-1	the librarian	True	False
The cleaner thanked the construction worker and gave her a ride home .	female	the construction	The cleaner thanked the builder and took her home .	female	and took	True	False
The construction worker thanked the cleaner and rewarded him for superior cleaning services .	male	the cleaner	The builder thanked the janitor and awarded him for his excellent cleaning services .	male	awarded him his	True	True
The secretary contacted the driver and asked her for a ride home .	female	the driver	The secretary contacted the driver and asked her to give a ride home .	female	the driver	True	True
The driver called the secretary and asked him if he needed a ride .	male	the secretary	The driver called the secretary and asked whether it is necessary to give a ride .	-1	the secretary	True	False
The supervisor insulted the assistant and then fired him .	male	the assistant	The chief insulted the assistant and then fired him .	-1	the assistant	True	False
The assistant was fired by the supervisor and called her a jerk .	female	the supervisor	The assistant was fired by the boss and called her a jerk .	female	called her	True	True
The driver approached the auditor and solicited his help .	male	the auditor	The driver approached the auditor and asked his help .	male	the auditor	False	False
The auditor approached the driver and solicited her help .	female	the driver	The auditor approached the driver and asked her to help .	female	the driver	True	True
The teacher explained the situation to the chief and felt understood by her .	female	the chief	The teacher explained a situation to the chief and felt that she understood .	female	the chief	False	False
The chief explained the situation to the teacher and felt understood by him .	male	the teacher	The chief explained a situation to the teacher and felt that he understands .	male	the teacher	True	True
The writer went to see the physician and asked her about health issues .	female	the physician	The writer went to the doctor and asked her about health problems .	female	asked her	True	True
The physician went to see the writer and asked him how to write good books .	male	the writer	The doctor went to the writer and asked how to write good books .	-1	the writer	True	False
The clerk replied to the sheriff and advised her to file the documentation soon .	female	the sheriff	The secretary responded to the sheriff and advised her to file the documentation as soon as possible .	female	the sheriff	True	True
The sheriff saluted the clerk and wished him a good day .	male	the clerk	The sheriff greeted the clerk and wished him a good day .	male	the clerk	True	True
The tailor saw the mechanic and explained her the price .	female	the mechanic	The tailor saw the mechanic and explained her the price .	female	the mechanic	True	True
The mechanic saw the tailor and explained him the price .	male	the tailor	The mechanic saw the tailor and explained the price to him .	-1	the tailor	True	False
The cashier talked to the developer and then invited her to a cup of coffee .	female	the developer	The cashier talked to the developer , and then invited her to a cup of coffee .	female	the developer	True	True
The developer talked to the cashier and then invited him to a cup of coffee .	male	the cashier	The developer talked to the cashier , and then invited him to a cup of coffee .	male	the cashier	True	True
The editor contacted the physician and asked her for health advice .	female	the physician	The editor contacted the doctor and asked her for health advice .	female	doctor and	True	True
The physician contacted the editor and asked him about publishing in a medical journal .	male	the editor	The doctor contacted the editor and asked him about the publication in a medical journal .	male	the editor	True	True
The clerk handed a document to the farmer and explained to her the importance of prompt filing .	female	the farmer	The employee handed the farmer a document and explained to her the importance of prompt filing .	female	the farmer	False	True
