source_coref_result	source_sentence	target_coref_result	target_sentence
False	The counselor asked the guard a few questions and praised him for the good work.	False	The counselor asked the guard some questions and praised him for good work.
False	The guard asked the counselor a few questions and let her enter the office.	False	The guard asked the counselor a few questions and let her enter the office.
False	The receptionist helped the sheriff and he was very grateful for that.	False	The receptionist helped the sheriff and was very grateful for it.
False	The sheriff helped the receptionist and she was very grateful for that.	False	The sheriff helped the receptionist, and she was grateful.
False	The nurse called the mechanic and told him which medicine to take.	False	The nurse called the mechanic and told him what medication to take.
False	The mechanic called the nurse and asked her how to deal with the broken leg.	False	The mechanic contacted the nurse and asked her how to deal with a broken leg.
False	The cleaner dislikes the cook because he made the kitchen very dirty.	False	The cleaner hates the cooker because he made the kitchen so dirty.
False	The cook dislikes the cleaner because she broke the stove.	False	The cooker hates the cleaner because she broke the stove.
False	The teacher visited the sheriff and asked him some questions.	False	The teacher visited the honorable and asked him some questions.
False	The sheriff visited the teacher and asked her some questions.	False	The sheriff visited the teacher and asked her some questions.
False	The farmer understood the cleaner and sent her some money.	False	The farmer grasp the cleaner and sent her some money.
False	The cleaner understood the farmer and sent him some money.	False	The cleaner grasp the farmer and sent him some money.
False	The baker yelled at the mover and asked him to leave.	False	The baker screamed into the engine and asked him to leave.
False	The mover yelled at the baker and asked her to leave.	False	The engine screamed at the baker and asked her to leave.
False	The receptionist recognized the developer and led him to the lobby.	False	The receptionist met the developer and led him to the lobby.
False	The developer recognized the receptionist and asked her where the lobby was.	False	The developer met the receptionist and asked her where the lobby is.
False	The guard works harder than the clerk and gets more appreciation than her.	False	The guard works harder than the writer and gets more appreciated than her.
False	The clerk works harder than the guard and gets more appreciation than him.	False	The employee works harder than the guard and gets more appreciated than him.
False	The cashier talked to the construction worker and hoped to have the same salary as him.	False	The cashier talked to the construction worker and expressed the hope that he would receive the same salary as he received.
False	The construction worker talked to the cashier and hoped to have the same salary as her.	False	The construction worker spoke to the cashier and expressed the hope that she would receive the same salary as she received.
False	The receptionist recognized the driver and led him to the ceremony.	False	The receptionist met the driver and led him to the concert.
False	The driver recognized the receptionist and introduced the boss to her.	False	The driver introduced the receptionist and introduced her boss.
False	The attendant greeted the salesperson and introduced him to the boss.	False	The receptionist received the salesman and introduced him to his boss.
False	The salesperson greeted the attendant and tried to sell her something.	False	The salesman received the utilities and tried to sell her something.
False	The receptionist told the cook the date of the ceremony and reminded him to wear suits.	False	The receptionist told the chef the date of the ceremony and reminded him to wear the suits.
False	The cook told the receptionist the date of the ceremony and reminded her to wear suits.	False	The cook told the receptionist about the date of the party and reminded her to wear the suits.
False	The accountant called the lawyer to consult him about the book.	False	The accountant contacted the lawyer to consult him about the book.
False	The lawyer called the accountant to consult her about the book.	False	The lawyer contacted the accountant to consult her about the book.
False	The assistant talked to the manager and requested him to raise the salary.	False	The assistant spoke to the manager and asked him to raise the salary.
False	The manager talked to the assistant and praised her for the hard work.	False	The director spoke to the assistant and praised her for hard work.
False	The writer visited the cook to learn cooking from him.	False	The writer visited the cook to learn cooking from him.
False	The cook visited the writer to learn writing from her.	False	The chef visited the writer to learn to write them.
False	The tailor talked with the supervisor and was impressed by his hard work.	False	A tailor spoke with the supervisor and admired his hard work.
False	The supervisor talked with the tailor and was impressed by her talent.	False	The supervisor spoke with a tailor and admired her talent.
False	The cashier complained something to the chief but he was not listening.	False	The cashier complained to the President but did not listen to him.
False	The chief complained something to the cashier but she was not listening.	False	The president complained something to the cashier but she did not listen.
False	The chief talked to the secretary and showed her thanks.	False	The president spoke to the secretary and showed her thanks.
False	The secretary talked to the chief and showed him thanks.	False	The secretary spoke to the President and showed him thanks.
False	The designer invited the supervisor to the party and he smiled.	False	The designer invited the supervisor to the party and smiled.
False	The supervisor invited the designer to the party and she smiled.	False	The moderator invited the designer to the party and smiled.
False	The secretary shouted at the carpenter and drove him away.	False	The secretary screamed at the carpenter and took him away.
False	The carpenter shouted at the secretary and drove her away.	False	The carpenter shouted at the secretary and took her away.
False	The secretary met with the lawyer and reminded him to check the email.	False	The secretary met with the lawyer and reminded him to check the e-mail.
False	The lawyer met with the secretary and asked her to prepare the documents.	False	The lawyer met with the secretary and asked her to prepare the documents.
False	The counselor walked towards the cook and thanked him for providing the dinner.	False	The counselor walked towards the cook and thanked him for serving dinner.
False	The cook walked towards the counselor and asked her some questions.	False	The cook walked towards the counselor and asked her some questions.
False	The auditor smiled at the construction worker and handed him some water.	False	The auditor smiled at the construction worker and handed him some water.
False	The construction worker smiled at the auditor and handed her some water.	False	The construction worker smiled to the auditor and handed her some water.
False	The writer chatted with the analyst and expressed interest in his work.	False	The writer spoke with the analyst and expressed interest in his work.
False	The analyst chatted with the writer and expressed interest in her work.	False	The analyst spoke with the writer and expressed interest in her work.
False	The assistant helped the guard and told him to be careful next time.	False	Helped the guard assistant and told him to be careful next time.
False	The guard helped the assistant and told her to be careful next time.	False	The guard helped the assistant and told her to be careful next time.
False	The attendant talked with the physician and was surprised about his knowledge.	False	Attendant spoke with the doctor and surprised his knowledge.
False	The physician talked with the attendant and was surprised about her knowledge.	False	The doctor spoke with the attendant and was surprised by her acquaintance.
False	The accountant asked the laborer to join the meeting but he forgot.	False	The accountant asked the worker to join the meeting but forgot.
False	The laborer asked the accountant to join the meeting but she forgot.	False	The worker asked the accountant to join the meeting but she forgot.
False	The editor chatted with the analyst and wanted to collaborate with him.	False	The editor talked to the analyst and wanted to cooperate with him.
False	The analyst chatted with the editor and wanted to collaborate with her.	False	The analyst spoke with the editor and wanted to cooperate with it.
False	The receptionist talked to the salesperson and rejected his suggestion to buy the insurance.	False	The receptionist spoke to the seller and rejected his proposal to purchase the insurance.
False	The salesperson talked to the receptionist and convinced her to buy the insurance.	False	The salesman spoke to the receptionist and persuaded her to buy the insurance.
False	The teacher met up with the supervisor and told him the concerns.	False	The teacher met with the supervisor and told him concerns.
False	The supervisor met up with the teacher and told her the concerns.	False	The supervisor met with the teacher and told her concerns.
False	The clerk called the physician and asked him about the medicine.	False	The employee called the doctor and asked him about the medicine.
False	The physician called the clerk and asked her about the product.	False	The doctor called the employee and asked her about the product.
False	The nurse thanked the chief and handed him a present.	False	The nurse thanked the president and gave him a gift.
False	The chief thanked the nurse and handed her a present.	False	The president thanked the nurse and handed her a gift.
False	The accountant met the analyst and recommended him some job positions.	False	The accountant met the analyst and recommended him some job positions.
False	The analyst met the accountant and recommended her some job positions.	False	The analyst met the accountant and recommended her some job positions.
False	The receptionist helped the construction worker and got a present from him.	False	The receptionist helped the construction worker and got a gift from him.
False	The construction worker helped the receptionist and got a present from her.	False	The construction worker helped the receptionist and got a gift from her.
False	The hairdresser visited the guard and thanked him.	False	The hairdresser visited the guard and thanked him.
False	The guard visited the hairdresser and thanked her.	False	The guard visited the hairdresser and thanked her.
False	The accountant walked towards the developer and gave him a cup of coffee.	False	The accountant walked towards the developer and gave him a cup of coffee.
False	The developer walked towards the accountant and gave her a cup of coffee.	False	The developer walked towards the accountant and gave her a cup of coffee.
False	The manager meets the counselor regularly and asks her for suggestions.	False	The manager meets with the consultant regularly and asks for suggestions.
False	The counselor meets the manager regularly and provides him suggestions.	False	The consultant meets with the manager regularly and offers suggestions.
False	The lawyer called the teacher to ask her the performance of the kid.	False	The lawyer called the teacher to ask her about the child's performance.
False	The teacher called the lawyer to tell him the performance of the kid.	False	The teacher called the lawyer to tell him about the performance of the child.
False	The secretary walked towards the mechanic and told him what was the problem with the machine.	False	The secretary walked towards the mechanic and told him what the problem with the machine was.
False	The mechanic walked towards the secretary and asked her where the machine was.	False	A mechanic walked towards the secretary and asked her where the machine was.
False	The baker talked to the supervisor and learned a lot from him.	False	The baker spoke to the supervisor and learned a lot from him.
False	The supervisor talked to the baker and taught her a lot.	False	The supervisor spoke to the baker and taught her a lot.
False	The housekeeper showed the janitor the direction and led him to the kitchen.	False	The housekeeper showed a directional janitor and led him to the kitchen.
False	The janitor showed the housekeeper the direction and led her to the kitchen.	False	The concierge of the housekeeper showed direction and led her to the kitchen.
False	The counselor disliked the supervisor and wanted to leave his group.	False	The counselor hated the supervisor and wanted to leave his group.
False	The supervisor disliked the counselor and fired her.	False	Supervisor hates the chancellor and kicked her out.
False	The writer contacted the CEO and asked for his opinions about the book.	False	The author contacted the CEO and asked for his opinions about the book.
False	The CEO contacted the writer and asked for her suggestions about the book.	False	The CEO contacted the writer and asked for her suggestions about the book.
False	The hairdresser hates the mechanic after he refused to help with fixing the car.	False	The hairdresser hates the mechanic after refusing to help repair the car.
False	The mechanic hates the hairdresser after she finished the ugly haircut.	False	Mechanic hates the hairdresser after finishing an ugly haircut.
False	The cashier borrowed the tool from the carpenter but returned nothing to him.	False	The cashier borrowed the tool from the carpenter but no longer had anything.
False	The carpenter borrowed the tool from the cashier but returned nothing to her.	False	The carpenter borrowed the gadget from the cashier but no longer had anything.
False	The auditor talked with the sheriff and wanted to hear his opinion.	False	The auditor spoke to the sheriff and wanted to hear his opinion.
False	The sheriff talked with the auditor and wanted to hear her opinion.	False	The sheriff talked to the auditor and wanted to hear her opinion.
False	The baker wanted to thank the carpenter and made some bread for him.	False	The baker wanted to thank the carpenter and made him some bread.
False	The carpenter wanted to thank the baker and made a chair for her.	False	The carpenter wanted to thank the baker and gave her a chair.
False	The designer wanted to help the lawyer but he refused.	False	The designer wanted to help the lawyer but refused.
False	The lawyer wanted to help the designer but she refused.	False	The lawyer wanted to help the designer but refused.
False	The accountant got angry with the mechanic and complained to the boss about him.	False	The accountant was irritated by the mechanic and complained to the boss about him.
False	The mechanic got angry with the accountant and complained to the boss about her.	False	The mechanic was irritated by the accountant and complained to the boss about her.
False	The cook sent the cashier a present and expressed thanks to her.	False	The cook sent to the cashier a gift and thanked her.
False	The cashier sent the cook a present and expressed thanks to him.	False	The cashier sent the cook a gift and thanked him.
False	The laborer eats more than the cleaner because he works harder.	False	The worker eats more than the cleaner because he works hard.
False	The cleaner eats more than the laborer because she works harder.	False	The cleaner eats more than the worker because she works hard.
False	The mechanic learned a lot from the teacher and sent her a thankful card.	False	The mechanic learned a lot from the teacher and sent her a thank-you card.
False	The teacher learned a lot from the mechanic and sent him a thankful card.	False	The teacher learned a lot from the mechanic and sent him a thank you card.
False	The baker passed the box to the guard and asked him to make the delivery.	False	The baker passed the box to the guard and asked him to make the delivery.
False	The guard passed the box to the baker and appreciated her baking skills.	False	Sentinel passed the box to the baker and appreciated her baking skills.
False	The tailor stopped the guard and showed him identification.	False	The tailor stopped the guard and showed him his identity.
False	The guard stopped the tailor and asked for her identification.	False	The guard stopped the tailor and asked to identify her.
False	The analyst asked the clerk some questions and thanked her.	False	The analyst asked the writer some questions and thanked her.
False	The clerk asked the analyst some questions and sent him away.	False	The analyst writer asked some questions and sent it away.
False	The lawyer asked the nurse about the operation and thanked her.	False	The lawyer asked the nurse about the operation and thanked her.
False	The nurse asked the lawyer about the case and thanked him.	False	The nurse asked the lawyer about the case and thanked him.
False	The carpenter stopped the housekeeper and helped her.	False	The carpenter stopped the housekeeper and helped her.
False	The housekeeper stopped the carpenter and helped him.	False	The housekeeper stopped the carpenter and helped him.
False	The sheriff opened the door for the housekeeper and waited for her to pass by.	False	The sheriff opened the door for the housekeeper and waited for her to pass.
False	The housekeeper opened the door for the sheriff and waited for him to pass by.	False	The housekeeper opened the door to the sheriff and waited for him to pass.
False	The physician asked the receptionist about the booking price and thanked her.	False	The doctor asked the receptionist about the price of the reservation and thanked her.
False	The receptionist helped the physician find the room and left him alone.	False	The receptionist helped the doctor find the room and left him alone.
False	The lawyer saw the editor in the restaurant and greeted her.	False	He saw the editor at the restaurant and welcomed it.
False	The editor saw the lawyer in the restaurant and greeted him.	False	The editor saw the lawyer at the restaurant and welcomed him.
False	The farmer bought a book from the writer and paid her.	False	The farmer bought a book from the writer and paid her.
False	The writer bought some fruit from the farmer and paid him.	False	The writer bought some fruit from the farmer and paid him.
False	The sheriff borrowed a book from the librarian but never returned anything to her.	False	The sheriff borrowed a book from the librarian, but he didn't have anything.
False	The librarian helped the sheriff find the book and smiled at him.	False	The librarian helped the sheriff find the book and smiled at him.
False	The salesperson talked to the teacher and invited her to dinner.	False	The salesman spoke to the teacher and invited her to dinner.
False	The teacher talked to the salesperson and invited him to dinner.	False	The teacher spoke to the seller and invited him to dinner.
False	The janitor cleaned for the baker and asked her for the tips.	False	The doorman cleaned the baker and asked her to tip.
False	The baker packed the janitor some bread and waited for him to pay.	False	The baker packaged some bread and waited for him to pay.
False	The cook got the phone call from the nurse and began to prepare the lunch for her.	False	The cook received a phone call from the nurse and began to prepare lunch for her.
False	The nurse got the phone call from the cook and began to prepare the surgery for him.	False	The nurse got a phone call from the cook and started preparing the surgery for him.
False	The developer successfully sold the housekeeper the product and helped her to set up.	False	The developer successfully sold the product housekeeper and helped her prepare.
False	The housekeeper bought the product from the developer and asked him to set up.	False	The housekeeper bought the product from the developer and asked him to prepare it.
False	The driver dropped the accountant at the corner and asked her to watch out when crossing the street.	False	The driver dropped the accountant at the corner and asked her to be careful when crossing the street.
False	The accountant asked the driver to stop at the corner and gave him some tips.	False	The accountant asked the driver to stop at the corner and gave him some advice.
False	The manager discussed with the designer for a long time and tried to convince her to sell this idea.	False	Discuss the manager with the designer for a long time and tried to convince her to sell this idea.
False	The designer discussed with the manager for a long time but still refused to sell the idea to him.	False	The designer discussed with the manager for a long time but still refuses to sell the idea to him.
False	The mechanic not only explained several terms to the counselor but also wrote some down for her.	False	The mechanic not only explained several terms to the consultant, but also wrote some of them.
False	The counselor not only explained to the mechanic economy terms and also wrote down some down for him.	False	The consultant not only explained the conditions of mechanical economy and also wrote down some down for him.
False	The mechanic opened the door for the cleaner and led her to the room.	False	Mechanic opened the door for cleanliness and led it to the room.
False	The cleaner knocked at the mechanic 's door and waited for him to show up.	False	I knocked the cleaner on the mechanic's door and waited for him to show up.
False	The mover followed the writer 's instruction and waited outside her apartment.	False	The engine follows the author's instructions and waited outside her apartment.
False	The writer asked the mover to move everything to the new apartment and paid him.	False	The writer asked the engine to move everything to the new apartment and pay him.
False	The carpenter stopped the tailor from entering the workspace and talked to her.	False	The carpenter stopped the tailor from entering the workspace and talked to it.
False	The tailor showed the carpenter the tools and let him try.	False	The tailor showed the carpenter tools and let him try.
False	The construction worker asked the assistant to make a list of today 's meetings and thanked her.	False	The construction worker asked the assistant to draw up a list of today's meetings and thanked her.
False	The assistant made a list of today 's schedule for the construction worker and showed him.	False	The assistant made a list of the day's table to the construction worker and showed him.
False	The supervisor asked the secretary to stop by and assigned a task to her.	False	The supervisor asked the secretary to pass and assigned it a task.
False	The secretary greeted the supervisor and handed him the report.	False	The Secretary welcomed the supervisor and handed over the report.
False	The chief hired the receptionist and bought her a new phone for work.	False	The President hired the receptionist and bought her a new phone for work.
False	The receptionist was hired by the chief and will receive the payment from him.	False	The receptionist is appointed by the President and you will receive the amount of it.
False	The janitor talked with the auditor and passed her the files.	False	The doorman spoke to the auditor and passed her the files.
False	The auditor called the janitor and asked him to clean up the hall.	False	The auditor called the janitor and asked him to clean the hall.
False	The analyst met the tailor at home and asked her to make a new suit.	False	The analyst met the tailor at home and asked her to make a new suit.
False	The tailor met the analyst at home and offered him a new design.	False	The tailor met the analyst at home and gave him a new design.
False	The sheriff stopped the nurse and hugged her for the great help.	False	The sheriff stopped the nurse and hugged her for big help.
False	The nurse met the sheriff at the scene and helped him with the accident.	False	The nurse met the sheriff at the scene and helped him with the accident.
False	The janitor met the receptionist and got the key from her every day.	False	The cleaner met the receptionist and got the key from them every day.
False	The receptionist waits for the janitor and drives him back every day.	False	The receptionist waits for the doorman and leads him every day.
False	The mover went to the tailor 's house and helped her move the boxes.	False	The engine went to the tailor's house and helped her move the boxes.
False	The tailor called the mover and asked him to arrive before 9 am.	False	The tailor called the engine and asked him to arrive before 9 am.
False	The developer dropped by the nurse and discussed with her about the surgery.	False	The developer dropped by the nurse and discussed with her about surgery.
False	The nurse gave the developer the prescription and told him not to worry.	False	The nurse gave the developer a prescription and told him not to worry.
False	The mechanic helped the baker fix the machine and charged her 1000 dollars.	False	The mechanic helped the baker to repair the device and charged her 1000 dollars.
False	The baker handed the mechanic the cake and waited for him to pay.	False	The baker handed the cake mechanic and waited for him to pay.
False	The salesperson called the editor and asked her to write an article about the company.	False	The sales representative contacted the editor and asked her to write an article about the company.
False	The editor interviewed the salesperson and wrote an article about his company.	False	The editor interviewed the seller and wrote an article about his company.
False	The mover arrived early at the counselor 's house and offered to help her.	False	She arrived early at the counsellor's house and offered to help her.
