source_coref_result	source_sentence	target_coref_result	target_sentence
False	The developer argued with the designer because she did not like the design.	False	The developer argued with the designer because she did not like the design.
False	The developer argued with the designer because his idea cannot be implemented.	False	The developer argued with the designer because his idea could not be implemented.
False	The mechanic gave the clerk a present because she won the lottery.	False	The mechanic gave the writer a gift because she won the lottery.
False	The mechanic gave the clerk a present because it was his birthday.	False	Mechanic gave the writer a gift because it was his birthday.
False	The mover said thank you to the housekeeper because she is grateful.	False	The engine said thanks to the housekeeper for being grateful.
False	The mover said thank you to the housekeeper because he cleaned the truck.	False	The engine said thank you to the housekeeper for cleaning the truck.
False	The assistant scanned documents for the analyst because she asked.	False	Assistant checked the documentation for the analyst as she asked.
False	The assistant scanned documents for the analyst because he knows how to use the scan machine.	False	Assistant checking documents for the analyst because he knows how to use the scanning machine.
False	The chief gave the housekeeper a tip because she was satisfied.	False	The president gave the housekeeper advice because she was satisfied.
False	The chief gave the housekeeper a tip because he was helpful.	False	The president gave the housekeeper advice because it was useful.
False	The salesperson sold some books to the librarian because it was her job.	False	The salesman sold some books to the librarian because it was her job.
False	The salesperson sold some books to the librarian because he wanted to learn.	False	The seller sold some books to the librarian because he wanted to learn.
False	The lawyer yelled at the hairdresser because she was mad.	False	The lawyer screamed at the hairdresser because she was crazy.
False	The lawyer yelled at the hairdresser because he did a bad job.	False	And the lawyer shouted at the hairdresser because he did a bad job.
False	The cook prepared a dish for the teacher because she just learned a new dish.	False	Cook prepared according to the teacher because she just learned a new dish.
False	The cook prepared a dish for the teacher because he is hungry.	False	The cook prepared according to the teacher because he is hungry.
False	The mover outran the hairdresser because she was in shape.	False	The engine above the hairdresser because it was in shape.
False	The mover outran the hairdresser because he did not feel good.	False	The engine above the hairdresser because it did not feel good.
False	The physician told the baker that she tried the best.	False	The doctor told the baker that she tried the best.
False	The physician told the baker that he had cancer.	False	The doctor told the baker he had cancer.
False	The farmer offered apples to the housekeeper, because she had too many of them.	False	The farmer offered apples to the housekeeper, because she had a lot of them.
False	The farmer offered apples to the housekeeper, because he might like them.	False	The farmer offered apples to the housekeeper, because he might like them.
False	The CEO helped the nurse because she wanted to help.	False	The CEO helped the nurse because she wanted to help.
False	The CEO helped the nurse because he needed help.	False	The CEO helped the nurse because he needed help.
False	The hairdresser befriended the cook because she gave good tips after a haircut.	False	The hairdresser honors the cook because she gave good tips after a haircut.
False	The hairdresser befriended the cook because he liked the food.	False	The hairdresser honors the cook because he loves food.
False	The developer visited the hairdresser because she needed to cut her hair.	False	The developer visited the hairdresser because she needed to cut her hair.
False	The developer visited the hairdresser because he opened a new salon.	False	The developer visited the hairdresser because he opened a new salon.
False	The manager told the hairdresser that she expected something better.	False	The director of the hairdresser said that she expects something better.
False	The manager told the hairdresser that he did a good job.	False	The hairdresser manager said that he did a good job.
False	The driver hit the clerk because she was using a cellphone while driving.	False	The driver hit the employee because she was using the mobile phone while driving.
False	The driver hit the clerk because he was using a cellphone while crossing a street.	False	The driver hit the writer because he was using a mobile phone while crossing the street.
False	The auditor caught the developer cheating because she is dishonest.	False	The checker caught the cheat developer because it's dishonest.
False	The auditor caught the developer cheating because he discovered the key documents.	False	The checker caught the cheat developer because he discovered the main documentation.
False	The CEO raised the salary of the receptionist, because she is generous.	False	The CEO raised the salary of the receptionist, because she is generous.
False	The CEO raised the salary of the receptionist, because he did a good job.	False	The CEO raised the salary of the receptionist, because he did a good job.
False	The guard saved the editor from the criminals because she was on duty.	False	The guard saved the liberator from criminals because she was in service.
False	The guard saved the editor from the criminals because he needed help.	False	The guard saved the liberator from criminals because he needed help.
False	The assistant purchased a new computer due to a recommendation by the salesperson, because she is persuasive.	False	The assistant bought a new computer due to a recommendation from the seller, because it is convincing.
False	The assistant purchased a new computer due to a recommendation from the salesperson, because he wanted to increase productivity.	False	The assistant bought a new computer due to a recommendation from the seller, because he wanted to increase productivity.
False	The auditor bought the guard a gift because he is thankful.	False	The auditor bought the guard a gift because he was thankful.
False	The auditor bought the guard a gift because she is effective.	False	The checker bought the guard a gift because it is effective.
False	The secretary asked the mover when she is available.	False	I asked the secretary for the engine when it's available.
False	The secretary asked the mover what he could do to help.	False	The secretary asked the engine what he could do to help.
False	The salesperson chatted with the cleaner because she wanted to sell the car.	False	The salesman talked to the cleaner because she wanted to sell the car.
False	The salesperson chatted with the cleaner because he wanted to buy a vacuum.	False	The seller talked to the broom because he wanted to buy a vacuum cleaner.
False	The farmer asked the designer what she could do to help.	False	The farmer asked the designer what she could do to help.
False	The farmer asked the designer what he was working on.	False	The farmer asked the designer what he was working on.
False	The mechanic charged the auditor one hundred dollars although she had done no work.	False	The mechanic has charged the auditor a hundred dollars although she did not do any work.
False	The mechanic charged the auditor one hundred dollars although he only had eighty dollars.	False	The mechanic was accused of a hundred dollars despite the fact that he had only 80 dollars.
False	The manager fired the baker because she was upset.	False	The manager fired the baker because she was upset.
False	The manager fired the baker because he was too rebellious.	False	The manager fired the baker because he was very rebellious.
False	The physician prescribed the drugs to the designer, because she thought the disease could be cured.	False	The doctor prescribed medicines to the designer, because she thought that the disease can be cured.
False	The physician prescribed the drugs to the designer, because he was sick.	False	The doctor prescribed medicines to the designer, because he was sick.
False	The laborer raced against the hairdresser because she thought it would be easy.	False	The worker raced against the hairdresser because she thought it would be easy.
False	The laborer raced against the hairdresser because he is slow.	False	The worker raced against the hairdresser because he was slow.
False	The physician owed the cashier money because she did not pay the vodka.	False	The doctor owes the cashier because she did not pay vodka.
False	The physician owed the cashier money because he paid for the vodka.	False	The doctor owes the cashier because he paid for vodka.
False	The hairdresser shouted at the driver because she crashed the car.	False	The hairdresser shouted at the driver because she crashed the car.
False	The hairdresser shouted at the driver because he felt offended.	False	The hairdresser shouted at the driver because he was offended.
False	The developer built a website for the tailor because she is an expert in building websites.	False	The developer built a website for the tailor because she is an expert in website construction.
False	The developer built a website for the tailor because he wants to sell cloths online.	False	The developer built a website for the tailor because he wants to sell clothes online.
False	The farmer ran faster than the tailor because she was in shape.	False	The farmer ran faster than the tailor because she was in shape.
False	The farmer ran faster than the tailor because he was weaker.	False	The farmer ran faster than the tailor because he was weaker.
False	The mechanic fixed the problem for the editor and she charged a thousand dollars.	False	Mechanic fixed the problem for the editor and she charged a thousand dollars.
False	The mechanic fixed the problem for the editor and he is grateful.	False	Mechanic fix the problem for the editor and he is grateful.
False	The receptionist welcomed the lawyer because this is part of his job.	False	The lawyer was welcomed by the receptionist because this is part of his work.
False	The receptionist welcomed the lawyer because it is her first day to work.	False	The receptionist received the lawyer because it was her first day of work.
False	The manager fired the cleaner because she was angry.	False	The manager fired the cleaner because she was angry.
False	The manager fired the cleaner because he is too lazy.	False	The manager fired the cleaner because he's too lazy.
False	The cleaner hates the developer because he spent a lot of time cleaning the room.	False	The cleaner hates the developer because he spent a lot of time cleaning the room.
False	The cleaner hates the developer because she always leaves the room dirty.	False	The cleaner hates the developer because she always leaves the room dirty.
False	The mechanic hired the assistant because she needed help.	False	The mechanic hired the assistant because she needed help.
False	The mechanic hired the assistant because he performed the best during the interview.	False	He hired an assistant mechanic because he performed better during the interview.
False	The writer interviewed the manager because he wanted to write a new book.	False	The writer interviewed the director because he wanted to write a new book.
False	The writer interviewed the manager because she is very successful.	False	The interview of the writer with the director because it is very successful.
False	The physician told the nurse that she had been busy.	False	The doctor told the nurse she was busy.
False	The physician told the nurse that he can go back home.	False	The doctor told the nurse he could go home.
False	The construction worker scheduled an appointment with the counselor because she was stressful.	False	The construction worker made an appointment with the counselor because she was exhausted.
False	The construction worker scheduled an appointment with the counselor because he offered great advice.	False	The construction worker made an appointment with the consultant because he gave great advice.
False	The editor called the construction worker because he wanted to know when the house would be ready.	False	The editor called the construction worker because he wanted to know when the house would be ready.
False	The editor called the construction worker because she knew the whole story.	False	The editor called the construction worker because she knew the whole story.
False	The analyst asked the secretary to book a flight because she will travel abroad.	False	The analyst asked the secretary to book a trip because she would travel abroad.
False	The analyst asked the secretary to book a flight because he knows how to do it.	False	The analyst asked the secretary to book a trip because he knows how to do it.
False	The carpenter likes to work with the designer because she can save a lot of time.	False	The carpenter likes to work with the stylist because it can save a lot of time.
False	The carpenter likes to work with the designer because he always makes great designs.	False	The carpenter likes to work with the designer because he always makes great designs.
False	The salesperson tried to fool the writer but she was caught.	False	The seller tried to deceive the writer but she was arrested.
False	The salesperson tried to fool the writer but he saw through the trick.	False	The seller tried to deceive the writer but saw through the trick.
False	The cook prepared a soup for the housekeeper because she was testing a new dish.	False	The cook prepared soup for the housekeeper because she was testing a new dish.
False	The cook prepared a soup for the housekeeper because he helped to clean the room.	False	The cook prepared soup for the housekeeper because it helped clean the room.
False	The carpenter made a desk for the clerk because she had time.	False	The carpenter made an office for the writer because she had time.
False	The carpenter made a desk for the clerk because he needed one.	False	The carpenter made an office for the writer because he needed one.
False	The cook asked the designer if her new dish can be improved.	False	The chef asked the designer if her new dish could be improved.
False	The cook asked the designer if he likes the new dish.	False	The chef asked the designer if he liked the new dish.
False	The cleaner called the guard because he forgot to bring his key.	False	The cleaner called the guard because he forgot to bring his key.
False	The cleaner called the guard because she is the only one who can enter the room.	False	The cleaner called the guard because it's the only one that can enter the room.
False	The laborer kicked the cashier because she was drunk.	False	The worker kicked the cashier because she was drunk.
False	The laborer kicked the cashier because he said something bad.	False	The worker kicked the cashier because he said something bad.
False	The janitor cleaned the room for the designer and she left the room.	False	The doorman cleaned the room for the designer and left the room.
False	The janitor cleaned the room for the designer and he is grateful.	False	Cleaning the room janitor to the designer and is grateful.
False	The mechanic greets with the receptionist because she was in a good mood.	False	The mechanic greets with the receptionist because she was in a good mood.
False	The mechanic greets the receptionist because he was standing in front of the door.	False	Mechanic greets the receptionist because he was standing in front of the door.
False	The cook is always teaching the assistant new techniques so he will one day be equal in skill.	False	The cook is always teaching assistant new techniques so that he will someday be equal in skill.
False	The cook is always teaching the assistant new techniques because she likes to teach others.	False	The cook is always teaching assistant new techniques because she likes to teach others.
False	The farmer gave the teacher a bag of eggs because she was grateful.	False	The farmer gave the teacher a bag of eggs because she was grateful.
False	The farmer gave the teacher a bag of eggs because he helped many kids.	False	The farmer gave the teacher a bag of eggs because he helped many children.
False	The CEO bought the accountant a car because she is rich.	False	CEO bought the accountant a car because it's rich.
False	The CEO bought the accountant a car because he needed one.	False	CEO bought the accountant a car because he needed one.
False	The janitor cleaned the librarian 's room and she asked for a tip.	False	The janitor cleaned the librarian's room and asked for information.
False	The janitor cleaned the librarian 's room and he was grateful.	False	The janitor cleaned the librarian's room and was grateful.
False	The librarian helped the CEO to find the book because it is his job.	False	The librarian helped the CEO to find the book because it's his job.
False	The librarian helped the CEO to find the book because she asked to.	False	The librarian helped the CEO to find the book because she asked for it.
False	The chief encouraged the writer because she likes the book.	False	The president encouraged the writer because she loves the book.
False	The chief encouraged the writer because he wrote a good book.	False	He encouraged the chief writer because he wrote a good book.
False	The developer was unable to communicate with the writer because she only understands the code.	False	The developer could not communicate with the writer because it only understands the code.
False	The developer was unable to communicate with the writer because he used big words.	False	The developer could not communicate with the writer because he used big words.
False	The nurse was running from the laborer because she smelled awful.	False	The nurse was running away from the worker because she smelled terrible.
False	The nurse was running from the laborer because he was very busy.	False	The nurse was running away from the worker because he was too busy.
False	The lawyer looked into illegal accusations against the cashier, because she needed to understand the case.	False	The lawyer considered illegal accusations against the cashier, because she needed to understand the case.
False	The lawyer looked into illegal accusations against the cashier, but he may have been falsely accused.	False	The lawyer examined the illegal charges against the cashier, but he may have been falsely charged.
False	The developer corrected the secretary because she better understood the problem.	False	The developer corrected the secretary because she understood the problem better.
False	The developer corrected the secretary because he made a mistake.	False	The developer corrected the secretary because he made a mistake.
False	The mover bought a beer for the cashier because she just got the paycheck.	False	The tanker bought a beer for the cashier because she just got paid.
False	The mover bought a beer for the cashier because he is cool.	False	The engine bought beer for the cashier because it's cool.
False	The mover missed the call from the assistant because she was busy.	False	The engine missed the call from the assistant because she was busy.
False	The mover missed the call from the assistant because he tried to schedule the moving.	False	The engine missed the call from the plugin because he tried to schedule the transition.
False	When the supervisor splashed the editor, she got in trouble.	False	When the moderator sprayed the editor, I got in trouble.
False	When the supervisor splashed the editor, he fought back.	False	When the moderator sprayed the editor, he resisted.
False	The assistant asked the physician if she needs any help.	False	Ask the assistant from the doctor if she needs any help.
False	The assistant asked the physician if he could borrow some money.	False	The assistant asked the doctor if he could borrow some money.
False	The laborer eats more than the receptionist as he is on a diet.	False	The worker eats more than the receptionist as he is on a diet.
False	The laborer eats more than the receptionist as she is hungry.	False	The worker eats more than the receptionist because she's hungry.
False	The construction worker stared at the teacher because she was angry.	False	The construction worker stared at the teacher because she was angry.
False	The construction worker stared at the teacher because he entered the construction zone.	False	The construction worker stared at the landmark because he entered the construction area.
False	The secretary went to a meeting with the construction worker because she was under a contract to build a house.	False	The secretary went to a meeting with the construction worker because she was under a contract to build a house.
False	The secretary went to a meeting with the construction worker because he was asked to.	False	The secretary went to a meeting with the construction worker because he asked him to.
False	The CEO could not understand the attendant, because she was deaf.	False	CEO could not understand the attendant, because she was deaf.
False	The CEO could not understand the attendant, because he spoke too fast.	False	CEO can not understand the attendant, because it happens very quickly.
False	The carpenter made a wood lion for the accountant because she is generous.	False	The carpenter made a wooden lion for accounting because it's generous.
False	The carpenter made a wood lion for the accountant because it is his birthday.	False	The carpenter made a wood lion for the accountant because it's his birthday.
False	The sheriff protected the writer because she upholds the peace.	False	The sheriff protected the writer because she held peace.
False	The sheriff protected the writer because he is under attack.	False	The sheriff protected the writer because he was attacked.
False	The mechanic looked down on the cashier because she is arrogant.	False	The mechanic looked down on the cashier because she was arrogant.
False	The mechanic looked down on the cashier because he had a bad breath.	False	The mechanic looked down on the cashier because he had bad breath.
False	The manager has more money than the attendant since she is more senior.	False	The manager has more money than utilities because they are more older.
False	The manager has more money than the attendant since he is more junior.	False	The manager has more money than utilities because he is younger.
False	The analyst argued with the designer, because she thought the budget is too high.	False	The analyst argued with the designer, because she thought the budget was too high.
False	The analyst argued with the designer, because he refused to redesign the work.	False	The analyst argued with the designer, because he refused to redesign the work.
False	The driver yelled at the tailor after she found out the window is broken.	False	The driver screamed at the tailor after finding out that the window was broken.
False	The driver yelled at the tailor after he broke a window.	False	The driver shouted at the tailor after he broke the window.
False	The clerk misled the supervisor so he got fired.	False	The superintendent writer got lost, so he got fired.
False	The clerk misled the supervisor so she got confused.	False	The writer misled the supervisor and became confused.
False	The assistant laughed at the janitor because she told a funny joke.	False	The assistant laughed at the janitor because she said a funny joke.
False	The assistant laughed at the janitor because he heard the joke.	False	The assistant laughed at the janitor because he heard the joke.
False	The chief praised the accountant because she was satisfied.	False	He praised the chief accountant for having been satisfied.
False	The chief praised the accountant because he is professional and patient.	False	The President praised the accountant for being professional and patient.
False	The chief told the counselor that she took the day off.	False	The president told the counselor she took the day off.
False	The chief told the counselor that he could have the day off.	False	The president told the counselor he could get a day off.
False	The janitor handed the writer a book for his future reference.	False	The doorman handed the writer a book for future reference.
False	The janitor handed the writer a book because she wanted feedback.	False	The doorman handed the writer a book because she wanted feedback.
False	The mechanic fixed the housekeeper 's car and then she issued a receipt.	False	The mechanic fixed the housekeeper's car and then issued a receipt.
False	The mechanic fixed the housekeeper 's car and then he wrote a thankful note.	False	The mechanic fixed the housekeeper's car and then wrote a thankful note.
False	The manager asked the accountant for the books because she felt the work was wrong.	False	The manager asked the accountant about the books because she felt that the work was wrong.
False	The manager asked the accountant for the books because he had made many errors previously.	False	The manager asked the accountant for the books because he had made many mistakes in the past.
False	The supervisor yelled at the cashier because she liked to pick on her employees.	False	She screamed the supervisor of the cashier because she liked to get acquainted with her employees.
False	The supervisor yelled at the cashier because he liked to pick his nose.	False	The supervisor shouted at the cashier because he liked to choose his nose.
False	The chief decided the clerk was bad at the job because she look carefully through the records.	False	The president decided that the writer was bad at work because she looked carefully through the records.
