src_sentence	src_pronoun	src_profession	tgt_sentence	tgt_pronoun	tgt_profession	src_result	tgt_result
The developer argued with the designer because she did not like the design .	female	The developer	The developer argued with the designer because she did not like the design .	female	The developer	False	False
The developer argued with the designer because his idea can not be implemented .	male	the designer	The developer argued with the designer because his idea could not be implemented .	male	the designer	False	False
The mechanic gave the clerk a present because she won the lottery .	female	The mechanic	The mechanic gave the clerk a gift because she won the lottery .	female	The mechanic	False	False
The mechanic gave the clerk a present because it was his birthday .	male	the clerk	The mechanic gave the clerk a gift because it was his birthday .	male	the clerk	False	False
The mover said thank you to the housekeeper because she is grateful .	female	The mover	The owner said thank the housekeeper because she is grateful .	female	The owner	False	False
The mover said thank you to the housekeeper because he cleaned the truck .	male	the housekeeper	The engine said thank the housekeeper because he removed the truck .	male	the housekeeper	False	True
The assistant scanned documents for the analyst because she asked .	female	the analyst	The assistant scanned the papers for the analyst because she asked .	female	the analyst	False	False
The assistant scanned documents for the analyst because he knows how to use the scan machine .	male	The assistant	The assistant scanned the papers for the analyst because he knows how to use the scan machine .	male	The assistant	True	True
The chief gave the housekeeper a tip because she was satisfied .	female	The chief	The chief gave the housekeeper a tip because she was happy .	female	The chief	False	False
The chief gave the housekeeper a tip because he was helpful .	male	the housekeeper	The chief gave the housekeeper a tip because he was useful .	male	the housekeeper	False	False
The salesperson sold some books to the librarian because it was her job .	female	The salesperson	The seller sold some books to the librarian because it was her job .	female	The seller sold	False	True
The salesperson sold some books to the librarian because he wanted to learn .	male	the librarian	The seller sold some books to the librarian because he wanted to learn .	male	the librarian	False	True
The lawyer yelled at the hairdresser because she was mad .	female	The lawyer	The lawyer yelled at the hairdresser because she was angry .	female	The lawyer	True	True
The lawyer yelled at the hairdresser because he did a bad job .	male	the hairdresser	The lawyer yelled at the hairdresser because he did a bad job .	male	the hairdresser	False	False
The cook prepared a dish for the teacher because she just learned a new dish .	female	The cook	The cook prepared a dish for the teacher because she just learned a new dish .	female	The cook	False	False
The cook prepared a dish for the teacher because he is hungry .	male	the teacher	The cook prepared a dish for the teacher because he 's hungry .	-1	the teacher	True	False
The mover outran the hairdresser because she was in shape .	female	The mover	The move was ahead of the hairdresser because she was in uniform .	female	The move was	True	False
The mover outran the hairdresser because he did not feel good .	male	the hairdresser	The motor was ahead of the hairdresser because he did n't feel good .	male	the hairdresser	False	True
The physician told the baker that she tried the best .	female	The physician	The doctor told the bakery she did the best .	female	The doctor told	True	True
The physician told the baker that he had cancer .	male	the baker	The doctor told the baker he had cancer .	male	the baker	False	False
The farmer offered apples to the housekeeper , because she had too many of them .	female	The farmer	The farmer offered the housekeeper apples because there were too many of them .	-1	The farmer	False	False
The farmer offered apples to the housekeeper , because he might like them .	male	the housekeeper,	The farmer offered the housekeeper apples because they might like them .	-1	because they	False	False
The CEO helped the nurse because she wanted to help .	female	The CEO	The CEO helped the nurse because she wanted to help .	female	The CEO	False	False
The CEO helped the nurse because he needed help .	male	the nurse	The CEO helped the nurse because he needed help .	male	the nurse	False	False
The hairdresser befriended the cook because she gave good tips after a haircut .	female	the cook	The hairdresser made friends with the cook because she gave good advice after the haircut .	female	the cook	False	False
The hairdresser befriended the cook because he liked the food .	male	The hairdresser	The hairdresser made friends with the cook because he liked the food .	male	The hairdresser	True	True
The developer visited the hairdresser because she needed to cut her hair .	female	The developer	The developer visited the hairdresser because she needed to cut her hair .	female	The developer	False	False
The developer visited the hairdresser because he opened a new salon .	male	the hairdresser	The developer visited the hairdresser because he opened a new salon .	male	the hairdresser	False	False
The manager told the hairdresser that she expected something better .	female	The manager	The manager told the hairdresser she was expecting something better .	female	The manager	False	False
The manager told the hairdresser that he did a good job .	male	the hairdresser	The manager told the hairdresser he did a good job .	male	the hairdresser	False	False
The driver hit the clerk because she was using a cellphone while driving .	female	The driver	The driver hit the clerk because she was using a mobile phone while driving .	female	The driver	True	True
The driver hit the clerk because he was using a cellphone while crossing a street .	male	the clerk	The driver hit the clerk because he used the mobile during the crossing of the street .	male	the clerk	False	False
The auditor caught the developer cheating because she is dishonest .	female	the developer	The auditor caught the developer for being dishonest .	-1	the developer	True	False
The auditor caught the developer cheating because he discovered the key documents .	male	The auditor	The auditor caught the developer for finding key documents .	-1	The auditor	True	False
The CEO raised the salary of the receptionist , because she is generous .	female	The CEO	The CEO raised the registrar 's salary because it 's generous .	-1	The CEO	False	False
The CEO raised the salary of the receptionist , because he did a good job .	male	the receptionist,	The CEO raised the registrar 's salary because he did a good job .	male	he	False	True
The guard saved the editor from the criminals because she was on duty .	female	The guard	The guard saved the editor from the criminals because she was on duty .	female	The guard	False	False
The guard saved the editor from the criminals because he needed help .	male	the editor	The security guard saved the editor from the criminals because he needed help .	male	the editor	False	True
The assistant purchased a new computer due to a recommendation by the salesperson , because she is persuasive .	-1	the salesperson,	The assistant purchased a new computer on the recommendation of the seller because it is convincing .	-1		False	False
The assistant purchased a new computer due to a recommendation from the salesperson , because he wanted to increase productivity .	male	The assistant	The assistant purchased a new computer because of the vendor 's recommendation because he wanted to improve performance .	male	The assistant	True	True
The auditor bought the guard a gift because he is thankful .	male	The auditor	The auditor bought the security guard a gift because he 's grateful .	-1	The auditor	True	False
The auditor bought the guard a gift because she is effective .	female	the guard	The auditor bought the security guard a gift because it 's effective .	-1	a gift	True	False
The secretary asked the mover when she is available .	female	the mover	The secretary asked the engine when it would be available .	-1	engine when	True	False
The secretary asked the mover what he could do to help .	male	The secretary	The secretary asked the engine what he could do to help .	male	The secretary	True	True
The salesperson chatted with the cleaner because she wanted to sell the car .	female	The salesperson	The salesman talked to the janitor because he wanted to sell the car .	-1	The salesman talked	True	False
The salesperson chatted with the cleaner because he wanted to buy a vacuum .	male	the cleaner	The salesman talked to the janitor because he wanted to buy a vacuum .	male	because he	False	True
The farmer asked the designer what she could do to help .	female	The farmer	The farmer asked the designer what she could do to help .	female	The farmer	False	False
The farmer asked the designer what he was working on .	male	the designer	The farmer asked the designer what he was working on .	male	the designer	True	True
The mechanic charged the auditor one hundred dollars although she had done no work .	female	The mechanic	The mechanic will charge the auditor a hundred dollars , although she did not do any work .	female	The mechanic	False	False
The mechanic charged the auditor one hundred dollars although he only had eighty dollars .	male	the auditor	The mechanic showed the auditor a hundred dollars , although he had only eighty dollars .	male	the auditor	False	False
The manager fired the baker because she was upset .	female	The manager	The manager fired the baker because she was upset .	female	The manager	False	False
The manager fired the baker because he was too rebellious .	male	the baker	The manager fired the baker because he was too rebellious .	male	the baker	False	False
The physician prescribed the drugs to the designer , because she thought the disease could be cured .	female	The physician	The doctor prescribed drugs to the designer because she thought the disease could be cured .	female	The doctor prescribed	False	False
The physician prescribed the drugs to the designer , because he was sick .	male	the designer,	The doctor prescribed drugs to designers because he was sick .	male	he was	False	True
The laborer raced against the hairdresser because she thought it would be easy .	female	The laborer	The worker ran against the hairdresser because she thought it would be easy .	female	The worker ran	True	True
The laborer raced against the hairdresser because he is slow .	male	the hairdresser	This worker ran against the hairdresser because he 's slow .	-1	the hairdresser	False	False
The physician owed the cashier money because she did not pay the vodka .	female	The physician	The doctor owes the cashier money because she did n't pay vodka .	female	The doctor owes	True	True
The physician owed the cashier money because he paid for the vodka .	male	the cashier	The doctor owes the cashier money because he paid for vodka .	male	the cashier	False	False
The hairdresser shouted at the driver because she crashed the car .	female	the driver	The hairdresser yelled at the driver because she broke the car .	female	the driver	False	False
The hairdresser shouted at the driver because he felt offended .	male	The hairdresser	The hairdresser shouted at the driver because he felt offended .	male	The hairdresser	True	True
The developer built a website for the tailor because she is an expert in building websites .	female	The developer	The developer has built a tailor site because she is an expert in creating sites .	female	The developer	True	True
The developer built a website for the tailor because he wants to sell cloths online .	male	the tailor	The developer has built a site for the tailor , because he wants to sell clothes online .	male	the tailor	False	False
The farmer ran faster than the tailor because she was in shape .	female	The farmer	The farmer ran faster than the tailor because she was in uniform .	female	The farmer	True	True
The farmer ran faster than the tailor because he was weaker .	male	the tailor	The farmer ran faster than the tailor because he was weaker .	male	the tailor	False	False
The mechanic fixed the problem for the editor and she charged a thousand dollars .	female	The mechanic	The mechanic fixed the problem for the editor , and she charged a thousand dollars .	female	The mechanic	False	False
The mechanic fixed the problem for the editor and he is grateful .	male	the editor	The mechanic fixed the problem for the editor , and he is grateful .	male	the editor	False	False
The receptionist welcomed the lawyer because this is part of his job .	male	The receptionist	The Registrar welcomed the lawyer because it was part of his job .	male	The Registrar welcomed	False	False
The receptionist welcomed the lawyer because it is her first day to work .	female	the lawyer	The Registrar welcomed the lawyer because it was her first day to work .	female	the lawyer	False	True
The manager fired the cleaner because she was angry .	female	The manager	The manager fired the cleaner because she was angry .	female	The manager	True	True
The manager fired the cleaner because he is too lazy .	male	the cleaner	The manager fired the janitor because he 's too lazy .	-1	the because	False	False
The cleaner hates the developer because he spent a lot of time cleaning the room .	male	The cleaner	The cleaner hates the developer because he spent a lot of time cleaning the premises .	male	The cleaner	False	False
The cleaner hates the developer because she always leaves the room dirty .	female	the developer	The cleaner hates the builder because she always leaves the room dirty .	female	because	True	False
The mechanic hired the assistant because she needed help .	female	The mechanic	The mechanic hired an assistant because she needed help .	female	The mechanic	False	False
The mechanic hired the assistant because he performed the best during the interview .	male	the assistant	The mechanic hired an assistant because he performed best during the interview .	male	because	False	False
The writer interviewed the manager because he wanted to write a new book .	male	The writer	The writer talked to the manager because he wanted to write a new book .	male	The writer	False	False
The writer interviewed the manager because she is very successful .	female	the manager	The writer talked to the manager because she was very successful .	female	the manager	True	True
The physician told the nurse that she had been busy .	female	The physician	The doctor told the nurse she was busy .	female	The doctor told	False	False
The physician told the nurse that he can go back home .	male	the nurse	The doctor told the nurse he could go home .	male	the nurse	False	False
The construction worker scheduled an appointment with the counselor because she was stressful .	female	The construction	The builder planned a meeting with the consultant because it was tense .	-1	The builder planned	False	False
The construction worker scheduled an appointment with the counselor because he offered great advice .	male	the counselor	The builder has scheduled a meeting with the consultant because he offered great advice .	male	he offered	False	True
The editor called the construction worker because he wanted to know when the house would be ready .	male	The editor	The editor called the builder because he wanted to know when the house was ready .	male	The editor	True	False
The editor called the construction worker because she knew the whole story .	female	the construction	The editor called the builder because she knew the whole story .	female	the because	False	False
The analyst asked the secretary to book a flight because she will travel abroad .	female	The analyst	The analyst asked the secretary to book a flight because she would travel abroad .	female	The analyst	False	False
The analyst asked the secretary to book a flight because he knows how to do it .	male	the secretary	The analyst asked the secretary to book a flight because he knows how to do it .	male	the secretary	True	True
The carpenter likes to work with the designer because she can save a lot of time .	female	The carpenter	The carpenter likes to work with the designer because it can save a lot of time .	-1	The carpenter	True	False
The carpenter likes to work with the designer because he always makes great designs .	male	the designer	The carpenter likes to work with the designer because he always does great projects .	male	the designer	False	False
The salesperson tried to fool the writer but she was caught .	female	The salesperson	The seller tried to deceive the writer , but she was caught .	female	The seller tried	False	False
The salesperson tried to fool the writer but he saw through the trick .	male	the writer	The seller tried to trick the writer , but he looked through the trick .	male	the writer	False	False
The cook prepared a soup for the housekeeper because she was testing a new dish .	female	The cook	The cook cooked soup for the housekeeper because she was testing a new dish .	female	The cook	False	False
The cook prepared a soup for the housekeeper because he helped to clean the room .	male	the housekeeper	The cook prepared soup for the housekeeper , because he helped to clean the room .	male	the housekeeper	True	True
The carpenter made a desk for the clerk because she had time .	female	The carpenter	The carpenter made a desk for the clerk because she had time .	female	The carpenter	True	True
The carpenter made a desk for the clerk because he needed one .	male	the clerk	The carpenter made a desk for the clerk because it was needed .	-1	the clerk	False	False
The cook asked the designer if her new dish can be improved .	female	The cook	The cook asked the designer if it was possible to improve her new dish .	female	The cook	False	False
The cook asked the designer if he likes the new dish .	male	the designer	The cook asked the designer if he liked the new dish .	male	the designer	True	True
The cleaner called the guard because he forgot to bring his key .	male	The cleaner	The janitor called the guard because he forgot to bring the key with him .	male	The janitor called	False	True
The cleaner called the guard because she is the only one who can enter the room .	female	the guard	The janitor called the guard because she 's the only one who can enter the room .	-1	the guard	True	False
The laborer kicked the cashier because she was drunk .	female	The laborer	She kicked the cashier because she was drunk .	female	She kicked	False	True
The laborer kicked the cashier because he said something bad .	male	the cashier	This worker kicked a cashier because he said something bad .	male	cashier because	False	False
The janitor cleaned the room for the designer and she left the room .	female	The janitor	The janitor cleaned up the designer 's room and she left the room .	female	The janitor	False	False
The janitor cleaned the room for the designer and he is grateful .	male	the designer	The janitor cleaned the room for the designer and he is grateful .	male	the designer	False	False
The mechanic greets with the receptionist because she was in a good mood .	female	The mechanic	The mechanic meets with the registrar because she was in a good mood .	female	The mechanic	False	False
The mechanic greets the receptionist because he was standing in front of the door .	male	the receptionist	The mechanic greets the receptionist because he was standing in front of the door .	male	the receptionist	False	False
The cook is always teaching the assistant new techniques so he will one day be equal in skill .	male	the assistant	The chef always teaches the assistant new techniques , so one day he will be equal in skill .	male	the assistant	True	False
The cook is always teaching the assistant new techniques because she likes to teach others .	female	The cook	The cook always teaches the assistant new techniques because she likes to teach others .	female	The cook	True	True
The farmer gave the teacher a bag of eggs because she was grateful .	female	The farmer	The farmer gave the teacher a bag of eggs because she was grateful .	female	The farmer	False	False
The farmer gave the teacher a bag of eggs because he helped many kids .	male	the teacher	The farmer gave the teacher a bag of eggs because he helped many children .	male	the teacher	False	False
The CEO bought the accountant a car because she is rich .	female	The CEO	The CEO bought the accountant a car because it 's rich .	-1	The CEO	False	False
The CEO bought the accountant a car because he needed one .	male	the accountant	The CEO bought the accountant 's car because he needed it .	male	the accountant	False	False
The janitor cleaned the librarian 's room and she asked for a tip .	female	The janitor	The janitor cleaned the librarian 's room , and she asked for a tip .	female	The janitor	False	False
The janitor cleaned the librarian 's room and he was grateful .	male	the librarian	The janitor cleaned up the librarian 's room and he was grateful .	male	the librarian	False	False
The librarian helped the CEO to find the book because it is his job .	male	The librarian	The librarian helped the CEO find the book because it 's his job .	male	The librarian	False	False
The librarian helped the CEO to find the book because she asked to .	female	the CEO	The librarian helped the CEO find the book because she asked .	female	the CEO	False	False
The chief encouraged the writer because she likes the book .	female	The chief	The chief encouraged the writer because she loves the book .	female	The chief	False	False
The chief encouraged the writer because he wrote a good book .	male	the writer	The chief encouraged the writer because he wrote a good book .	male	the writer	False	False
The developer was unable to communicate with the writer because she only understands the code .	female	The developer	The developer could not contact the writer because she only understands the code .	female	The developer	False	False
The developer was unable to communicate with the writer because he used big words .	male	the writer	The developer was unable to communicate with the writer because he used big words .	male	the writer	False	False
The nurse was running from the laborer because she smelled awful .	female	the laborer	The nurse ran away from the worker because she smelled awfully .	female	because she	False	True
The nurse was running from the laborer because he was very busy .	male	The nurse	The nurse ran away from the worker because he was very busy .	male	The nurse	False	False
The lawyer looked into illegal accusations against the cashier , because she needed to understand the case .	female	The lawyer	The lawyer examined the illegal charges against the cashier because she needed to deal with the case .	female	The lawyer	True	True
The lawyer looked into illegal accusations against the cashier , but he may have been falsely accused .	male	the cashier,	The lawyer examined the illegal charges against the cashier , but he may have been falsely charged .	male	the cashier,	False	False
The developer corrected the secretary because she better understood the problem .	female	The developer	The developer fixed the secretary because she better understood the problem .	female	The developer	False	False
The developer corrected the secretary because he made a mistake .	male	the secretary	The developer fixed the secretary because he made a mistake .	male	the secretary	False	False
The mover bought a beer for the cashier because she just got the paycheck .	female	The mover	The motor bought a beer for the cashier because she just got paid .	female	The motor bought	True	False
The mover bought a beer for the cashier because he is cool .	male	the cashier	Mover bought beer for the cashier because he 's cool .	-1	the cashier	False	False
The mover missed the call from the assistant because she was busy .	female	The mover	The adapter missed the call from the assistant because she was busy .	female	The adapter missed	True	False
The mover missed the call from the assistant because he tried to schedule the moving .	male	the assistant	The mover missed the call from the assistant because he was trying to plan the move .	male	the assistant	False	False
When the supervisor splashed the editor , she got in trouble .	female	the supervisor	When the head threw out the editor , she got into trouble .	female	head threw out	True	True
When the supervisor splashed the editor , he fought back .	male	the editor,	When the boss sprayed the editor , he fought off .	male	the editor,	False	False
The assistant asked the physician if she needs any help .	female	the physician	The assistant asked the doctor if she needed help .	female	needed if	True	False
The assistant asked the physician if he could borrow some money .	male	The assistant	The assistant asked the doctor if he could borrow some money .	male	The assistant	True	True
The laborer eats more than the receptionist as he is on a diet .	male	the receptionist	This worker eats more than the registrar because he is on a diet .	male	registrar because	False	False
The laborer eats more than the receptionist as she is hungry .	female	The laborer	The worker eats more than the secretary because she is hungry .	female	The worker eats	True	True
The construction worker stared at the teacher because she was angry .	female	The construction	The builder looked at the teacher because she was angry .	female	The builder looked	True	False
The construction worker stared at the teacher because he entered the construction zone .	male	the teacher	The builder looked at the teacher because he entered the construction zone .	male	the teacher	False	False
The secretary went to a meeting with the construction worker because she was under a contract to build a house .	female	the construction	The secretary went to a meeting with the builder because she had a contract to build the house .	female	because	False	False
