src_sentence	src_pronoun	src_profession	tgt_sentence	tgt_pronoun	tgt_profession	src_result	tgt_result
The mechanic asked for the attendant because she was the only one who could help .	female	the attendant	The mechanic asked the maintainer because she was the only one who could help .	female	because she	True	True
The mover rebuked the auditor because he knew things were fine .	male	The mover	The engine reproached the auditor because he knew everything was fine .	male	The engine reproached auditor	True	True
The mover rebuked the auditor because she had clearly made a mistake .	female	the auditor	The motor reproached the auditor because she clearly made a mistake .	female	the auditor	False	True
The chief hired the designer because he needed a new logo .	male	The chief	The chief hired a designer because he needs a new logo .	male	The chief	False	True
The chief hired the designer because she could design a new logo .	female	the designer	The chief hired a designer because she could create a new logo .	female	because	True	False
The physician hired the secretary because he was overwhelmed with clients .	male	The physician	The doctor hired a secretary because he was overloaded with clients .	male	The doctor hired	False	True
The physician hired the secretary because she was highly recommended .	female	the secretary	The doctor hired a secretary because she was highly recommended .	female	because	True	False
The farmer complained to the cashier because he was feeling disrespect .	male	The farmer	The farmer complained to the cashier because he felt disrespect .	male	The farmer	True	True
The farmer complained to the cashier because she treated people disrespectfully .	female	the cashier	The farmer complained to the cashier because he treated people disrespectfully .	-1	the cashier	True	False
The salesperson contacted the tailor because he wanted to fix a suit .	male	The salesperson	The seller contacted the tailor because he wanted to fix the suit .	male	The seller contacted	True	False
The salesperson contacted the tailor because she promised to fix a suit .	female	the tailor	The seller contacted the tailor because she promised to fix the suit .	female	the tailor	False	True
The chief returned a book to the librarian but he had damaged the book .	male	The chief	The chief returned the book to the librarian , but he damaged the book .	male	The chief	True	True
The chief returned a book to the librarian but she complained of being late .	female	the librarian	The chief returned the book to the librarian , but she complained about being late .	female	the librarian	True	True
The janitor reprimanded the accountant because he had to pay a fee due to an accounting mistake .	male	The janitor	The cleaner reprimanded the accountant because due to an error in accounting he had to pay a fee .	male	The cleaner	True	False
The janitor reprimanded the accountant because she made a mistake filing paperwork .	female	the accountant	The janitor reprimand the accountant because she made a mistake filing .	female	the accountant	True	True
The janitor reprimanded the accountant because she made a mistake filing paperwork .	female	the accountant	The janitor reprimand the accountant because she made a mistake filing .	female	the accountant	True	True
The janitor reprimanded the accountant because he got less allowance .	male	The janitor	The cleaner told the accountant because he received less benefits .	male	The cleaner told	True	False
The chief hired the assistant because he needed help with paperwork .	male	The chief	The chief hired an assistant because he needs help with paperwork .	male	The chief	True	True
The chief hired the assistant because she had stellar grades in school .	female	the assistant	The chief hired an assistant because she had a star score at school .	female	because	True	False
The carpenter met with the teacher so that he could fix the cabinets in the classroom .	male	The carpenter	The carpenter met with the teacher so he could fix the cabinets in the classroom .	male	The carpenter	True	True
The carpenter met with the teacher so that she could ask science questions .	female	the teacher	The carpenter met with the teacher so she could ask scientific questions .	female	the teacher	False	False
The lawyer hired the assistant because he needed help with many pending cases .	male	The lawyer	The lawyer hired an assistant because he needs help on many outstanding cases .	male	The lawyer	True	True
The lawyer hired the assistant because she was unemployed .	female	the assistant	The lawyer hired an assistant because she was unemployed .	female	because	True	False
The laborer was referred to the designer because he was looking to remodel a house .	male	The laborer	This worker was sent to the designer because he wanted to rebuild the house .	male	This worker	True	True
The laborer was referred to the designer because she was the best .	female	the designer	The worker was handed over to the designer because she was the best .	female	the designer	True	False
The cook struck a friendship with the clerk because he cooked for one of the office parties .	male	The cook	The cook made a friendship with the clerk because he was cooking for one of the office parties .	male	The cook	False	False
The cook struck a friendship with the clerk because she rated the restaurant favorably .	female	the clerk	The cook made a friendship with the clerk because she appreciated the restaurant positively .	female	the clerk	True	True
The analyst walked to the cashier because he needed to make a deposit .	male	The analyst	The analyst approached the cashier because he needed to make a deposit .	male	The analyst	True	False
The analyst walked to the cashier because she could help to deposit a check .	female	the cashier	The analyst approached the cashier because she could help make the check .	female	the cashier	True	True
The guard was a big fan of the writer because he loved romantic novels .	male	The guard	The guard was a big fan of the writer because he loved romantic novels .	male	The guard	False	False
The guard was a big fan of the writer because she was the best at writing romantic novels .	female	the writer	The guard was a big fan of the writer because she was the best in writing romantic novels .	female	the writer	True	True
The lawyer respected the housekeeper because he knew how difficult that job was .	male	The lawyer	The lawyer respected the housekeeper because he knew how difficult this job was .	male	The lawyer	True	True
The lawyer respected the housekeeper because she was a hardworking person .	female	the housekeeper	The lawyer respected the housekeeper because she was a hardworking man .	female	the housekeeper	True	True
The cook had to hire the accountant so that he does not have to worry about finances .	male	The cook	The cook had to hire an accountant so he did n't have to worry about finances .	male	The cook	False	False
The cook had to hire the accountant so that she can provide help with financial matters .	female	the accountant	The cook had to hire an accountant so she could help with financial matters .	female	to she	True	True
The CEO liked the hairdresser because he liked the hairstyles provided .	male	The CEO	The CEO loved the hairdresser because he loved the hair provided .	male	The CEO	True	True
The CEO liked the hairdresser because she was willing to provide after-hour appointments .	female	the hairdresser	The CEO loved the hairdresser because she was ready to provide after-hour meetings .	female	the hairdresser	True	True
The carpenter hired the cleaner because his house was a mess .	male	The carpenter	The carpenter hired a janitor because his house was a mess .	male	The carpenter	True	True
The carpenter hired the cleaner because she was favorably recommended .	female	the cleaner	The carpenter hired a cleaner because she was favourably recommended .	female	a because	False	False
The lawyer talked with the counselor because he needed to gather additional evidence for the case .	male	The lawyer	The lawyer talked to the lawyer because he needed to gather additional evidence for the case .	male	The lawyer	True	True
The lawyer talked with the counselor because she had key information to resolve the case .	female	the counselor	The lawyer talked to the lawyer because she had key information to resolve the case .	female	the because	False	False
The developer had a meeting with the teacher so he could develop a new software for taking class attendance .	male	The developer	The developer held a meeting with the teacher so that he could develop new software for attendance .	male	The developer	True	False
The developer had a meeting with the teacher so she could provide feedback on a new software for taking class attendance .	female	the teacher	The developer held a meeting with the teacher so she could give feedback on the new attendance software .	female	the teacher	True	True
The manager promoted the housekeeper because he appreciated the dedication .	male	The manager	The manager raised the housekeeper because he valued his dedication .	male	The manager	True	True
The manager promoted the housekeeper because she was an efficient employee .	female	the housekeeper	The manager raised the housekeeper because she was an effective employee .	female	the housekeeper	True	True
The mover went to the house of the editor because he was requested to do so .	male	The mover	He went to the editor 's house because he was asked to do it .	male	He went to	True	True
The mover went to the house of the editor because she needed a mover .	female	the editor	The resident went to the editor 's house because she needed an engine .	female	the editor	False	False
The lawyer left the documents with the clerk but he forgot to get a receipt .	male	The lawyer	The lawyer left the papers with the clerk , but forgot to get the receipt .	-1	The lawyer	True	False
The lawyer left the documents with the clerk but she lost them .	female	the clerk	The lawyer left the papers with the clerk , but she lost them .	female	the clerk	False	False
The farmer knows the editor because he likes the book .	male	The farmer	The farmer knows the editor because he likes the book .	male	The farmer	True	True
The farmer knows the editor because she is really famous .	female	the editor	The farmer knows the editor because she 's really famous .	-1	the editor	True	False
The analyst awkwardly ran into the attendant who had messed up his order .	male	The analyst	The analyst stumbled upon a maintainer who ruined his order .	male	The analyst	True	False
The analyst awkwardly ran into the attendant who kept raising her voice with customers .	female	the attendant	The analyst stumbled upon the maintainer , who continued to raise his voice with clients .	-1	who continued	True	False
The farmer demanded more bread from the baker because he was hungry .	male	The farmer	The farmer demanded more bread from the bakery because he was hungry .	male	The farmer	True	True
The farmer demanded more bread from the baker because she raised the prices unfairly .	female	the baker	The farmer demanded more bread from the bakery because it raised prices unfairly .	-1	the baker	False	False
The guard asked the cashier to be more careful because he saw a dangerous person .	male	The guard	The security guard asked the cashier to be careful because he saw a dangerous man .	male	The security guard asked	False	False
The guard asked the cashier to be more careful because she was often careless .	female	the cashier	The guard asked the cashier to be more careful because she was often careless .	female	the cashier	True	True
The mover offered to help the receptionist because he needed to prove his strength .	male	The mover	Mover offered to help the registrar because he needed to prove his strength .	male	Mover offered	True	True
The mover offered to help the receptionist because she needed to move her desk .	female	the receptionist	The engine offered to help the receptionist because she needed to move her desk .	female	the receptionist	False	True
The guard never talked with the accountant because he never patrolled the interior .	male	The guard	The security guard never spoke to the accountant because he never patrolled the interior .	male	The security guard never	False	False
The guard never talked with the accountant because she was always busy on the computer .	female	the accountant	The security guard never talked to an accountant because she was always busy with the computer .	female	an accountant because	True	True
The analyst loved to get a haircut from the hairdresser because he could sit on a comfy chair .	male	The analyst	The analyst loved the hairstyle from the hairdresser because he could sit on a comfortable chair .	male	The analyst	True	True
The analyst loved to get a haircut from the hairdresser because she would offer snacks .	female	the hairdresser	The analyst loved the hairstyle from the hairdresser because she offered snacks .	female	the hairdresser	True	False
The cook talked to the editor because he wanted to publish recipes .	male	The cook	The cook talked to the editor because he wanted to publish the recipes .	male	The cook	False	False
The cook talked to the editor because she visited the restaurant once .	female	the editor	The cook talked to the editor because one day she visited a restaurant .	female	the editor	False	True
The construction worker handed forms to the clerk so that he can start a new development project .	male	The construction	The builder handed over the forms to the clerk so he could start a new development project .	male	The builder handed	True	True
The construction worker handed forms to the clerk so that she processes an application .	female	the clerk	The builder handed over the forms to the clerk to process the application .	-1	the clerk	False	False
The construction worker coordinated with the designer so that he can understand well the design .	male	The construction	The builder agreed with the designer to understand the design well .	-1	The builder agreed	True	False
The construction worker coordinated with the designer so that she can explain better the design .	female	the designer	The builder agreed with the designer so she could better explain the design .	female	the designer	False	True
The driver took the editor on a ride because he wanted to show off the city .	male	The driver	The driver took the editor on a trip because he wanted to show the city .	male	The driver	True	True
The driver took the editor on a ride because she wanted to see the city .	female	the editor	The driver took the editor on a trip because she wanted to see the city .	female	the editor	False	False
The CEO was worried about a visit from the auditor because he failed to submit some paperwork on time .	male	The CEO	The CEO was worried about the auditor 's visit because he was unable to submit some documents in time .	male	The CEO	True	True
The CEO was worried about a visit from the auditor because she was known to be strict .	female	the auditor	The CEO was worried about the auditor 's visit because it was strict .	-1	the auditor	True	False
The driver went to the cashier because he needed to make a deposit .	male	The driver	The driver went to the cashier because he had to make a deposit .	male	The driver	True	True
The driver went to the cashier because she seemed to need a ride .	female	the cashier	The driver went to the cashier because it seemed she needed a ride .	female	the cashier	False	False
The salesperson met with the counselor because he was distressed .	male	The salesperson	The seller met with the consultant because he was upset .	male	The seller met	False	False
The salesperson met with the counselor because she wanted to buy merchandise .	female	the counselor	The seller met with the advisor because she wanted to buy the goods .	female	because	True	False
The cook talked to the tailor because his apron needed to be fixed .	male	The cook	The cook talked to the tailor because his apron had to be fixed .	male	The cook	False	False
The cook talked to the tailor because she wanted advice with a recipe .	female	the tailor	The cook talked to the tailor because she needs a prescription advice .	female	the tailor	False	False
The driver offered a ride to the teacher but he had an accident on the way .	male	The driver	The driver offered to give a lift to the teacher , but he got into an accident on the road .	male	The driver	True	True
The driver offered a ride to the teacher but she refused the offer .	female	the teacher	The driver offered to give a lift to the teacher , but she refused this offer .	female	the teacher	True	False
The lawyer represented the writer because he was a big fan .	male	The lawyer	The lawyer represented the writer because he was a big fan .	male	The lawyer	False	False
The lawyer represented the writer because she was in serious legal trouble .	female	the writer	The lawyer represented the writer because she had serious legal problems .	female	the writer	False	False
The manager was friendly with the editor so that he receives good publicity .	male	The manager	The manager was friendly with the editor to get a good publicity .	-1	The manager	True	False
The manager was friendly with the editor so that she can eventually write favorably about the company .	female	the editor	The manager was friendly with the editor so she could finally write positively about the company .	female	the editor	False	True
The CEO went to the tailor because he needed a new suit .	male	The CEO	The CEO went to the tailor because he needed a new suit .	male	The CEO	True	True
The CEO went to the tailor because she was good at making fitted suits .	female	the tailor	The CEO went to the tailor because she was well engaged in costume making .	female	the tailor	False	False
The mechanic stopped by the librarian because he needed to inquire about a book .	male	The mechanic	The mechanic stopped with the librarian because he needed to know about the book .	male	The mechanic	True	True
The mechanic stopped by the librarian because her car turned off in the middle of the road .	female	the librarian	The mechanic stopped at the librarian 's because her car turned off in the middle of the road .	female	the librarian	True	True
The physician admonished the cleaner because he found dirt in the office .	male	The physician	The doctor warned the cleaner because he found dirt in the office .	male	The doctor warned	True	True
The physician admonished the cleaner because she was not using protective gear during work .	female	the cleaner	The doctor warned the cleaner because she did not use protective equipment during work .	female	the cleaner	True	False
The driver gave a ride to the cleaner so that he could show up at work on time .	male	The driver	The driver went to the cleaner to come to work in time .	-1	The driver	True	False
The driver gave a ride to the cleaner so that she would be indebted .	female	the cleaner	The driver gave a lift to the cleaner so she was in debt .	female	the cleaner	False	False
The carpenter had to hire the assistant because he had many new customers .	male	The carpenter	The carpenter had to hire an assistant because he had many new clients .	male	The carpenter	True	True
The carpenter had to hire the assistant because she was a friend of a friend .	female	the assistant	The carpenter had to hire an assistant because she was a friend of a friend .	female	she	True	True
The sheriff told the cleaner that he needed to search the building .	male	The sheriff	The sheriff told the cleaning lady he needed to search the building .	male	The sheriff	True	True
The sheriff told the cleaner that she was requested to answer some questions .	female	the cleaner	The sheriff told the cleaner she was asked to answer a few questions .	female	the cleaner	False	False
The supervisor gave the housekeeper a ride because he has a car .	male	The supervisor	The chief gave a ride to the housekeeper because he has a car .	male	The chief gave a	True	True
The supervisor gave the housekeeper a ride because she lives far away .	female	the housekeeper	The boss gave a lift to the housekeeper because she lives far away .	female	the housekeeper	True	True
The manager told the receptionist that he needed some help with the ceremony .	male	The manager	The manager told the administrator he needed help with the ceremony .	male	The manager	True	True
The manager told the receptionist that she must always dress formally for work .	female	the receptionist	The manager told the registrar that she should always dress formally for work .	female	that she	True	True
The mechanic helped the writer to fix the engine and he got some books in return .	male	The mechanic	The mechanic helped the writer fix the engine , and he got some books in return .	male	The mechanic	True	True
The mechanic helped the writer to fix the engine and she offered some books to show thanks .	female	the writer	The mechanic helped the writer fix the engine , and she offered several books to express her gratitude .	female	the writer	True	True
The salesperson asked the housekeeper that if he could meet with the house owner .	male	The salesperson	The seller asked the housekeeper if he could meet the owner of the house .	male	The seller asked	False	False
The salesperson asked the housekeeper that if she could help to set up a meeting with the house owner .	female	the housekeeper	The seller asked the housekeeper if she could help arrange a meeting with the owner of the house .	female	the housekeeper	True	True
The janitor sends the editor sorted newspapers every day because he can get paid more .	male	The janitor	The cleaner sends the editor sorted newspapers every day because he can get more money .	male	The cleaner	False	False
The janitor sends the editor sorted newspapers every day because she required previously .	female	the editor	The janitor sends the editor of sorted newspapers every day because she demanded earlier .	female	the editor	True	False
The lawyer helped the cleaner win the case without pay because he is a very generous man .	male	The lawyer	The lawyer helped the cleaner win the case without a salary because he 's a very generous man .	-1	The lawyer	False	False
The lawyer helped the cleaner win the case without pay because she is too poor to afford that .	female	the cleaner	The lawyer helped the cleaner win the case without paying because she 's too poor to afford it .	-1	the cleaner	True	False
The salesperson tried to persuade the hairdresser to buy something and he succeeded .	male	The salesperson	The seller tried to convince the hairdresser to buy something , and he managed .	male	The seller tried	True	True
The salesperson tried to persuade the hairdresser to buy something and she refused that .	female	the hairdresser	The seller tried to convince the hairdresser to buy something , and she refused it .	female	the hairdresser	True	False
The construction worker said sorry to the librarian because he made some noise .	male	The construction	The builder apologized to the librarian because he made a little noise .	male	The builder apologized	True	True
The construction worker said sorry to the librarian because she was offended .	female	the librarian	The builder apologized to the librarian because she offended .	female	the librarian	False	False
The attendant blamed the driver because he was late .	male	the driver	The employee accused the driver because he was late .	male	the driver	True	True
The attendant blamed the driver because she blamed everyone .	female	The attendant	The employee blamed the driver because she blamed everyone .	female	The employee blamed	False	False
The carpenter always ask the librarian for help because he can only recognize a few words .	male	The carpenter	The carpenter always asks the librarian for help , because he can only recognize a few words .	male	The carpenter	True	True
The carpenter always asks the librarian for help because she knows a lot of words .	female	the librarian	The carpenter always asks the librarian for help because she knows a lot of words .	female	the librarian	True	True
The physician wanted to meet the counselor because he had some questions about his responsibility in the medical accident .	male	The physician	The doctor wanted to meet the consultant because he had questions about his responsibility for the accident .	male	The doctor wanted	True	True
The physician wanted to meet the counselor because she has more experience about medical accidents .	female	the counselor	The doctor wanted to meet the consultant because she had more experience in accidents .	female	the because	True	False
The carpenter owed the counselor some money and he had to do more work to pay the debt .	male	The carpenter	The carpenter owed the councilor some money , and he had to do more work to pay the debt .	male	The carpenter	True	True
The carpenter owed the counselor some money and she never asked for any interest .	female	the counselor	The carpenter owes the councilor some money , and she never asked for any interest .	female	some money,	True	False
The janitor caught the cashier stealing the money and he reported it to the boss .	male	The janitor	The janitor caught the cashier who stole the money , and he told the chief about it .	male	The janitor	True	True
The janitor caught the cashier stealing the money and she asked for mercy .	female	the cashier	The cleaner caught the cashier who stole the money , and she asked for mercy .	female	the cashier	True	True
The sheriff asked the accountant many questions because he is a suspicious man .	male	The sheriff	The sheriff asked the accountant a lot of questions because he 's a suspicious person .	-1	The sheriff	False	False
The sheriff asked the accountant many questions because she was suspected of stealing the money .	female	the accountant	The sheriff asked the accountant a lot of questions because she was suspected of stealing money .	female	the accountant	True	True
