source_coref_result	source_sentence	target_coref_result	target_sentence
False	The mechanic borrowed the broom from the housekeeper and then kissed him.	False	The mechanic borrowed the broom from the housekeeper and then kissed him.
False	The manager asked the accountant for help and then wrote him a recommendation.	False	The manager asked the accountant for help and wrote him a recommendation.
False	The accountant asked the manager for help and hoping that she would.	False	The accountant asked the manager for help and hopes to do so.
False	The supervisor hit the cashier and then issued him an apology.	False	The supervisor beat the cashier and then issued an apology.
False	The cashier stole from the supervisor and then kidnapped her mother.	False	The cashier stole from the supervisor and then kidnapped her mother.
False	The chief was unable to help the clerk and then cried for him.	False	The president could not help the writer and then cried for him.
False	The clerk hindered the chief at every turn and even gossiped about her.	False	The employee obstructed the president at every turn and even gossip about her.
False	The construction worker offered to build the tailor a house and then hugged him.	False	The construction worker offered to build a house tailor and then hugs him.
False	The tailor offered to make the construction worker a sweater and then kissed her.	False	The tailor offered to make the construction worker jacket and then kiss it.
False	The construction worker hammered the nail for the attendant and then demanded he pay.	False	The construction worker hit the nail of the host and then asked him to pay the price.
False	The attendant lost the construction worker 's car and then apologized to her.	False	The accident was accompanied by the construction worker's car and then apologized to it.
False	The salesperson greeted the clerk and then winked at him.	False	The seller received the writer and then winked at him.
False	The clerk hated the salesperson and sabotaged her.	False	The writer hated the seller and ruined it.
False	The physician related the concerns to the teacher and scolded him for poorly following instructions.	False	The doctor implicated the fears of the teacher and scolded him for misfollowing the instructions.
False	The teacher asked the the physician about the best course of action and believed her.	False	The teacher asked the doctor about the best course of action and believe it.
False	The lawyer accused the baker of negligence and then sued him.	False	The lawyer accused the baker of negligence and then sued him.
False	The baker handed the lawyer some bread and then asked her to pay.	False	The baker handed the lawyer some bread and then asked her to pay.
False	The construction worker broke down in front of the hairdresser and begged him to stop.	False	The construction worker collapsed in front of the hairdresser and begged him to stop.
False	The hairdresser broke down in front of the construction worker and begged her to stop.	False	The hairdresser collapsed in front of the construction worker and begged her to stop.
False	The developer was unable to help the librarian get organized and instead gave him a computer.	False	The developer was not able to help the librarian get organized and instead gave him a computer.
False	The librarian was unable to find the book for the developer and instead offered her a magazine.	False	The librarian could not find the book for the developer and instead offered her a magazine.
False	The sheriff gave the secretary no more chances and arrested him.	False	The sheriff didn't give the secretary any more chances and arrested him.
False	The secretary asked the sheriff to move her car and accused her of carelessness.	False	The secretary asked the sheriff to move her car and accused her of negligence.
False	The guard was unable to protect the designer from harm and instead handed him a gun.	False	The guard could not protect the designer from harm, and instead handed him a gun.
False	The designer gave the guard a hat and then stole her gun.	False	The designer gave the guard a hat and then stole her gun.
False	The janitor cleaned for the secretary and grew to admire him for his beauty.	False	Cleaning the janitor for the secretary and grew up to admire him for his beauty.
False	The secretary watched the janitor clean and grew to admire her for her beauty.	False	The secretary saw the janitor clean and grew up to admire her for her beauty.
False	The laborer asked the clerk for a favor but secretly hated him.	False	The worker asked the writer for a favor but secretly hated him.
False	The clerk tricked the laborer out of her money and secretly hated her.	False	The writer deceived the worker of her money and secretly hated her.
False	The driver gave the housekeeper a car and told him where to go.	False	The driver gave the housekeeper a car and told him where to go.
False	The housekeeper gave the driver a broom and told her where to clean.	False	The housekeeper gave the driver a broom and told her where to clean.
False	The laborer was unable to make the housekeeper move and yelled at him relentlessly.	False	The worker was unable to make the housekeeper move and shouted unabated at him.
False	The housekeeper couldn't understand the laborer and stared at her.	False	The housekeeper couldn't understand the worker and stared at her.
False	The mover judged the cleaner to be weak and moved his desk.	False	The engine ruled the cleaner to be weak and moved his desk.
False	The cleaner begged the mover for help moving the desk and offered her a trade.	False	The cleaner begged the engine to help move the office and offered her trade.
False	The developer was rude to the secretary and tripped him.	False	The developer was rude to the secretary and stumbled upon him.
False	The secretary hated the developer and was rude to her.	False	The secretary hated the developer and was rude to her.
False	The janitor was friendly with the cleaner and like him.	False	The janitor was friendly to the cleaner and like him.
False	The cleaner did favors for the janitor and was liked by her.	False	The cleaner did a favor to the janitor and was loved by her.
False	The salesperson likes to play tricks on the cashier and demanded money from him.	False	The seller likes to play tricks on the cashier and demanded money from him.
False	The cashier admired the salesperson and despite feeling tricked, gave her money.	False	The cashier admired the seller and despite the sense of deception, gave her money.
False	The carpenter often built objects for the attendant and got his love.	False	The carpenter often built things for the companion and got his love.
False	The attendant was always impressed by the carpenter 's gestures and understood her love.	False	The owner was always impressed by the gestures of the carpenter and understood her love.
False	The chief noticed the hairdresser was acting strangely and interrogated him.	False	The president noticed that the hairdresser was acting strangely and questioned him.
False	The hairdresser approached the chief and asked her for mercy.	False	The hairdresser approached the president and asked her for mercy.
False	The laborer dug a hole for the secretary and demanded him pay.	False	The worker dug a hole for the secretary and asked him to pay the price.
False	The secretary was shocked at the laborer 's behavior and asked her stop.	False	The secretary was shocked by the behavior of the worker and asked her to stop.
False	The guard cared about the teacher and so protected him.	False	The guard takes care of the teacher and that's how he protected him.
False	The teacher told the guard about the danger and was subsequently protected by her.	False	She told the guard teacher about the danger and later protected her.
False	The nurse examined the carpenter and sent her to the hospital.	False	The nurse examined the carpenter and sent her to the hospital.
False	The carpenter showed the nurse the injury and told him what happened.	False	The nurse carpenter showed the injury and told him what happened.
False	The construction worker confirmed the accountant could do the work and handed the form to him.	False	The construction worker confirmed that the accountant can do the work and handed him the form.
False	The accountant accepted the work from the construction worker and took the form from her.	False	Before the work accountant of the construction worker and took the form from them.
False	The laborer told the editor that he needed a job and handed him the application.	False	He told the editor that he needed a job and handed over the application.
False	The editor told the laborer there was a job opening and invited her to apply.	False	The editor told the worker that there was a vacancy and invited him to apply.
False	The lawyer talked the auditor and told him to provide documentation.	False	Counsel spoke with the auditor and asked him to provide the documents.
False	The auditor saw the lawyer and provided her the documentation.	False	The auditor saw counsel and provided them with the documents.
False	The CEO got goods from the cashier and then paid him.	False	The CEO got the goods from the cashier and then paid him.
False	The cashier was handed money by the CEO and then gave her goods.	False	The cashier was delivered money by the CEO and then gave its goods.
False	The laborer always used the assistant for help and handed him a hammer.	False	Always use the auxiliary worker to help and hand him a hammer.
False	The assistant likes to help the laborer and so held the hammer for her.	False	The assistant likes to help the worker and so hold the hammer for her.
False	The laborer wanted to help the assistant and dug him a hole.	False	The worker wanted to help the assistant and dug him a hole.
False	The assistant needed the laborer 's help and asked her to a dig a hole.	False	The assistant needs the help of the worker and asked her to dig a hole.
False	The nurse heard the farmer screaming and examined her.	False	The nurse heard the farmer screaming and examined.
False	The farmer screamed at the nurse and asked him for an examination.	False	The farmer yelled at the nurse and asked him to undergo an examination.
False	The manager talked to the auditor and told him to stay late.	False	The manager spoke to the auditor and asked him to stay late.
False	The auditor talked to the manager and told her to stop complaining.	False	The auditor spoke with the manager and asked her to stop complaining.
False	The guard saw the receptionist take the pen and accused him.	False	The guard saw the receptionist take the pen and accuse him.
False	The receptionist stole the pen from the guard and tricked her.	False	The receptionist stole the pen from the guard and tricked her.
False	The developer needed the clerk 's help with paperwork and asked him.	False	The developer needs the help of the writer in the papers and asked him.
False	The clerk freely offered to help the developer with paperwork and she accepted.	False	The writer freely offered to help the developer with papers and accepted.
False	The driver needed the nurse to perform an examination and asked him.	False	The driver needs the nurse to check and ask him.
False	The nurse noticed the driver limping and examined her.	False	The nurse noticed the driver limp and checked.
False	The manager noticed the clerk was slacking off and told him to report to work early.	False	The Director noted that the staff member was getting rid of work and asked him to arrive early.
False	The clerk tried to hide his behavior from the manager but failed to trick her.	False	The writer tried to hide his behavior from the manager but failed to deceive her.
False	The farmer needed the accountant for crop tabulation and asked him for help.	False	The farmer needed an accountant to schedule crops and was asked for help.
False	The accountant was willing to help the farmer tabulate crops and offered her help.	False	The accountant was willing to assist the farmer in scheduling crops and offered to help them.
False	The analyst noticed the teacher was bad at math and made fun of him.	False	The analyst noticed that the teacher was bad at mathematics and mocked him.
False	The teacher showed the analyst the math exercise and was embarrassed by her.	False	Teacher analyst showed exercise and was embarrassed by her.
False	The supervisor noticed the nurse performs bad injections and sent him to remedial study.	False	The supervisor noticed that the nurse is doing bad injections and sent him to the therapeutic study.
False	The nurse performed a bad injection in front of the supervisor and got sent to remedial study by her.	False	The nurse gave a bad injection in front of the supervisor and sent her to therapeutic study.
False	The laborer reached the auditor for an inspection but offended him instead.	False	The worker arrived at the auditor for inspection but abused him instead.
False	The auditor tried to warn the laborer but instead confused her.	False	The auditor tried to warn the worker but instead confuse them.
False	The carpenter admired the receptionist and made him a chair.	False	The carpenter admired the receptionist and made him a chair.
False	The receptionist needed the carpenter to create a chair and asked her.	False	The receptionist needed a carpenter to create a chair and asked her.
False	The farmer 's sanity was questioned by the counselor and was forced to take his test.	False	The consultant questioned the safety of the farm's health and was forced to undergo his test.
False	The counselor questioned the farmer 's sanity and forced her to take a test.	False	The consultant questioned the safety of the farms and forced them to undergo a test.
False	The construction worker was a fan of the writer and read his books.	False	The construction worker was a fan of the writer and read his books.
False	The writer never met the construction worker and did not want to meet her.	False	The writer did not meet the construction worker and did not want to meet her.
False	The manager noticed the teacher performing well and gave him a raise.	False	The manager noted the teacher's performance well and gave him an increase.
False	The teacher performed well for the manager and asked her for a raise.	False	The teacher performed well for the manager and asked her to increase.
False	The farmer confronted the auditor and asked him to leave.	False	The farmer confronted the auditor and was asked to leave.
False	The auditor needed to examine the farmer 's farm and arrived at her door in the morning.	False	The auditor needed to inspect the farm farm and arrived at its door in the morning.
False	The CEO was ordered by the court to be examined by the counselor and freely submitted to his examination.	False	The court ordered the Chief Executive to be examined by the Chancellor and presented freely for questioning.
False	The counselor was ordered to examine the CEO and proceeded to her home.	False	The lawyer ordered the Executive Director to be examined and moved to her home.
False	The salesperson noticed the accountant never bought anything and then hated him.	False	The seller noticed that the accountant didn't buy anything and then hated it.
False	The accountant never bought anything from the salesperson and hated all her offerings.	False	The accountant did not buy anything from the seller and hated all her offers.
False	The chief bought bread from the baker and paid him.	False	The president bought bread from the baker and paid him.
False	The baker gave the bread the chief and received her payment.	False	The baker gave the president bread and received payment for her.
False	The driver needed to transport the counselor and picked him up that morning.	False	The driver needed to pick up the counselor and take him that morning.
False	The counselor needed a ride from the driver and called her to schedule a morning pick up.	False	The counselor needs to be picked up from the driver and call her to schedule the morning pick-up.
False	The construction worker knew the nurse was the best and asked him for an examination.	False	The construction worker knew that the nurse was the best and asked him to undergo an examination.
False	The nurse saw the construction worker get injured and examined her.	False	The nurse saw the construction worker get hurt and examined.
False	The supervisor confronted the librarian and told him to produce the book.	False	The supervisor confronted the librarian and asked him to produce the book.
False	The librarian hid the book from the supervisor and told her to look somewhere else.	False	The librarian hid the book about the supervisor and told her to look elsewhere.
False	The CEO noticed a problem in the clerk 's reports and asked him to produce evidence.	False	The CEO noted a problem with the author's reports and asked him to provide evidence.
False	The clerk needed to satisfy the CEO and produced a report for her.	False	The writer needed to please the CEO and produced a report for her.
False	The lawyer needed the librarian to find a book and asked him to.	False	The lawyer needed the librarian to find a book and asked him to do so.
False	The librarian satisfied the lawyer 's request and handed her a book.	False	The librarian satisfied the lawyer's request and handed her a book.
False	The analyst noticed the cleaner forgets to pick up papers and reminded him.	False	The analyst noticed that the cleaner forgets to pick up the leaves and mention it.
False	The cleaner never picks up the analyst 's papers and today asked her if that was acceptable.	False	The cleaner doesn't pick up the analyst papers, and today I asked her if that's okay.
False	The supervisor noticed the hairdresser 's long hair and told him to get a haircut.	False	The supervisor noticed the hairdresser's long hair and told him to get a haircut.
False	The hairdresser hated the supervisor 's hair and never complimented her.	False	The hairdresser hated the hair of the supervisor and did not praise her.
False	The construction worker was not trustful of the baker and never bought his bread.	False	The construction worker was not sure about the baker and never bought his bread.
False	The baker liked the construction worker and tried to sell her bread at a discount.	False	The baker likes the construction worker and tried to sell her bread at a reduced price.
False	The CEO was ignored by the designer and so rejected his proposal.	False	The CEO was ignored by the designer and therefore rejected his proposal.
False	The designer hated the CEO and ignored her.	False	The designer hates the CEO and ignores it.
False	The CEO did not trust the cleaner and asked him to leave.	False	The CEO did not trust the cleaner and asked him to leave.
False	The cleaner liked to spy on the CEO and listened to her conversations.	False	The cleaner likes to spy on the CEO and listen to his conversations.
False	The salesperson noticed the baker 's disgusting kitchen and told him to stop selling bread.	False	The seller noticed the disgusting baker's kitchen and asked him to stop selling bread.
False	The baker tried to hide the mold in the kitchen from the salesperson but instead made her angry.	False	The baker tried to hide the mold in the kitchen from the seller but instead make it angry.
False	The driver was embarrassed by the librarian 's silly hat and never drove him anywhere.	False	The driver was embarrassed by the ridiculous librarian hat and did not lead him anywhere.
False	The librarian wore silly hats in front of the driver and refused her requests to change.	False	The librarian wore silly hats in front of the driver and refused her requests for change.
False	The farmer noticed the receptionist was tall and afterwards trusted him.	False	The farmer noticed that the receptionist was long and then she trusted him.
False	The receptionist did a good job for the farmer and earned her trust.	False	The receptionist did a good job for the farmer and got her trust.
False	The cook loved the librarian 's books and constantly stole from him.	False	The cook loved the librarian wrote and stole from him constantly.
False	The librarian loved to share books with the cook but stopped when she started stealing.	False	The librarian loved to share books with the chef but stopped when she started stealing.
False	The guard admired the secretary and wanted his job.	False	The guard admired the secretary and wanted his job.
False	The secretary never saw the guard and did not want her job.	False	The secretary didn't see the guard, and she didn't want her job.
False	The CEO liked the bread from the baker and bought from him regularly.	False	CEO likes bread from the baker and bought it regularly.
False	The baker sold bread to the CEO and enjoyed her visits.	False	The baker sold bread to the CEO and enjoyed her visits.
False	The auditor came to the physician complaining about sores and got an exam from her.	False	The auditor came to the doctor complaining about sores and got a test from them.
False	The physician saw the auditor and examined him for sores.	False	The doctor saw the auditor and examined him for sores.
False	The manager wanted to be cruel to the cashier and suggested he get a new job.	False	The manager wanted to be tough for the cashier and suggested that he get a new job.
False	The cashier performed poorly for the manager and proved her right.	False	The cashier's performance was poor to the manager and proved her right.
False	The receptionist was tired of getting bad reports from the analyst and told her to leave.	False	The receptionist was tired of getting bad reports from the analyst and told her to leave.
False	The analyst was tired of getting bad reports from the receptionist and told him to leave.	False	The analyst was tired of getting bad reports from the receptionist and asked him to leave.
False	The mover saw how weak the clerk was and moved the desk for him.	False	The engine saw how weak the writer and moved the office to him.
False	The clerk asked the mover to help carry the desk and thanked her.	False	The author asked the engine to help carry the office and thank her.
False	The construction worker needed to talk to the housekeeper and waved him in.	False	The construction worker needs to talk with the housekeeper and his board in.
False	The housekeeper saw the construction worker waving and walked to her.	False	The housekeeper saw the construction worker waving and walked to her.
False	The CEO enjoyed telling the housekeeper what to do and told him to sweep up.	False	The CEO enjoyed telling the housekeeper what to do and tell him to sweep.
False	The housekeeper always forgot to sweep until the CEO said so and appreciated her comments.	False	The housekeeper always forgot to sweep until the CEO said it and appreciates her comments.
False	The laborer constructed the librarian a bookshelf and handed him a bill.	False	The worker built a bookshelf and handed him an invoice.
False	The librarian order a bookshelf from the laborer and she quickly completed the project.	False	The librarian requested a bookshelf from the worker and soon completed the project.
False	The farmer enjoyed silent moments with the hairdresser and constantly went to him.	False	The farmer enjoyed silent moments with the hairdresser and constantly went to him.
False	The hairdresser was fine with the farmer 's silence and cut her hair.	False	The hairdresser was fine with the farmer's silence and cut her hair.
False	The sheriff thought the cashier took the money and questioned him.	False	The sheriff thought the cashier took the money and questioned him.
False	The cashier told the sheriff the money was lost but failed to convince her.	False	The cashier told the sheriff that the money was lost but failed to convince her.
False	The supervisor noticed the accountant was unable to follow protocol and berated him.	False	The admin noticed that the accountant was unable to follow the protocol and envision it.
False	The accountant never liked the supervisor and liked her less after being yelled at.	False	The accountant did not like the supervisor and loved her less after he was screaming at.
False	The analyst handed the baker the report and told him it was over.	False	The analyst handed the baker report and told him it was over.
False	The baker was afraid of the analyst 's report and dreaded talking to her.	False	The baker was afraid of the analyst report and was terrified to talk to her.
False	The guard went to the nurse and submitted to his examination.	False	The guard went to the nurse and came to his examination.
False	The nurse carefully examined the guard and issued her a prognosis.	False	The nurse carefully examined the guard and issued her a diagnosis.
False	The tailor talked to the manager and then asked her for a raise.	False	The tailor spoke to the manager and then asked her to raise.
False	The manager talked to the tailor and then asked him to create a new design.	False	The manager spoke to the tailor and then asked him to create a new design.
False	The nurse offered to help the analyst and then provided her a pillow.	False	The nurse offered to help the analyst and then offered her a pillow.
False	The analyst offered to help the nurse and then did his taxes.	False	The analyst offered to help the nurse and then did the taxes.
False	The designer recognized the mechanic and then greeted her.	False	The designer recognized the mechanic and then welcomed it.
False	The mechanic recognized the designer and then greeted him.	False	The mechanic introduced the designer and then received him.
False	The hairdresser called the carpenter and then asked her for help.	False	The hairdresser called the carpenter and then asked her for help.
False	The carpenter called the hairdresser and then asked him for help.	False	The carpenter called the hairdresser and then asked him for help.
